Site.Code,Round,Name,SiteRound,Date,Year,Month,Day,Time.Start,Time.Stop,Survey.Time,Observers,Pond.Type,Lat,Long,Easting,Northing,Property.Owner,HUC10.Name,HUC12.Name,Nearest,Area,Elevevation,Pond.Made,Source,Developed200m,Forest200m,Wetlands200m,Lawn200m,HerbScrub200m,Water200m,Developed500m,Forest500m,Wetlands500m,Lawn500m,HerbScrub500m,Water500m,Barren.Land.1000m,Cultivated.Crops.1000m,Deciduous.Forest.1000m,Developed.High.Intensity.1000m,Developed.Low.Intensity.1000m,Developed.Medium.Intensity.1000m,Developed.Open.Space.1000m,Emergent.Herbaceuous.Wetlands.1000m,Evergreen.Forest.1000m,Hay.Pasture.1000m,Herbaceuous.1000m,Mixed.Forest.1000m,Open.Water.1000m,Shrub.Scrub.1000m,Woody.Wetlands.1000m,Developed1000m,Forest1000m,Wetlands1000m,Lawn1000m,HerbScrub1000m,Water1000m,Air.Temp,Wind,Humidity,Clouds,In.OutFlow,Canopy.Cover,Water.Temp,Conductivity,Sp.Condunctivity,DO.p,DO.mg,Salinity,Chloride,Turbidity,pH,av.DO,av.DOp,av.SpC,av.pH,av.Sal,av.Turb,av.temp,av.Chlor,Nitrate,People,Perc.Open.Water,Perc.Emergent,Perc.Total.Floating,Perc.Substrate,Perc.Submergent,Substrate,Surface.Heterogeneity ,Sub.Heterogeneity ,Sub.Score,Woody.Debris,Hab.Complexity,av.HC,Notes.2020,Notes.2019,Total.Rich.Native,Plant.Rich,Invert.Rich,Fish.Rich,Vert.Rich,Animal.Rich,Inv.Fish.Rich,Total.Rich,Inv.Fish.P,Herp.Rich,Amphib.Rich,L.clamitans,L.catesbeiana,A.americanus,L.pipiens,H.versicolor,L.palustris,P.maculata,P.crucifer,N.viridescens,Lithobates.spp,Turtles,C.picta,C.serpentina,E.blandingii,Turtle.Rich,Snakes,Fish,C.inconstans,U.limi,P.promelas,N.cornutus,Sm.Unidentified,Lg.Unidentified,L.gibbosus,L.macrochirus,A.melas,C.auratus,Lepomis.spp,L.cyanellus,M.salmoides,C.carpio,Amphipoda.Hyalellidae,Arachnida.Pisauridae,Bivalvia.Sphaeriidae,Bivalvia.Unionidae,Cladocera.spp,Coleoptera.Curculionoidea,Coleoptera.Dytiscidae,Coleoptera.Gyrinidae,Coleoptera.Haliplidae,Coleoptera.Hydrophilidae,Coleoptera.Lampyridae,Coleoptera.Scirtidae,Coleoptera.spp,Collembola.spp,Copepoda.spp,Decapoda.Cambaridae,Diptera.Ceratopogonidae,Diptera.Chaoboridae,Diptera.Chironomidae,Diptera.Culicidae,Diptera.Dixidae,Diptera.Dolichopodidae,Diptera.Ephydridae,Diptera.Psychodidae,Diptera.Sciomyzidae,Diptera.Stratiomyidae,Diptera.Tabanidae,Diptera.Tanyderidae,Diptera.Tipulidae,Diptera.spp,Ephemeroptera.Baetidae,Ephemeroptera.Caenidae,Ephemeroptera.Siphlonuridae,Gastropoda.Ancylidae,Gastropoda.Lymnaeidae,Gastropoda.Physidae,Gastropoda.Planorbidae,Gastropoda.Viviparidae,Hemiptera.Belostomatidae,Hemiptera.Corixidae,Hemiptera.Gerridae,Hemiptera.Mesoveliidae,Hemiptera.Nepidae,Hemiptera.Notonectidae,Hemiptera.Pleidae,Hemiptera.Saldidae,Hemiptera.spp,Hemiptera.Veliidae,Hirudinea.spp,Hydrachnidiae.spp,Isopoda.Asellidae,Lepidoptera.Pyralidae,Odonata.Aeshnidae,Odonata.Coenagrionidae,Odonata.Lestidae,Odonata.Libellulidae,Odonata.spp,Ostracod.spp,Plecoptera.Perlodidae,Trichoptera.Hydroptilidae,Trichoptera.Leptoceridae,Inverts.SEINE,Seine.Distance,Notes.Sweep.Seine,Potamogeton.nodosus,Phalaras.arundinacea,Eleocharis.spp,Ceratophyllum.demersum,Myriophyllum.spicatum,Polygonum.pensylvanicum,Aster.spp,Iris.versicolor,Potamogeton.foliosus,Typha.spp,Sparganium.spp,Scirpus.validus,Carex.spp,Lemna.minor,Sagittaria.latifolia,Elodia.canadensis,Wolffia.columbiana,Stuckenia.pectinata,Sagittaria.cuneata,Alisma.spp,Scirpus.spp,Scirpus.cyperinus,Riccia.fluitans,Potamogeton.spp,Salix.spp,Juncus.effiusus,Lemna.trisula,Drepanocladus.spp,Chara.contraria,Polygonum.amphibium,Ranunculus.sceleratus,Typha.angustifolia,Chara.globularis,Potamogeton.crispus,Phragmites.australis,Utricularia.macrorhiza,Typha.latifolia,Cicuta.bulbifera,Eleocharis.acicularis,Scirpus.fluviatilis,Scirpus.actutus,Spirodela.polyrhiza,Ludwigia.palustris,Vallisneria.americana,Acorus.calamus,Sparganium.eurycarpum,Eleocharis.palustris,Ranunculus.aquatilis,Poa.spp,Chara.spp,Chara.braunii,Myriophyllum.spp,Najas.flexilis,Nuphar.variegata,Pontederia.cordata,Nitella.flexilis,Elodia.nuttalli,Nymphaea.odorata,Potamogeton.zosteriformis,Scirpus.americanus,Lythrum.salicaria,Lycopus.americanus,Nasturtium.officinale,Impatiens.capensis,Sparganium.angustifolium,Ranunculus.flabellaris,Stuckenia.filiformis,Callitriche.palustris,Zannichellia.palustris
ALC,3,Alliant Center Pond,ALC_3,5/26/2020,2020,5,26,8:37:00,9:44:00,1:07,DCT,Urban,43.04651292,-89.37525752,306538.9061,4768718.054,COLISEUM DANE CO,Lake Monona-Yahara River,Lake Monona-Yahara River,117.91,3189,NA,1974,Stormwater,0.820143885,0,0.09352518,0.086330935,0,0,0.629885057,0.157471264,0.08045977,0.050574713,0.035632184,0.045977011,0.00114482,0.007727533,0.074699485,0.162278191,0.194046938,0.18374356,0.088437321,0.01688609,0.001431025,0.058672009,0.002862049,0.040927304,0.160847167,0,0.006296508,0.540068689,0.117057813,0.023182599,0.088437321,0.069261591,0.160847167,23,7,74,50,5,1,24.1,560,570,118.6,9.67,0.28,242.15,154.3,8.95,5.51,66.15,497.58,8.34,0.24,188.85,22.73,167.87,NA,0,95,4,1,15,85,"Mud,Vegetation,Rock ",1,2,2,2,1.75,1.88,"Surprisingly gorgeous pond- lots of submergent, emergent plant varieties, little trash and Ephemeroptera, trichoptera and damselflies.",NA,49,15,27,4,7,34,0,49,0,3,2,1,0,0,0,0,0,0,0,0,NA,"Painted,,,,",1,0,0,1,NA,"Yes, small,,,,",0,0,0,0,1,0,0,0,0,0,0,0,0,0,NA,NA,NA,NA,NA,NA,NA,NA,NA,NA,NA,NA,NA,NA,NA,NA,NA,NA,NA,NA,NA,NA,NA,NA,NA,NA,NA,NA,NA,NA,NA,NA,NA,NA,NA,NA,NA,NA,NA,NA,NA,NA,NA,NA,NA,NA,NA,NA,NA,NA,NA,NA,NA,NA,NA,NA,NA,NA,NA,NA,NA,NA,NA,NA,0,1,1,1,1,0,0,0,1,1,1,1,1,1,1,1,1,1,0,0,0,0,0,0,0,0,0,0,0,0,0,0,0,0,0,0,0,0,0,0,0,0,0,0,0,0,0,0,0,0,0,0,0,0,0,0,0,0,0,0,0,0,0,0,0,0,0,0,0
ALC,4,Alliant Center Pond,ALC_4,7/20/2020,2020,7,20,7:45:00,8:43:00,0:58,DCT,Urban,43.04651292,-89.37525752,306538.9061,4768718.054,COLISEUM DANE CO,Lake Monona-Yahara River,Lake Monona-Yahara River,117.91,3189,NA,1974,Stormwater,0.820143885,0,0.09352518,0.086330935,0,0,0.629885057,0.157471264,0.08045977,0.050574713,0.035632184,0.045977011,0.00114482,0.007727533,0.074699485,0.162278191,0.194046938,0.18374356,0.088437321,0.01688609,0.001431025,0.058672009,0.002862049,0.040927304,0.160847167,0,0.006296508,0.540068689,0.117057813,0.023182599,0.088437321,0.069261591,0.160847167,21,4,75,1,5,3,23,348.2,361.7,8.2,0.68,0.17,5.53,297.1,7.72,5.51,66.15,497.58,8.34,0.24,188.85,22.73,167.87,NA,0,30,5,65,5,95,"Firm Soil,Rock ,NA",3,1,2,2,2,1.88,"Thick Elodia throughout water column up to surface with floating algae on top. Steepbank with a variety of emergent in thin strip around pond surrounded by rock rip-rap. Fountain actively going, tons of amphipods.",NA,49,15,27,4,7,34,0,49,0,3,2,1,0,0,0,0,0,0,0,0,NA,"Painted,,,,NA",1,0,0,1,NA,"Shiners, Brook Stickleback,,,,NA",1,0,0,1,0,0,0,0,0,0,0,0,0,0,NA,NA,NA,NA,NA,NA,NA,NA,NA,NA,NA,NA,NA,NA,NA,NA,NA,NA,NA,NA,NA,NA,NA,NA,NA,NA,NA,NA,NA,NA,NA,NA,NA,NA,NA,NA,NA,NA,NA,NA,NA,NA,NA,NA,NA,NA,NA,NA,NA,NA,NA,NA,NA,NA,NA,NA,NA,NA,NA,NA,NA,NA,NA,NA,0,1,1,1,1,0,0,0,1,1,1,1,0,1,1,1,0,1,1,0,0,0,0,0,0,0,0,0,0,0,0,0,0,0,0,0,0,0,0,0,0,0,0,0,0,0,0,0,0,0,0,0,0,0,0,0,0,0,0,0,0,0,0,0,0,0,0,0,0
ALC,1,Alliant Center Pond,ALC_1,6/18/2019,2019,6,18,13:57:00,14:45:00,0:48,"DP,EC,CL",Urban,43.04651292,-89.37525752,306538.9061,4768718.054,COLISEUM DANE CO,Lake Monona-Yahara River,Lake Monona-Yahara River,117.91,3189,258,1974,Stormwater,0.820143885,0,0.09352518,0.086330935,0,0,0.629885057,0.157471264,0.08045977,0.050574713,0.035632184,0.045977011,0.00114482,0.007727533,0.074699485,0.162278191,0.194046938,0.18374356,0.088437321,0.01688609,0.001431025,0.058672009,0.002862049,0.040927304,0.160847167,0,0.006296508,0.540068689,0.117057813,0.023182599,0.088437321,0.069261591,0.160847167,NA,NA,NA,95,NA,9,19.7,813,904,70.2,6.21,0.45,242.87,154.2,NA,5.51,66.15,497.58,8.34,0.24,188.85,22.73,167.87,1.34,NA,NA,NA,NA,NA,NA,NA,NA,NA,NA,NA,NA,NA,NA,"has fountain, possible other types of fish",49,15,27,4,7,34,0,49,0,3,2,0,0,1,0,0,0,0,0,0,0,NA,0,0,0,1,NA,"minnows,sunfish",0,0,1,0,0,0,0,0,0,0,NA,0,0,0,1,0,1,0,1,0,1,0,1,1,0,0,0,1,1,0,1,1,1,0,0,0,0,0,0,0,0,0,0,0,1,0,0,0,1,1,1,0,1,1,1,1,1,1,0,0,0,0,1,1,1,1,1,1,1,1,0,1,0,0,0,NA,11,NA,NA,NA,NA,NA,NA,NA,NA,NA,NA,NA,NA,NA,NA,NA,NA,NA,NA,NA,NA,NA,NA,NA,NA,NA,NA,NA,NA,NA,NA,NA,NA,NA,NA,NA,NA,NA,NA,NA,NA,NA,NA,NA,NA,NA,NA,NA,NA,NA,NA,NA,NA,NA,NA,NA,NA,NA,NA,NA,NA,NA,NA,NA,NA,NA,NA,NA,NA,NA,NA
ALC,2,Alliant Center Pond,ALC_2,7/19/2019,2019,7,19,10:09:00,10:25:00,0:16,"EC,CL,BC",Urban,43.04651292,-89.37525752,306538.9061,4768718.054,COLISEUM DANE CO,Lake Monona-Yahara River,Lake Monona-Yahara River,117.91,3189,262,1974,Stormwater,0.820143885,0,0.09352518,0.086330935,0,0,0.629885057,0.157471264,0.08045977,0.050574713,0.035632184,0.045977011,0.00114482,0.007727533,0.074699485,0.162278191,0.194046938,0.18374356,0.088437321,0.01688609,0.001431025,0.058672009,0.002862049,0.040927304,0.160847167,0,0.006296508,0.540068689,0.117057813,0.023182599,0.088437321,0.069261591,0.160847167,27,3,78,100,NA,9,24.1,152,154.6,67.6,5.48,0.07,18.59,149.8,NA,5.51,66.15,497.58,8.34,0.24,188.85,22.73,167.87,1.54,NA,NA,NA,NA,NA,NA,NA,NA,NA,NA,NA,NA,NA,NA,lots of veg cut down since first round,49,15,27,4,7,34,0,49,0,3,2,1,0,1,0,0,0,0,0,0,0,NA,0,0,0,1,NA,minnow sp.,0,0,0,0,0,0,1,0,0,0,NA,0,0,0,NA,NA,NA,NA,NA,NA,NA,NA,NA,NA,NA,NA,NA,NA,NA,NA,NA,NA,NA,NA,NA,NA,NA,NA,NA,NA,NA,NA,NA,NA,NA,NA,NA,NA,NA,NA,NA,NA,NA,NA,NA,NA,NA,NA,NA,NA,NA,NA,NA,NA,NA,NA,NA,NA,NA,NA,NA,NA,NA,NA,NA,slugs,0,slugs may have been washed in?,NA,NA,NA,NA,NA,NA,NA,NA,NA,NA,NA,NA,NA,NA,NA,NA,NA,NA,NA,NA,NA,NA,NA,NA,NA,NA,NA,NA,NA,NA,NA,NA,NA,NA,NA,NA,NA,NA,NA,NA,NA,NA,NA,NA,NA,NA,NA,NA,NA,NA,NA,NA,NA,NA,NA,NA,NA,NA,NA,NA,NA,NA,NA,NA,NA,NA,NA,NA,NA
SWP-ARB,3,Arboretum Stormwater Pond,SWP-ARB_3,5/16/2020,2020,5,16,9:22:00,10:12:00,0:50,DCT,Green Space,43.03666602,-89.4243379,302509.6194,4767738.857,UNIV OF WIS REGENTS,Lake Monona-Yahara River,Lake Monona-Yahara River,8.33,558,NA,2010,Stormwater,0.459854015,0.094890511,0.350364964,0.03649635,0.058394161,0,0.53272101,0.052812859,0.306544202,0.019517796,0.086107922,0.001148106,0.000573,0.040137615,0.11668578,0.096616972,0.192087156,0.137327982,0.136754587,0.039277523,0.006880734,0.054759174,0.001433486,0.035550459,0.00086,0,0.141055046,0.42603211,0.159116972,0.180332569,0.136754587,0.096330275,0.00086,13,10,74,75,5,0,17.1,371.7,437.4,59.2,5.56,0.21,500.21,168.6,7.29,4.14,46.55,1262.35,7.2,0.64,166.18,20.68,515,NA,0,80,10,10,95,5,"Mud,,NA",3,1,1,0,1.25,2.25,"No amphibians observed in pond, although numerous ranid tadpoles seen in both the pond to north and outflow pond.",NA,41,14,23,0,4,27,0,41,0,4,3,0,0,0,0,0,0,0,0,0,NA,"Painted,,,,NA",1,0,0,1,NA,NA,0,0,0,0,0,0,0,0,0,0,0,0,0,0,NA,NA,NA,NA,NA,NA,NA,NA,NA,NA,NA,NA,NA,NA,NA,NA,NA,NA,NA,NA,NA,NA,NA,NA,NA,NA,NA,NA,NA,NA,NA,NA,NA,NA,NA,NA,NA,NA,NA,NA,NA,NA,NA,NA,NA,NA,NA,NA,NA,NA,NA,NA,NA,NA,NA,NA,NA,NA,NA,NA,NA,NA,NA,NA,0,0,0,0,0,0,0,0,1,1,0,0,1,1,0,0,1,0,0,0,0,0,0,0,0,0,0,0,0,0,0,0,0,0,0,0,0,0,0,0,0,0,0,0,0,0,0,0,0,0,0,0,0,0,0,0,0,0,0,0,0,0,0,0,0,0,0,0,0
SWP-ARB,4,Arboretum Stormwater Pond,SWP-ARB_4,7/9/2020,2020,7,9,6:10:00,6:54:00,0:44,DCT,Green Space,43.03666602,-89.4243379,302509.6194,4767738.857,UNIV OF WIS REGENTS,Lake Monona-Yahara River,Lake Monona-Yahara River,8.33,558,NA,2010,Stormwater,0.459854015,0.094890511,0.350364964,0.03649635,0.058394161,0,0.53272101,0.052812859,0.306544202,0.019517796,0.086107922,0.001148106,0.000573,0.040137615,0.11668578,0.096616972,0.192087156,0.137327982,0.136754587,0.039277523,0.006880734,0.054759174,0.001433486,0.035550459,0.00086,0,0.141055046,0.42603211,0.159116972,0.180332569,0.136754587,0.096330275,0.00086,23,2,89,10,5,0,22.7,805,842,2.9,0.25,0.41,232.25,313.9,7.1,4.14,46.55,1262.35,7.2,0.64,166.18,20.68,515,NA,0,50,15,35,56,44,"Firm Soil,Leaf Litter,NA",5,5,2,1,3.25,2.25,Water clear but filled with trash. Lots of deer beds. Green juvs. Water at NHWL. Variety of emergent but mostly typha in the water.,NA,41,14,23,0,4,27,0,41,0,4,3,1,0,0,0,1,0,0,0,0,NA,"Painted,,,,NA",1,0,0,1,NA,NA,0,0,0,0,0,0,0,0,0,0,0,0,0,0,NA,NA,NA,NA,NA,NA,NA,NA,NA,NA,NA,NA,NA,NA,NA,NA,NA,NA,NA,NA,NA,NA,NA,NA,NA,NA,NA,NA,NA,NA,NA,NA,NA,NA,NA,NA,NA,NA,NA,NA,NA,NA,NA,NA,NA,NA,NA,NA,NA,NA,NA,NA,NA,NA,NA,NA,NA,NA,NA,NA,NA,NA,NA,NA,0,0,1,1,0,0,0,0,1,1,1,1,1,1,1,0,1,0,0,0,0,1,0,0,0,0,0,0,0,0,0,0,0,0,0,0,0,0,0,0,0,0,0,0,1,0,0,0,1,0,0,0,0,0,0,0,0,0,0,0,0,0,0,0,1,0,0,0,0
SWP-ARB,1,Arboretum Stormwater Pond,SWP-ARB_1,5/29/2019,2019,5,29,13:02:00,14:05:00,1:03,"DP,ES,EC,EP",Green Space,43.03666602,-89.4243379,302509.6194,4767738.857,UNIV OF WIS REGENTS,Lake Monona-Yahara River,Lake Monona-Yahara River,8.33,558,NA,2010,Stormwater,0.459854015,0.094890511,0.350364964,0.03649635,0.058394161,0,0.53272101,0.052812859,0.306544202,0.019517796,0.086107922,0.001148106,0.000573,0.040137615,0.11668578,0.096616972,0.192087156,0.137327982,0.136754587,0.039277523,0.006880734,0.054759174,0.001433486,0.035550459,0.00086,0,0.141055046,0.42603211,0.159116972,0.180332569,0.136754587,0.096330275,0.00086,19,2,70,62,NA,7,18.9,1460,1652,83,7.4,0.84,337.66,80.82,NA,4.14,46.55,1262.35,7.2,0.64,166.18,20.68,515,1.68,NA,NA,NA,NA,NA,NA,NA,NA,NA,NA,NA,NA,NA,NA,"No recorded distance for zoop. Tow 3, No substrate recorded, No perimeter recorded, Elevation incorrect, Toad tadpoles present in small, adjacent pond",41,14,23,0,4,27,0,41,0,4,3,1,0,0,0,0,0,0,0,0,1,Painted,1,0,0,1,NA,NA,0,0,0,0,0,0,0,0,0,0,NA,0,0,0,1,0,1,0,1,0,1,0,0,0,1,0,0,1,1,1,1,0,1,0,0,0,0,0,1,0,0,0,0,1,0,0,0,0,1,1,1,0,1,1,0,1,0,1,1,0,0,0,1,0,0,0,1,0,1,1,1,1,0,0,0,NA,6,NA,NA,NA,NA,NA,NA,NA,NA,NA,NA,NA,NA,NA,NA,NA,NA,NA,NA,NA,NA,NA,NA,NA,NA,NA,NA,NA,NA,NA,NA,NA,NA,NA,NA,NA,NA,NA,NA,NA,NA,NA,NA,NA,NA,NA,NA,NA,NA,NA,NA,NA,NA,NA,NA,NA,NA,NA,NA,NA,NA,NA,NA,NA,NA,NA,NA,NA,NA,NA,NA
SWP-ARB,2,Arboretum Stormwater Pond,SWP-ARB_2,7/17/2019,2019,7,17,8:54:00,9:11:00,0:17,"EC,CL,EP",Green Space,43.03666602,-89.4243379,302509.6194,4767738.857,UNIV OF WIS REGENTS,Lake Monona-Yahara River,Lake Monona-Yahara River,8.33,558,261,2010,Stormwater,0.459854015,0.094890511,0.350364964,0.03649635,0.058394161,0,0.53272101,0.052812859,0.306544202,0.019517796,0.086107922,0.001148106,0.000573,0.040137615,0.11668578,0.096616972,0.192087156,0.137327982,0.136754587,0.039277523,0.006880734,0.054759174,0.001433486,0.035550459,0.00086,0,0.141055046,0.42603211,0.159116972,0.180332569,0.136754587,0.096330275,0.00086,26,3,70,1,NA,12,24,2076,2118,41.1,3.34,1.08,707.13,101.4,NA,4.14,46.55,1262.35,7.2,0.64,166.18,20.68,515,4.42,NA,NA,NA,NA,NA,NA,NA,NA,NA,NA,NA,NA,NA,NA,other larve=very tiny toad-like tads with visible intestines,41,14,23,0,4,27,0,41,0,4,3,1,0,1,0,0,0,0,0,0,1,NA,0,0,0,1,NA,NA,0,0,0,0,0,0,0,0,0,0,NA,0,0,0,NA,NA,NA,NA,NA,NA,NA,NA,NA,NA,NA,NA,NA,NA,NA,NA,NA,NA,NA,NA,NA,NA,NA,NA,NA,NA,NA,NA,NA,NA,NA,NA,NA,NA,NA,NA,NA,NA,NA,NA,NA,NA,NA,NA,NA,NA,NA,NA,NA,NA,NA,NA,NA,NA,NA,NA,NA,NA,NA,NA,NA,"Odonata,Belestoma",13,other amphibian=tiny toad like tad with visible intestines,NA,NA,NA,NA,NA,NA,NA,NA,NA,NA,NA,NA,NA,NA,NA,NA,NA,NA,NA,NA,NA,NA,NA,NA,NA,NA,NA,NA,NA,NA,NA,NA,NA,NA,NA,NA,NA,NA,NA,NA,NA,NA,NA,NA,NA,NA,NA,NA,NA,NA,NA,NA,NA,NA,NA,NA,NA,NA,NA,NA,NA,NA,NA,NA,NA,NA,NA,NA,NA
AV,3,Avalon,AV_3,5/25/2020,2020,5,25,14:00:00,14:25:00,0:25,DCT,Urban,43.00460131,-89.50442667,295878.9128,4764369.509,CITY OF MADISON ENGINEER STORMWATER UTILITY 533,Headwaters Sugar River,Badger Mill Creek,277.75,424,NA,2000,Stormwater,0.685714286,0,0,0.235714286,0.078571429,0,0.546605293,0.003452244,0,0.14269275,0.300345224,0.006904488,0.000573,0.062732741,0.008879977,0.00658837,0.236321971,0.273560584,0.122028072,0.00343741,0,0.268404469,0.005729017,0,0.011744486,0,0,0.516470925,0.008879977,0.00343741,0.122028072,0.336866227,0.011744486,28,13,57,20,1,0,23.4,109,112.5,45.9,3.77,0.05,149.22,NA,6.96,2.35,27.8,108.5,6.86,0.05,189.13,21.7,53.11,NA,0,65,20,15,100,0,"Mud,Leaf Litter,",4,1,2,0,1.75,1.5,"Deep leaf litter, trash substrate. Clear water",NA,28,10,15,0,3,18,0,28,0,3,2,0,1,0,0,0,0,0,0,0,NA,NA,0,0,0,1,NA,NA,0,0,0,0,0,0,0,0,0,0,0,0,0,0,NA,NA,NA,NA,NA,NA,NA,NA,NA,NA,NA,NA,NA,NA,NA,NA,NA,NA,NA,NA,NA,NA,NA,NA,NA,NA,NA,NA,NA,NA,NA,NA,NA,NA,NA,NA,NA,NA,NA,NA,NA,NA,NA,NA,NA,NA,NA,NA,NA,NA,NA,NA,NA,NA,NA,NA,NA,NA,NA,NA,NA,NA,NA,NA,0,1,1,0,0,0,0,0,0,1,0,1,0,1,0,0,0,0,0,0,0,0,0,0,0,0,0,0,0,0,0,0,0,0,0,0,0,0,0,0,0,0,0,0,0,0,0,0,0,0,0,0,0,0,0,0,0,0,0,0,0,0,0,0,0,0,0,0,0
AV,4,Avalon,AV_4,7/29/2020,2020,7,29,8:12:00,9:04:00,0:52,DCT,Urban,43.00460131,-89.50442667,295878.9128,4764369.509,CITY OF MADISON ENGINEER STORMWATER UTILITY 533,Headwaters Sugar River,Badger Mill Creek,277.75,424,NA,2000,Stormwater,0.685714286,0,0,0.235714286,0.078571429,0,0.546605293,0.003452244,0,0.14269275,0.300345224,0.006904488,0.000573,0.062732741,0.008879977,0.00658837,0.236321971,0.273560584,0.122028072,0.00343741,0,0.268404469,0.005729017,0,0.011744486,0,0,0.516470925,0.008879977,0.00343741,0.122028072,0.336866227,0.011744486,23,1,75,0,1,0,22,89,94.5,20.9,1.76,0.04,5.08,253.1,6.75,2.35,27.8,108.5,6.86,0.05,189.13,21.7,53.11,NA,0,5,30,65,100,0,"Leaf Litter,Rock ,Sand",1,1,3,0,1.25,1.5,"Millions of mosquito larvae, almost no other insects seen. Substrate is gravel covered with typha leaf litter and smells terrible. Plenty of frogs but no larvae, no submerged detected. Sphaeridae and corixidae, only invert detected.",NA,28,10,15,0,3,18,0,28,0,3,2,1,1,0,0,0,0,0,0,0,NA,"Painted,,,,",1,0,0,1,NA,NA,0,0,0,0,0,0,0,0,0,0,0,0,0,0,NA,NA,NA,NA,NA,NA,NA,NA,NA,NA,NA,NA,NA,NA,NA,NA,NA,NA,NA,NA,NA,NA,NA,NA,NA,NA,NA,NA,NA,NA,NA,NA,NA,NA,NA,NA,NA,NA,NA,NA,NA,NA,NA,NA,NA,NA,NA,NA,NA,NA,NA,NA,NA,NA,NA,NA,NA,NA,NA,NA,NA,NA,NA,NA,0,1,1,0,0,1,0,0,0,1,0,1,0,1,0,0,1,0,0,1,1,1,0,0,0,0,0,0,0,0,0,0,0,0,0,0,0,0,0,0,0,0,0,0,0,0,0,0,0,0,0,0,0,0,0,0,0,0,0,0,0,0,0,0,0,0,0,0,0
AV,1,Avalon,AV_1,6/26/2019,2019,6,26,13:55:00,14:15:00,0:20,"ES,EC,CL,EP",Urban,43.00460131,-89.50442667,295878.9128,4764369.509,CITY OF MADISON ENGINEER STORMWATER UTILITY 533,Headwaters Sugar River,Badger Mill Creek,277.75,424,203,2000,Stormwater,0.685714286,0,0,0.235714286,0.078571429,0,0.546605293,0.003452244,0,0.14269275,0.300345224,0.006904488,0.000573,0.062732741,0.008879977,0.00658837,0.236321971,0.273560584,0.122028072,0.00343741,0,0.268404469,0.005729017,0,0.011744486,0,0,0.516470925,0.008879977,0.00343741,0.122028072,0.336866227,0.011744486,28,2,37,80,NA,2,21.2,93,100.3,31.5,2.71,0.05,4.06,131.9,NA,2.35,27.8,108.5,6.86,0.05,189.13,21.7,53.11,0.3,NA,NA,NA,NA,NA,NA,NA,NA,NA,NA,NA,NA,NA,NA,"Drag zoop tows, no area/perimeter calculated due to depth, no property owner recorded",28,10,15,0,3,18,0,28,0,3,2,1,1,0,0,0,0,0,0,0,0,NA,0,0,0,1,NA,NA,0,0,0,0,0,0,0,0,0,0,NA,0,0,0,1,0,1,0,1,0,1,0,0,1,0,0,0,1,1,0,0,0,1,1,0,0,0,0,0,1,0,0,0,0,0,0,0,0,1,1,0,0,0,1,0,1,0,0,1,1,0,0,1,0,0,0,0,0,0,0,0,1,0,0,0,"backswimmers,beetles,mosquito larvae",5,hard to seine,NA,NA,NA,NA,NA,NA,NA,NA,NA,NA,NA,NA,NA,NA,NA,NA,NA,NA,NA,NA,NA,NA,NA,NA,NA,NA,NA,NA,NA,NA,NA,NA,NA,NA,NA,NA,NA,NA,NA,NA,NA,NA,NA,NA,NA,NA,NA,NA,NA,NA,NA,NA,NA,NA,NA,NA,NA,NA,NA,NA,NA,NA,NA,NA,NA,NA,NA,NA,NA
AV,2,Avalon,AV_2,8/2/2019,2019,8,2,8:45:00,9:00:00,0:15,"CL,EP,BC",Urban,43.00460131,-89.50442667,295878.9128,4764369.509,CITY OF MADISON ENGINEER STORMWATER UTILITY 533,Headwaters Sugar River,Badger Mill Creek,277.75,424,303,2000,Stormwater,0.685714286,0,0,0.235714286,0.078571429,0,0.546605293,0.003452244,0,0.14269275,0.300345224,0.006904488,0.000573,0.062732741,0.008879977,0.00658837,0.236321971,0.273560584,0.122028072,0.00343741,0,0.268404469,0.005729017,0,0.011744486,0,0,0.516470925,0.008879977,0.00343741,0.122028072,0.336866227,0.011744486,22,0,57,1,NA,2,20.2,115.1,126.7,12.9,1.14,0.06,6.04,182.4,NA,2.35,27.8,108.5,6.86,0.05,189.13,21.7,53.11,0.84,NA,NA,NA,NA,NA,NA,NA,NA,NA,NA,NA,NA,NA,NA,Very deep,28,10,15,0,3,18,0,28,0,3,2,1,0,0,0,0,0,0,0,0,0,Painted,1,0,0,1,NA,NA,0,0,0,0,0,0,0,0,0,0,NA,0,0,0,NA,NA,NA,NA,NA,NA,NA,NA,NA,NA,NA,NA,NA,NA,NA,NA,NA,NA,NA,NA,NA,NA,NA,NA,NA,NA,NA,NA,NA,NA,NA,NA,NA,NA,NA,NA,NA,NA,NA,NA,NA,NA,NA,NA,NA,NA,NA,NA,NA,NA,NA,NA,NA,NA,NA,NA,NA,NA,NA,NA,NA,NA,1,too deep in many areas to sweep and seine,NA,NA,NA,NA,NA,NA,NA,NA,NA,NA,NA,NA,NA,NA,NA,NA,NA,NA,NA,NA,NA,NA,NA,NA,NA,NA,NA,NA,NA,NA,NA,NA,NA,NA,NA,NA,NA,NA,NA,NA,NA,NA,NA,NA,NA,NA,NA,NA,NA,NA,NA,NA,NA,NA,NA,NA,NA,NA,NA,NA,NA,NA,NA,NA,NA,NA,NA,NA,NA
BF1,3,Badfish 1,BF1_3,5/11/2021,2021,5,11,11:31:00,12:10:00,0:39,"DCT, JM",Rural,42.86369112,-89.26652896,314847.4326,4748170,WIDNR,Badfish Creek,Rutland Creek-Badfish Creek,22.46,1627,279,1968,Natural,0,0,0.964028777,0,0.035971223,0,0,0.013777268,0.754305396,0,0.231917336,0,0.000286,0.245990836,0.032359679,0,0,0,0,0.42812142,0.003150057,0.107101947,0,0.008018328,0.000286,0,0.174684994,0,0.043528064,0.602806415,0,0.353092784,0.000286,11,8,36,2,0,20,NA,NA,NA,NA,NA,NA,NA,NA,NA,0.36,3.85,384.2,7.06,0.19,481.9,17.45,360.83,NA,0,70,2,28,100,0,"Super Muddy, Woody",1,1,2,5,2.25,2.25,"14 Total turtles upon arrival, 6 Blandings and 8 Painted. 2 ranid frogs, 1 green and no sign of pickerel. 1 juv painted turtle predated. 3 seines, 1)0, 2)0, 3) 1 mudminnow.",NA,35,7,19,1,9,28,0,35,0,8,5,1,0,0,0,0,0,0,0,0,NA,"Blanding's,Painted,,,NA",1,0,1,3,NA,"Mud Minnow,,,,NA",0,1,0,0,0,0,0,0,0,0,0,0,0,0,NA,NA,NA,NA,NA,NA,NA,NA,NA,NA,NA,NA,NA,NA,NA,NA,NA,NA,NA,NA,NA,NA,NA,NA,NA,NA,NA,NA,NA,NA,NA,NA,NA,NA,NA,NA,NA,NA,NA,NA,NA,NA,NA,NA,NA,NA,NA,NA,NA,NA,NA,NA,NA,NA,NA,NA,NA,NA,NA,NA,NA,NA,NA,NA,0,0,0,0,0,0,0,0,0,0,0,0,0,1,0,0,1,0,0,0,0,0,1,0,1,0,1,0,0,0,0,0,0,0,0,0,0,0,0,0,0,0,0,0,0,0,0,0,0,0,0,0,0,0,0,0,0,0,0,0,0,0,0,0,0,0,0,0,0
BF1,4,Badfish 1,BF1_4,5/13/2021,2021,5,13,13:21:00,13:58:00,0:37,DCT,Rural,42.86369112,-89.26652896,314847.4326,4748170,WIDNR,Badfish Creek,Rutland Creek-Badfish Creek,22.46,1627,279,1968,Natural,0,0,0.964028777,0,0.035971223,0,0,0.013777268,0.754305396,0,0.231917336,0,0.000286,0.245990836,0.032359679,0,0,0,0,0.42812142,0.003150057,0.107101947,0,0.008018328,0.000286,0,0.174684994,0,0.043528064,0.602806415,0,0.353092784,0.000286,19,4,20,50,0,20,NA,NA,NA,NA,NA,NA,NA,NA,NA,0.36,3.85,384.2,7.06,0.19,481.9,17.45,360.83,NA,0,70,10,20,100,0,"Super Muddy,Leaf Litter,",1,1,2,5,2.25,2.25,"Small snapping turtle seen basking, lots of turtles out, 11 total, several green frogs, Pickerel and 1 leopard or pickerel. Water cold and clear and not dominated by DW yet.",NA,35,7,19,1,9,28,0,35,0,8,5,1,0,0,1,0,1,0,0,0,NA,"Blanding's,Snapping,Painted,,",1,1,1,3,NA,"Mud Minnow,,,,NA",0,1,0,0,0,0,0,0,0,0,0,0,0,0,NA,NA,NA,NA,NA,NA,NA,NA,NA,NA,NA,NA,NA,NA,NA,NA,NA,NA,NA,NA,NA,NA,NA,NA,NA,NA,NA,NA,NA,NA,NA,NA,NA,NA,NA,NA,NA,NA,NA,NA,NA,NA,NA,NA,NA,NA,NA,NA,NA,NA,NA,NA,NA,NA,NA,NA,NA,NA,NA,NA,NA,NA,NA,NA,0,1,0,0,0,0,0,0,0,0,0,0,0,1,0,0,1,0,0,0,0,0,1,0,1,0,1,1,0,0,0,0,0,0,0,0,0,0,0,0,0,0,0,0,0,0,0,0,0,0,0,0,0,0,0,0,0,0,0,0,0,0,0,0,0,0,0,0,0
BF1,1,Badfish 1,BF1_1,6/18/2020,2020,6,18,9:24:00,10:15:00,0:51,DCT,Rural,42.86369112,-89.26652896,314847.4326,4748170,WIDNR,Badfish Creek,Rutland Creek-Badfish Creek,22.46,1627,269,1968,Natural,0,0,0.964028777,0,0.035971223,0,0,0.013777268,0.754305396,0,0.231917336,0,0.000286,0.245990836,0.032359679,0,0,0,0,0.42812142,0.003150057,0.107101947,0,0.008018328,0.000286,0,0.174684994,0,0.043528064,0.602806415,0,0.353092784,0.000286,26,5,47,0,0,35,17,293.2,346,3.8,0.36,0.17,360.83,421.8,7.18,0.36,3.85,384.2,7.06,0.19,481.9,17.45,360.83,NA,0,0,10,90,NA,NA,NA,NA,NA,NA,NA,NA,NA,"Thick floating veg layer, clear beneath with thick flocc layer of sticks and leaves. Phalaras on edges, would be emergent id water was higher, looks about 4ft lower than high water line. Lots of toad tads and mudminnows. Lots of green frogs but no larave observed. Corixidae and snails only inverts observed.",NA,35,7,19,1,9,28,0,35,0,8,5,1,1,1,0,0,0,0,0,0,NA,"Painted,Blanding's,,,NA",1,0,1,3,NA,"Mud Minnow,,,,NA",0,1,0,0,0,0,0,0,0,0,0,0,0,0,1,0,1,0,1,1,1,1,1,1,0,0,1,1,1,0,1,0,1,0,0,0,0,0,1,1,0,1,0,0,0,1,0,0,1,1,1,0,1,0,1,1,1,0,1,0,1,1,1,1,0,1,0,1,0,1,0,1,0,0,0,NA,3,NA,NA,NA,NA,NA,NA,NA,NA,NA,NA,NA,NA,NA,NA,NA,NA,NA,NA,NA,NA,NA,NA,NA,NA,NA,NA,NA,NA,NA,NA,NA,NA,NA,NA,NA,NA,NA,NA,NA,NA,NA,NA,NA,NA,NA,NA,NA,NA,NA,NA,NA,NA,NA,NA,NA,NA,NA,NA,NA,NA,NA,NA,NA,NA,NA,NA,NA,NA,NA,NA
BF1,2,Badfish 1,BF1_2,8/5/2020,2020,8,5,11:45:00,12:51:00,1:06,DCT,Rural,42.86369112,-89.26652896,314847.4326,4748170,WIDNR,Badfish Creek,Rutland Creek-Badfish Creek,22.46,1627,279,1968,Natural,0,0,0.964028777,0,0.035971223,0,0,0.013777268,0.754305396,0,0.231917336,0,0.000286,0.245990836,0.032359679,0,0,0,0,0.42812142,0.003150057,0.107101947,0,0.008018328,0.000286,0,0.174684994,0,0.043528064,0.602806415,0,0.353092784,0.000286,22,6,53,70,0,35,17.9,365.3,422.4,3.9,0.36,0.2,2.5,542,6.94,0.36,3.85,384.2,7.06,0.19,481.9,17.45,360.83,NA,0,1,10,89,NA,NA,NA,NA,NA,NA,NA,NA,NA,"Water 1.5 m lower than previous visit. Bank exposed mud with almost no emergent except willows. No submergent detected. Lots of green and toads on bank, only 1 leopard (pickerel?). 1 Blandings 1 Painted. 2 muskrat in middle of pond. Drops off to knee deep mud immediately. Can't survey inner pond.",NA,35,7,19,1,9,28,0,35,0,8,5,1,0,1,0,0,1,0,0,0,NA,"Blanding's,Painted,,,NA",1,0,1,3,NA,"Mud Minnow,,,,NA",0,1,0,0,0,0,0,0,0,0,0,0,0,0,NA,NA,NA,NA,NA,NA,NA,NA,NA,NA,NA,NA,NA,NA,NA,NA,NA,NA,NA,NA,NA,NA,NA,NA,NA,NA,NA,NA,NA,NA,NA,NA,NA,NA,NA,NA,NA,NA,NA,NA,NA,NA,NA,NA,NA,NA,NA,NA,NA,NA,NA,NA,NA,NA,NA,NA,NA,NA,NA,NA,NA,NA,NA,NA,NA,NA,NA,NA,NA,NA,NA,NA,NA,NA,NA,NA,NA,NA,NA,NA,NA,NA,NA,NA,NA,NA,NA,NA,NA,NA,NA,NA,NA,NA,NA,NA,NA,NA,NA,NA,NA,NA,NA,NA,NA,NA,NA,NA,NA,NA,NA,NA,NA,NA,NA,NA,NA,NA,NA,NA,NA,NA,NA,NA,NA,NA,NA,NA,NA,NA,NA,NA,NA
BF2,3,Badfish 2,BF2_3,5/11/2021,2021,5,11,12:45:00,13:11:00,0:26,"DCT, JM",Rural,42.86444704,-89.26700947,314810.4389,4748255.004,WIDNR,Badfish Creek,Rutland Creek-Badfish Creek,25.18,1229,284,1968,Natural,0,0,0.921985816,0,0.078014184,0,0,0.012629162,0.765786452,0,0.221584386,0,0.000572,0.218088151,0.028334287,0,0,0,0,0.458500286,0.004579279,0.107040641,0,0.006296508,0.000286,0,0.176302232,0,0.039210074,0.634802519,0,0.325128792,0.000286,12,11,34,NA,0,5,NA,NA,NA,NA,NA,NA,NA,NA,NA,1.27,13.65,321.5,7.73,0.16,472.6,18.05,145.58,NA,0,60,5,35,0,100,Super muddy,1,1,1,4,1.75,1.88,"Water high and clear, Seines: 1)Belostomatid 2)0, 3)0. Mud and woody debris make seining incredibly difficult",NA,46,12,27,1,7,34,0,46,0,6,4,1,0,0,0,0,0,0,0,0,NA,Painted,1,0,0,2,NA,Mudminnow,0,1,0,0,0,0,0,0,0,0,0,0,0,0,NA,NA,NA,NA,NA,NA,NA,NA,NA,NA,NA,NA,NA,NA,NA,NA,NA,NA,NA,NA,NA,NA,NA,NA,NA,NA,NA,NA,NA,NA,NA,NA,NA,NA,NA,NA,NA,NA,NA,NA,NA,NA,NA,NA,NA,NA,NA,NA,NA,NA,NA,NA,NA,NA,NA,NA,NA,NA,NA,NA,NA,NA,NA,NA,0,1,0,1,0,0,0,0,0,0,0,0,0,0,0,1,1,0,0,0,0,0,0,0,1,0,1,0,1,0,0,0,0,0,0,0,0,0,0,0,0,0,0,0,0,0,0,0,0,0,0,0,0,0,0,0,0,0,0,0,0,0,0,0,0,0,0,0,0
BF2,4,Badfish 2,BF2_4,5/13/2021,2021,5,13,14:50:00,15:24:00,0:34,DCT,Rural,42.86444704,-89.26700947,314810.4389,4748255.004,WIDNR,Badfish Creek,Rutland Creek-Badfish Creek,25.18,1229,284,1968,Natural,0,0,0.921985816,0,0.078014184,0,0,0.012629162,0.765786452,0,0.221584386,0,0.000572,0.218088151,0.028334287,0,0,0,0,0.458500286,0.004579279,0.107040641,0,0.006296508,0.000286,0,0.176302232,0,0.039210074,0.634802519,0,0.325128792,0.000286,19,6,20,45,0,10,NA,NA,NA,NA,NA,NA,NA,NA,NA,1.27,13.65,321.5,7.73,0.16,472.6,18.05,145.58,NA,0,30,5,65,0,100,"Super Muddy,Leaf Litter,",1,1,2,4,2,1.88,"Water cool and clear, not dominated by floating yet. Lots of submergent veg. Lethoceran and pickerel.",NA,46,12,27,1,7,34,0,46,0,6,4,1,0,0,0,0,1,0,0,0,NA,Painted,1,0,0,2,NA,Mudminnow,0,1,0,0,0,0,0,0,0,0,0,0,0,0,NA,NA,NA,NA,NA,NA,NA,NA,NA,NA,NA,NA,NA,NA,NA,NA,NA,NA,NA,NA,NA,NA,NA,NA,NA,NA,NA,NA,NA,NA,NA,NA,NA,NA,NA,NA,NA,NA,NA,NA,NA,NA,NA,NA,NA,NA,NA,NA,NA,NA,NA,NA,NA,NA,NA,NA,NA,NA,NA,NA,NA,NA,NA,NA,0,1,1,1,0,0,0,0,0,0,0,0,1,1,0,1,1,0,0,0,0,0,0,0,1,0,0,1,1,1,0,0,0,0,0,0,0,0,0,0,0,0,0,0,0,0,0,0,0,0,0,0,0,0,0,0,0,0,0,0,0,0,0,0,0,0,0,0,0
BF2,1,Badfish 2,BF2_1,6/18/2020,2020,6,18,11:04:00,11:33:00,0:29,DCT,Rural,42.86444704,-89.26700947,314810.4389,4748255.004,WIDNR,Badfish Creek,Rutland Creek-Badfish Creek,25.18,1229,284,1968,Natural,0,0,0.921985816,0,0.078014184,0,0,0.012629162,0.765786452,0,0.221584386,0,0.000572,0.218088151,0.028334287,0,0,0,0,0.458500286,0.004579279,0.107040641,0,0.006296508,0.000286,0,0.176302232,0,0.039210074,0.634802519,0,0.325128792,0.000286,28,6,38,2,0,5,19.5,276.1,308.3,7.9,0.7,0.15,145.58,429.5,7.43,1.27,13.65,321.5,7.73,0.16,472.6,18.05,145.58,NA,0,2,8,90,NA,NA,NA,NA,NA,NA,NA,NA,NA,Water is deep with deep flocc layer and water column totally filled with Elodia and coontail. Tons of dragonflies and millions of toadlets. Observed leopard frog eating a toadlet,NA,46,12,27,1,7,34,0,46,0,6,4,1,1,1,0,0,0,0,0,0,NA,NA,0,0,0,2,NA,"Mud Minnow,,,,NA",0,1,0,0,0,0,0,0,0,0,0,0,0,0,1,0,1,0,1,0,1,1,1,1,0,0,1,1,1,0,1,0,1,1,0,0,1,0,0,1,0,0,0,1,1,1,0,0,1,1,1,0,1,0,1,1,1,0,1,0,1,1,1,1,1,1,1,1,0,1,0,1,0,0,0,NA,3,NA,NA,NA,NA,NA,NA,NA,NA,NA,NA,NA,NA,NA,NA,NA,NA,NA,NA,NA,NA,NA,NA,NA,NA,NA,NA,NA,NA,NA,NA,NA,NA,NA,NA,NA,NA,NA,NA,NA,NA,NA,NA,NA,NA,NA,NA,NA,NA,NA,NA,NA,NA,NA,NA,NA,NA,NA,NA,NA,NA,NA,NA,NA,NA,NA,NA,NA,NA,NA,NA
BF2,2,Badfish 2,BF2_2,8/5/2020,2020,8,5,10:04:00,10:55:00,0:51,DCT,Rural,42.86444704,-89.26700947,314810.4389,4748255.004,WIDNR,Badfish Creek,Rutland Creek-Badfish Creek,25.18,1229,284,1968,Natural,0,0,0.921985816,0,0.078014184,0,0,0.012629162,0.765786452,0,0.221584386,0,0.000572,0.218088151,0.028334287,0,0,0,0,0.458500286,0.004579279,0.107040641,0,0.006296508,0.000286,0,0.176302232,0,0.039210074,0.634802519,0,0.325128792,0.000286,21,5,60,40,0,20,16.6,281,334.7,19.4,1.84,0.16,2.53,515.7,8.02,1.27,13.65,321.5,7.73,0.16,472.6,18.05,145.58,NA,0,1,5,94,NA,NA,NA,NA,NA,NA,NA,NA,NA,100's of bullfrog and green frogs and lots of toadlets along edge. Water 1.5 meter below NHWL leaving a mudbank. Almost no current emergent except moss and willows. Emergent estimated for NHWL. Surface covered in Wolffia with dense submergent below. Water cold.,NA,46,12,27,1,7,34,0,46,0,6,4,1,1,1,0,0,1,0,0,0,NA,"Blanding's,Painted,,,NA",1,0,1,2,Garter,"Mudminnow,,,,NA",0,1,0,0,0,0,0,0,0,0,0,0,0,0,NA,NA,NA,NA,NA,NA,NA,NA,NA,NA,NA,NA,NA,NA,NA,NA,NA,NA,NA,NA,NA,NA,NA,NA,NA,NA,NA,NA,NA,NA,NA,NA,NA,NA,NA,NA,NA,NA,NA,NA,NA,NA,NA,NA,NA,NA,NA,NA,NA,NA,NA,NA,NA,NA,NA,NA,NA,NA,NA,NA,NA,NA,NA,NA,NA,NA,NA,NA,NA,NA,NA,NA,NA,NA,NA,NA,NA,NA,NA,NA,NA,NA,NA,NA,NA,NA,NA,NA,NA,NA,NA,NA,NA,NA,NA,NA,NA,NA,NA,NA,NA,NA,NA,NA,NA,NA,NA,NA,NA,NA,NA,NA,NA,NA,NA,NA,NA,NA,NA,NA,NA,NA,NA,NA,NA,NA,NA,NA,NA,NA,NA,NA,NA
BF3,3,Badfish 3,BF3_3,5/11/2021,2021,5,11,14:08:00,NA,NA,"DCT, JM",Rural,42.87154,-89.26814,314739.308,4749045.182,WIDNR,Badfish Creek,Rutland Creek-Badfish Creek,15.16,3469,269,1968,Natural,0,0.092857143,0.8,0,0.107142857,0,0,0.049199085,0.688787185,0,0.26201373,0,0.000572,0.161705781,0.004579279,0,0.000859,0,0.004293074,0.540927304,0.004579279,0.203205495,0,0.004579279,0.000286,0,0.07441328,0.000859,0.013737836,0.615340584,0.004293074,0.364911276,0.000286,13,7,31,10,2,1,NA,NA,NA,NA,NA,NA,NA,NA,NA,11.18,132.6,584.5,7.88,0.29,87.23,21.15,343.53,NA,0,85,10,5,65,35,Super muddy,5,4,1,3,3.25,3.38,"Water much lower than ususal 20 cm of water on 50cm of thick mud. No amphibians, but 3 snapping turtles and 2 water snakes. No seining, mud makes it impossible.",NA,57,21,29,2,7,36,0,57,0,5,4,1,0,0,0,0,0,0,0,0,NA,Snapping,0,1,0,1,Water,Stickleback,1,0,0,0,0,0,0,0,0,0,0,0,0,0,NA,NA,NA,NA,NA,NA,NA,NA,NA,NA,NA,NA,NA,NA,NA,NA,NA,NA,NA,NA,NA,NA,NA,NA,NA,NA,NA,NA,NA,NA,NA,NA,NA,NA,NA,NA,NA,NA,NA,NA,NA,NA,NA,NA,NA,NA,NA,NA,NA,NA,NA,NA,NA,NA,NA,NA,NA,NA,NA,NA,NA,NA,NA,NA,0,1,0,1,0,0,0,0,1,0,0,1,1,1,1,1,1,1,1,0,0,0,0,0,1,0,0,0,0,0,1,1,1,1,1,0,0,0,0,0,0,0,0,0,0,0,0,0,0,0,0,0,0,0,0,0,0,0,0,0,0,0,0,0,0,0,0,0,0
BF3,4,Badfish 3,BF3_4,5/13/2021,2021,5,13,15:44:00,16:07:00,0:23,DCT,Rural,42.87154,-89.26814,314739.308,4749045.182,WIDNR,Badfish Creek,Rutland Creek-Badfish Creek,15.16,3469,269,1968,Natural,0,0.092857143,0.8,0,0.107142857,0,0,0.049199085,0.688787185,0,0.26201373,0,0.000572,0.161705781,0.004579279,0,0.000859,0,0.004293074,0.540927304,0.004579279,0.203205495,0,0.004579279,0.000286,0,0.07441328,0.000859,0.013737836,0.615340584,0.004293074,0.364911276,0.000286,18,6,24,30,2,2,NA,NA,NA,NA,NA,NA,NA,NA,NA,11.18,132.6,584.5,7.88,0.29,87.23,21.15,343.53,NA,0,83,15,2,45,55,Super muddy,5,5,1,3,3.5,3.38,"Super low water and very muddy. Water clear and about 12 cm deep, but mud is 50cm dep",NA,57,21,29,2,7,36,0,57,0,5,4,1,0,0,0,0,0,0,0,0,NA,Snapping,0,1,0,1,NA,NA,0,0,0,0,0,0,0,0,0,0,0,0,0,0,NA,NA,NA,NA,NA,NA,NA,NA,NA,NA,NA,NA,NA,NA,NA,NA,NA,NA,NA,NA,NA,NA,NA,NA,NA,NA,NA,NA,NA,NA,NA,NA,NA,NA,NA,NA,NA,NA,NA,NA,NA,NA,NA,NA,NA,NA,NA,NA,NA,NA,NA,NA,NA,NA,NA,NA,NA,NA,NA,NA,NA,NA,NA,NA,0,1,0,1,0,0,0,0,1,0,0,1,0,1,1,1,1,1,1,0,1,0,0,0,0,0,0,0,0,0,1,0,1,0,1,1,1,1,0,0,0,0,0,0,0,0,0,0,0,0,0,0,0,0,0,0,0,0,0,0,0,0,0,0,0,0,0,0,0
BF3,1,Badfish 3,BF3_1,6/18/2020,2020,6,18,12:34:00,13:29:00,0:55,DCT,Rural,42.87154,-89.26814,314739.308,4749045.182,WIDNR,Badfish Creek,Rutland Creek-Badfish Creek,15.16,3469,269,1968,Natural,0,0.092857143,0.8,0,0.107142857,0,0,0.049199085,0.688787185,0,0.26201373,0,0.000572,0.161705781,0.004579279,0,0.000859,0,0.004293074,0.540927304,0.004579279,0.203205495,0,0.004579279,0.000286,0,0.07441328,0.000859,0.013737836,0.615340584,0.004293074,0.364911276,0.000286,28,7,36,18,2,8,23.6,583,599,208.3,17.17,0.29,343.53,88.95,8.06,11.18,132.6,584.5,7.88,0.29,87.23,21.15,343.53,NA,0,55,10,35,NA,NA,NA,NA,NA,NA,NA,NA,NA,"Shallow water column but deep flocculent substrate. Crystal clear to the top of flocc, wide variety of submergent and emergent plants.",NA,57,21,29,2,7,36,0,57,0,5,4,1,1,1,1,0,0,0,0,0,NA,NA,0,0,0,1,NA,"Stickleback,,,,NA",1,0,0,0,0,0,0,0,0,0,0,0,0,0,1,0,1,0,1,0,1,0,1,1,0,0,0,1,1,0,1,0,1,1,0,0,1,0,0,1,0,0,0,1,1,1,0,0,1,1,1,0,1,1,1,1,1,1,1,0,0,1,1,1,1,1,1,1,0,1,0,1,0,0,0,NA,3,NA,NA,NA,NA,NA,NA,NA,NA,NA,NA,NA,NA,NA,NA,NA,NA,NA,NA,NA,NA,NA,NA,NA,NA,NA,NA,NA,NA,NA,NA,NA,NA,NA,NA,NA,NA,NA,NA,NA,NA,NA,NA,NA,NA,NA,NA,NA,NA,NA,NA,NA,NA,NA,NA,NA,NA,NA,NA,NA,NA,NA,NA,NA,NA,NA,NA,NA,NA,NA,NA
BF3,2,Badfish 3,BF3_2,8/5/2020,2020,8,5,15:14:00,17:38:00,2:24,DCT,Rural,42.87154,-89.26814,314739.308,4749045.182,WIDNR,Badfish Creek,Rutland Creek-Badfish Creek,15.16,3469,269,1968,Natural,0,0.092857143,0.8,0,0.107142857,0,0,0.049199085,0.688787185,0,0.26201373,0,0.000572,0.161705781,0.004579279,0,0.000859,0,0.004293074,0.540927304,0.004579279,0.203205495,0,0.004579279,0.000286,0,0.07441328,0.000859,0.013737836,0.615340584,0.004293074,0.364911276,0.000286,22,6,53,55,2,3,18.7,501,570,56.9,5.18,0.28,2.62,85.51,7.69,11.18,132.6,584.5,7.88,0.29,87.23,21.15,343.53,NA,0,60,10,30,NA,NA,NA,NA,NA,NA,NA,NA,NA,"Thick boot sucking mud that smells bad, makes it impossible to survey interior of pond. Water shallow ~20cm but ~30 cm of mud below. Wide variety of submergent mixed together lots of green frogs. Awesome pond minus mud.",NA,57,21,29,2,7,36,0,57,0,5,4,1,1,0,0,0,0,0,0,0,NA,NA,0,0,0,1,Garter,"Juv. Sunfish,,,,NA",0,0,0,0,0,0,0,0,0,0,1,0,0,0,NA,NA,NA,NA,NA,NA,NA,NA,NA,NA,NA,NA,NA,NA,NA,NA,NA,NA,NA,NA,NA,NA,NA,NA,NA,NA,NA,NA,NA,NA,NA,NA,NA,NA,NA,NA,NA,NA,NA,NA,NA,NA,NA,NA,NA,NA,NA,NA,NA,NA,NA,NA,NA,NA,NA,NA,NA,NA,NA,NA,NA,NA,NA,NA,NA,NA,NA,NA,NA,NA,NA,NA,NA,NA,NA,NA,NA,NA,NA,NA,NA,NA,NA,NA,NA,NA,NA,NA,NA,NA,NA,NA,NA,NA,NA,NA,NA,NA,NA,NA,NA,NA,NA,NA,NA,NA,NA,NA,NA,NA,NA,NA,NA,NA,NA,NA,NA,NA,NA,NA,NA,NA,NA,NA,NA,NA,NA,NA,NA,NA,NA,NA,NA
BP,3,Badger Prairie,BP_3,5/25/2020,2020,5,25,14:41:00,16:03:00,1:22,DCT,Green Space,42.99864099,-89.52725696,293998.139,4763763.347,COUNTY OF DANE,Headwaters Sugar River,Badger Mill Creek,175.34,2191,NA,1995,Natural,0.246478873,0,0,0.161971831,0.584507042,0.007042254,0.413043478,0,0,0.200228833,0.371853547,0.014874142,0,0.040746055,0.008321377,0.042754663,0.238163558,0.188235294,0.175035868,0,0,0.294691535,0,0.006312769,0.005738881,0,0,0.469153515,0.014634146,0,0.175035868,0.33543759,0.005738881,28,15,55,15,0,2,25.6,33.8,33.1,139.6,11.01,0.01,140.3,59.25,9.63,8.16,104.68,45.31,9.73,0.02,72.84,26,48.46,NA,6,98,2,0,40,60,"Mud,Vegetation,NA",1,5,1,2,2.25,2,Large leeches with olive top and orange belly. Thousands of bullfrog tadpoles.,NA,28,10,13,2,5,18,0,28,0,3,2,0,1,0,0,0,0,0,0,0,NA,NA,0,0,0,1,NA,"Shiner,,,,NA",0,0,0,1,0,0,0,0,0,0,0,0,0,0,NA,NA,NA,NA,NA,NA,NA,NA,NA,NA,NA,NA,NA,NA,NA,NA,NA,NA,NA,NA,NA,NA,NA,NA,NA,NA,NA,NA,NA,NA,NA,NA,NA,NA,NA,NA,NA,NA,NA,NA,NA,NA,NA,NA,NA,NA,NA,NA,NA,NA,NA,NA,NA,NA,NA,NA,NA,NA,NA,NA,NA,NA,NA,NA,0,0,0,0,0,0,0,0,1,0,0,0,0,0,0,1,0,0,0,0,0,0,0,0,0,0,0,0,0,0,0,0,0,0,0,0,0,0,1,0,0,0,0,0,0,0,0,0,0,0,0,0,0,0,0,0,0,0,0,0,0,0,0,0,0,0,0,0,0
BP,4,Badger Prairie,BP_4,7/29/2020,2020,7,29,9:25:00,10:21:00,0:56,DCT,Green Space,42.99864099,-89.52725696,293998.139,4763763.347,COUNTY OF DANE,Headwaters Sugar River,Badger Mill Creek,175.34,2191,NA,1995,Natural,0.246478873,0,0,0.161971831,0.584507042,0.007042254,0.413043478,0,0,0.200228833,0.371853547,0.014874142,0,0.040746055,0.008321377,0.042754663,0.238163558,0.188235294,0.175035868,0,0,0.294691535,0,0.006312769,0.005738881,0,0,0.469153515,0.014634146,0,0.175035868,0.33543759,0.005738881,25,4,64,2,0,2,27.2,45.9,44.1,90.2,6.92,0.02,3.67,117.3,9.82,8.16,104.68,45.31,9.73,0.02,72.84,26,48.46,NA,3,98,2,0,10,90,"Mud,,NA",1,2,1,3,1.75,2,"Several dead fish, tons of bullfrogs. Water starting to turn green.",NA,28,10,13,2,5,18,0,28,0,3,2,0,1,0,0,0,0,0,0,0,NA,NA,0,0,0,1,NA,"Shiner,,,,NA",0,0,0,1,0,0,0,0,0,0,0,0,0,0,NA,NA,NA,NA,NA,NA,NA,NA,NA,NA,NA,NA,NA,NA,NA,NA,NA,NA,NA,NA,NA,NA,NA,NA,NA,NA,NA,NA,NA,NA,NA,NA,NA,NA,NA,NA,NA,NA,NA,NA,NA,NA,NA,NA,NA,NA,NA,NA,NA,NA,NA,NA,NA,NA,NA,NA,NA,NA,NA,NA,NA,NA,NA,NA,0,1,1,0,0,0,1,0,1,0,0,0,1,0,0,1,0,0,0,1,1,0,0,0,0,0,0,0,0,1,0,0,0,0,0,0,0,0,1,0,0,0,0,0,0,0,0,0,0,0,0,0,0,0,0,0,0,0,0,0,0,0,0,0,0,0,0,0,0
BP,1,Badger Prairie,BP_1,6/26/2019,2019,6,26,12:55:00,13:35:00,0:40,"ES,EC,CL,EP",Green Space,42.99864099,-89.52725696,293998.139,4763763.347,COUNTY OF DANE,Headwaters Sugar River,Badger Mill Creek,175.34,2191,296,1995,Natural,0.246478873,0,0,0.161971831,0.584507042,0.007042254,0.413043478,0,0,0.200228833,0.371853547,0.014874142,0,0.040746055,0.008321377,0.042754663,0.238163558,0.188235294,0.175035868,0,0,0.294691535,0,0.006312769,0.005738881,0,0,0.469153515,0.014634146,0,0.175035868,0.33543759,0.005738881,29,3,36,50,NA,9,26.8,52.6,50.9,126.4,9.61,0.02,2.49,55.35,NA,8.16,104.68,45.31,9.73,0.02,72.84,26,48.46,0.4,NA,NA,NA,NA,NA,NA,NA,NA,NA,NA,NA,NA,NA,NA,"High heat, probable overheated bullfrog larvae, huge amounts of metamorph ranids, No property owner recorded,",28,10,13,2,5,18,0,28,0,3,2,1,1,0,0,0,0,0,0,0,1,Painted,1,0,0,1,NA,Possible Goldfish,0,0,1,0,0,0,0,0,0,0,NA,0,0,0,1,0,0,0,0,0,1,0,1,0,0,0,0,0,1,0,1,0,1,0,0,0,0,0,0,0,0,0,0,0,0,1,0,0,0,0,1,0,0,1,0,0,1,1,0,0,0,0,1,1,0,0,0,1,0,0,0,0,0,0,0,Backswimmers,13.5,NA,NA,NA,NA,NA,NA,NA,NA,NA,NA,NA,NA,NA,NA,NA,NA,NA,NA,NA,NA,NA,NA,NA,NA,NA,NA,NA,NA,NA,NA,NA,NA,NA,NA,NA,NA,NA,NA,NA,NA,NA,NA,NA,NA,NA,NA,NA,NA,NA,NA,NA,NA,NA,NA,NA,NA,NA,NA,NA,NA,NA,NA,NA,NA,NA,NA,NA,NA,NA,NA
BP,2,Badger Prairie,BP_2,8/2/2019,2019,8,2,9:15:00,9:29:00,0:14,"CL,EP,BC",Green Space,42.99864099,-89.52725696,293998.139,4763763.347,COUNTY OF DANE,Headwaters Sugar River,Badger Mill Creek,175.34,2191,295,1995,Natural,0.246478873,0,0,0.161971831,0.584507042,0.007042254,0.413043478,0,0,0.200228833,0.371853547,0.014874142,0,0.040746055,0.008321377,0.042754663,0.238163558,0.188235294,0.175035868,0,0,0.294691535,0,0.006312769,0.005738881,0,0,0.469153515,0.014634146,0,0.175035868,0.33543759,0.005738881,23,0,53,0,NA,16,24.4,52.6,53.2,62.5,5.09,0.02,2.58,59.47,NA,8.16,104.68,45.31,9.73,0.02,72.84,26,48.46,1.01,NA,NA,NA,NA,NA,NA,NA,NA,NA,NA,NA,NA,NA,NA,NA,28,10,13,2,5,18,0,28,0,3,2,1,1,0,0,0,0,0,0,0,0,NA,0,0,0,1,NA,NA,0,0,1,1,0,0,0,0,0,0,NA,0,0,0,NA,NA,NA,NA,NA,NA,NA,NA,NA,NA,NA,NA,NA,NA,NA,NA,NA,NA,NA,NA,NA,NA,NA,NA,NA,NA,NA,NA,NA,NA,NA,NA,NA,NA,NA,NA,NA,NA,NA,NA,NA,NA,NA,NA,NA,NA,NA,NA,NA,NA,NA,NA,NA,NA,NA,NA,NA,NA,NA,NA,NA,NA,16,NA,NA,NA,NA,NA,NA,NA,NA,NA,NA,NA,NA,NA,NA,NA,NA,NA,NA,NA,NA,NA,NA,NA,NA,NA,NA,NA,NA,NA,NA,NA,NA,NA,NA,NA,NA,NA,NA,NA,NA,NA,NA,NA,NA,NA,NA,NA,NA,NA,NA,NA,NA,NA,NA,NA,NA,NA,NA,NA,NA,NA,NA,NA,NA,NA,NA,NA,NA,NA,NA
BaxN,3,Baxter North,BaxN_3,5/26/2020,2020,5,26,10:04:00,11:09:00,1:05,DCT,Green Space,43.02946538,-89.3707364,306853.6651,4766814.411,CITY OF MADISON PARKS Baxter Park,Lake Monona-Yahara River,Lake Monona-Yahara River,101.73,1400,NA,2000,Stormwater,0.248175182,0.153284672,0.474452555,0.02189781,0.102189781,0,0.372413793,0.091954023,0.344827586,0.037931034,0.152873563,0,0,0.218624642,0.05243553,0.004584527,0.264183381,0.081088825,0.068194842,0.145558739,0,0.047851003,0.001719198,0.080229226,0,0.005730659,0.029799427,0.349856734,0.132664756,0.175358166,0.068194842,0.273925501,0,25,12,65,55,2,0,21.4,232.6,249.9,3.5,0.3,0.12,187.97,197.9,6.69,0.99,11.15,179.03,7.02,0.09,203.22,20.2,80.77,NA,5,20,30,50,90,10,"Super Muddy,Leaf Litter,Sand",2,1,3,1,1.75,1.63,"Mix of substrates with majority deep cattail leaf litter, some areas pure mud with slime film.",NA,38,12,21,0,5,26,0,38,0,5,3,1,0,1,0,0,0,0,0,0,NA,"Painted,Snapping,,,",1,1,0,2,NA,NA,0,0,0,0,0,0,0,0,0,0,0,0,0,0,NA,NA,NA,NA,NA,NA,NA,NA,NA,NA,NA,NA,NA,NA,NA,NA,NA,NA,NA,NA,NA,NA,NA,NA,NA,NA,NA,NA,NA,NA,NA,NA,NA,NA,NA,NA,NA,NA,NA,NA,NA,NA,NA,NA,NA,NA,NA,NA,NA,NA,NA,NA,NA,NA,NA,NA,NA,NA,NA,NA,NA,NA,NA,NA,0,1,1,1,0,0,0,0,0,1,0,0,1,1,0,0,0,0,0,0,0,1,1,1,0,0,0,0,0,0,0,0,0,0,0,0,0,0,0,0,0,0,0,0,0,0,0,0,0,0,0,0,0,0,0,0,0,0,0,0,0,0,0,0,0,0,0,0,0
BaxN,4,Baxter North,BaxN_4,7/20/2020,2020,7,20,9:15:00,9:54:00,0:39,DCT,Green Space,43.02946538,-89.3707364,306853.6651,4766814.411,CITY OF MADISON PARKS Baxter Park,Lake Monona-Yahara River,Lake Monona-Yahara River,101.73,1400,NA,2000,Stormwater,0.248175182,0.153284672,0.474452555,0.02189781,0.102189781,0,0.372413793,0.091954023,0.344827586,0.037931034,0.152873563,0,0,0.218624642,0.05243553,0.004584527,0.264183381,0.081088825,0.068194842,0.145558739,0,0.047851003,0.001719198,0.080229226,0,0.005730659,0.029799427,0.349856734,0.132664756,0.175358166,0.068194842,0.273925501,0,22,5,68,0,2,1,21.3,113.4,122.1,15.3,1.32,0.06,4.95,402.3,7.34,0.99,11.15,179.03,7.02,0.09,203.22,20.2,80.77,NA,0,5,30,65,100,0,"Super Muddy,Leaf Litter,Rock ",1,1,3,1,1.5,1.63,"Dense mosquitoes, very unpleasent. Thick typha leaf litter under duckweed, no submergent detected, but did not venture into pond. Water variables taken at clear pool near inflow and may not reflect the rest of the pond. Thick flocc in pond.",NA,38,12,21,0,5,26,0,38,0,5,3,1,0,0,0,0,0,0,0,0,NA,NA,0,0,0,2,NA,NA,0,0,0,0,0,0,0,0,0,0,0,0,0,0,NA,NA,NA,NA,NA,NA,NA,NA,NA,NA,NA,NA,NA,NA,NA,NA,NA,NA,NA,NA,NA,NA,NA,NA,NA,NA,NA,NA,NA,NA,NA,NA,NA,NA,NA,NA,NA,NA,NA,NA,NA,NA,NA,NA,NA,NA,NA,NA,NA,NA,NA,NA,NA,NA,NA,NA,NA,NA,NA,NA,NA,NA,NA,NA,0,1,0,0,0,0,1,0,0,1,0,0,1,1,0,0,0,0,0,0,0,1,1,0,1,1,0,0,0,0,0,0,0,0,0,0,0,0,0,0,0,0,0,0,0,0,0,0,0,0,0,0,0,0,0,0,0,0,0,0,0,0,0,0,0,0,0,0,0
BaxN,1,Baxter North,BaxN_1,6/6/2019,2019,6,6,8:51:00,9:50:00,0:59,"ES,EP,EC,CL,JC",Green Space,43.02946538,-89.3707364,306853.6651,4766814.411,CITY OF MADISON PARKS Baxter Park,Lake Monona-Yahara River,Lake Monona-Yahara River,101.73,1400,NA,2000,Stormwater,0.248175182,0.153284672,0.474452555,0.02189781,0.102189781,0,0.372413793,0.091954023,0.344827586,0.037931034,0.152873563,0,0,0.218624642,0.05243553,0.004584527,0.264183381,0.081088825,0.068194842,0.145558739,0,0.047851003,0.001719198,0.080229226,0,0.005730659,0.029799427,0.349856734,0.132664756,0.175358166,0.068194842,0.273925501,0,21,2,70,5,NA,2,19.1,175.7,198,5.1,0.46,0.09,34.69,173.8,NA,0.99,11.15,179.03,7.02,0.09,203.22,20.2,80.77,0.59,NA,NA,NA,NA,NA,NA,NA,NA,NA,NA,NA,NA,NA,NA,"other veg=phragmites,zoop tows were dragged",38,12,21,0,5,26,0,38,0,5,3,1,0,1,1,0,0,0,0,0,0,Painted,1,0,0,2,NA,NA,0,0,0,0,0,0,0,0,0,0,NA,0,0,0,1,1,1,0,1,0,1,0,0,1,0,0,0,1,1,0,1,0,1,0,0,0,0,0,0,1,0,0,0,1,0,0,0,0,1,1,1,0,0,0,0,1,0,0,1,0,1,1,1,0,0,0,0,1,0,0,1,0,0,1,0,NA,6,possible leaopard frog in seine notes are unclear,NA,NA,NA,NA,NA,NA,NA,NA,NA,NA,NA,NA,NA,NA,NA,NA,NA,NA,NA,NA,NA,NA,NA,NA,NA,NA,NA,NA,NA,NA,NA,NA,NA,NA,NA,NA,NA,NA,NA,NA,NA,NA,NA,NA,NA,NA,NA,NA,NA,NA,NA,NA,NA,NA,NA,NA,NA,NA,NA,NA,NA,NA,NA,NA,NA,NA,NA,NA,NA
BaxN,2,Baxter North,BaxN_2,8/1/2019,2019,8,1,10:08:00,10:20:00,0:12,"BC,CL,EP",Green Space,43.02946538,-89.3707364,306853.6651,4766814.411,CITY OF MADISON PARKS Baxter Park,Lake Monona-Yahara River,Lake Monona-Yahara River,101.73,1400,265,2000,Stormwater,0.248175182,0.153284672,0.474452555,0.02189781,0.102189781,0,0.372413793,0.091954023,0.344827586,0.037931034,0.152873563,0,0,0.218624642,0.05243553,0.004584527,0.264183381,0.081088825,0.068194842,0.145558739,0,0.047851003,0.001719198,0.080229226,0,0.005730659,0.029799427,0.349856734,0.132664756,0.175358166,0.068194842,0.273925501,0,22,2,52,5,NA,2,19,129.3,146.1,20.7,1.88,0.07,19.65,38.89,NA,0.99,11.15,179.03,7.02,0.09,203.22,20.2,80.77,0.86,NA,NA,NA,NA,NA,NA,NA,NA,NA,NA,NA,NA,NA,NA,bottom is all dead cattails,38,12,21,0,5,26,0,38,0,5,3,1,0,0,0,0,0,0,0,0,0,NA,0,0,0,2,NA,NA,0,0,0,0,0,0,0,0,0,0,NA,0,0,0,NA,NA,NA,NA,NA,NA,NA,NA,NA,NA,NA,NA,NA,NA,NA,NA,NA,NA,NA,NA,NA,NA,NA,NA,NA,NA,NA,NA,NA,NA,NA,NA,NA,NA,NA,NA,NA,NA,NA,NA,NA,NA,NA,NA,NA,NA,NA,NA,NA,NA,NA,NA,NA,NA,NA,NA,NA,NA,NA,NA,NA,Belestoma,3,too many dead cattails to do anymore seines,NA,NA,NA,NA,NA,NA,NA,NA,NA,NA,NA,NA,NA,NA,NA,NA,NA,NA,NA,NA,NA,NA,NA,NA,NA,NA,NA,NA,NA,NA,NA,NA,NA,NA,NA,NA,NA,NA,NA,NA,NA,NA,NA,NA,NA,NA,NA,NA,NA,NA,NA,NA,NA,NA,NA,NA,NA,NA,NA,NA,NA,NA,NA,NA,NA,NA,NA,NA,NA
CMP,3,Cherokee Marsh Pond,CMP_3,5/4/2021,2021,5,4,15:30:00,16:15:00,0:45,DCT,Rural,43.171566,-89.359913,308179.8792,4782570.772,WIDNR,Headwaters Yahara River,Cherokee Lake-Yahara River,359.02,711,NA,1937,Natural,0,0.208633094,0.431654676,0,0.35971223,0,0,0.180778032,0.704805492,0,0.109839817,0.004576659,0.026518392,0.0071286,0.078414599,0,0.002281152,0.000285,0.013401768,0.55916738,0,0.065012831,0.007413744,0.007698888,0.124607927,0.009694896,0.098374679,0.002566296,0.086113487,0.657542059,0.013401768,0.089250071,0.124607927,13,9,56,75,0,0,NA,NA,NA,NA,NA,NA,NA,NA,NA,0.71,7.15,113.35,6.52,0.06,433.15,16,307.02,NA,5,30,25,45,100,0,"Mud,Leaf Litter,Firm Soil",1,1,3,5,2.5,2.38,"Tons of toads and chorus calling, lots of green tads, thick flocculent of decaying veg. Emergent still mostly dead but phalaras has sprouted up. 2 water snakes seen mating!",NA,40,11,23,0,6,29,0,40,0,6,5,1,0,1,0,0,0,1,0,0,NA,NA,0,0,0,1,Water,NA,0,0,0,0,0,0,0,0,0,0,0,0,0,0,NA,NA,NA,NA,NA,NA,NA,NA,NA,NA,NA,NA,NA,NA,NA,NA,NA,NA,NA,NA,NA,NA,NA,NA,NA,NA,NA,NA,NA,NA,NA,NA,NA,NA,NA,NA,NA,NA,NA,NA,NA,NA,NA,NA,NA,NA,NA,NA,NA,NA,NA,NA,NA,NA,NA,NA,NA,NA,NA,NA,NA,NA,NA,NA,0,1,0,0,0,0,1,0,0,0,0,0,0,1,1,0,1,0,1,0,0,0,0,0,1,0,0,0,0,0,0,0,0,0,0,0,0,0,0,0,0,0,0,0,0,1,0,0,0,0,0,0,0,0,0,0,0,0,0,0,0,0,0,0,0,0,0,0,0
CMP,4,Cherokee Marsh Pond,CMP_4,5/12/2021,2021,5,12,14:03:00,14:38:00,0:35,"DCT, JT",Rural,43.171566,-89.359913,308179.8792,4782570.772,WIDNR,Headwaters Yahara River,Cherokee Lake-Yahara River,359.02,711,NA,1937,Natural,0,0.208633094,0.431654676,0,0.35971223,0,0,0.180778032,0.704805492,0,0.109839817,0.004576659,0.026518392,0.0071286,0.078414599,0,0.002281152,0.000285,0.013401768,0.55916738,0,0.065012831,0.007413744,0.007698888,0.124607927,0.009694896,0.098374679,0.002566296,0.086113487,0.657542059,0.013401768,0.089250071,0.124607927,18,1,20,30,0,0,NA,NA,NA,NA,NA,NA,NA,NA,NA,0.71,7.15,113.35,6.52,0.06,433.15,16,307.02,NA,2,20,40,40,100,0,"Mud,Leaf Litter,",1,1,2,5,2.25,2.38,"Water level pretty high, a lot less toads calling and none observed",NA,40,11,23,0,6,29,0,40,0,6,5,1,0,1,1,0,0,0,0,0,NA,NA,0,0,0,1,Water,NA,0,0,0,0,0,0,0,0,0,0,0,0,0,0,NA,NA,NA,NA,NA,NA,NA,NA,NA,NA,NA,NA,NA,NA,NA,NA,NA,NA,NA,NA,NA,NA,NA,NA,NA,NA,NA,NA,NA,NA,NA,NA,NA,NA,NA,NA,NA,NA,NA,NA,NA,NA,NA,NA,NA,NA,NA,NA,NA,NA,NA,NA,NA,NA,NA,NA,NA,NA,NA,NA,NA,NA,NA,NA,0,1,1,0,0,0,1,0,0,0,1,0,0,1,1,0,1,0,0,0,1,0,0,0,1,0,0,0,0,0,0,0,0,0,0,0,0,0,0,0,0,0,0,0,0,0,0,0,0,0,0,0,0,0,0,0,0,0,0,0,0,0,0,0,0,0,0,0,0
CMP,1,Cherokee Marsh Pond,CMP_1,6/16/2020,2020,6,16,8:40:00,9:57:00,1:17,DCT,Rural,43.171566,-89.359913,308179.8792,4782570.772,WIDNR,Headwaters Yahara River,Cherokee Lake-Yahara River,359.02,711,NA,1937,Natural,0,0.208633094,0.431654676,0,0.35971223,0,0,0.180778032,0.704805492,0,0.109839817,0.004576659,0.026518392,0.0071286,0.078414599,0,0.002281152,0.000285,0.013401768,0.55916738,0,0.065012831,0.007413744,0.007698888,0.124607927,0.009694896,0.098374679,0.002566296,0.086113487,0.657542059,0.013401768,0.089250071,0.124607927,18,8,54,2,0,0,14.6,97.6,121.9,11.4,1.14,0.06,307.02,511.6,6.57,0.71,7.15,113.35,6.52,0.06,433.15,16,307.02,NA,NA,2,30,68,NA,NA,NA,NA,NA,NA,NA,NA,NA,Thick floating veg layer with cold turbid flocculent water column. No submergent observed. Edges are floating mats that appear shallow but are .5 m deep when stepped on. Phalaras surrounds site. Lots of woody debris.,NA,40,11,23,0,6,29,0,40,0,6,5,0,0,1,1,1,0,1,0,0,NA,"Painted,,,,NA",1,0,0,1,NA,NA,0,0,0,0,0,0,0,0,0,0,0,0,0,0,1,0,1,0,1,0,1,0,1,1,0,1,0,1,1,0,1,1,1,0,0,0,0,0,0,1,0,0,0,1,0,0,0,0,1,1,1,0,1,1,0,1,1,1,1,0,0,1,1,1,1,1,0,1,1,1,0,1,0,0,0,NA,3,NA,NA,NA,NA,NA,NA,NA,NA,NA,NA,NA,NA,NA,NA,NA,NA,NA,NA,NA,NA,NA,NA,NA,NA,NA,NA,NA,NA,NA,NA,NA,NA,NA,NA,NA,NA,NA,NA,NA,NA,NA,NA,NA,NA,NA,NA,NA,NA,NA,NA,NA,NA,NA,NA,NA,NA,NA,NA,NA,NA,NA,NA,NA,NA,NA,NA,NA,NA,NA,NA
CMP,2,Cherokee Marsh Pond,CMP_2,8/14/2020,2020,8,14,13:40:00,14:40:00,1:00,DCT,Rural,43.171566,-89.359913,308179.8792,4782570.772,WIDNR,Headwaters Yahara River,Cherokee Lake-Yahara River,359.02,711,NA,1937,Natural,0,0.208633094,0.431654676,0,0.35971223,0,0,0.180778032,0.704805492,0,0.109839817,0.004576659,0.026518392,0.0071286,0.078414599,0,0.002281152,0.000285,0.013401768,0.55916738,0,0.065012831,0.007413744,0.007698888,0.124607927,0.009694896,0.098374679,0.002566296,0.086113487,0.657542059,0.013401768,0.089250071,0.124607927,19,8,51,55,0,0,17.4,89.5,104.8,2.9,0.27,0.05,2.42,354.7,6.46,0.71,7.15,113.35,6.52,0.06,433.15,16,307.02,NA,4,10,20,70,NA,NA,NA,NA,NA,NA,NA,NA,NA,"Thick flocc in water, no submergent detected. Water's edge dominated by burreed and aster with phalaras past waters edge.",NA,40,11,23,0,6,29,0,40,0,6,5,0,0,0,1,1,0,0,0,0,NA,NA,0,0,0,1,NA,NA,0,0,0,0,0,0,0,0,0,0,0,0,0,0,NA,NA,NA,NA,NA,NA,NA,NA,NA,NA,NA,NA,NA,NA,NA,NA,NA,NA,NA,NA,NA,NA,NA,NA,NA,NA,NA,NA,NA,NA,NA,NA,NA,NA,NA,NA,NA,NA,NA,NA,NA,NA,NA,NA,NA,NA,NA,NA,NA,NA,NA,NA,NA,NA,NA,NA,NA,NA,NA,NA,NA,NA,NA,NA,NA,NA,NA,NA,NA,NA,NA,NA,NA,NA,NA,NA,NA,NA,NA,NA,NA,NA,NA,NA,NA,NA,NA,NA,NA,NA,NA,NA,NA,NA,NA,NA,NA,NA,NA,NA,NA,NA,NA,NA,NA,NA,NA,NA,NA,NA,NA,NA,NA,NA,NA,NA,NA,NA,NA,NA,NA,NA,NA,NA,NA,NA,NA,NA,NA,NA,NA,NA,NA
CAP,3,Commercial Ave. Pond,CAP_3,5/21/2020,2020,5,21,13:53:00,14:29:00,0:36,DCT,Urban,43.10708366,-89.29787954,313025.8164,4775269.253,CITY OF MADISON ENGINEER STORMWATER UTILITY 533,Lake Monona-Yahara River,Starkweather Creek,595.48,3193,NA,1995,Stormwater,0.905797101,0,0,0.094202899,0,0,0.804822044,0,0,0.114810563,0.080367394,0,0,0.012048193,0.011187608,0.025243832,0.445783133,0.213711991,0.140849111,0,0.001434309,0.110728629,0,0.03643144,0,0.002581756,0,0.684738956,0.049053356,0,0.140849111,0.125358577,0,19,6,63,92,5,0,20.1,87.8,96.9,113.6,10.01,0.04,119.44,145.6,8.92,6.3,75.43,83.48,9,0.04,113.37,23.4,46.28,NA,0,95,3,2,30,70,"Mud,Leaf Litter,NA",1,3,2,0,1.5,2.38,"Dead RWBB, dead toad, Deep layer of flocculent.",NA,27,11,12,1,4,16,0,27,0,3,2,1,0,1,0,0,0,0,0,0,NA,"Painted,,,,NA",1,0,0,1,NA,NA,0,0,0,0,0,0,0,0,0,0,0,0,0,0,NA,NA,NA,NA,NA,NA,NA,NA,NA,NA,NA,NA,NA,NA,NA,NA,NA,NA,NA,NA,NA,NA,NA,NA,NA,NA,NA,NA,NA,NA,NA,NA,NA,NA,NA,NA,NA,NA,NA,NA,NA,NA,NA,NA,NA,NA,NA,NA,NA,NA,NA,NA,NA,NA,NA,NA,NA,NA,NA,NA,NA,NA,NA,NA,0,1,1,1,0,0,0,0,1,0,0,0,1,1,0,0,0,0,0,0,0,0,0,0,1,0,0,0,0,0,0,0,0,0,0,0,1,0,0,1,0,0,0,0,0,0,0,0,0,0,0,0,0,0,0,0,0,0,0,0,0,0,0,0,0,0,0,0,0
CAP,4,Commercial Ave. Pond,CAP_4,8/7/2020,2020,8,7,9:50:00,10:51:00,1:01,DCT,Urban,43.10708366,-89.29787954,313025.8164,4775269.253,CITY OF MADISON ENGINEER STORMWATER UTILITY 533,Lake Monona-Yahara River,Starkweather Creek,595.48,3193,NA,1995,Stormwater,0.905797101,0,0,0.094202899,0,0,0.804822044,0,0,0.114810563,0.080367394,0,0,0.012048193,0.011187608,0.025243832,0.445783133,0.213711991,0.140849111,0,0.001434309,0.110728629,0,0.03643144,0,0.002581756,0,0.684738956,0.049053356,0,0.140849111,0.125358577,0,22,6,67,0,5,0,22.4,63.6,66.9,80.4,6.8,0.03,4.73,123.9,9.08,6.3,75.43,83.48,9,0.04,113.37,23.4,46.28,NA,0,45,5,50,50,50,"Firm Soil,Mud,NA",5,5,2,1,3.25,2.38,"No snails, fish, amphibs, turtles detected. Libullidae only insect detected. What is the heron eating? Lots and lots of hair algae both floating and submerged. Water crystal clear to the bottom otherwise.",NA,27,11,12,1,4,16,0,27,0,3,2,0,0,0,0,0,0,0,0,0,NA,NA,0,0,0,1,NA,NA,0,0,0,0,0,0,0,0,0,0,0,0,0,0,NA,NA,NA,NA,NA,NA,NA,NA,NA,NA,NA,NA,NA,NA,NA,NA,NA,NA,NA,NA,NA,NA,NA,NA,NA,NA,NA,NA,NA,NA,NA,NA,NA,NA,NA,NA,NA,NA,NA,NA,NA,NA,NA,NA,NA,NA,NA,NA,NA,NA,NA,NA,NA,NA,NA,NA,NA,NA,NA,NA,NA,NA,NA,NA,0,1,1,0,0,1,0,0,1,0,0,0,1,1,0,0,0,0,0,0,0,0,0,0,1,0,0,0,0,0,0,0,0,0,0,0,1,0,0,1,1,0,0,0,0,0,0,0,0,0,0,0,0,0,0,0,0,0,0,0,0,0,0,0,0,0,0,0,0
CAP,1,Commercial Ave. Pond,CAP_1,7/2/2019,2019,7,2,10:50:00,11:19:00,0:29,"ES,EP,CL",Urban,43.10708366,-89.29787954,313025.8164,4775269.253,CITY OF MADISON ENGINEER STORMWATER UTILITY 533,Lake Monona-Yahara River,Starkweather Creek,595.48,3193,285,1995,Stormwater,0.905797101,0,0,0.094202899,0,0,0.804822044,0,0,0.114810563,0.080367394,0,0,0.012048193,0.011187608,0.025243832,0.445783133,0.213711991,0.140849111,0,0.001434309,0.110728629,0,0.03643144,0,0.002581756,0,0.684738956,0.049053356,0,0.140849111,0.125358577,0,29,6,64,35,NA,2,27.7,91.4,87,81.1,6.17,0.04,7.57,79.77,NA,6.3,75.43,83.48,9,0.04,113.37,23.4,46.28,0.49,NA,NA,NA,NA,NA,NA,NA,NA,NA,NA,NA,NA,NA,NA,"had 90 outflows written-very incorrect,substrate was muddy on bank by the road",27,11,12,1,4,16,0,27,0,3,2,0,0,0,0,0,0,0,0,0,1,NA,0,0,0,1,NA,NA,0,0,0,0,0,0,0,0,0,0,NA,0,0,0,0,0,1,0,1,0,0,0,1,0,0,0,0,1,1,0,1,0,1,0,0,0,0,0,0,0,0,0,0,0,0,0,0,0,1,1,1,0,0,1,0,0,0,0,0,0,0,0,1,1,0,0,0,0,0,1,0,1,0,0,0,"crayfish,clams",11.5,NA,NA,NA,NA,NA,NA,NA,NA,NA,NA,NA,NA,NA,NA,NA,NA,NA,NA,NA,NA,NA,NA,NA,NA,NA,NA,NA,NA,NA,NA,NA,NA,NA,NA,NA,NA,NA,NA,NA,NA,NA,NA,NA,NA,NA,NA,NA,NA,NA,NA,NA,NA,NA,NA,NA,NA,NA,NA,NA,NA,NA,NA,NA,NA,NA,NA,NA,NA,NA,NA
CAP,2,Commercial Ave. Pond,CAP_2,8/15/2019,2019,8,15,11:19:00,11:30:00,0:11,"EC,CL,EP",Urban,43.10708366,-89.29787954,313025.8164,4775269.253,CITY OF MADISON ENGINEER STORMWATER UTILITY 533,Lake Monona-Yahara River,Starkweather Creek,595.48,3193,293,1995,Stormwater,0.905797101,0,0,0.094202899,0,0,0.804822044,0,0,0.114810563,0.080367394,0,0,0.012048193,0.011187608,0.025243832,0.445783133,0.213711991,0.140849111,0,0.001434309,0.110728629,0,0.03643144,0,0.002581756,0,0.684738956,0.049053356,0,0.140849111,0.125358577,0,23,6,50,2,NA,2,23.4,80.6,83.1,26.6,2.2,0.04,11.82,104.2,NA,6.3,75.43,83.48,9,0.04,113.37,23.4,46.28,0.94,NA,NA,NA,NA,NA,NA,NA,NA,NA,NA,NA,NA,NA,NA,No max depth recorded,27,11,12,1,4,16,0,27,0,3,2,0,0,0,0,0,0,0,0,0,0,NA,0,0,0,1,NA,Pumpkinseed,0,0,0,0,0,0,1,0,0,0,NA,0,0,0,NA,NA,NA,NA,NA,NA,NA,NA,NA,NA,NA,NA,NA,NA,NA,NA,NA,NA,NA,NA,NA,NA,NA,NA,NA,NA,NA,NA,NA,NA,NA,NA,NA,NA,NA,NA,NA,NA,NA,NA,NA,NA,NA,NA,NA,NA,NA,NA,NA,NA,NA,NA,NA,NA,NA,NA,NA,NA,NA,NA,NA,NA,13,Nothing in ~15 seines,NA,NA,NA,NA,NA,NA,NA,NA,NA,NA,NA,NA,NA,NA,NA,NA,NA,NA,NA,NA,NA,NA,NA,NA,NA,NA,NA,NA,NA,NA,NA,NA,NA,NA,NA,NA,NA,NA,NA,NA,NA,NA,NA,NA,NA,NA,NA,NA,NA,NA,NA,NA,NA,NA,NA,NA,NA,NA,NA,NA,NA,NA,NA,NA,NA,NA,NA,NA,NA
CG,3,Cottage Grove,CG_3,5/21/2020,2020,5,21,10:43:00,11:57:00,1:14,DCT,Rural,43.08741385,-89.2532419,316599.3004,4772986.17,CITY OF MADISON PARKS DOOR CREEK PARK,Lake Kegonsa-Yahara River,Door Creek,223.29,875,NA,2000,Natural,0.128571429,0.05,0.207142857,0.078571429,0.535714286,0,0.196100917,0.05733945,0.139908257,0.038990826,0.565366972,0.002293578,0.000286,0.367411226,0.075887743,0.000286,0.103379152,0.076174112,0.046678121,0.084765178,0,0.170389462,0.002863688,0.038659794,0.007731959,0.00257732,0.022909507,0.179839633,0.114547537,0.107674685,0.046678121,0.543241695,0.007731959,15,10,73,100,0,3,18.7,70.3,79.9,123.6,11.23,0.04,216.22,228.1,7.85,7.28,85.55,82.15,7.76,0.04,158.53,22.68,73.59,NA,0,95,4,1,30,70,"Mud,Leaf Litter,NA",1,3,2,1,1.75,2,"Near stream, connects to flooded cattail marsh, water high. Water was much more green on second visit to re-take TRB.",NA,47,14,26,0,7,33,0,47,0,7,6,0,0,1,0,0,0,1,0,0,NA,NA,0,0,0,1,NA,NA,0,0,0,0,0,0,0,0,0,0,0,0,0,0,NA,NA,NA,NA,NA,NA,NA,NA,NA,NA,NA,NA,NA,NA,NA,NA,NA,NA,NA,NA,NA,NA,NA,NA,NA,NA,NA,NA,NA,NA,NA,NA,NA,NA,NA,NA,NA,NA,NA,NA,NA,NA,NA,NA,NA,NA,NA,NA,NA,NA,NA,NA,NA,NA,NA,NA,NA,NA,NA,NA,NA,NA,NA,NA,0,1,0,1,0,0,0,0,1,0,0,0,1,1,0,0,0,0,0,1,0,0,1,0,1,0,0,0,0,0,0,0,0,0,0,0,0,0,0,0,0,0,0,0,0,0,0,0,0,0,0,0,0,0,0,0,0,0,0,0,0,0,0,0,0,0,0,0,0
CG,4,Cottage Grove,CG_4,7/22/2020,2020,7,22,9:35:00,10:22:00,0:47,DCT,Rural,43.08741385,-89.2532419,316599.3004,4772986.17,CITY OF MADISON PARKS DOOR CREEK PARK,Lake Kegonsa-Yahara River,Door Creek,223.29,875,NA,2000,Natural,0.128571429,0.05,0.207142857,0.078571429,0.535714286,0,0.196100917,0.05733945,0.139908257,0.038990826,0.565366972,0.002293578,0.000286,0.367411226,0.075887743,0.000286,0.103379152,0.076174112,0.046678121,0.084765178,0,0.170389462,0.002863688,0.038659794,0.007731959,0.00257732,0.022909507,0.179839633,0.114547537,0.107674685,0.046678121,0.543241695,0.007731959,23,7,76,30,0,5,25,71.6,71.6,66.9,5.36,0.03,14.5,178.3,7.66,7.28,85.55,82.15,7.76,0.04,158.53,22.68,73.59,NA,0,75,8,17,10,90,"Firm Soil,Mud,NA",3,2,2,2,2.25,2,"Clear water, lots of Nepidae. Active construction nearby.",NA,47,14,26,0,7,33,0,47,0,7,6,1,1,0,0,1,0,0,0,0,NA,"Painted,,,,NA",1,0,0,1,NA,NA,0,0,0,0,0,0,0,0,0,0,0,0,0,0,NA,NA,NA,NA,NA,NA,NA,NA,NA,NA,NA,NA,NA,NA,NA,NA,NA,NA,NA,NA,NA,NA,NA,NA,NA,NA,NA,NA,NA,NA,NA,NA,NA,NA,NA,NA,NA,NA,NA,NA,NA,NA,NA,NA,NA,NA,NA,NA,NA,NA,NA,NA,NA,NA,NA,NA,NA,NA,NA,NA,NA,NA,NA,NA,1,1,0,1,0,0,0,0,1,0,0,0,1,1,0,0,0,0,0,1,1,1,0,0,1,0,0,0,0,0,0,0,0,0,0,0,0,0,0,0,0,1,1,1,0,0,0,0,0,0,0,0,0,0,0,0,0,0,0,0,0,0,0,0,0,0,0,0,0
CG,1,Cottage Grove,CG_1,6/25/2019,2019,6,25,12:15:00,12:55:00,0:40,"ES,CL,EP",Rural,43.08741385,-89.2532419,316599.3004,4772986.17,CITY OF MADISON PARKS DOOR CREEK PARK,Lake Kegonsa-Yahara River,Door Creek,223.29,875,274,2000,Natural,0.128571429,0.05,0.207142857,0.078571429,0.535714286,0,0.196100917,0.05733945,0.139908257,0.038990826,0.565366972,0.002293578,0.000286,0.367411226,0.075887743,0.000286,0.103379152,0.076174112,0.046678121,0.084765178,0,0.170389462,0.002863688,0.038659794,0.007731959,0.00257732,0.022909507,0.179839633,0.114547537,0.107674685,0.046678121,0.543241695,0.007731959,26,8,57,95,NA,12,22.4,80.6,84.8,97.7,8.18,0.04,2.45,117,NA,7.28,85.55,82.15,7.76,0.04,158.53,22.68,73.59,0.71,NA,NA,NA,NA,NA,NA,NA,NA,NA,NA,NA,NA,NA,NA,"No area/perimeter calculated, no inflows/outflows visible, no shoreline vegetation percentage recorded,",47,14,26,0,7,33,0,47,0,7,6,1,1,1,0,0,0,0,0,0,0,NA,0,0,0,1,NA,NA,0,0,0,0,0,0,0,0,0,0,NA,0,0,0,1,0,0,0,1,0,1,0,1,1,0,0,1,1,1,0,0,1,1,0,0,0,0,0,0,1,0,0,0,0,1,0,1,0,1,1,1,0,0,1,1,0,1,1,1,0,0,1,1,1,0,1,0,0,1,1,0,1,0,0,1,"""Stick bug"", snails, backswimmers, damselfly larvae",9,A lot of inverts in sweeps - boatment and leeches,NA,NA,NA,NA,NA,NA,NA,NA,NA,NA,NA,NA,NA,NA,NA,NA,NA,NA,NA,NA,NA,NA,NA,NA,NA,NA,NA,NA,NA,NA,NA,NA,NA,NA,NA,NA,NA,NA,NA,NA,NA,NA,NA,NA,NA,NA,NA,NA,NA,NA,NA,NA,NA,NA,NA,NA,NA,NA,NA,NA,NA,NA,NA,NA,NA,NA,NA,NA,NA
CG,2,Cottage Grove,CG_2,8/6/2019,2019,8,6,11:53:00,12:11:00,0:18,"ES,EP,CL",Rural,43.08741385,-89.2532419,316599.3004,4772986.17,CITY OF MADISON PARKS DOOR CREEK PARK,Lake Kegonsa-Yahara River,Door Creek,223.29,875,272,2000,Natural,0.128571429,0.05,0.207142857,0.078571429,0.535714286,0,0.196100917,0.05733945,0.139908257,0.038990826,0.565366972,0.002293578,0.000286,0.367411226,0.075887743,0.000286,0.103379152,0.076174112,0.046678121,0.084765178,0,0.170389462,0.002863688,0.038659794,0.007731959,0.00257732,0.022909507,0.179839633,0.114547537,0.107674685,0.046678121,0.543241695,0.007731959,25,8,66,2,NA,16,24.6,91.6,92.3,54,4.34,0.04,2.1,110.7,NA,7.28,85.55,82.15,7.76,0.04,158.53,22.68,73.59,1.4,NA,NA,NA,NA,NA,NA,NA,NA,NA,NA,NA,NA,NA,NA,NA,47,14,26,0,7,33,0,47,0,7,6,1,0,0,1,1,0,0,0,0,1,NA,0,0,0,1,NA,NA,0,0,0,0,0,0,0,0,0,0,NA,0,0,0,NA,NA,NA,NA,NA,NA,NA,NA,NA,NA,NA,NA,NA,NA,NA,NA,NA,NA,NA,NA,NA,NA,NA,NA,NA,NA,NA,NA,NA,NA,NA,NA,NA,NA,NA,NA,NA,NA,NA,NA,NA,NA,NA,NA,NA,NA,NA,NA,NA,NA,NA,NA,NA,NA,NA,NA,NA,NA,NA,NA,NA,NA,21,"Very thick parrot's feather, difficult to sample",NA,NA,NA,NA,NA,NA,NA,NA,NA,NA,NA,NA,NA,NA,NA,NA,NA,NA,NA,NA,NA,NA,NA,NA,NA,NA,NA,NA,NA,NA,NA,NA,NA,NA,NA,NA,NA,NA,NA,NA,NA,NA,NA,NA,NA,NA,NA,NA,NA,NA,NA,NA,NA,NA,NA,NA,NA,NA,NA,NA,NA,NA,NA,NA,NA,NA,NA,NA,NA
COY-ARB,3,Coyote Pond,COY-ARB_3,5/16/2020,2020,5,16,10:36:00,11:25:00,0:49,DCT,Green Space,43.03737412,-89.42897822,302133.8724,4767828.429,UNIV OF WIS REGENTS,Lake Monona-Yahara River,Lake Monona-Yahara River,306.84,1104,NA,1957,Stormwater,0,0.224637681,0.253623188,0.007246377,0.507246377,0,0.317241379,0.132183908,0.245977011,0.072413793,0.226436782,0.003448276,0.000573,0.040687679,0.130945559,0.074212034,0.166475645,0.101719198,0.187965616,0.037249284,0.028366762,0.05530086,0,0.059598854,0.00086,0,0.116045845,0.342406877,0.218911175,0.153295129,0.187965616,0.095988539,0.00086,16,9,66,NA,2,2,11.7,859,1154,25,2.43,0.58,470.82,154.6,7.24,5.16,54.93,1393,7.34,0.7,154.7,17.39,399.77,NA,0,15,15,70,30,70,"Super Muddy,Vegetation,",2,4,1,1,2,1.75,"28 painted turtles,",NA,39,14,20,1,5,25,0,39,0,4,3,1,0,1,0,0,0,0,0,0,NA,"Painted,,,,",1,0,0,1,NA,NA,0,0,0,0,0,0,0,0,0,0,0,0,0,0,NA,NA,NA,NA,NA,NA,NA,NA,NA,NA,NA,NA,NA,NA,NA,NA,NA,NA,NA,NA,NA,NA,NA,NA,NA,NA,NA,NA,NA,NA,NA,NA,NA,NA,NA,NA,NA,NA,NA,NA,NA,NA,NA,NA,NA,NA,NA,NA,NA,NA,NA,NA,NA,NA,NA,NA,NA,NA,NA,NA,NA,NA,NA,NA,0,1,0,1,0,0,0,0,1,0,0,0,1,1,0,0,0,0,0,0,0,0,0,0,0,0,0,0,0,0,0,0,0,0,0,0,0,0,0,0,0,0,0,0,0,0,1,1,0,0,0,0,0,0,0,0,0,0,0,0,0,0,0,0,0,0,0,0,0
COY-ARB,4,Coyote Pond,COY-ARB_4,7/7/2020,2020,7,7,6:47:00,7:51:00,1:04,DCT,Green Space,43.03737412,-89.42897822,302133.8724,4767828.429,UNIV OF WIS REGENTS,Lake Monona-Yahara River,Lake Monona-Yahara River,306.84,1104,NA,1957,Stormwater,0,0.224637681,0.253623188,0.007246377,0.507246377,0,0.317241379,0.132183908,0.245977011,0.072413793,0.226436782,0.003448276,0.000573,0.040687679,0.130945559,0.074212034,0.166475645,0.101719198,0.187965616,0.037249284,0.028366762,0.05530086,0,0.059598854,0.00086,0,0.116045845,0.342406877,0.218911175,0.153295129,0.187965616,0.095988539,0.00086,24,1,81,2,2,2,21.6,1391,1487,2.8,0.24,0.75,370.4,189.2,7.43,5.16,54.93,1393,7.34,0.7,154.7,17.39,399.77,NA,0,25,25,50,10,90,"Super Muddy,,NA",3,2,1,0,1.5,1.75,"Water level ~ 5cm lower. Hard to determine submergent due to algae, but coontail based on sweeps- whole water column is submergent- covered in algae. Gross film over water.",NA,39,14,20,1,5,25,0,39,0,4,3,1,0,0,0,1,0,0,0,0,NA,"Painted,,,,NA",1,0,0,1,NA,NA,0,0,0,0,0,0,0,0,0,0,0,0,0,0,NA,NA,NA,NA,NA,NA,NA,NA,NA,NA,NA,NA,NA,NA,NA,NA,NA,NA,NA,NA,NA,NA,NA,NA,NA,NA,NA,NA,NA,NA,NA,NA,NA,NA,NA,NA,NA,NA,NA,NA,NA,NA,NA,NA,NA,NA,NA,NA,NA,NA,NA,NA,NA,NA,NA,NA,NA,NA,NA,NA,NA,NA,NA,NA,0,1,1,1,0,0,0,1,1,0,0,1,1,1,0,0,1,0,0,0,0,0,0,0,1,0,0,0,0,0,0,1,0,0,0,0,0,0,0,0,0,0,0,0,0,0,0,0,1,0,0,0,0,0,0,0,0,0,0,0,0,0,0,0,0,0,0,0,0
COY-ARB,1,Coyote Pond,COY-ARB_1,5/28/2019,2019,5,28,12:03:00,13:25:00,1:22,"DP,ES,EC,EP",Green Space,43.03737412,-89.42897822,302133.8724,4767828.429,UNIV OF WIS REGENTS,Lake Monona-Yahara River,Lake Monona-Yahara River,306.84,1104,NA,1957,Stormwater,0,0.224637681,0.253623188,0.007246377,0.507246377,0,0.317241379,0.132183908,0.245977011,0.072413793,0.226436782,0.003448276,0.000573,0.040687679,0.130945559,0.074212034,0.166475645,0.101719198,0.187965616,0.037249284,0.028366762,0.05530086,0,0.059598854,0.00086,0,0.116045845,0.342406877,0.218911175,0.153295129,0.187965616,0.095988539,0.00086,15,5.5,73,85,NA,12,15.3,933,1146,140.2,13.53,0.57,291.37,143.6,NA,5.16,54.93,1393,7.34,0.7,154.7,17.39,399.77,1.52,NA,NA,NA,NA,NA,NA,NA,NA,NA,NA,NA,NA,NA,NA,"Zoop tows dragged due to algae, no substrate recorded, no perimeter recorded, elevation incorrect,",39,14,20,1,5,25,0,39,0,4,3,1,0,1,0,0,0,0,0,0,1,NA,0,0,0,1,NA,Stickleback,1,0,0,0,0,0,0,0,0,0,NA,0,0,0,1,0,1,0,1,0,1,0,1,1,0,1,0,1,1,0,1,0,1,0,0,0,0,0,0,0,0,0,0,1,0,0,0,0,1,1,1,0,0,1,0,0,0,1,1,0,0,0,1,0,0,0,0,1,1,1,0,1,0,0,0,NA,6,NA,NA,NA,NA,NA,NA,NA,NA,NA,NA,NA,NA,NA,NA,NA,NA,NA,NA,NA,NA,NA,NA,NA,NA,NA,NA,NA,NA,NA,NA,NA,NA,NA,NA,NA,NA,NA,NA,NA,NA,NA,NA,NA,NA,NA,NA,NA,NA,NA,NA,NA,NA,NA,NA,NA,NA,NA,NA,NA,NA,NA,NA,NA,NA,NA,NA,NA,NA,NA,NA
COY-ARB,2,Coyote Pond,COY-ARB_2,7/17/2019,2019,7,17,8:16:00,8:31:00,0:15,"EC,CL,EP",Green Space,43.03737412,-89.42897822,302133.8724,4767828.429,UNIV OF WIS REGENTS,Lake Monona-Yahara River,Lake Monona-Yahara River,306.84,1104,219,1957,Stormwater,0,0.224637681,0.253623188,0.007246377,0.507246377,0,0.317241379,0.132183908,0.245977011,0.072413793,0.226436782,0.003448276,0.000573,0.040687679,0.130945559,0.074212034,0.166475645,0.101719198,0.187965616,0.037249284,0.028366762,0.05530086,0,0.059598854,0.00086,0,0.116045845,0.342406877,0.218911175,0.153295129,0.187965616,0.095988539,0.00086,24,3,80,5,NA,8,21,1650,1785,51.7,4.44,0.91,437.12,131.4,NA,5.16,54.93,1393,7.34,0.7,154.7,17.39,399.77,3.82,NA,NA,NA,NA,NA,NA,NA,NA,NA,NA,NA,NA,NA,NA,NA,39,14,20,1,5,25,0,39,0,4,3,1,0,0,0,0,0,0,0,0,0,NA,0,0,0,1,NA,NA,0,0,0,0,0,0,0,0,0,0,NA,0,0,0,NA,NA,NA,NA,NA,NA,NA,NA,NA,NA,NA,NA,NA,NA,NA,NA,NA,NA,NA,NA,NA,NA,NA,NA,NA,NA,NA,NA,NA,NA,NA,NA,NA,NA,NA,NA,NA,NA,NA,NA,NA,NA,NA,NA,NA,NA,NA,NA,NA,NA,NA,NA,NA,NA,NA,NA,NA,NA,NA,NA,NA,"Odonata,backswimmers",5,inverts only did >12 sweeps,NA,NA,NA,NA,NA,NA,NA,NA,NA,NA,NA,NA,NA,NA,NA,NA,NA,NA,NA,NA,NA,NA,NA,NA,NA,NA,NA,NA,NA,NA,NA,NA,NA,NA,NA,NA,NA,NA,NA,NA,NA,NA,NA,NA,NA,NA,NA,NA,NA,NA,NA,NA,NA,NA,NA,NA,NA,NA,NA,NA,NA,NA,NA,NA,NA,NA,NA,NA,NA
DSP-SW,3,Daniels St. Pond,DSP-SW_3,5/21/2020,2020,5,21,16:50:00,17:40:00,0:50,DCT,Urban,43.0579077,-89.30068687,312647.5099,4769814.234,CITY OF MADISON ENGINEER STORMWATER UTILITY 533,Lake Monona-Yahara River,Lake Monona-Yahara River,413.84,7751,NA,1995,Stormwater,0.542857143,0.007142857,0.114285714,0.128571429,0.171428571,0.035714286,0.836197022,0.01489118,0.026345934,0.075601375,0.041237113,0.005727377,0,0.026044648,0.024041214,0.208357184,0.245850029,0.320549513,0.083571837,0.023468804,0,0.041499714,0.000859,0.008586148,0.006296508,0,0.010875787,0.774756726,0.032627361,0.034344591,0.083571837,0.068402977,0.006296508,19,9,61,100,1,8,19.7,401.2,446.3,113.8,10.12,0.22,155.19,88.64,8.3,7.69,93.05,537.55,8.51,0.26,124.74,23.95,137.53,NA,0,98,1,1,50,50,"Rock ,Sand,NA",1,5,2,3,2.75,2.75,"Rocky over sand substrate with lots of sticks, clearwater. Industrial all around but large greenspace with nearby wetlands.",NA,26,13,7,2,6,13,0,26,0,4,2,0,1,0,0,0,0,0,0,0,NA,"Snapping,,,,NA",0,1,0,2,NA,"Sunfish, smaller fish,,,,NA",0,0,0,0,1,0,0,0,0,0,1,0,0,0,NA,NA,NA,NA,NA,NA,NA,NA,NA,NA,NA,NA,NA,NA,NA,NA,NA,NA,NA,NA,NA,NA,NA,NA,NA,NA,NA,NA,NA,NA,NA,NA,NA,NA,NA,NA,NA,NA,NA,NA,NA,NA,NA,NA,NA,NA,NA,NA,NA,NA,NA,NA,NA,NA,NA,NA,NA,NA,NA,NA,NA,NA,NA,NA,0,0,1,0,1,0,0,0,1,1,0,1,1,0,0,0,0,0,0,0,0,0,0,0,1,0,0,0,0,0,0,0,0,1,0,0,0,0,0,0,0,0,0,0,0,0,0,0,0,0,0,0,0,0,0,0,0,0,0,0,0,0,0,0,0,0,0,0,0
DSP-SW,4,Daniels St. Pond,DSP-SW_4,8/11/2020,2020,8,11,10:20:00,11:41:00,1:21,DCT,Urban,43.0579077,-89.30068687,312647.5099,4769814.234,CITY OF MADISON ENGINEER STORMWATER UTILITY 533,Lake Monona-Yahara River,Lake Monona-Yahara River,413.84,7751,NA,1995,Stormwater,0.542857143,0.007142857,0.114285714,0.128571429,0.171428571,0.035714286,0.836197022,0.01489118,0.026345934,0.075601375,0.041237113,0.005727377,0,0.026044648,0.024041214,0.208357184,0.245850029,0.320549513,0.083571837,0.023468804,0,0.041499714,0.000859,0.008586148,0.006296508,0,0.010875787,0.774756726,0.032627361,0.034344591,0.083571837,0.068402977,0.006296508,22,2,60,0,1,8,24.8,320.3,321.5,88.7,7.15,0.15,5.65,263.6,8.72,7.69,93.05,537.55,8.51,0.26,124.74,23.95,137.53,NA,2,88,10,2,60,40,"Firm Soil,Rock ,NA",2,4,2,3,2.75,2.75,"Water pea soup green around edges, clear in other parts. Hard to gauge submergent, lots of willows growing out of water's edge, but otherwise very little emergent. Locals say Pike and carp in pond.",NA,26,13,7,2,6,13,0,26,0,4,2,1,1,0,0,0,0,0,0,0,NA,"Painted,,,,NA",1,0,0,2,NA,"Sunfish, Large fish jumping, bluegill, according to locasl: Pike, Carp, Bass,,,,NA",0,0,0,0,0,0,0,0,0,0,1,0,0,0,NA,NA,NA,NA,NA,NA,NA,NA,NA,NA,NA,NA,NA,NA,NA,NA,NA,NA,NA,NA,NA,NA,NA,NA,NA,NA,NA,NA,NA,NA,NA,NA,NA,NA,NA,NA,NA,NA,NA,NA,NA,NA,NA,NA,NA,NA,NA,NA,NA,NA,NA,NA,NA,NA,NA,NA,NA,NA,NA,NA,NA,NA,NA,NA,0,0,1,1,1,0,0,1,1,1,0,1,1,0,0,0,0,1,0,0,0,1,0,0,1,0,0,0,0,0,0,0,0,1,0,0,0,0,0,1,0,0,0,0,0,0,0,0,0,0,0,0,0,0,0,0,0,0,0,0,0,0,0,0,0,0,0,0,0
DSP-SW,1,Daniels St. Pond,DSP-SW_1,6/7/2019,2019,6,7,12:09:00,12:55:00,0:46,"CL,ER,EC,ES,RH",Urban,43.0579077,-89.30068687,312647.5099,4769814.234,CITY OF MADISON ENGINEER STORMWATER UTILITY 533,Lake Monona-Yahara River,Lake Monona-Yahara River,413.84,7751,854,1995,Stormwater,0.542857143,0.007142857,0.114285714,0.128571429,0.171428571,0.035714286,0.836197022,0.01489118,0.026345934,0.075601375,0.041237113,0.005727377,0,0.026044648,0.024041214,0.208357184,0.245850029,0.320549513,0.083571837,0.023468804,0,0.041499714,0.000859,0.008586148,0.006296508,0,0.010875787,0.774756726,0.032627361,0.034344591,0.083571837,0.068402977,0.006296508,26,8,48,0,NA,12,25,1076,1076,102.9,8.24,0.53,208.44,49.4,NA,7.69,93.05,537.55,8.51,0.26,124.74,23.95,137.53,1.15,NA,NA,NA,NA,NA,NA,NA,NA,NA,NA,NA,NA,NA,NA,*snapping turtle was a dead skeleton,26,13,7,2,6,13,0,26,0,4,2,1,1,0,0,0,0,0,0,0,0,Snapping,0,1,0,2,NA,"bluegill, largemouth bass,pumpkin seed, sunfish, large fish",0,0,0,0,0,0,0,0,0,0,NA,0,0,0,1,0,0,0,1,0,0,0,0,0,0,0,0,0,1,0,1,0,1,0,0,0,0,0,0,0,0,0,0,0,0,0,0,0,0,0,0,0,0,0,0,0,0,0,0,0,0,0,1,1,1,0,0,0,0,0,0,1,0,1,0,NA,10,*didn't catch anything but lots of bluegill,NA,NA,NA,NA,NA,NA,NA,NA,NA,NA,NA,NA,NA,NA,NA,NA,NA,NA,NA,NA,NA,NA,NA,NA,NA,NA,NA,NA,NA,NA,NA,NA,NA,NA,NA,NA,NA,NA,NA,NA,NA,NA,NA,NA,NA,NA,NA,NA,NA,NA,NA,NA,NA,NA,NA,NA,NA,NA,NA,NA,NA,NA,NA,NA,NA,NA,NA,NA,NA
DSP-SW,2,Daniels St. Pond,DSP-SW_2,7/30/2019,2019,7,30,10:14:00,10:36:00,0:22,"ES,EP,CL",Urban,43.0579077,-89.30068687,312647.5099,4769814.234,CITY OF MADISON ENGINEER STORMWATER UTILITY 533,Lake Monona-Yahara River,Lake Monona-Yahara River,413.84,7751,273,1995,Stormwater,0.542857143,0.007142857,0.114285714,0.128571429,0.171428571,0.035714286,0.836197022,0.01489118,0.026345934,0.075601375,0.041237113,0.005727377,0,0.026044648,0.024041214,0.208357184,0.245850029,0.320549513,0.083571837,0.023468804,0,0.041499714,0.000859,0.008586148,0.006296508,0,0.010875787,0.774756726,0.032627361,0.034344591,0.083571837,0.068402977,0.006296508,21,7,63,40,NA,9,26.3,314,306.4,66.8,5.25,0.14,48.96,97.31,NA,7.69,93.05,537.55,8.51,0.26,124.74,23.95,137.53,2.21,NA,NA,NA,NA,NA,NA,NA,NA,NA,NA,NA,NA,NA,NA,only one physid and it was dead,26,13,7,2,6,13,0,26,0,4,2,1,0,0,0,0,0,0,0,0,0,NA,0,0,0,2,NA,"bass,bluegill,sunfish, large jumping fish",0,0,0,0,0,1,0,1,0,0,NA,0,0,0,NA,NA,NA,NA,NA,NA,NA,NA,NA,NA,NA,NA,NA,NA,NA,NA,NA,NA,NA,NA,NA,NA,NA,NA,NA,NA,NA,NA,NA,NA,NA,NA,NA,NA,NA,NA,NA,NA,NA,NA,NA,NA,NA,NA,NA,NA,NA,NA,NA,NA,NA,NA,NA,NA,NA,NA,NA,NA,NA,NA,NA,NA,29,NA,NA,NA,NA,NA,NA,NA,NA,NA,NA,NA,NA,NA,NA,NA,NA,NA,NA,NA,NA,NA,NA,NA,NA,NA,NA,NA,NA,NA,NA,NA,NA,NA,NA,NA,NA,NA,NA,NA,NA,NA,NA,NA,NA,NA,NA,NA,NA,NA,NA,NA,NA,NA,NA,NA,NA,NA,NA,NA,NA,NA,NA,NA,NA,NA,NA,NA,NA,NA,NA
DOBA10,3,Dobson A10 Pond,DOBA10_3,5/22/2020,2020,5,22,12:05:00,12:55:00,0:50,DCT,Urban,43.10730843,-89.49580797,296920.8321,4775754.901,MIDDLETON CITY OF,Lake Mendota-Yahara River,Pheasant Branch,327.17,884,NA,2000,Stormwater,0.857142857,0,0,0.142857143,0,0,0.576349024,0.099885189,0.197474168,0.111366246,0.006888634,0.008036739,0,0.007731959,0.06930126,0.034077892,0.32674685,0.227376861,0.097079038,0.036941581,0,0.008877434,0,0.047823597,0.00257732,0,0.141466208,0.588201604,0.117124857,0.178407789,0.097079038,0.016609393,0.00257732,16,2,84,100,3,2,18.7,193.3,219.7,85.9,7.78,0.1,145.6,114.6,7.24,2.83,31.9,206.78,7.03,0.1,119.78,21.3,91.43,NA,0,75,15,10,100,0,"Super Muddy,Leaf Litter,NA",3,1,2,0,1.5,1.38,Very deep flocculent substrate ~.5m mostly leaf litter. Thick cattails along edge.,NA,38,9,24,0,5,29,0,38,0,5,4,0,0,0,1,0,0,0,0,0,NA,"Painted,,,,NA",1,0,0,1,NA,NA,0,0,0,0,0,0,0,0,0,0,0,0,0,0,NA,NA,NA,NA,NA,NA,NA,NA,NA,NA,NA,NA,NA,NA,NA,NA,NA,NA,NA,NA,NA,NA,NA,NA,NA,NA,NA,NA,NA,NA,NA,NA,NA,NA,NA,NA,NA,NA,NA,NA,NA,NA,NA,NA,NA,NA,NA,NA,NA,NA,NA,NA,NA,NA,NA,NA,NA,NA,NA,NA,NA,NA,NA,NA,0,0,0,0,0,0,0,0,0,1,0,1,0,1,0,0,0,0,0,0,0,0,0,0,0,0,0,0,0,0,0,0,0,0,0,0,0,0,0,0,0,0,0,0,0,0,0,0,0,0,0,0,0,0,0,0,0,0,0,0,0,0,0,0,0,0,0,0,0
DOBA10,4,Dobson A10 Pond,DOBA10_4,7/14/2020,2020,7,14,7:41:00,8:36:00,0:55,DCT,Urban,43.10730843,-89.49580797,296920.8321,4775754.901,MIDDLETON CITY OF,Lake Mendota-Yahara River,Pheasant Branch,327.17,884,NA,2000,Stormwater,0.857142857,0,0,0.142857143,0,0,0.576349024,0.099885189,0.197474168,0.111366246,0.006888634,0.008036739,0,0.007731959,0.06930126,0.034077892,0.32674685,0.227376861,0.097079038,0.036941581,0,0.008877434,0,0.047823597,0.00257732,0,0.141466208,0.588201604,0.117124857,0.178407789,0.097079038,0.016609393,0.00257732,21,8,78,80,3,2,22.1,112.3,118.9,11.6,0.98,0.06,333.65,135.4,6.81,2.83,31.9,206.78,7.03,0.1,119.78,21.3,91.43,NA,0,5,25,75,90,10,"Super Muddy,Leaf Litter,NA",1,1,2,1,1.25,1.38,Drop off deep and muddy quickly. Tons of green frogs.,NA,38,9,24,0,5,29,0,38,0,5,4,1,0,0,0,1,0,0,0,0,NA,"Painted,,,,NA",1,0,0,1,NA,NA,0,0,0,0,0,0,0,0,0,0,0,0,0,0,NA,NA,NA,NA,NA,NA,NA,NA,NA,NA,NA,NA,NA,NA,NA,NA,NA,NA,NA,NA,NA,NA,NA,NA,NA,NA,NA,NA,NA,NA,NA,NA,NA,NA,NA,NA,NA,NA,NA,NA,NA,NA,NA,NA,NA,NA,NA,NA,NA,NA,NA,NA,NA,NA,NA,NA,NA,NA,NA,NA,NA,NA,NA,NA,0,1,0,0,0,1,0,1,1,1,0,1,1,1,0,0,1,0,0,0,0,0,0,0,0,0,0,0,0,0,0,0,0,0,0,0,0,0,0,0,0,0,0,0,0,0,0,0,0,0,0,0,0,0,0,0,0,0,0,0,0,0,0,0,0,0,0,0,0
DOBA10,1,Dobson A10 Pond,DOBA10_1,6/27/2019,2019,6,27,9:49:00,10:31:00,0:42,"DP,CL,BC,EP",Urban,43.10730843,-89.49580797,296920.8321,4775754.901,MIDDLETON CITY OF,Lake Mendota-Yahara River,Pheasant Branch,327.17,884,289,2000,Stormwater,0.857142857,0,0,0.142857143,0,0,0.576349024,0.099885189,0.197474168,0.111366246,0.006888634,0.008036739,0,0.007731959,0.06930126,0.034077892,0.32674685,0.227376861,0.097079038,0.036941581,0,0.008877434,0,0.047823597,0.00257732,0,0.141466208,0.588201604,0.117124857,0.178407789,0.097079038,0.016609393,0.00257732,26,3,72,5,NA,2,22.6,309.7,324.7,7.2,0.61,0.15,90.09,114.9,NA,2.83,31.9,206.78,7.03,0.1,119.78,21.3,91.43,0.94,NA,NA,NA,NA,NA,NA,NA,NA,NA,NA,NA,NA,NA,NA,other larvae=hyla sp.,38,9,24,0,5,29,0,38,0,5,4,1,0,0,0,1,0,0,0,0,0,NA,0,0,0,1,NA,NA,0,0,0,0,0,0,0,0,0,0,NA,0,0,0,1,0,1,0,1,0,1,0,1,1,0,0,0,1,1,0,1,1,1,0,0,0,0,0,0,1,0,0,0,0,0,1,0,0,1,1,0,0,1,1,0,1,1,1,1,0,0,1,1,0,0,0,1,1,1,0,0,1,0,0,0,Odonata,4,other amphibian=hyla sp.,NA,NA,NA,NA,NA,NA,NA,NA,NA,NA,NA,NA,NA,NA,NA,NA,NA,NA,NA,NA,NA,NA,NA,NA,NA,NA,NA,NA,NA,NA,NA,NA,NA,NA,NA,NA,NA,NA,NA,NA,NA,NA,NA,NA,NA,NA,NA,NA,NA,NA,NA,NA,NA,NA,NA,NA,NA,NA,NA,NA,NA,NA,NA,NA,NA,NA,NA,NA,NA
DOBA10,2,Dobson A10 Pond,DOBA10_2,8/9/2019,2019,8,9,9:43:00,9:57:00,0:14,"CL,EC,BC",Urban,43.10730843,-89.49580797,296920.8321,4775754.901,MIDDLETON CITY OF,Lake Mendota-Yahara River,Pheasant Branch,327.17,884,289,2000,Stormwater,0.857142857,0,0,0.142857143,0,0,0.576349024,0.099885189,0.197474168,0.111366246,0.006888634,0.008036739,0,0.007731959,0.06930126,0.034077892,0.32674685,0.227376861,0.097079038,0.036941581,0,0.008877434,0,0.047823597,0.00257732,0,0.141466208,0.588201604,0.117124857,0.178407789,0.097079038,0.016609393,0.00257732,20,2,58,10,NA,2,21.8,153.7,163.8,22.9,1.95,0.08,38.6,114.2,NA,2.83,31.9,206.78,7.03,0.1,119.78,21.3,91.43,1,NA,NA,NA,NA,NA,NA,NA,NA,NA,NA,NA,NA,NA,NA,"No shoreline vegetation recorded, No max depth recorded",38,9,24,0,5,29,0,38,0,5,4,1,0,0,0,0,0,0,0,0,0,NA,0,0,0,1,NA,NA,0,0,0,0,0,0,0,0,0,0,NA,0,0,0,NA,NA,NA,NA,NA,NA,NA,NA,NA,NA,NA,NA,NA,NA,NA,NA,NA,NA,NA,NA,NA,NA,NA,NA,NA,NA,NA,NA,NA,NA,NA,NA,NA,NA,NA,NA,NA,NA,NA,NA,NA,NA,NA,NA,NA,NA,NA,NA,NA,NA,NA,NA,NA,NA,NA,NA,NA,NA,NA,NA,NA,NA,8,NA,NA,NA,NA,NA,NA,NA,NA,NA,NA,NA,NA,NA,NA,NA,NA,NA,NA,NA,NA,NA,NA,NA,NA,NA,NA,NA,NA,NA,NA,NA,NA,NA,NA,NA,NA,NA,NA,NA,NA,NA,NA,NA,NA,NA,NA,NA,NA,NA,NA,NA,NA,NA,NA,NA,NA,NA,NA,NA,NA,NA,NA,NA,NA,NA,NA,NA,NA,NA,NA
DOBA14,3,Dobson A14 Pond,DOBA14_3,6/9/2020,2020,6,9,9:15:00,9:42:00,0:27,DCT,Urban,43.01919422,-89.29927098,312644.9999,4765511.735,NEP LLC,Lake Monona-Yahara River,Lake Waubesa-Yahara River,444.06,380,NA,2005,Stormwater,0.628571429,0,0,0.371428571,0,0,0.695051784,0,0,0.271576525,0.001150748,0.032220944,0,0.000286,0.007159221,0.044959908,0.380870561,0.170962199,0.187857961,0.001145475,0.000286,0.000573,0.000573,0.007159221,0.191867125,0.00257732,0.003722795,0.596792669,0.014604811,0.00486827,0.187857961,0.004009164,0.191867125,26,8,49,10,2,3,26.1,244.7,239.5,53.1,4.14,0.11,202.7,196.9,7.64,3.66,45.88,147.03,7.8,0.07,69.08,25.08,76.29,NA,0,98,1,1,100,0,"Mud,,NA",1,1,1,0,0.75,1.25,"Shallow, muddy, and very turbid.",NA,22,8,10,2,4,14,0,22,0,2,2,0,1,1,0,0,0,0,0,0,NA,NA,0,0,0,0,NA,"Possible mud minnow, saw a small fish jump,,,,NA",0,0,0,0,1,0,0,0,0,0,0,0,0,0,NA,NA,NA,NA,NA,NA,NA,NA,NA,NA,NA,NA,NA,NA,NA,NA,NA,NA,NA,NA,NA,NA,NA,NA,NA,NA,NA,NA,NA,NA,NA,NA,NA,NA,NA,NA,NA,NA,NA,NA,NA,NA,NA,NA,NA,NA,NA,NA,NA,NA,NA,NA,NA,NA,NA,NA,NA,NA,NA,NA,NA,NA,NA,NA,0,0,0,0,0,0,0,0,0,0,0,1,0,1,1,0,0,0,0,0,0,0,0,0,0,0,0,0,0,0,0,1,0,0,0,0,0,0,0,0,0,0,0,0,0,0,1,0,0,0,0,0,0,0,0,0,0,0,0,0,0,0,0,0,0,0,0,0,0
DOBA14,4,Dobson A14 Pond,DOBA14_4,7/17/2020,2020,7,17,8:30:00,9:18:00,0:48,DCT,Urban,43.01919422,-89.29927098,312644.9999,4765511.735,NEP LLC,Lake Monona-Yahara River,Lake Waubesa-Yahara River,444.06,380,NA,2005,Stormwater,0.628571429,0,0,0.371428571,0,0,0.695051784,0,0,0.271576525,0.001150748,0.032220944,0,0.000286,0.007159221,0.044959908,0.380870561,0.170962199,0.187857961,0.001145475,0.000286,0.000573,0.000573,0.007159221,0.191867125,0.00257732,0.003722795,0.596792669,0.014604811,0.00486827,0.187857961,0.004009164,0.191867125,22,8,81,0,2,2,24.3,89.7,90.9,64.6,5.28,0.04,41.34,52.5,7.96,3.66,45.88,147.03,7.8,0.07,69.08,25.08,76.29,NA,0,70,5,25,100,0,"Mud,Rock ,NA",4,1,2,0,1.75,1.25,"Water super green with floating algae mats and submerged algae, green film over open water. Mostly terrestrial veg surround pond, with cattails at one end and sparse emergent. No submergent detected. Bottom algae mats and chain/hair algae.",NA,22,8,10,2,4,14,0,22,0,2,2,0,1,0,0,0,0,0,0,0,NA,NA,0,0,0,0,NA,NA,0,0,0,0,0,0,0,0,0,0,0,0,0,0,NA,NA,NA,NA,NA,NA,NA,NA,NA,NA,NA,NA,NA,NA,NA,NA,NA,NA,NA,NA,NA,NA,NA,NA,NA,NA,NA,NA,NA,NA,NA,NA,NA,NA,NA,NA,NA,NA,NA,NA,NA,NA,NA,NA,NA,NA,NA,NA,NA,NA,NA,NA,NA,NA,NA,NA,NA,NA,NA,NA,NA,NA,NA,NA,0,1,0,0,0,0,0,0,0,0,0,1,1,1,1,0,0,0,0,1,0,0,0,0,0,0,0,0,0,0,0,1,0,0,0,0,0,0,0,0,0,0,0,0,0,0,1,0,0,0,0,0,0,0,0,0,0,0,0,0,0,0,0,0,0,0,0,0,0
DOBA14,1,Dobson A14 Pond,DOBA14_1,7/3/2019,2019,7,3,7:54:00,8:22:00,0:28,"EC,CL,EP",Urban,43.01919422,-89.29927098,312644.9999,4765511.735,NEP LLC,Lake Monona-Yahara River,Lake Waubesa-Yahara River,444.06,380,255,2005,Stormwater,0.628571429,0,0,0.371428571,0,0,0.695051784,0,0,0.271576525,0.001150748,0.032220944,0,0.000286,0.007159221,0.044959908,0.380870561,0.170962199,0.187857961,0.001145475,0.000286,0.000573,0.000573,0.007159221,0.191867125,0.00257732,0.003722795,0.596792669,0.014604811,0.00486827,0.187857961,0.004009164,0.191867125,24,4,85,70,NA,12,26.5,173.2,168.2,40.9,3.18,0.08,18.01,15.9,NA,3.66,45.88,147.03,7.8,0.07,69.08,25.08,76.29,0.97,NA,NA,NA,NA,NA,NA,NA,NA,NA,NA,NA,NA,NA,NA,"No pond area/perimeter calculated, No property owner/name recorded",22,8,10,2,4,14,0,22,0,2,2,0,0,0,0,0,0,0,0,0,0,NA,0,0,0,0,NA,Tiny unknown sp.,0,0,0,0,0,0,0,0,0,0,NA,0,0,0,1,0,1,0,0,0,0,0,0,0,0,0,0,0,1,1,1,0,1,0,0,0,0,0,0,0,0,0,0,0,0,0,0,0,1,0,0,0,0,1,0,0,0,1,1,0,0,0,1,0,0,0,0,0,0,0,0,0,0,0,0,"Backswimmer, Crawfish",10,NA,NA,NA,NA,NA,NA,NA,NA,NA,NA,NA,NA,NA,NA,NA,NA,NA,NA,NA,NA,NA,NA,NA,NA,NA,NA,NA,NA,NA,NA,NA,NA,NA,NA,NA,NA,NA,NA,NA,NA,NA,NA,NA,NA,NA,NA,NA,NA,NA,NA,NA,NA,NA,NA,NA,NA,NA,NA,NA,NA,NA,NA,NA,NA,NA,NA,NA,NA,NA,NA
DOBA14,2,Dobson A14 Pond,DOBA14_2,8/6/2019,2019,8,6,9:26:00,9:44:00,0:18,"ES,EP,CL",Urban,43.01919422,-89.29927098,312644.9999,4765511.735,NEP LLC,Lake Monona-Yahara River,Lake Waubesa-Yahara River,444.06,380,263,2005,Stormwater,0.628571429,0,0,0.371428571,0,0,0.695051784,0,0,0.271576525,0.001150748,0.032220944,0,0.000286,0.007159221,0.044959908,0.380870561,0.170962199,0.187857961,0.001145475,0.000286,0.000573,0.000573,0.007159221,0.191867125,0.00257732,0.003722795,0.596792669,0.014604811,0.00486827,0.187857961,0.004009164,0.191867125,21,8,82,15,NA,2,23.4,86.8,89.5,24.9,2.05,0.04,8.17,11,NA,3.66,45.88,147.03,7.8,0.07,69.08,25.08,76.29,1.23,NA,NA,NA,NA,NA,NA,NA,NA,NA,NA,NA,NA,NA,NA,NA,22,8,10,2,4,14,0,22,0,2,2,0,0,0,0,0,0,0,0,0,0,NA,0,0,0,0,NA,shiners,0,0,1,1,0,0,0,0,0,0,NA,0,0,0,NA,NA,NA,NA,NA,NA,NA,NA,NA,NA,NA,NA,NA,NA,NA,NA,NA,NA,NA,NA,NA,NA,NA,NA,NA,NA,NA,NA,NA,NA,NA,NA,NA,NA,NA,NA,NA,NA,NA,NA,NA,NA,NA,NA,NA,NA,NA,NA,NA,NA,NA,NA,NA,NA,NA,NA,NA,NA,NA,NA,NA,crayfish,20,NA,NA,NA,NA,NA,NA,NA,NA,NA,NA,NA,NA,NA,NA,NA,NA,NA,NA,NA,NA,NA,NA,NA,NA,NA,NA,NA,NA,NA,NA,NA,NA,NA,NA,NA,NA,NA,NA,NA,NA,NA,NA,NA,NA,NA,NA,NA,NA,NA,NA,NA,NA,NA,NA,NA,NA,NA,NA,NA,NA,NA,NA,NA,NA,NA,NA,NA,NA,NA,NA
DOBA16,3,Dobson A16 Pond,DOBA16_3,6/3/2020,2020,6,3,14:45:00,15:27:00,0:42,DCT,Urban,43.143674,-89.27533307,314970.8192,4779282.791,NELSON ROAD LLC,Lake Monona-Yahara River,Starkweather Creek,187.61,592,NA,2005,Stormwater,0.676258993,0.079136691,0.064748201,0.079136691,0.100719424,0,0.281464531,0.163615561,0.067505721,0.068649886,0.417620137,0.001144165,0.000859,0.209908362,0.062142039,0.048396334,0.137170676,0.136597938,0.085051546,0.017468499,0,0.259163803,0,0.03722795,0.000573,0,0.005441008,0.322164948,0.099369989,0.022909507,0.085051546,0.469072165,0.000573,29,1,31,NA,5,0,26.2,231.7,226.6,73.3,5.71,0.11,148.28,108,7.4,4.66,57.6,433.78,7.28,0.21,112.63,23.68,209.67,NA,0,90,8,2,80,20,"Super Muddy,,",2,2,1,0,1.25,1.75,"Very busy street nearby, not many submergent plants visible, depth drops off quickly.",NA,36,13,18,3,5,23,0,36,0,2,2,1,0,0,0,0,0,0,0,0,NA,NA,0,0,0,0,NA,"Sunfish spp.,,,,",0,0,0,0,0,0,0,0,0,0,1,0,0,0,NA,NA,NA,NA,NA,NA,NA,NA,NA,NA,NA,NA,NA,NA,NA,NA,NA,NA,NA,NA,NA,NA,NA,NA,NA,NA,NA,NA,NA,NA,NA,NA,NA,NA,NA,NA,NA,NA,NA,NA,NA,NA,NA,NA,NA,NA,NA,NA,NA,NA,NA,NA,NA,NA,NA,NA,NA,NA,NA,NA,NA,NA,NA,NA,0,0,1,0,0,0,0,0,1,1,0,1,1,1,0,0,0,0,0,0,0,0,0,0,1,0,0,0,0,0,0,0,0,0,0,0,0,0,0,0,0,0,0,0,0,0,0,0,0,0,0,1,0,0,0,0,0,0,0,0,0,0,0,0,0,0,0,0,0
DOBA16,4,Dobson A16 Pond,DOBA16_4,8/4/2020,2020,8,4,10:15:00,11:08:00,0:53,DCT,Urban,43.143674,-89.27533307,314970.8192,4779282.791,NELSON ROAD LLC,Lake Monona-Yahara River,Starkweather Creek,187.61,592,NA,2005,Stormwater,0.676258993,0.079136691,0.064748201,0.079136691,0.100719424,0,0.281464531,0.163615561,0.067505721,0.068649886,0.417620137,0.001144165,0.000859,0.209908362,0.062142039,0.048396334,0.137170676,0.136597938,0.085051546,0.017468499,0,0.259163803,0,0.03722795,0.000573,0,0.005441008,0.322164948,0.099369989,0.022909507,0.085051546,0.469072165,0.000573,17,7,58,0,5,0,21.5,223.1,238.9,30.1,2.59,0.11,1.75,119.4,7.16,4.66,57.6,433.78,7.28,0.21,112.63,23.68,209.67,NA,0,80,15,5,70,30,"Firm Soil,Leaf Litter,Rock ",3,3,3,0,2.25,1.75,"Shallow bench with typha and leafy PW, drops off steeply to deep turbid water. Some areas filled with algae. Tons of snails and pumkinseed. 5m buffer then mowed",NA,36,13,18,3,5,23,0,36,0,2,2,1,0,0,0,0,0,0,0,0,NA,NA,0,0,0,0,NA,"Pumpkinseed,,,,",0,0,0,0,0,0,1,0,0,0,0,0,0,0,NA,NA,NA,NA,NA,NA,NA,NA,NA,NA,NA,NA,NA,NA,NA,NA,NA,NA,NA,NA,NA,NA,NA,NA,NA,NA,NA,NA,NA,NA,NA,NA,NA,NA,NA,NA,NA,NA,NA,NA,NA,NA,NA,NA,NA,NA,NA,NA,NA,NA,NA,NA,NA,NA,NA,NA,NA,NA,NA,NA,NA,NA,NA,NA,0,1,1,0,0,1,0,0,1,1,0,1,1,1,0,0,0,0,0,0,0,0,0,0,0,0,0,0,0,1,0,0,0,0,0,0,0,0,0,1,0,0,0,0,0,0,0,0,0,0,0,0,1,0,0,0,0,0,0,0,0,0,0,0,0,0,0,0,0
DOBA16,1,Dobson A16 Pond,DOBA16_1,7/2/2019,2019,7,2,10:00:00,10:29:00,0:29,"ES,EP,CL",Urban,43.143674,-89.27533307,314970.8192,4779282.791,NELSON ROAD LLC,Lake Monona-Yahara River,Starkweather Creek,187.61,592,290,2005,Stormwater,0.676258993,0.079136691,0.064748201,0.079136691,0.100719424,0,0.281464531,0.163615561,0.067505721,0.068649886,0.417620137,0.001144165,0.000859,0.209908362,0.062142039,0.048396334,0.137170676,0.136597938,0.085051546,0.017468499,0,0.259163803,0,0.03722795,0.000573,0,0.005441008,0.322164948,0.099369989,0.022909507,0.085051546,0.469072165,0.000573,29,5,67,15,NA,2,25.2,421.4,419.6,83.4,6.62,0.2,99.64,111.8,NA,4.66,57.6,433.78,7.28,0.21,112.63,23.68,209.67,1.29,NA,NA,NA,NA,NA,NA,NA,NA,NA,NA,NA,NA,NA,NA,NA,36,13,18,3,5,23,0,36,0,2,2,1,0,1,0,0,0,0,0,0,0,NA,0,0,0,0,NA,lots of small fish,0,0,0,0,0,0,0,0,0,0,NA,0,0,0,0,0,1,0,1,0,0,0,1,0,0,0,0,1,0,0,1,0,1,0,0,0,0,0,0,0,1,0,0,0,0,0,0,0,1,1,1,0,0,1,1,1,0,1,0,0,0,0,1,1,0,0,1,1,0,1,0,1,0,0,0,"Planorbid,Physid,Odonata",4,NA,NA,NA,NA,NA,NA,NA,NA,NA,NA,NA,NA,NA,NA,NA,NA,NA,NA,NA,NA,NA,NA,NA,NA,NA,NA,NA,NA,NA,NA,NA,NA,NA,NA,NA,NA,NA,NA,NA,NA,NA,NA,NA,NA,NA,NA,NA,NA,NA,NA,NA,NA,NA,NA,NA,NA,NA,NA,NA,NA,NA,NA,NA,NA,NA,NA,NA,NA,NA,NA
DOBA16,2,Dobson A16 Pond,DOBA16_2,8/15/2019,2019,8,15,9:56:00,10:06:00,0:10,"EC,EP,CL",Urban,43.143674,-89.27533307,314970.8192,4779282.791,NELSON ROAD LLC,Lake Monona-Yahara River,Starkweather Creek,187.61,592,292,2005,Stormwater,0.676258993,0.079136691,0.064748201,0.079136691,0.100719424,0,0.281464531,0.163615561,0.067505721,0.068649886,0.417620137,0.001144165,0.000859,0.209908362,0.062142039,0.048396334,0.137170676,0.136597938,0.085051546,0.017468499,0,0.259163803,0,0.03722795,0.000573,0,0.005441008,0.322164948,0.099369989,0.022909507,0.085051546,0.469072165,0.000573,22,4,61,1,NA,2,21.8,798,850,43.6,3.71,0.42,381.1,111.3,NA,4.66,57.6,433.78,7.28,0.21,112.63,23.68,209.67,4.34,NA,NA,NA,NA,NA,NA,NA,NA,NA,NA,NA,NA,NA,NA,NA,36,13,18,3,5,23,0,36,0,2,2,0,0,0,0,0,0,0,0,0,0,NA,0,0,0,0,NA,sunfish,0,0,0,0,0,0,0,1,0,0,NA,0,0,0,NA,NA,NA,NA,NA,NA,NA,NA,NA,NA,NA,NA,NA,NA,NA,NA,NA,NA,NA,NA,NA,NA,NA,NA,NA,NA,NA,NA,NA,NA,NA,NA,NA,NA,NA,NA,NA,NA,NA,NA,NA,NA,NA,NA,NA,NA,NA,NA,NA,NA,NA,NA,NA,NA,NA,NA,NA,NA,NA,NA,NA,NA,5.5,NA,NA,NA,NA,NA,NA,NA,NA,NA,NA,NA,NA,NA,NA,NA,NA,NA,NA,NA,NA,NA,NA,NA,NA,NA,NA,NA,NA,NA,NA,NA,NA,NA,NA,NA,NA,NA,NA,NA,NA,NA,NA,NA,NA,NA,NA,NA,NA,NA,NA,NA,NA,NA,NA,NA,NA,NA,NA,NA,NA,NA,NA,NA,NA,NA,NA,NA,NA,NA,NA
DOBA22,3,Dobson A22 Pond,DOBA22_3,6/9/2020,2020,6,9,8:19:00,8:51:00,0:32,DCT,Urban,43.02661718,-89.28484903,313842.6511,4766304,CITY OF MADISON ENGINEER STORMWATER UTILITY 533,Lake Monona-Yahara River,Lake Waubesa-Yahara River,64.29,1725,NA,2005,Stormwater,0.755395683,0,0,0.223021583,0.021582734,0,0.695652174,0.020594966,0,0.196796339,0.086956522,0,0.021974886,0.035673516,0.013127854,0.008847032,0.396974886,0.194634703,0.202054795,0.015981735,0,0.079052511,0.003710046,0.02597032,0.000571,0,0.001426941,0.600456621,0.039098174,0.017408676,0.202054795,0.118436073,0.000571,23,6,52,10,6,0,24.7,112,112.5,103.2,8.25,0.05,274.2,161.1,10.03,5.17,65.7,80.28,9.36,0.04,132.15,25.35,93.99,NA,1,50,1,49,17,83,"Firm Soil,Leaf Litter,Rock ",5,2,3,1,2.75,2.5,Actively mowing edges of site during survey. Water level looks .5m lower than normal. Emergent would be slightly greater if water was at normal high water line. Water column nearly completely Pota spp. Up to surface. Local man says it dries up sometimes in summer and asked why no cattails. Lots of amphipods and water boatman.,NA,22,8,10,1,4,14,0,22,0,3,3,1,0,1,0,0,0,0,0,0,NA,NA,0,0,0,0,NA,NA,0,0,0,0,0,0,0,0,0,0,0,0,0,0,NA,NA,NA,NA,NA,NA,NA,NA,NA,NA,NA,NA,NA,NA,NA,NA,NA,NA,NA,NA,NA,NA,NA,NA,NA,NA,NA,NA,NA,NA,NA,NA,NA,NA,NA,NA,NA,NA,NA,NA,NA,NA,NA,NA,NA,NA,NA,NA,NA,NA,NA,NA,NA,NA,NA,NA,NA,NA,NA,NA,NA,NA,NA,NA,0,1,0,0,0,0,0,0,1,0,0,1,0,0,0,0,0,0,0,0,0,0,0,0,1,0,0,0,0,0,0,0,0,0,0,0,0,0,0,0,0,0,0,0,0,0,0,0,0,0,0,0,0,0,0,0,0,0,0,0,0,0,0,0,0,0,0,0,0
DOBA22,4,Dobson A22 Pond,DOBA22_4,7/17/2020,2020,7,17,7:10:00,8:11:00,1:01,DCT,Urban,43.02661718,-89.28484903,313842.6511,4766304,CITY OF MADISON ENGINEER STORMWATER UTILITY 533,Lake Monona-Yahara River,Lake Waubesa-Yahara River,64.29,1725,NA,2005,Stormwater,0.755395683,0,0,0.223021583,0.021582734,0,0.695652174,0.020594966,0,0.196796339,0.086956522,0,0.021974886,0.035673516,0.013127854,0.008847032,0.396974886,0.194634703,0.202054795,0.015981735,0,0.079052511,0.003710046,0.02597032,0.000571,0,0.001426941,0.600456621,0.039098174,0.017408676,0.202054795,0.118436073,0.000571,19,4,90,0,6,0,25,73.7,73.7,56.1,4.52,0.03,91.72,163.8,8.68,5.17,65.7,80.28,9.36,0.04,132.15,25.35,93.99,NA,1,95,2,3,45,55,"Firm Soil,Rock ,NA",1,5,2,1,2.25,2.5,"Water higher than previous visit ~.5m. Percentages given for normal high water line, not current water line. Most emergent would be out of water. ~3m buffer before mowing.",NA,22,8,10,1,4,14,0,22,0,3,3,0,1,0,0,0,0,0,0,0,NA,NA,0,0,0,0,NA,"Sunfish, bluegill size,,,,NA",0,0,0,0,0,0,0,0,0,0,1,0,0,0,NA,NA,NA,NA,NA,NA,NA,NA,NA,NA,NA,NA,NA,NA,NA,NA,NA,NA,NA,NA,NA,NA,NA,NA,NA,NA,NA,NA,NA,NA,NA,NA,NA,NA,NA,NA,NA,NA,NA,NA,NA,NA,NA,NA,NA,NA,NA,NA,NA,NA,NA,NA,NA,NA,NA,NA,NA,NA,NA,NA,NA,NA,NA,NA,0,1,1,0,0,1,0,0,1,0,0,1,1,1,0,0,0,0,0,0,0,0,0,0,1,0,0,0,0,0,0,0,0,0,0,0,0,0,0,0,0,0,0,0,0,0,0,0,0,0,0,0,0,0,0,0,0,0,0,0,0,0,0,0,0,0,0,0,0
DOBA22,1,Dobson A22 Pond,DOBA22_1,7/3/2019,2019,7,3,8:35:00,9:11:00,0:36,"CL,EC,EP",Urban,43.02661718,-89.28484903,313842.6511,4766304,CITY OF MADISON ENGINEER STORMWATER UTILITY 533,Lake Monona-Yahara River,Lake Waubesa-Yahara River,64.29,1725,265,2005,Stormwater,0.755395683,0,0,0.223021583,0.021582734,0,0.695652174,0.020594966,0,0.196796339,0.086956522,0,0.021974886,0.035673516,0.013127854,0.008847032,0.396974886,0.194634703,0.202054795,0.015981735,0,0.079052511,0.003710046,0.02597032,0.000571,0,0.001426941,0.600456621,0.039098174,0.017408676,0.202054795,0.118436073,0.000571,24,5,85,70,NA,16,27.9,64.6,61.2,85,6.4,0.03,3.55,99.61,NA,5.17,65.7,80.28,9.36,0.04,132.15,25.35,93.99,0.98,NA,NA,NA,NA,NA,NA,NA,NA,NA,NA,NA,NA,NA,NA,"No outflows recorded, No property name/owner, No pond area/perimeter calculted,",22,8,10,1,4,14,0,22,0,3,3,0,1,0,0,0,0,0,0,0,1,NA,0,0,0,0,NA,NA,0,0,0,0,0,0,0,0,0,0,NA,0,0,0,1,0,1,0,1,0,0,0,0,0,0,0,0,0,0,0,0,1,1,0,0,0,0,0,0,0,0,0,0,0,0,0,0,0,0,1,1,0,0,1,0,0,0,1,0,0,0,0,1,0,0,0,0,0,0,0,0,0,0,0,1,"Backswimmers, planorbids",12,NA,NA,NA,NA,NA,NA,NA,NA,NA,NA,NA,NA,NA,NA,NA,NA,NA,NA,NA,NA,NA,NA,NA,NA,NA,NA,NA,NA,NA,NA,NA,NA,NA,NA,NA,NA,NA,NA,NA,NA,NA,NA,NA,NA,NA,NA,NA,NA,NA,NA,NA,NA,NA,NA,NA,NA,NA,NA,NA,NA,NA,NA,NA,NA,NA,NA,NA,NA,NA,NA
DOBA22,2,Dobson A22 Pond,DOBA22_2,8/6/2019,2019,8,6,9:02:00,9:20:00,0:18,"ES,EP,CL",Urban,43.02661718,-89.28484903,313842.6511,4766304,CITY OF MADISON ENGINEER STORMWATER UTILITY 533,Lake Monona-Yahara River,Lake Waubesa-Yahara River,64.29,1725,275,2005,Stormwater,0.755395683,0,0,0.223021583,0.021582734,0,0.695652174,0.020594966,0,0.196796339,0.086956522,0,0.021974886,0.035673516,0.013127854,0.008847032,0.396974886,0.194634703,0.202054795,0.015981735,0,0.079052511,0.003710046,0.02597032,0.000571,0,0.001426941,0.600456621,0.039098174,0.017408676,0.202054795,0.118436073,0.000571,21,8,82,45,NA,2,23.8,72,73.7,18.5,1.52,0.03,4.21,104.1,NA,5.17,65.7,80.28,9.36,0.04,132.15,25.35,93.99,1.48,NA,NA,NA,NA,NA,NA,NA,NA,NA,NA,NA,NA,NA,NA,NA,22,8,10,1,4,14,0,22,0,3,3,1,0,0,0,0,0,0,0,0,0,NA,0,0,0,0,NA,NA,0,0,0,0,0,0,0,0,0,0,NA,0,0,0,NA,NA,NA,NA,NA,NA,NA,NA,NA,NA,NA,NA,NA,NA,NA,NA,NA,NA,NA,NA,NA,NA,NA,NA,NA,NA,NA,NA,NA,NA,NA,NA,NA,NA,NA,NA,NA,NA,NA,NA,NA,NA,NA,NA,NA,NA,NA,NA,NA,NA,NA,NA,NA,NA,NA,NA,NA,NA,NA,NA,NA,NA,20,>15 sweeps,NA,NA,NA,NA,NA,NA,NA,NA,NA,NA,NA,NA,NA,NA,NA,NA,NA,NA,NA,NA,NA,NA,NA,NA,NA,NA,NA,NA,NA,NA,NA,NA,NA,NA,NA,NA,NA,NA,NA,NA,NA,NA,NA,NA,NA,NA,NA,NA,NA,NA,NA,NA,NA,NA,NA,NA,NA,NA,NA,NA,NA,NA,NA,NA,NA,NA,NA,NA,NA
DOBA25,3,Dobson A25 Pond,DOBA25_3,6/3/2020,2020,6,3,16:40:00,17:08:00,0:28,DCT,Rural,43.15995893,-89.27100459,315371.8752,4781081.791,MADISON CITY OF,Koshkonong Creek,Headwaters Koshkonong Creek,10.62,9467,NA,2005,Stormwater,0.185714286,0,0.007142857,0.042857143,0.435714286,0.307142857,0.32416953,0.002290951,0.010309278,0.100801833,0.487972509,0.071019473,0.002003434,0.343732112,0.017172295,0.091013165,0.115626789,0.181740126,0.09358901,0.01688609,0,0.117344018,0,0.000859,0.017744705,0.002289639,0,0.38838008,0.01803091,0.01688609,0.09358901,0.46336577,0.017744705,29,6,34,10,2,0,28.3,674,634,112.3,8.4,0.31,151.23,111.4,8.27,5.53,69.78,504.3,8.36,0.25,122.95,24.45,148.46,NA,0,98,1,1,98,2,"Firm Soil,Rock ,NA",1,1,2,0,1,1.13,"Large site with steep bank that drops of to 0.5m then flat, firm bottom with rocks, submergent very sparse, but hard to tell because very turbid. Rained hard the night before survey. Floating and submerged mats of algae that look like cyano.",NA,24,10,11,3,4,15,1,25,1,1,1,0,0,0,0,0,0,0,0,0,NA,NA,0,0,0,0,NA,"carp, one dead,,,,NA",0,0,0,0,0,0,0,0,0,0,0,0,0,1,NA,NA,NA,NA,NA,NA,NA,NA,NA,NA,NA,NA,NA,NA,NA,NA,NA,NA,NA,NA,NA,NA,NA,NA,NA,NA,NA,NA,NA,NA,NA,NA,NA,NA,NA,NA,NA,NA,NA,NA,NA,NA,NA,NA,NA,NA,NA,NA,NA,NA,NA,NA,NA,NA,NA,NA,NA,NA,NA,NA,NA,NA,NA,NA,0,1,1,0,0,0,0,0,1,0,0,0,0,0,0,0,0,0,0,0,0,0,0,0,0,0,0,0,0,0,0,0,0,0,0,0,1,0,0,0,0,0,0,0,0,0,0,0,0,0,0,0,0,0,0,0,0,0,0,0,0,0,0,0,0,0,0,0,0
DOBA25,4,Dobson A25 Pond,DOBA25_4,8/4/2020,2020,8,4,8:30:00,9:42:00,1:12,DCT,Rural,43.15995893,-89.27100459,315371.8752,4781081.791,MADISON CITY OF,Koshkonong Creek,Headwaters Koshkonong Creek,10.62,9467,NA,2005,Stormwater,0.185714286,0,0.007142857,0.042857143,0.435714286,0.307142857,0.32416953,0.002290951,0.010309278,0.100801833,0.487972509,0.071019473,0.002003434,0.343732112,0.017172295,0.091013165,0.115626789,0.181740126,0.09358901,0.01688609,0,0.117344018,0,0.000859,0.017744705,0.002289639,0,0.38838008,0.01803091,0.01688609,0.09358901,0.46336577,0.017744705,14,8,77,0,2,0,20.8,322.5,350.7,70,6.1,0.17,3.62,137.4,8.44,5.53,69.78,504.3,8.36,0.25,122.95,24.45,148.46,NA,0,98,1,1,99,1,"Firm Soil,Rock ,NA",1,1,2,1,1.25,1.13,"Very turbid. More insects than previously assumed in emergent Phalaras. Nepidae, Damsel, Corixidae. Steep bank with almost no emergentin water. Some green film on surface.",NA,24,10,11,3,4,15,1,25,1,1,1,1,0,0,0,0,0,0,0,0,NA,NA,0,0,0,0,NA,"Pumpkinseed, Large Carp,,,,NA",0,0,0,0,0,0,1,0,0,0,0,0,0,1,NA,NA,NA,NA,NA,NA,NA,NA,NA,NA,NA,NA,NA,NA,NA,NA,NA,NA,NA,NA,NA,NA,NA,NA,NA,NA,NA,NA,NA,NA,NA,NA,NA,NA,NA,NA,NA,NA,NA,NA,NA,NA,NA,NA,NA,NA,NA,NA,NA,NA,NA,NA,NA,NA,NA,NA,NA,NA,NA,NA,NA,NA,NA,NA,0,1,1,0,0,1,0,0,1,0,1,0,0,0,0,0,0,1,0,0,0,0,0,0,1,0,0,0,0,1,0,0,0,0,0,0,1,0,0,0,1,0,0,0,0,0,0,0,0,0,0,0,0,0,0,0,0,0,0,0,0,0,0,0,0,0,0,0,0
DOBA25,1,Dobson A25 Pond,DOBA25_1,7/2/2019,2019,7,2,9:10:00,9:42:00,0:32,"ES,EP,CL",Rural,43.15995893,-89.27100459,315371.8752,4781081.791,MADISON CITY OF,Koshkonong Creek,Headwaters Koshkonong Creek,10.62,9467,277,2005,Stormwater,0.185714286,0,0.007142857,0.042857143,0.435714286,0.307142857,0.32416953,0.002290951,0.010309278,0.100801833,0.487972509,0.071019473,0.002003434,0.343732112,0.017172295,0.091013165,0.115626789,0.181740126,0.09358901,0.01688609,0,0.117344018,0,0.000859,0.017744705,0.002289639,0,0.38838008,0.01803091,0.01688609,0.09358901,0.46336577,0.017744705,28,5,69,10,NA,2,26.5,632,615,79.9,6.2,0.3,153.49,111.1,NA,5.53,69.78,504.3,8.36,0.25,122.95,24.45,148.46,2.22,NA,NA,NA,NA,NA,NA,NA,NA,NA,NA,NA,NA,NA,NA,unkown turtle-moved too fast to see,24,10,11,3,4,15,1,25,1,1,1,0,0,0,0,0,0,0,0,0,0,NA,0,0,0,0,NA,"Shiners,other unknown jumping fish",0,0,0,1,0,0,0,0,0,0,NA,0,0,0,0,0,0,0,1,0,0,0,1,0,0,0,0,0,1,0,1,0,1,0,0,0,0,0,0,1,0,0,0,0,0,1,0,0,0,0,1,0,0,0,0,0,0,0,0,0,0,0,1,1,0,0,0,1,0,1,0,0,0,0,1,NA,16,NA,NA,NA,NA,NA,NA,NA,NA,NA,NA,NA,NA,NA,NA,NA,NA,NA,NA,NA,NA,NA,NA,NA,NA,NA,NA,NA,NA,NA,NA,NA,NA,NA,NA,NA,NA,NA,NA,NA,NA,NA,NA,NA,NA,NA,NA,NA,NA,NA,NA,NA,NA,NA,NA,NA,NA,NA,NA,NA,NA,NA,NA,NA,NA,NA,NA,NA,NA,NA,NA
DOBA25,2,Dobson A25 Pond,DOBA25_2,8/15/2019,2019,8,15,9:24:00,9:36:00,0:12,"EC,EP,CL",Rural,43.15995893,-89.27100459,315371.8752,4781081.791,MADISON CITY OF,Koshkonong Creek,Headwaters Koshkonong Creek,10.62,9467,279,2005,Stormwater,0.185714286,0,0.007142857,0.042857143,0.435714286,0.307142857,0.32416953,0.002290951,0.010309278,0.100801833,0.487972509,0.071019473,0.002003434,0.343732112,0.017172295,0.091013165,0.115626789,0.181740126,0.09358901,0.01688609,0,0.117344018,0,0.000859,0.017744705,0.002289639,0,0.38838008,0.01803091,0.01688609,0.09358901,0.46336577,0.017744705,19,4,68,NA,NA,3,22.2,394.6,417.5,16.9,1.43,0.2,140.67,131.9,NA,5.53,69.78,504.3,8.36,0.25,122.95,24.45,148.46,3.79,NA,NA,NA,NA,NA,NA,NA,NA,NA,NA,NA,NA,NA,NA,fish might have been carp,24,10,11,3,4,15,1,25,1,1,1,0,0,0,0,0,0,0,0,0,0,NA,0,0,0,0,NA,huge fish,0,0,0,0,0,0,0,0,0,0,NA,0,0,0,NA,NA,NA,NA,NA,NA,NA,NA,NA,NA,NA,NA,NA,NA,NA,NA,NA,NA,NA,NA,NA,NA,NA,NA,NA,NA,NA,NA,NA,NA,NA,NA,NA,NA,NA,NA,NA,NA,NA,NA,NA,NA,NA,NA,NA,NA,NA,NA,NA,NA,NA,NA,NA,NA,NA,NA,NA,NA,NA,NA,NA,NA,14,>20 sweeps didnt get anything,NA,NA,NA,NA,NA,NA,NA,NA,NA,NA,NA,NA,NA,NA,NA,NA,NA,NA,NA,NA,NA,NA,NA,NA,NA,NA,NA,NA,NA,NA,NA,NA,NA,NA,NA,NA,NA,NA,NA,NA,NA,NA,NA,NA,NA,NA,NA,NA,NA,NA,NA,NA,NA,NA,NA,NA,NA,NA,NA,NA,NA,NA,NA,NA,NA,NA,NA,NA,NA
DOBA3,3,Dobson A3 Pond,DOBA3_3,5/21/2020,2020,5,21,14:58:00,15:51:00,0:53,DCT,Rural,43.07095423,-89.25969568,316024.7167,4771172.374,GRACE EVANGELICAL CHURCH INC,Lake Monona-Yahara River,Lake Monona-Yahara River,285.49,518,NA,2005,Natural,0.09352518,0,0.079136691,0.043165468,0.784172662,0,0.052691867,0.012600229,0.340206186,0.020618557,0.573883162,0,0,0.441547278,0.069054441,0.000573,0.033237822,0.002578797,0.022922636,0.174212034,0.004584527,0.14469914,0,0.036962751,0,0.001432665,0.068194842,0.036389685,0.110601719,0.242406877,0.022922636,0.587679083,0,19,8,60,100,1,0,21.8,64.9,69.2,169,14.44,0.03,123.85,274.1,9.75,7.69,94.15,81.83,8.21,0.04,159.93,23.33,47.79,NA,1,70,25,5,50,50,"Mud,Vegetation,NA",4,1,1,0,1.5,1.63,Thick mats of unknown dead vegetation all around pond. Landownersays typha does not form cattails. Poor vis and hard to determine submergent. Fishing spider and water striders.,NA,29,13,10,0,6,16,0,29,0,6,6,1,0,1,0,0,0,1,0,0,NA,NA,0,0,0,0,NA,NA,0,0,0,0,0,0,0,0,0,0,0,0,0,0,NA,NA,NA,NA,NA,NA,NA,NA,NA,NA,NA,NA,NA,NA,NA,NA,NA,NA,NA,NA,NA,NA,NA,NA,NA,NA,NA,NA,NA,NA,NA,NA,NA,NA,NA,NA,NA,NA,NA,NA,NA,NA,NA,NA,NA,NA,NA,NA,NA,NA,NA,NA,NA,NA,NA,NA,NA,NA,NA,NA,NA,NA,NA,NA,0,1,1,0,0,0,0,0,1,0,0,0,0,1,0,0,0,0,0,1,0,0,0,0,0,0,0,0,0,0,0,0,0,0,0,0,1,0,1,0,0,0,1,0,0,0,0,0,0,0,0,0,0,0,0,0,0,0,0,0,0,0,0,0,0,0,0,0,0
DOBA3,4,Dobson A3 Pond,DOBA3_4,8/7/2020,2020,8,7,8:05:00,9:21:00,1:16,DCT,Rural,43.07095423,-89.25969568,316024.7167,4771172.374,GRACE EVANGELICAL CHURCH INC,Lake Monona-Yahara River,Lake Monona-Yahara River,285.49,518,NA,2005,Natural,0.09352518,0,0.079136691,0.043165468,0.784172662,0,0.052691867,0.012600229,0.340206186,0.020618557,0.573883162,0,0,0.441547278,0.069054441,0.000573,0.033237822,0.002578797,0.022922636,0.174212034,0.004584527,0.14469914,0,0.036962751,0,0.001432665,0.068194842,0.036389685,0.110601719,0.242406877,0.022922636,0.587679083,0,18,3,85,0,1,0,17.8,33.1,38.4,35.5,3.29,0.02,5.74,111.4,6.66,7.69,94.15,81.83,8.21,0.04,159.93,23.33,47.79,NA,0,40,50,10,15,85,"Mud,,NA",4,2,1,0,1.75,1.63,"Cool pond with lots of plants, tons of water plantains and Grey tree frog tads. Water shallow and slightly lower than previous. Dense leafy PW mixed with stonewort, very little DW in corners, more floating water plantain. Buffer 3m.",NA,29,13,10,0,6,16,0,29,0,6,6,1,0,0,0,1,0,0,0,0,NA,NA,0,0,0,0,NA,NA,0,0,0,0,0,0,0,0,0,0,0,0,0,0,NA,NA,NA,NA,NA,NA,NA,NA,NA,NA,NA,NA,NA,NA,NA,NA,NA,NA,NA,NA,NA,NA,NA,NA,NA,NA,NA,NA,NA,NA,NA,NA,NA,NA,NA,NA,NA,NA,NA,NA,NA,NA,NA,NA,NA,NA,NA,NA,NA,NA,NA,NA,NA,NA,NA,NA,NA,NA,NA,NA,NA,NA,NA,NA,1,0,1,0,0,1,0,0,1,0,0,0,0,1,0,0,0,0,0,1,0,0,0,0,0,0,0,0,0,0,0,0,0,0,0,0,1,0,1,0,0,0,1,1,0,0,0,0,1,1,0,0,0,0,0,0,0,0,0,0,0,0,0,0,0,0,0,0,0
DOBA3,1,Dobson A3 Pond,DOBA3_1,7/3/2019,2019,7,3,10:40:00,11:13:00,0:33,"CL,EC,EP",Rural,43.07095423,-89.25969568,316024.7167,4771172.374,GRACE EVANGELICAL CHURCH INC,Lake Monona-Yahara River,Lake Monona-Yahara River,285.49,518,266,2005,Natural,0.09352518,0,0.079136691,0.043165468,0.784172662,0,0.052691867,0.012600229,0.340206186,0.020618557,0.573883162,0,0,0.441547278,0.069054441,0.000573,0.033237822,0.002578797,0.022922636,0.174212034,0.004584527,0.14469914,0,0.036962751,0,0.001432665,0.068194842,0.036389685,0.110601719,0.242406877,0.022922636,0.587679083,0,28,4,72,93,NA,2,28.8,133.9,124.7,137.9,10.31,0.06,11.72,112.1,NA,7.69,94.15,81.83,8.21,0.04,159.93,23.33,47.79,0.85,NA,NA,NA,NA,NA,NA,NA,NA,NA,NA,NA,NA,NA,NA,"No outflows recorded, no property name/owner recorded, no pond area/perimeter calculated, DO% was bouncing between 70 - 140%, Lots of hylid tads, clams present",29,13,10,0,6,16,0,29,0,6,6,1,0,0,0,1,0,0,0,0,0,NA,0,0,0,0,NA,NA,0,0,0,0,0,0,0,0,0,0,NA,0,0,0,1,0,1,0,1,0,0,0,0,1,0,0,0,0,1,0,0,1,1,0,0,0,0,0,0,0,0,0,0,0,0,0,0,0,0,0,1,0,0,1,0,0,0,1,0,0,0,0,1,0,0,0,0,0,0,1,0,0,0,0,0,"Backswimmers, dragonfly larvae",9,NA,NA,NA,NA,NA,NA,NA,NA,NA,NA,NA,NA,NA,NA,NA,NA,NA,NA,NA,NA,NA,NA,NA,NA,NA,NA,NA,NA,NA,NA,NA,NA,NA,NA,NA,NA,NA,NA,NA,NA,NA,NA,NA,NA,NA,NA,NA,NA,NA,NA,NA,NA,NA,NA,NA,NA,NA,NA,NA,NA,NA,NA,NA,NA,NA,NA,NA,NA,NA,NA
DOBA3,2,Dobson A3 Pond,DOBA3_2,8/6/2019,2019,8,6,10:14:00,10:31:00,0:17,"ES,EP,CL",Rural,43.07095423,-89.25969568,316024.7167,4771172.374,GRACE EVANGELICAL CHURCH INC,Lake Monona-Yahara River,Lake Monona-Yahara River,285.49,518,272,2005,Natural,0.09352518,0,0.079136691,0.043165468,0.784172662,0,0.052691867,0.012600229,0.340206186,0.020618557,0.573883162,0,0,0.441547278,0.069054441,0.000573,0.033237822,0.002578797,0.022922636,0.174212034,0.004584527,0.14469914,0,0.036962751,0,0.001432665,0.068194842,0.036389685,0.110601719,0.242406877,0.022922636,0.587679083,0,23,8,76,5,NA,2,24.9,94.9,95,34.2,2.73,0.04,7.81,142.1,NA,7.69,94.15,81.83,8.21,0.04,159.93,23.33,47.79,1.45,NA,NA,NA,NA,NA,NA,NA,NA,NA,NA,NA,NA,NA,NA,open water not recorded,29,13,10,0,6,16,0,29,0,6,6,0,0,0,1,1,0,0,0,0,1,NA,0,0,0,0,NA,NA,0,0,0,0,0,0,0,0,0,0,NA,0,0,0,NA,NA,NA,NA,NA,NA,NA,NA,NA,NA,NA,NA,NA,NA,NA,NA,NA,NA,NA,NA,NA,NA,NA,NA,NA,NA,NA,NA,NA,NA,NA,NA,NA,NA,NA,NA,NA,NA,NA,NA,NA,NA,NA,NA,NA,NA,NA,NA,NA,NA,NA,NA,NA,NA,NA,NA,NA,NA,NA,NA,NA,NA,15,NA,NA,NA,NA,NA,NA,NA,NA,NA,NA,NA,NA,NA,NA,NA,NA,NA,NA,NA,NA,NA,NA,NA,NA,NA,NA,NA,NA,NA,NA,NA,NA,NA,NA,NA,NA,NA,NA,NA,NA,NA,NA,NA,NA,NA,NA,NA,NA,NA,NA,NA,NA,NA,NA,NA,NA,NA,NA,NA,NA,NA,NA,NA,NA,NA,NA,NA,NA,NA,NA
DOBA4,3,Dobson A4 Pond,DOBA4_3,5/21/2020,2020,5,21,12:59:00,13:34:00,0:35,DCT,Urban,43.09265805,-89.26627707,315554.0217,4773597.171,DOOR CREEK CHURCH INC,Lake Kegonsa-Yahara River,Door Creek,69.45,4432,NA,2000,Stormwater,0.507142857,0,0,0.142857143,0.35,0,0.528604119,0,0,0.129290618,0.342105263,0,0,0.128727064,0.013761468,0.005447248,0.270355505,0.233084862,0.164277523,0.00516055,0,0.156823394,0.000573,0.020928899,0.00086,0,0,0.508887615,0.034690367,0.00516055,0.164277523,0.286123853,0.00086,18,8,67,75,5,1,19.7,128.7,143.1,105.6,9.38,0.07,119,117.5,8.19,7.13,84.65,124.88,7.79,0.06,116.05,22.9,56.36,NA,NA,95,5,0,70,30,"Firm Soil,Rock ,NA",1,3,2,0,1.5,1.75,"Dead toad, dead fish~ 3in. Fairly turbid. Whirligig beetles",NA,31,14,12,3,6,18,1,32,1,3,2,0,0,1,0,0,0,0,0,0,NA,NA,0,0,0,1,NA,"Dead fish,,,,NA",0,0,0,0,0,0,0,0,0,0,0,0,0,0,NA,NA,NA,NA,NA,NA,NA,NA,NA,NA,NA,NA,NA,NA,NA,NA,NA,NA,NA,NA,NA,NA,NA,NA,NA,NA,NA,NA,NA,NA,NA,NA,NA,NA,NA,NA,NA,NA,NA,NA,NA,NA,NA,NA,NA,NA,NA,NA,NA,NA,NA,NA,NA,NA,NA,NA,NA,NA,NA,NA,NA,NA,NA,NA,1,0,1,0,0,0,0,1,0,1,1,1,1,0,0,0,0,0,0,0,0,0,0,0,0,0,0,0,0,0,0,0,0,0,0,0,0,0,0,0,0,0,0,0,0,0,0,0,0,0,0,0,0,0,0,0,0,0,0,0,0,0,0,0,0,0,0,0,0
DOBA4,4,Dobson A4 Pond,DOBA4_4,8/3/2020,2020,8,3,15:25:00,16:18:00,0:53,DCT,Urban,43.09265805,-89.26627707,315554.0217,4773597.171,DOOR CREEK CHURCH INC,Lake Kegonsa-Yahara River,Door Creek,69.45,4432,NA,2000,Stormwater,0.507142857,0,0,0.142857143,0.35,0,0.528604119,0,0,0.129290618,0.342105263,0,0,0.128727064,0.013761468,0.005447248,0.270355505,0.233084862,0.164277523,0.00516055,0,0.156823394,0.000573,0.020928899,0.00086,0,0,0.508887615,0.034690367,0.00516055,0.164277523,0.286123853,0.00086,18,12,67,100,5,0,22.8,59.4,62.1,77.7,6.51,0.03,1.71,147.3,7.39,7.13,84.65,124.88,7.79,0.06,116.05,22.9,56.36,NA,0,65,15,20,100,0,"Firm Soil,Rock ,Sand",4,1,3,0,2,1.75,"Awesome stormwater pond. Wide variety of emergent along edge, but steep bank. Longleaf pondweed around entire edge, but no submergent, open water abd hard soil in middle.",NA,31,14,12,3,6,18,1,32,1,3,2,1,0,0,0,0,0,0,0,0,NA,NA,0,0,0,1,NA,"Goldfish, Shiner,,,,",0,0,0,1,0,0,0,0,0,1,0,0,0,0,NA,NA,NA,NA,NA,NA,NA,NA,NA,NA,NA,NA,NA,NA,NA,NA,NA,NA,NA,NA,NA,NA,NA,NA,NA,NA,NA,NA,NA,NA,NA,NA,NA,NA,NA,NA,NA,NA,NA,NA,NA,NA,NA,NA,NA,NA,NA,NA,NA,NA,NA,NA,NA,NA,NA,NA,NA,NA,NA,NA,NA,NA,NA,NA,1,1,1,0,0,0,0,1,0,1,1,1,1,0,1,0,0,0,0,0,0,1,0,0,1,0,0,0,0,0,0,0,0,0,0,0,0,0,0,1,1,0,0,0,0,0,0,0,1,0,0,0,0,0,0,0,0,0,0,0,0,0,0,0,0,0,0,0,0
DOBA4,1,Dobson A4 Pond,DOBA4_1,6/25/2019,2019,6,25,13:45:00,14:20:00,0:35,"ES,CL,EP",Urban,43.09265805,-89.26627707,315554.0217,4773597.171,DOOR CREEK CHURCH INC,Lake Kegonsa-Yahara River,Door Creek,69.45,4432,289,2000,Stormwater,0.507142857,0,0,0.142857143,0.35,0,0.528604119,0,0,0.129290618,0.342105263,0,0,0.128727064,0.013761468,0.005447248,0.270355505,0.233084862,0.164277523,0.00516055,0,0.156823394,0.000573,0.020928899,0.00086,0,0,0.508887615,0.034690367,0.00516055,0.164277523,0.286123853,0.00086,22,7,74,75,NA,2,22.9,204.7,213.3,106.4,8.81,0.1,43.01,108.2,NA,7.13,84.65,124.88,7.79,0.06,116.05,22.9,56.36,0.99,NA,NA,NA,NA,NA,NA,NA,NA,NA,NA,NA,NA,NA,NA,"No area, perimeter calculated, No outflow recorded",31,14,12,3,6,18,1,32,1,3,2,1,0,1,0,0,0,0,0,0,0,NA,0,0,0,1,NA,Goldfish,0,0,1,0,0,0,0,0,0,1,NA,0,0,0,1,1,0,0,1,0,0,0,1,1,0,0,0,0,1,0,0,0,1,0,0,0,0,0,0,0,0,0,0,0,0,1,0,0,0,0,0,0,0,1,0,0,0,0,1,0,0,0,1,1,0,1,0,1,0,0,0,0,0,0,0,NA,15,Fishing spider and beetle larvae in sweeps,NA,NA,NA,NA,NA,NA,NA,NA,NA,NA,NA,NA,NA,NA,NA,NA,NA,NA,NA,NA,NA,NA,NA,NA,NA,NA,NA,NA,NA,NA,NA,NA,NA,NA,NA,NA,NA,NA,NA,NA,NA,NA,NA,NA,NA,NA,NA,NA,NA,NA,NA,NA,NA,NA,NA,NA,NA,NA,NA,NA,NA,NA,NA,NA,NA,NA,NA,NA,NA
DOBA4,2,Dobson A4 Pond,DOBA4_2,8/6/2019,2019,8,6,11:21:00,11:38:00,0:17,"ES,EP,CL",Urban,43.09265805,-89.26627707,315554.0217,4773597.171,DOOR CREEK CHURCH INC,Lake Kegonsa-Yahara River,Door Creek,69.45,4432,160,2000,Stormwater,0.507142857,0,0,0.142857143,0.35,0,0.528604119,0,0,0.129290618,0.342105263,0,0,0.128727064,0.013761468,0.005447248,0.270355505,0.233084862,0.164277523,0.00516055,0,0.156823394,0.000573,0.020928899,0.00086,0,0,0.508887615,0.034690367,0.00516055,0.164277523,0.286123853,0.00086,25,8,66,5,NA,16,26.2,82.9,81,48.9,3.81,0.04,7.07,91.18,NA,7.13,84.65,124.88,7.79,0.06,116.05,22.9,56.36,1.17,NA,NA,NA,NA,NA,NA,NA,NA,NA,NA,NA,NA,NA,NA,NA,31,14,12,3,6,18,1,32,1,3,2,1,0,0,0,0,0,0,0,0,0,Painted,1,0,0,1,NA,Goldfish,0,0,1,1,0,0,0,0,0,1,NA,0,0,0,NA,NA,NA,NA,NA,NA,NA,NA,NA,NA,NA,NA,NA,NA,NA,NA,NA,NA,NA,NA,NA,NA,NA,NA,NA,NA,NA,NA,NA,NA,NA,NA,NA,NA,NA,NA,NA,NA,NA,NA,NA,NA,NA,NA,NA,NA,NA,NA,NA,NA,NA,NA,NA,NA,NA,NA,NA,NA,NA,NA,NA,NA,0,No seine distances recorded,NA,NA,NA,NA,NA,NA,NA,NA,NA,NA,NA,NA,NA,NA,NA,NA,NA,NA,NA,NA,NA,NA,NA,NA,NA,NA,NA,NA,NA,NA,NA,NA,NA,NA,NA,NA,NA,NA,NA,NA,NA,NA,NA,NA,NA,NA,NA,NA,NA,NA,NA,NA,NA,NA,NA,NA,NA,NA,NA,NA,NA,NA,NA,NA,NA,NA,NA,NA,NA
DOBA5,3,Dobson A5 Pond,DOBA5_3,5/21/2020,2020,5,21,16:00:00,16:33:00,0:33,DCT,Urban,43.07498036,-89.27972208,314406.3454,4771663.632,CITY OF MADISON ENGINEER STORMWATER UTILITY 533,Lake Monona-Yahara River,Lake Monona-Yahara River,963.83,3774,NA,1995,Stormwater,0.690647482,0.057553957,0,0.151079137,0.100719424,0,0.593570608,0.057405281,0,0.130884041,0.177956372,0,0.040676024,0.132340304,0.056717273,0.019192209,0.363219708,0.136350616,0.150100258,0.000573,0,0.06559725,0,0.031223145,0,0.000286,0.003723861,0.518762532,0.087940418,0.004296763,0.150100258,0.198224005,0,19,8,61,100,2,0,19.9,168.7,175.7,184.4,16.31,0.08,174.37,104.7,9.9,8.5,102.85,162.5,9.29,0.08,134.76,24.53,78.51,NA,0,95,1,4,100,0,"Rock ,Sand,NA",1,1,2,0,1,1.13,"Roaring traffic, can faintly hear chorus frogs. Sand and rock bottom woth mats of hair algae.",NA,19,5,11,0,3,14,0,19,0,3,3,0,0,1,0,0,0,1,0,0,NA,NA,0,0,0,0,NA,NA,0,0,0,0,0,0,0,0,0,0,0,0,0,0,NA,NA,NA,NA,NA,NA,NA,NA,NA,NA,NA,NA,NA,NA,NA,NA,NA,NA,NA,NA,NA,NA,NA,NA,NA,NA,NA,NA,NA,NA,NA,NA,NA,NA,NA,NA,NA,NA,NA,NA,NA,NA,NA,NA,NA,NA,NA,NA,NA,NA,NA,NA,NA,NA,NA,NA,NA,NA,NA,NA,NA,NA,NA,NA,0,1,1,0,0,0,0,0,0,0,0,0,0,0,0,0,0,0,0,0,0,0,0,0,0,0,0,0,0,0,0,0,0,0,0,0,0,0,0,0,1,0,0,0,0,0,0,0,0,0,0,0,0,0,0,0,0,0,0,0,0,0,0,0,0,0,0,0,0
DOBA5,4,Dobson A5 Pond,DOBA5_4,8/3/2020,2020,8,3,12:39:00,13:22:00,0:43,DCT,Urban,43.07498036,-89.27972208,314406.3454,4771663.632,CITY OF MADISON ENGINEER STORMWATER UTILITY 533,Lake Monona-Yahara River,Lake Monona-Yahara River,963.83,3774,NA,1995,Stormwater,0.690647482,0.057553957,0,0.151079137,0.100719424,0,0.593570608,0.057405281,0,0.130884041,0.177956372,0,0.040676024,0.132340304,0.056717273,0.019192209,0.363219708,0.136350616,0.150100258,0.000573,0,0.06559725,0,0.031223145,0,0.000286,0.003723861,0.518762532,0.087940418,0.004296763,0.150100258,0.198224005,0,16,9,73,100,2,0,23.3,81,84.6,72.3,6,0.04,2.8,232.9,8.67,8.5,102.85,162.5,9.29,0.08,134.76,24.53,78.51,NA,0,98,1,1,98,2,"Rock ,Sand,NA",1,1,2,1,1.25,1.13,"Freshly mowed up to water's edge .25m buffer, water turbid. Numerous crayfish. Several ranids, assumed green.",NA,19,5,11,0,3,14,0,19,0,3,3,1,0,1,0,0,0,0,0,0,NA,NA,0,0,0,0,NA,"Crayfish,,,,NA",0,0,0,0,0,0,0,0,0,0,0,0,0,0,NA,NA,NA,NA,NA,NA,NA,NA,NA,NA,NA,NA,NA,NA,NA,NA,NA,NA,NA,NA,NA,NA,NA,NA,NA,NA,NA,NA,NA,NA,NA,NA,NA,NA,NA,NA,NA,NA,NA,NA,NA,NA,NA,NA,NA,NA,NA,NA,NA,NA,NA,NA,NA,NA,NA,NA,NA,NA,NA,NA,NA,NA,NA,NA,0,1,1,0,0,0,0,0,1,0,0,0,1,0,0,0,0,0,0,0,0,0,0,0,0,0,0,0,0,0,0,0,0,0,0,0,0,0,0,0,1,0,0,0,0,0,0,0,0,0,0,0,0,0,0,0,0,0,0,0,0,0,0,0,0,0,0,0,0
DOBA5,1,Dobson A5 Pond,DOBA5_1,7/3/2019,2019,7,3,11:35:00,11:58:00,0:23,"CL,EC,EP",Urban,43.07498036,-89.27972208,314406.3454,4771663.632,CITY OF MADISON ENGINEER STORMWATER UTILITY 533,Lake Monona-Yahara River,Lake Monona-Yahara River,963.83,3774,284,1995,Stormwater,0.690647482,0.057553957,0,0.151079137,0.100719424,0,0.593570608,0.057405281,0,0.130884041,0.177956372,0,0.040676024,0.132340304,0.056717273,0.019192209,0.363219708,0.136350616,0.150100258,0.000573,0,0.06559725,0,0.031223145,0,0.000286,0.003723861,0.518762532,0.087940418,0.004296763,0.150100258,0.198224005,0,27,6,69,100,NA,2,29,288.3,267.6,117,8.69,0.13,44.16,83.53,NA,8.5,102.85,162.5,9.29,0.08,134.76,24.53,78.51,0.91,NA,NA,NA,NA,NA,NA,NA,NA,NA,NA,NA,NA,NA,NA,other snail=clams,19,5,11,0,3,14,0,19,0,3,3,1,0,0,0,0,0,0,0,0,0,NA,0,0,0,0,NA,NA,0,0,0,0,0,0,0,0,0,0,NA,0,0,0,1,0,1,0,0,0,1,0,0,0,0,0,0,0,1,1,0,0,0,0,0,0,0,0,0,0,0,0,0,0,0,0,0,0,0,1,1,0,0,1,0,0,0,1,0,0,0,0,1,0,0,0,0,0,1,1,0,0,0,0,0,"backswimmers,stickbug,crawfish,Planorbid",14,NA,NA,NA,NA,NA,NA,NA,NA,NA,NA,NA,NA,NA,NA,NA,NA,NA,NA,NA,NA,NA,NA,NA,NA,NA,NA,NA,NA,NA,NA,NA,NA,NA,NA,NA,NA,NA,NA,NA,NA,NA,NA,NA,NA,NA,NA,NA,NA,NA,NA,NA,NA,NA,NA,NA,NA,NA,NA,NA,NA,NA,NA,NA,NA,NA,NA,NA,NA,NA,NA
DOBA5,2,Dobson A5 Pond,DOBA5_2,8/6/2019,2019,8,6,10:39:00,10:55:00,0:16,"ES,EP,CL",Urban,43.07498036,-89.27972208,314406.3454,4771663.632,CITY OF MADISON ENGINEER STORMWATER UTILITY 533,Lake Monona-Yahara River,Lake Monona-Yahara River,963.83,3774,276,1995,Stormwater,0.690647482,0.057553957,0,0.151079137,0.100719424,0,0.593570608,0.057405281,0,0.130884041,0.177956372,0,0.040676024,0.132340304,0.056717273,0.019192209,0.363219708,0.136350616,0.150100258,0.000573,0,0.06559725,0,0.031223145,0,0.000286,0.003723861,0.518762532,0.087940418,0.004296763,0.150100258,0.198224005,0,24,7,70,5,NA,2,25.9,122.6,122.1,37.7,2.99,0.06,17,117.9,NA,8.5,102.85,162.5,9.29,0.08,134.76,24.53,78.51,1.71,NA,NA,NA,NA,NA,NA,NA,NA,NA,NA,NA,NA,NA,NA,NA,19,5,11,0,3,14,0,19,0,3,3,0,0,0,0,0,0,0,0,0,0,NA,0,0,0,0,NA,NA,0,0,0,0,0,0,0,0,0,0,NA,0,0,0,NA,NA,NA,NA,NA,NA,NA,NA,NA,NA,NA,NA,NA,NA,NA,NA,NA,NA,NA,NA,NA,NA,NA,NA,NA,NA,NA,NA,NA,NA,NA,NA,NA,NA,NA,NA,NA,NA,NA,NA,NA,NA,NA,NA,NA,NA,NA,NA,NA,NA,NA,NA,NA,NA,NA,NA,NA,NA,NA,NA,NA,NA,24,Large crayfish in sweeps and seines,NA,NA,NA,NA,NA,NA,NA,NA,NA,NA,NA,NA,NA,NA,NA,NA,NA,NA,NA,NA,NA,NA,NA,NA,NA,NA,NA,NA,NA,NA,NA,NA,NA,NA,NA,NA,NA,NA,NA,NA,NA,NA,NA,NA,NA,NA,NA,NA,NA,NA,NA,NA,NA,NA,NA,NA,NA,NA,NA,NA,NA,NA,NA,NA,NA,NA,NA,NA,NA
DOBA7,3,Dobson A7 Pond,DOBA7_3,6/3/2020,2020,6,3,7:50:00,8:23:00,0:33,DCT,Green Space,43.05995178,-89.49946121,296466.7461,4770504.468,CITY OF MADISON ENGINEER STORMWATER UTILITY 533,Headwaters Sugar River,Badger Mill Creek,5.89,8692,NA,1995,Stormwater,0.442028986,0,0,0.152173913,0.333333333,0.072463768,0.811858609,0.006841505,0,0.088939567,0.0672748,0.025085519,0.00086,0.000287,0.002293578,0.22190367,0.273222477,0.32912844,0.125,0,0,0.016055046,0.00086,0.023795872,0.006594037,0,0,0.824254587,0.02608945,0,0.125,0.017201835,0.006594037,19,5,93,90,5,0,23.1,196.8,204.2,88.5,7.29,0.1,221.17,167.9,8.27,7.29,89.73,230.25,8.08,0.11,120.23,24.3,118.02,NA,0,99,1,0,100,0,"Firm Soil,Rock ,NA",1,1,2,0,1,1.13,Hevay rains the night before may affect water perameters. Extremely turbid. Steep bank that drops to .25 m No submergent detected in several sweeps.,NA,23,8,11,2,4,15,0,23,0,2,2,0,0,1,0,0,0,0,0,0,NA,NA,0,0,0,0,NA,"Dead fathead minnow,,,,NA",0,0,1,0,0,0,0,0,0,0,0,0,0,0,NA,NA,NA,NA,NA,NA,NA,NA,NA,NA,NA,NA,NA,NA,NA,NA,NA,NA,NA,NA,NA,NA,NA,NA,NA,NA,NA,NA,NA,NA,NA,NA,NA,NA,NA,NA,NA,NA,NA,NA,NA,NA,NA,NA,NA,NA,NA,NA,NA,NA,NA,NA,NA,NA,NA,NA,NA,NA,NA,NA,NA,NA,NA,NA,0,1,1,0,0,0,0,0,0,0,0,0,1,0,0,0,0,0,0,0,0,0,0,0,1,0,0,0,0,0,0,0,0,0,0,0,0,0,0,0,0,0,0,0,0,0,0,0,0,0,0,0,0,0,0,0,0,0,0,0,0,0,0,0,0,0,0,0,0
DOBA7,4,Dobson A7 Pond,DOBA7_4,7/24/2020,2020,7,24,7:30:00,8:24:00,0:54,DCT,Green Space,43.05995178,-89.49946121,296466.7461,4770504.468,CITY OF MADISON ENGINEER STORMWATER UTILITY 533,Headwaters Sugar River,Badger Mill Creek,5.89,8692,NA,1995,Stormwater,0.442028986,0,0,0.152173913,0.333333333,0.072463768,0.811858609,0.006841505,0,0.088939567,0.0672748,0.025085519,0.00086,0.000287,0.002293578,0.22190367,0.273222477,0.32912844,0.125,0,0,0.016055046,0.00086,0.023795872,0.006594037,0,0,0.824254587,0.02608945,0,0.125,0.017201835,0.006594037,19,1,83,0,5,3,24.5,129.4,130.7,60.2,4.88,0.06,8.22,33.73,7.89,7.29,89.73,230.25,8.08,0.11,120.23,24.3,118.02,NA,0,97,2,1,98,2,"Rock ,Sand,Mud",1,1,3,0,1.25,1.13,"Water turbid and mostly gravel/cobble substrate with some mud. Steep bank with almost no emergent in the water, but atop bank. Hair algae along shoreline with bright green algae on top.",NA,23,8,11,2,4,15,0,23,0,2,2,0,1,0,0,0,0,0,0,0,NA,NA,0,0,0,0,NA,"Shiner,,,,",0,0,0,1,0,0,0,0,0,0,0,0,0,0,NA,NA,NA,NA,NA,NA,NA,NA,NA,NA,NA,NA,NA,NA,NA,NA,NA,NA,NA,NA,NA,NA,NA,NA,NA,NA,NA,NA,NA,NA,NA,NA,NA,NA,NA,NA,NA,NA,NA,NA,NA,NA,NA,NA,NA,NA,NA,NA,NA,NA,NA,NA,NA,NA,NA,NA,NA,NA,NA,NA,NA,NA,NA,NA,0,1,1,0,0,1,0,0,0,1,0,1,1,0,0,0,0,0,0,0,0,0,0,0,1,0,0,0,0,0,0,0,0,1,0,0,0,0,0,0,0,0,0,0,0,0,0,0,0,0,0,0,0,0,0,0,0,0,0,0,0,0,0,0,0,0,0,0,0
DOBA7,1,Dobson A7 Pond,DOBA7_1,6/21/2019,2019,6,21,12:57:00,13:35:00,0:38,"ES,CL,BC",Green Space,43.05995178,-89.49946121,296466.7461,4770504.468,CITY OF MADISON ENGINEER STORMWATER UTILITY 533,Headwaters Sugar River,Badger Mill Creek,5.89,8692,34,1995,Stormwater,0.442028986,0,0,0.152173913,0.333333333,0.072463768,0.811858609,0.006841505,0,0.088939567,0.0672748,0.025085519,0.00086,0.000287,0.002293578,0.22190367,0.273222477,0.32912844,0.125,0,0,0.016055046,0.00086,0.023795872,0.006594037,0,0,0.824254587,0.02608945,0,0.125,0.017201835,0.006594037,22,11,45,85,NA,2,23,378.7,393.9,132.3,10.96,0.19,96.52,155,NA,7.29,89.73,230.25,8.08,0.11,120.23,24.3,118.02,1.48,NA,NA,NA,NA,NA,NA,NA,NA,NA,NA,NA,NA,NA,NA,"No zoop tow distance, no pond area/perimeter calculation, no property name or owner recorded",23,8,11,2,4,15,0,23,0,2,2,0,0,0,0,0,0,0,0,0,0,NA,0,0,0,0,NA,Dead fish,0,0,1,0,0,0,0,0,0,0,NA,0,0,0,0,0,0,0,1,0,1,0,1,1,0,0,0,1,1,0,0,0,1,0,0,0,0,0,0,0,0,0,0,0,0,1,0,0,0,0,1,0,0,1,0,0,0,0,0,0,0,0,0,1,0,0,0,0,0,0,0,0,1,0,1,NA,9,NA,NA,NA,NA,NA,NA,NA,NA,NA,NA,NA,NA,NA,NA,NA,NA,NA,NA,NA,NA,NA,NA,NA,NA,NA,NA,NA,NA,NA,NA,NA,NA,NA,NA,NA,NA,NA,NA,NA,NA,NA,NA,NA,NA,NA,NA,NA,NA,NA,NA,NA,NA,NA,NA,NA,NA,NA,NA,NA,NA,NA,NA,NA,NA,NA,NA,NA,NA,NA,NA
DOBA7,2,Dobson A7 Pond,DOBA7_2,7/16/2019,2019,7,16,10:06:00,10:20:00,0:14,"ES,EC,CL",Green Space,43.05995178,-89.49946121,296466.7461,4770504.468,CITY OF MADISON ENGINEER STORMWATER UTILITY 533,Headwaters Sugar River,Badger Mill Creek,5.89,8692,316,1995,Stormwater,0.442028986,0,0,0.152173913,0.333333333,0.072463768,0.811858609,0.006841505,0,0.088939567,0.0672748,0.025085519,0.00086,0.000287,0.002293578,0.22190367,0.273222477,0.32912844,0.125,0,0,0.016055046,0.00086,0.023795872,0.006594037,0,0,0.824254587,0.02608945,0,0.125,0.017201835,0.006594037,24,6,74,5,NA,2,26.6,198.1,192.2,77.9,6.02,0.09,36.37,124.3,NA,7.29,89.73,230.25,8.08,0.11,120.23,24.3,118.02,2.07,NA,NA,NA,NA,NA,NA,NA,NA,NA,NA,NA,NA,NA,NA,submerged algae,23,8,11,2,4,15,0,23,0,2,2,0,1,0,0,0,0,0,0,0,0,NA,0,0,0,0,NA,NA,0,0,0,1,0,0,0,0,0,0,NA,0,0,0,NA,NA,NA,NA,NA,NA,NA,NA,NA,NA,NA,NA,NA,NA,NA,NA,NA,NA,NA,NA,NA,NA,NA,NA,NA,NA,NA,NA,NA,NA,NA,NA,NA,NA,NA,NA,NA,NA,NA,NA,NA,NA,NA,NA,NA,NA,NA,NA,NA,NA,NA,NA,NA,NA,NA,NA,NA,NA,NA,NA,NA,NA,0,NA,NA,NA,NA,NA,NA,NA,NA,NA,NA,NA,NA,NA,NA,NA,NA,NA,NA,NA,NA,NA,NA,NA,NA,NA,NA,NA,NA,NA,NA,NA,NA,NA,NA,NA,NA,NA,NA,NA,NA,NA,NA,NA,NA,NA,NA,NA,NA,NA,NA,NA,NA,NA,NA,NA,NA,NA,NA,NA,NA,NA,NA,NA,NA,NA,NA,NA,NA,NA,NA
DOBA8,3,Dobson A8 Pond,DOBA8_3,5/29/2020,2020,5,29,9:38:00,10:29:00,0:51,DCT,Urban,43.03821381,-89.52240961,294525.358,4768146.273,CITY OF MADISON ENGINEER STORMWATER UTILITY 533,Headwaters Sugar River,Badger Mill Creek,248.69,4454,NA,2000,Stormwater,0.553191489,0,0,0.04964539,0.397163121,0,0.483390607,0.012600229,0,0.042382589,0.458190149,0.001145475,0.001148765,0.410109133,0.069500287,0.006031017,0.151062608,0.16053992,0.075531304,0.000574,0.000287,0.078690408,0.000574,0.037622056,0.00689259,0.001435956,0,0.317633544,0.107409535,0.000574,0.075531304,0.490809879,0.00689259,16,10,59,10,3,8,22,66.1,70.1,84.3,7.1,0.03,211.88,118.3,8.12,5.51,66.73,95.1,7.6,0.04,119.73,23.85,84.19,NA,0,98,1,1,98,2,"Firm Soil,Mud,Rock ",1,1,3,2,1.75,1.75,"Lots of sunfish, steep bank, turbid open water. Several dead fish and dead toad.",NA,23,8,11,2,4,15,0,23,0,2,2,1,1,0,0,0,0,0,0,0,NA,NA,0,0,0,0,NA,"Pumpkinseed,,,,",0,0,0,0,0,0,1,0,0,0,0,0,0,0,NA,NA,NA,NA,NA,NA,NA,NA,NA,NA,NA,NA,NA,NA,NA,NA,NA,NA,NA,NA,NA,NA,NA,NA,NA,NA,NA,NA,NA,NA,NA,NA,NA,NA,NA,NA,NA,NA,NA,NA,NA,NA,NA,NA,NA,NA,NA,NA,NA,NA,NA,NA,NA,NA,NA,NA,NA,NA,NA,NA,NA,NA,NA,NA,1,1,0,0,0,0,0,0,0,0,0,0,1,0,0,0,0,0,0,0,0,0,0,0,1,0,0,0,0,0,0,0,0,0,0,0,0,0,0,0,0,0,0,0,0,0,0,0,0,0,0,0,0,0,0,0,0,0,0,0,0,0,0,0,0,0,0,0,0
DOBA8,4,Dobson A8 Pond,DOBA8_4,7/28/2020,2020,7,28,9:45:00,10:49:00,1:04,DCT,Urban,43.03821381,-89.52240961,294525.358,4768146.273,CITY OF MADISON ENGINEER STORMWATER UTILITY 533,Headwaters Sugar River,Badger Mill Creek,248.69,4454,NA,2000,Stormwater,0.553191489,0,0,0.04964539,0.397163121,0,0.483390607,0.012600229,0,0.042382589,0.458190149,0.001145475,0.001148765,0.410109133,0.069500287,0.006031017,0.151062608,0.16053992,0.075531304,0.000574,0.000287,0.078690408,0.000574,0.037622056,0.00689259,0.001435956,0,0.317633544,0.107409535,0.000574,0.075531304,0.490809879,0.00689259,21,2,74,60,3,2,26.4,46.5,45.4,28.8,2.23,0.02,3.22,154.5,7.08,5.51,66.73,95.1,7.6,0.04,119.73,23.85,84.19,NA,15,90,2,8,100,0,"Rock ,Sand,NA",2,1,2,2,1.75,1.75,"Freshly mowed up to water's edge, tons of leafy debris in water. Fairly turbid. No insects except 1 Baetid mayfly. Lots of Frogs but no tads. Several dead fish. Look like blue gill. A class stopped and talked with me about pond.",NA,23,8,11,2,4,15,0,23,0,2,2,1,1,0,0,0,0,0,0,0,NA,NA,0,0,0,0,NA,"Pumpkinseed,,,,NA",0,0,0,0,0,0,1,0,0,0,0,0,0,0,NA,NA,NA,NA,NA,NA,NA,NA,NA,NA,NA,NA,NA,NA,NA,NA,NA,NA,NA,NA,NA,NA,NA,NA,NA,NA,NA,NA,NA,NA,NA,NA,NA,NA,NA,NA,NA,NA,NA,NA,NA,NA,NA,NA,NA,NA,NA,NA,NA,NA,NA,NA,NA,NA,NA,NA,NA,NA,NA,NA,NA,NA,NA,NA,1,1,1,0,0,0,1,0,0,0,0,1,1,0,0,0,0,0,0,0,0,1,0,0,1,0,0,0,0,0,0,0,0,0,0,0,0,0,0,0,0,0,0,0,0,0,0,0,0,0,0,0,0,0,0,0,0,0,0,0,0,0,0,0,0,0,0,0,0
DOBA8,1,Dobson A8 Pond,DOBA8_1,6/19/2019,2019,6,19,10:10:00,10:50:00,0:40,"CL,EC,DP",Urban,43.03821381,-89.52240961,294525.358,4768146.273,CITY OF MADISON ENGINEER STORMWATER UTILITY 533,Headwaters Sugar River,Badger Mill Creek,248.69,4454,329,2000,Stormwater,0.553191489,0,0,0.04964539,0.397163121,0,0.483390607,0.012600229,0,0.042382589,0.458190149,0.001145475,0.001148765,0.410109133,0.069500287,0.006031017,0.151062608,0.16053992,0.075531304,0.000574,0.000287,0.078690408,0.000574,0.037622056,0.00689259,0.001435956,0,0.317633544,0.107409535,0.000574,0.075531304,0.490809879,0.00689259,17,3,93,100,NA,1,22.2,166.2,175.8,104,8.7,0.08,34.04,114.1,NA,5.51,66.73,95.1,7.6,0.04,119.73,23.85,84.19,1.08,NA,NA,NA,NA,NA,NA,NA,NA,NA,NA,NA,NA,NA,NA,"no infow, outflow, photo number, ow, cc, or depth recorded",23,8,11,2,4,15,0,23,0,2,2,0,0,0,0,0,0,0,0,0,1,NA,0,0,0,0,NA,"sunfish,bluegill",0,0,0,0,0,0,1,1,0,0,NA,0,0,0,0,0,1,0,1,0,0,0,0,0,0,0,1,0,1,0,1,0,1,0,0,0,0,0,0,0,0,0,0,1,0,0,0,0,0,1,1,0,0,0,0,0,0,0,0,0,0,1,1,0,0,0,0,1,0,0,0,0,0,1,0,NA,16,NA,NA,NA,NA,NA,NA,NA,NA,NA,NA,NA,NA,NA,NA,NA,NA,NA,NA,NA,NA,NA,NA,NA,NA,NA,NA,NA,NA,NA,NA,NA,NA,NA,NA,NA,NA,NA,NA,NA,NA,NA,NA,NA,NA,NA,NA,NA,NA,NA,NA,NA,NA,NA,NA,NA,NA,NA,NA,NA,NA,NA,NA,NA,NA,NA,NA,NA,NA,NA,NA
DOBA8,2,Dobson A8 Pond,DOBA8_2,8/2/2019,2019,8,2,8:07:00,4:28:00,NA,"CL,EP,BC",Urban,43.03821381,-89.52240961,294525.358,4768146.273,CITY OF MADISON ENGINEER STORMWATER UTILITY 533,Headwaters Sugar River,Badger Mill Creek,248.69,4454,326,2000,Stormwater,0.553191489,0,0,0.04964539,0.397163121,0,0.483390607,0.012600229,0,0.042382589,0.458190149,0.001145475,0.001148765,0.410109133,0.069500287,0.006031017,0.151062608,0.16053992,0.075531304,0.000574,0.000287,0.078690408,0.000574,0.037622056,0.00689259,0.001435956,0,0.317633544,0.107409535,0.000574,0.075531304,0.490809879,0.00689259,21,1.2,65,0,NA,1,24.8,88.7,89.1,49.8,4.01,0.04,6.64,92.02,NA,5.51,66.73,95.1,7.6,0.04,119.73,23.85,84.19,1.17,NA,NA,NA,NA,NA,NA,NA,NA,NA,NA,NA,NA,NA,NA,"no infow, outflow, ow, cc, or dept recorded",23,8,11,2,4,15,0,23,0,2,2,0,0,0,0,0,0,0,0,0,0,NA,0,0,0,0,NA,NA,0,0,0,0,0,0,0,1,0,0,NA,0,0,0,NA,NA,NA,NA,NA,NA,NA,NA,NA,NA,NA,NA,NA,NA,NA,NA,NA,NA,NA,NA,NA,NA,NA,NA,NA,NA,NA,NA,NA,NA,NA,NA,NA,NA,NA,NA,NA,NA,NA,NA,NA,NA,NA,NA,NA,NA,NA,NA,NA,NA,NA,NA,NA,NA,NA,NA,NA,NA,NA,NA,NA,NA,12,NA,NA,NA,NA,NA,NA,NA,NA,NA,NA,NA,NA,NA,NA,NA,NA,NA,NA,NA,NA,NA,NA,NA,NA,NA,NA,NA,NA,NA,NA,NA,NA,NA,NA,NA,NA,NA,NA,NA,NA,NA,NA,NA,NA,NA,NA,NA,NA,NA,NA,NA,NA,NA,NA,NA,NA,NA,NA,NA,NA,NA,NA,NA,NA,NA,NA,NA,NA,NA,NA
DOBA9,3,Dobson A9 Pond,DOBA9_3,5/22/2020,2020,5,22,13:27:00,NA,NA,DCT,Urban,43.11485408,-89.49178986,297272.7146,4776583.171,MIDDLETON CITY OF,Lake Mendota-Yahara River,Pheasant Branch,315.8,525,NA,2005,Stormwater,0.637681159,0.31884058,0,0.036231884,0.007246377,0,0.413318025,0.145809414,0.378874856,0.050516648,0.011481056,0,0,0.114932645,0.030094583,0.012324448,0.146460304,0.160791058,0.054170249,0.238463743,0,0.053310404,0,0.035826884,0.006592147,0,0.147033534,0.31957581,0.065921467,0.385497277,0.054170249,0.16824305,0.006592147,18,2,76,100,3,0,17.5,202.9,236.5,90.7,8.4,0.11,188.92,115.9,6.89,2.96,32.5,200.83,6.92,0.08,144.13,19.73,77.47,NA,2,25,50,25,80,20,"Super Muddy,Leaf Litter,NA",3,2,2,0,1.75,1.75,"Deep muddy floc, clear water under lilys with no other veg.",NA,34,10,20,0,4,24,0,34,0,4,4,0,0,0,1,0,0,0,0,0,NA,NA,0,0,0,0,NA,NA,0,0,0,0,0,0,0,0,0,0,0,0,0,0,NA,NA,NA,NA,NA,NA,NA,NA,NA,NA,NA,NA,NA,NA,NA,NA,NA,NA,NA,NA,NA,NA,NA,NA,NA,NA,NA,NA,NA,NA,NA,NA,NA,NA,NA,NA,NA,NA,NA,NA,NA,NA,NA,NA,NA,NA,NA,NA,NA,NA,NA,NA,NA,NA,NA,NA,NA,NA,NA,NA,NA,NA,NA,NA,0,0,0,0,0,0,0,0,1,1,0,1,1,0,0,0,0,0,0,0,0,0,0,0,0,0,0,0,0,0,0,0,0,0,0,0,0,0,0,0,0,0,0,0,0,0,0,0,0,0,0,0,0,1,1,0,0,0,0,0,0,0,0,0,0,0,0,0,0
DOBA9,4,Dobson A9 Pond,DOBA9_4,7/14/2020,2020,7,14,6:50:00,7:34:00,0:44,DCT,Urban,43.11485408,-89.49178986,297272.7146,4776583.171,MIDDLETON CITY OF,Lake Mendota-Yahara River,Pheasant Branch,315.8,525,NA,2005,Stormwater,0.637681159,0.31884058,0,0.036231884,0.007246377,0,0.413318025,0.145809414,0.378874856,0.050516648,0.011481056,0,0,0.114932645,0.030094583,0.012324448,0.146460304,0.160791058,0.054170249,0.238463743,0,0.053310404,0,0.035826884,0.006592147,0,0.147033534,0.31957581,0.065921467,0.385497277,0.054170249,0.16824305,0.006592147,20,9,81,40,3,0,21.2,134.5,144.8,5.2,0.44,0.02,504.53,186.1,6.95,2.96,32.5,200.83,6.92,0.08,144.13,19.73,77.47,NA,0,20,75,5,60,40,"Super Muddy,,NA",2,4,1,0,1.75,1.75,"Deep mud and thick emergent, makes very difficult to navigate. Mud bottom with pota. Ver small open water pool, the rest emergent.",NA,34,10,20,0,4,24,0,34,0,4,4,1,0,0,0,0,0,0,0,0,NA,NA,0,0,0,0,NA,NA,0,0,0,0,0,0,0,0,0,0,0,0,0,0,NA,NA,NA,NA,NA,NA,NA,NA,NA,NA,NA,NA,NA,NA,NA,NA,NA,NA,NA,NA,NA,NA,NA,NA,NA,NA,NA,NA,NA,NA,NA,NA,NA,NA,NA,NA,NA,NA,NA,NA,NA,NA,NA,NA,NA,NA,NA,NA,NA,NA,NA,NA,NA,NA,NA,NA,NA,NA,NA,NA,NA,NA,NA,NA,0,0,0,0,0,0,0,0,1,1,0,1,0,1,1,0,0,0,0,0,0,0,0,0,0,0,0,0,0,0,0,0,0,0,0,0,0,0,0,1,0,0,0,0,0,0,0,0,1,0,0,0,0,1,1,0,0,0,0,0,0,0,0,0,0,0,0,0,0
DOBA9,1,Dobson A9 Pond,DOBA9_1,6/27/2019,2019,6,27,9:00:00,9:38:00,0:38,"DP,CL,BC",Urban,43.11485408,-89.49178986,297272.7146,4776583.171,MIDDLETON CITY OF,Lake Mendota-Yahara River,Pheasant Branch,315.8,525,290,2005,Stormwater,0.637681159,0.31884058,0,0.036231884,0.007246377,0,0.413318025,0.145809414,0.378874856,0.050516648,0.011481056,0,0,0.114932645,0.030094583,0.012324448,0.146460304,0.160791058,0.054170249,0.238463743,0,0.053310404,0,0.035826884,0.006592147,0,0.147033534,0.31957581,0.065921467,0.385497277,0.054170249,0.16824305,0.006592147,25,3,71,10,NA,2,20.6,188.9,206.1,10.7,0.93,0.1,18.29,105.2,NA,2.96,32.5,200.83,6.92,0.08,144.13,19.73,77.47,0.74,NA,NA,NA,NA,NA,NA,NA,NA,NA,NA,NA,NA,NA,NA,"other amphib=Hyla,suspected turtles",34,10,20,0,4,24,0,34,0,4,4,1,0,0,0,1,0,0,0,0,1,NA,0,0,0,0,NA,NA,0,0,0,0,0,0,0,0,0,0,NA,0,0,0,1,0,1,0,1,0,1,0,0,1,0,0,0,1,1,0,0,1,1,0,0,0,0,0,0,1,0,0,0,1,0,0,0,0,1,1,1,0,1,1,0,0,1,1,0,0,0,0,1,1,0,0,1,0,1,0,0,1,0,0,0,"Odonata,Backswimmers,Bloodworms,Planorbid,Lymnaeid",6,other amphib=hyla sp.,NA,NA,NA,NA,NA,NA,NA,NA,NA,NA,NA,NA,NA,NA,NA,NA,NA,NA,NA,NA,NA,NA,NA,NA,NA,NA,NA,NA,NA,NA,NA,NA,NA,NA,NA,NA,NA,NA,NA,NA,NA,NA,NA,NA,NA,NA,NA,NA,NA,NA,NA,NA,NA,NA,NA,NA,NA,NA,NA,NA,NA,NA,NA,NA,NA,NA,NA,NA,NA
DOBA9,2,Dobson A9 Pond,DOBA9_2,8/9/2019,2019,8,9,9:22:00,9:32:00,0:10,"CL,BC,EC",Urban,43.11485408,-89.49178986,297272.7146,4776583.171,MIDDLETON CITY OF,Lake Mendota-Yahara River,Pheasant Branch,315.8,525,34,2005,Stormwater,0.637681159,0.31884058,0,0.036231884,0.007246377,0,0.413318025,0.145809414,0.378874856,0.050516648,0.011481056,0,0,0.114932645,0.030094583,0.012324448,0.146460304,0.160791058,0.054170249,0.238463743,0,0.053310404,0,0.035826884,0.006592147,0,0.147033534,0.31957581,0.065921467,0.385497277,0.054170249,0.16824305,0.006592147,19,2,60,10,NA,2,19.6,193.8,215.9,23.4,2.08,0.1,25.21,169.3,NA,2.96,32.5,200.83,6.92,0.08,144.13,19.73,77.47,1.59,NA,NA,NA,NA,NA,NA,NA,NA,NA,NA,NA,NA,NA,NA,No open water/canopy cover/max depth/shoreline vegetated recorded,34,10,20,0,4,24,0,34,0,4,4,0,0,0,0,0,0,0,0,0,0,NA,0,0,0,0,NA,NA,0,0,0,0,0,0,0,0,0,0,NA,0,0,0,NA,NA,NA,NA,NA,NA,NA,NA,NA,NA,NA,NA,NA,NA,NA,NA,NA,NA,NA,NA,NA,NA,NA,NA,NA,NA,NA,NA,NA,NA,NA,NA,NA,NA,NA,NA,NA,NA,NA,NA,NA,NA,NA,NA,NA,NA,NA,NA,NA,NA,NA,NA,NA,NA,NA,NA,NA,NA,NA,NA,NA,NA,2,NA,NA,NA,NA,NA,NA,NA,NA,NA,NA,NA,NA,NA,NA,NA,NA,NA,NA,NA,NA,NA,NA,NA,NA,NA,NA,NA,NA,NA,NA,NA,NA,NA,NA,NA,NA,NA,NA,NA,NA,NA,NA,NA,NA,NA,NA,NA,NA,NA,NA,NA,NA,NA,NA,NA,NA,NA,NA,NA,NA,NA,NA,NA,NA,NA,NA,NA,NA,NA,NA
DON,3,Donald,DON_3,5/25/2020,2020,5,25,16:39:00,17:01:00,0:22,DCT,Rural,42.95642107,-89.67968481,281423.2048,4759459.857,COUNTY OF DANE,West Branch Sugar River,Mt. Vernon Creek,231.71,2274,NA,1974,Natural,0,0.649635036,0.182481752,0.058394161,0.109489051,0,0,0.618993135,0.113272311,0.02402746,0.243707094,0,0,0.284327719,0.323151584,0,0.012560662,0.000285,0.025692264,0.033114473,0.00713674,0.241792749,0.003140166,0.051669997,0,0.001712818,0.015415358,0.012846132,0.381958321,0.048529832,0.025692264,0.530973451,0,28,13,56,20,0,1,25.1,289.3,288.5,169.5,13.48,0.14,189.66,35.88,8.75,9.13,116.73,292.35,8.85,0.14,49.11,26.45,71.43,NA,1,98,1,1,10,90,"Vegetation,,",1,1,1,1,1,1.38,"Deep water, fairly clear with 1 submergent plant type throughout. Lots of toads breeding.",NA,36,12,17,3,7,24,0,36,0,4,3,0,0,1,0,0,0,0,0,0,NA,"Painted,,,,",1,0,0,1,NA,NA,0,0,0,0,0,0,0,0,0,0,0,0,0,0,NA,NA,NA,NA,NA,NA,NA,NA,NA,NA,NA,NA,NA,NA,NA,NA,NA,NA,NA,NA,NA,NA,NA,NA,NA,NA,NA,NA,NA,NA,NA,NA,NA,NA,NA,NA,NA,NA,NA,NA,NA,NA,NA,NA,NA,NA,NA,NA,NA,NA,NA,NA,NA,NA,NA,NA,NA,NA,NA,NA,NA,NA,NA,NA,0,1,1,0,0,0,0,0,1,0,0,0,1,1,0,0,0,0,0,0,0,0,0,0,0,0,0,0,0,0,0,0,0,0,0,0,0,0,0,0,0,0,0,0,0,0,0,0,0,0,0,0,0,0,0,0,0,0,0,0,0,0,0,0,0,0,0,0,0
DON,4,Donald,DON_4,7/27/2020,2020,7,27,8:20:00,9:58:00,1:38,DCT,Rural,42.95642107,-89.67968481,281423.2048,4759459.857,COUNTY OF DANE,West Branch Sugar River,Mt. Vernon Creek,231.71,2274,NA,1974,Natural,0,0.649635036,0.182481752,0.058394161,0.109489051,0,0,0.618993135,0.113272311,0.02402746,0.243707094,0,0,0.284327719,0.323151584,0,0.012560662,0.000285,0.025692264,0.033114473,0.00713674,0.241792749,0.003140166,0.051669997,0,0.001712818,0.015415358,0.012846132,0.381958321,0.048529832,0.025692264,0.530973451,0,22,6,83,95,0,1,27.6,287.4,273.8,85.9,6.56,0.13,8.16,71.85,8.94,9.13,116.73,292.35,8.85,0.14,49.11,26.45,71.43,NA,0,96,3,1,20,80,"Mud,,NA",1,3,1,2,1.75,1.38,"Storm the night before survey. Water turbid. Tons of water striders and surface beetles. Steep bank around most of pond drops off to deep water very quickly. Only caught small fish, but heard something larger splash. Lots of Naucoridae-creeping water bugs, first site these were observed.",NA,36,12,17,3,7,24,0,36,0,4,3,1,0,0,0,0,0,0,0,0,NA,"Painted,,,,NA",1,0,0,1,NA,"Brook Stickleback, Common Shiner,,,,NA",1,0,0,1,0,0,0,0,0,0,0,0,0,0,NA,NA,NA,NA,NA,NA,NA,NA,NA,NA,NA,NA,NA,NA,NA,NA,NA,NA,NA,NA,NA,NA,NA,NA,NA,NA,NA,NA,NA,NA,NA,NA,NA,NA,NA,NA,NA,NA,NA,NA,NA,NA,NA,NA,NA,NA,NA,NA,NA,NA,NA,NA,NA,NA,NA,NA,NA,NA,NA,NA,NA,NA,NA,NA,0,1,1,0,0,0,1,0,1,0,0,0,0,1,1,0,0,0,0,0,1,1,0,0,1,0,0,0,1,0,0,0,0,0,0,0,0,0,0,0,0,0,0,0,0,0,0,0,0,0,0,0,1,0,0,0,0,0,0,0,0,0,0,0,0,0,0,0,0
DON,1,Donald,DON_1,7/9/2019,2019,7,9,12:40:00,13:04:00,0:24,"ES,CL,EP",Rural,42.95642107,-89.67968481,281423.2048,4759459.857,COUNTY OF DANE,West Branch Sugar River,Mt. Vernon Creek,231.71,2274,286,1974,Natural,0,0.649635036,0.182481752,0.058394161,0.109489051,0,0,0.618993135,0.113272311,0.02402746,0.243707094,0,0,0.284327719,0.323151584,0,0.012560662,0.000285,0.025692264,0.033114473,0.00713674,0.241792749,0.003140166,0.051669997,0,0.001712818,0.015415358,0.012846132,0.381958321,0.048529832,0.025692264,0.530973451,0,27,11,56,52,NA,3,26,242.6,287.1,127.3,9.99,0.14,10.4,45.17,NA,9.13,116.73,292.35,8.85,0.14,49.11,26.45,71.43,1.07,NA,NA,NA,NA,NA,NA,NA,NA,NA,NA,NA,NA,NA,NA,"Very deep, technicians unable to enter the water at all, no substrate info, no area/perimeter calculated, No inflow/outflow/open water/canopy cover recorded,",36,12,17,3,7,24,0,36,0,4,3,1,0,1,0,0,0,0,0,0,0,Other,0,0,0,1,NA,Stickleback,1,0,1,0,0,0,0,0,0,0,NA,0,0,0,1,0,1,0,0,0,0,1,0,1,0,0,0,0,1,0,0,0,1,0,0,0,0,0,0,0,0,0,0,0,0,1,0,0,1,1,1,0,1,1,0,0,0,1,1,0,0,0,1,0,0,0,1,1,0,1,0,0,0,0,0,NA,0,"No seines, unable to enter water, all sweeps completed from dock/bank",NA,NA,NA,NA,NA,NA,NA,NA,NA,NA,NA,NA,NA,NA,NA,NA,NA,NA,NA,NA,NA,NA,NA,NA,NA,NA,NA,NA,NA,NA,NA,NA,NA,NA,NA,NA,NA,NA,NA,NA,NA,NA,NA,NA,NA,NA,NA,NA,NA,NA,NA,NA,NA,NA,NA,NA,NA,NA,NA,NA,NA,NA,NA,NA,NA,NA,NA,NA,NA
DON,2,Donald,DON_2,8/9/2019,2019,8,9,12:43:00,12:51:00,0:08,"CL,EC,BC",Rural,42.95642107,-89.67968481,281423.2048,4759459.857,COUNTY OF DANE,West Branch Sugar River,Mt. Vernon Creek,231.71,2274,292,1974,Natural,0,0.649635036,0.182481752,0.058394161,0.109489051,0,0,0.618993135,0.113272311,0.02402746,0.243707094,0,0,0.284327719,0.323151584,0,0.012560662,0.000285,0.025692264,0.033114473,0.00713674,0.241792749,0.003140166,0.051669997,0,0.001712818,0.015415358,0.012846132,0.381958321,0.048529832,0.025692264,0.530973451,0,24,7,42,15,NA,3,27.1,332.6,320,84.2,6.49,0.15,14.22,43.53,NA,9.13,116.73,292.35,8.85,0.14,49.11,26.45,71.43,1.36,NA,NA,NA,NA,NA,NA,NA,NA,NA,NA,NA,NA,NA,NA,NA,36,12,17,3,7,24,0,36,0,4,3,1,0,0,1,0,0,0,0,0,0,Painted,1,0,0,1,NA,Shiners,0,0,0,1,0,0,0,0,0,0,NA,0,0,0,NA,NA,NA,NA,NA,NA,NA,NA,NA,NA,NA,NA,NA,NA,NA,NA,NA,NA,NA,NA,NA,NA,NA,NA,NA,NA,NA,NA,NA,NA,NA,NA,NA,NA,NA,NA,NA,NA,NA,NA,NA,NA,NA,NA,NA,NA,NA,NA,NA,NA,NA,NA,NA,NA,NA,NA,NA,NA,NA,NA,NA,NA,0,Too deep to seine,NA,NA,NA,NA,NA,NA,NA,NA,NA,NA,NA,NA,NA,NA,NA,NA,NA,NA,NA,NA,NA,NA,NA,NA,NA,NA,NA,NA,NA,NA,NA,NA,NA,NA,NA,NA,NA,NA,NA,NA,NA,NA,NA,NA,NA,NA,NA,NA,NA,NA,NA,NA,NA,NA,NA,NA,NA,NA,NA,NA,NA,NA,NA,NA,NA,NA,NA,NA,NA
DC1,3,Door Creek 1,DC1_3,5/30/2020,2020,5,30,9:37:00,10:31:00,0:54,DCT,Rural,43.0969622,-89.24795067,317058.4281,4774035.008,COUNTY OF DANE,Lake Kegonsa-Yahara River,Door Creek,32.85,1310,NA,2010,Natural,0,0,0.71942446,0,0.28057554,0,0.045924225,0.07347876,0.252583238,0.047072331,0.55912744,0.019517796,0.001144492,0.4,0.04148784,0.008583691,0.084406295,0.054363376,0.081831187,0.084406295,0,0.192274678,0.001716738,0.034334764,0.004864092,0,0.010586552,0.147353362,0.075822604,0.094992847,0.081831187,0.593991416,0.004864092,17,8,61,15,0,0,17.6,315.5,367.9,80.4,7.5,0.18,216.72,339.1,9.5,3.89,42.58,517.7,8.38,0.25,349.1,20.4,124.18,NA,0,15,5,80,5,95,"Leaf Litter,Vegetation,Rock ",2,1,3,3,2.25,2.5,"Tons of vegetation in and top of water, water column completely filled with Pota. Spp. Shallow flooded wetalnd surround pond. Gravel substrate with decaying leaf litter/veg",NA,45,17,20,3,8,28,0,45,0,5,3,1,0,0,0,0,0,0,0,0,NA,"Painted,Snapping,,,",1,1,0,2,NA,NA,0,0,0,0,0,0,0,0,0,0,0,0,0,0,NA,NA,NA,NA,NA,NA,NA,NA,NA,NA,NA,NA,NA,NA,NA,NA,NA,NA,NA,NA,NA,NA,NA,NA,NA,NA,NA,NA,NA,NA,NA,NA,NA,NA,NA,NA,NA,NA,NA,NA,NA,NA,NA,NA,NA,NA,NA,NA,NA,NA,NA,NA,NA,NA,NA,NA,NA,NA,NA,NA,NA,NA,NA,NA,0,1,1,1,0,0,1,0,1,0,0,0,1,1,0,0,1,0,0,0,0,0,0,0,0,0,1,0,0,0,0,0,0,0,0,0,0,1,0,1,0,0,0,0,0,0,0,0,0,0,0,0,0,0,0,0,0,0,0,0,0,0,0,0,0,0,0,0,0
DC1,4,Door Creek 1,DC1_4,7/12/2020,2020,7,12,11:35:00,12:29:00,0:54,DCT,Rural,43.0969622,-89.24795067,317058.4281,4774035.008,COUNTY OF DANE,Lake Kegonsa-Yahara River,Door Creek,32.85,1310,NA,2010,Natural,0,0,0.71942446,0,0.28057554,0,0.045924225,0.07347876,0.252583238,0.047072331,0.55912744,0.019517796,0.001144492,0.4,0.04148784,0.008583691,0.084406295,0.054363376,0.081831187,0.084406295,0,0.192274678,0.001716738,0.034334764,0.004864092,0,0.010586552,0.147353362,0.075822604,0.094992847,0.081831187,0.593991416,0.004864092,23,8,62,60,0,1,24.6,464.1,467.3,6.2,0.5,0.22,NA,407.1,7.25,3.89,42.58,517.7,8.38,0.25,349.1,20.4,124.18,NA,0,15,15,70,60,40,"Super Muddy,,",2,4,1,4,2.75,2.5,Deep flocc and mud substrate around most of pond with no submergent and floating on top. Big patch of dense sago with some leafy and coontail.,NA,45,17,20,3,8,28,0,45,0,5,3,1,0,0,1,0,0,0,0,0,NA,NA,0,0,0,2,NA,NA,0,0,0,0,0,0,0,0,0,0,0,0,0,0,NA,NA,NA,NA,NA,NA,NA,NA,NA,NA,NA,NA,NA,NA,NA,NA,NA,NA,NA,NA,NA,NA,NA,NA,NA,NA,NA,NA,NA,NA,NA,NA,NA,NA,NA,NA,NA,NA,NA,NA,NA,NA,NA,NA,NA,NA,NA,NA,NA,NA,NA,NA,NA,NA,NA,NA,NA,NA,NA,NA,NA,NA,NA,NA,0,1,1,1,0,0,1,0,1,0,0,1,1,1,1,0,1,1,0,1,0,1,0,0,0,0,1,0,0,0,0,0,0,0,0,0,1,1,0,0,0,0,0,0,0,0,0,0,0,0,0,0,0,0,0,0,0,0,0,0,0,0,0,0,0,0,0,0,0
DC1,1,Door Creek 1,DC1_1,6/25/2019,2019,6,25,9:30:00,10:15:00,0:45,"ES,CL,EP",Rural,43.0969622,-89.24795067,317058.4281,4774035.008,COUNTY OF DANE,Lake Kegonsa-Yahara River,Door Creek,32.85,1310,274,2010,Natural,0,0,0.71942446,0,0.28057554,0,0.045924225,0.07347876,0.252583238,0.047072331,0.55912744,0.019517796,0.001144492,0.4,0.04148784,0.008583691,0.084406295,0.054363376,0.081831187,0.084406295,0,0.192274678,0.001716738,0.034334764,0.004864092,0,0.010586552,0.147353362,0.075822604,0.094992847,0.081831187,0.593991416,0.004864092,22,8,64,10,NA,2,17.5,475.7,555.6,64.4,5.94,0.27,62.59,313.6,NA,3.89,42.58,517.7,8.38,0.25,349.1,20.4,124.18,2.14,NA,NA,NA,NA,NA,NA,NA,NA,NA,NA,NA,NA,NA,NA,"No pond area/perimeter calculated,",45,17,20,3,8,28,0,45,0,5,3,1,0,1,0,0,0,0,0,0,1,NA,0,0,0,2,NA,NA,1,0,1,0,0,0,0,0,0,0,NA,0,0,0,1,0,1,0,0,1,1,0,0,1,0,0,1,0,1,0,1,0,1,0,0,0,0,0,0,1,0,0,1,0,0,0,0,0,1,1,1,0,1,1,0,1,0,0,1,0,1,0,1,0,0,1,0,0,0,0,0,1,0,0,0,Beetle larvae,3,NA,NA,NA,NA,NA,NA,NA,NA,NA,NA,NA,NA,NA,NA,NA,NA,NA,NA,NA,NA,NA,NA,NA,NA,NA,NA,NA,NA,NA,NA,NA,NA,NA,NA,NA,NA,NA,NA,NA,NA,NA,NA,NA,NA,NA,NA,NA,NA,NA,NA,NA,NA,NA,NA,NA,NA,NA,NA,NA,NA,NA,NA,NA,NA,NA,NA,NA,NA,NA,NA
DC1,2,Door Creek 1,DC1_2,8/8/2019,2019,8,8,10:47:00,NA,NA,"BC,CL,,EC",Rural,43.0969622,-89.24795067,317058.4281,4774035.008,COUNTY OF DANE,Lake Kegonsa-Yahara River,Door Creek,32.85,1310,286,2010,Natural,0,0,0.71942446,0,0.28057554,0,0.045924225,0.07347876,0.252583238,0.047072331,0.55912744,0.019517796,0.001144492,0.4,0.04148784,0.008583691,0.084406295,0.054363376,0.081831187,0.084406295,0,0.192274678,0.001716738,0.034334764,0.004864092,0,0.010586552,0.147353362,0.075822604,0.094992847,0.081831187,0.593991416,0.004864092,22,9,69,30,NA,3,21.9,640,680,19.3,1.63,0.33,93.22,336.6,NA,3.89,42.58,517.7,8.38,0.25,349.1,20.4,124.18,3.05,NA,NA,NA,NA,NA,NA,NA,NA,NA,NA,NA,NA,NA,NA,other larvae=leopard,45,17,20,3,8,28,0,45,0,5,3,0,0,0,1,0,0,0,0,0,0,NA,0,0,0,2,NA,NA,1,1,0,0,0,0,0,0,0,0,NA,0,0,0,NA,NA,NA,NA,NA,NA,NA,NA,NA,NA,NA,NA,NA,NA,NA,NA,NA,NA,NA,NA,NA,NA,NA,NA,NA,NA,NA,NA,NA,NA,NA,NA,NA,NA,NA,NA,NA,NA,NA,NA,NA,NA,NA,NA,NA,NA,NA,NA,NA,NA,NA,NA,NA,NA,NA,NA,NA,NA,NA,NA,NA,NA,6,nothing in sweeps,NA,NA,NA,NA,NA,NA,NA,NA,NA,NA,NA,NA,NA,NA,NA,NA,NA,NA,NA,NA,NA,NA,NA,NA,NA,NA,NA,NA,NA,NA,NA,NA,NA,NA,NA,NA,NA,NA,NA,NA,NA,NA,NA,NA,NA,NA,NA,NA,NA,NA,NA,NA,NA,NA,NA,NA,NA,NA,NA,NA,NA,NA,NA,NA,NA,NA,NA,NA,NA
DC2,3,Door Creek 2,DC2_3,5/30/2020,2020,5,30,10:37:00,11:12:00,0:35,DCT,Rural,43.09626148,-89.24800062,317052.2758,4773957.298,COUNTY OF DANE,Lake Kegonsa-Yahara River,Door Creek,22.22,607,NA,2010,Natural,0,0,0.678832117,0,0.321167883,0,0.036781609,0.097701149,0.227586207,0.037931034,0.57816092,0.01954023,0.00114646,0.408139868,0.041559186,0.006878762,0.084551447,0.056176555,0.081398682,0.086271138,0,0.182000573,0.00171969,0.033533964,0.004872456,0,0.011751218,0.147606764,0.07509315,0.098022356,0.081398682,0.591860132,0.004872456,17,10,51,35,0,0,18.9,363.3,411,63.6,5.77,0.2,139.19,452.4,7.96,4.9,82.18,445,8.25,0.22,372.6,21.25,81.52,NA,0,60,10,30,55,45,"Mud,,NA",4,5,1,0,2.5,2.38,"Dense mats of forked duckweed on top of submergent, clear water with mud bottom and some submergent",NA,47,16,23,3,8,31,0,47,0,5,4,1,0,0,0,0,0,0,0,0,NA,"Snapping,,,,NA",0,1,0,1,NA,NA,0,0,0,0,0,0,0,0,0,0,0,0,0,0,NA,NA,NA,NA,NA,NA,NA,NA,NA,NA,NA,NA,NA,NA,NA,NA,NA,NA,NA,NA,NA,NA,NA,NA,NA,NA,NA,NA,NA,NA,NA,NA,NA,NA,NA,NA,NA,NA,NA,NA,NA,NA,NA,NA,NA,NA,NA,NA,NA,NA,NA,NA,NA,NA,NA,NA,NA,NA,NA,NA,NA,NA,NA,NA,0,1,0,1,0,0,0,0,1,0,0,1,1,1,0,0,1,0,0,1,0,0,0,0,0,0,1,0,0,0,0,0,0,0,0,0,0,0,0,1,0,0,0,0,0,0,0,0,0,0,0,0,0,0,0,0,0,0,0,0,0,0,0,0,0,0,0,0,0
DC2,4,Door Creek 2,DC2_4,7/12/2020,2020,7,12,10:41:00,11:27:00,0:46,DCT,Rural,43.09626148,-89.24800062,317052.2758,4773957.298,COUNTY OF DANE,Lake Kegonsa-Yahara River,Door Creek,22.22,607,NA,2010,Natural,0,0,0.678832117,0,0.321167883,0,0.036781609,0.097701149,0.227586207,0.037931034,0.57816092,0.01954023,0.00114646,0.408139868,0.041559186,0.006878762,0.084551447,0.056176555,0.081398682,0.086271138,0,0.182000573,0.00171969,0.033533964,0.004872456,0,0.011751218,0.147606764,0.07509315,0.098022356,0.081398682,0.591860132,0.004872456,23,7,66,25,0,0,24.5,332.9,335.8,84.9,6.85,0.16,NA,407.7,8.54,4.9,82.18,445,8.25,0.22,372.6,21.25,81.52,NA,0,40,10,50,20,80,"Mud,Super Muddy,",4,3,2,0,2.25,2.38,Film and algae on surface. 100s of black/blue dragonflies. Tons of submergent covered in forked DW up to surface. Bubbly green algae mats and film.,NA,47,16,23,3,8,31,0,47,0,5,4,1,0,0,0,0,0,0,0,0,NA,NA,0,0,0,1,NA,"Stickleback, Shiner,,,,",1,0,0,1,0,0,0,0,0,0,0,0,0,0,NA,NA,NA,NA,NA,NA,NA,NA,NA,NA,NA,NA,NA,NA,NA,NA,NA,NA,NA,NA,NA,NA,NA,NA,NA,NA,NA,NA,NA,NA,NA,NA,NA,NA,NA,NA,NA,NA,NA,NA,NA,NA,NA,NA,NA,NA,NA,NA,NA,NA,NA,NA,NA,NA,NA,NA,NA,NA,NA,NA,NA,NA,NA,NA,0,1,1,1,0,0,1,0,0,0,0,1,1,1,0,0,1,1,0,0,0,1,0,0,0,0,1,0,0,0,0,0,0,0,0,0,0,1,0,0,0,0,0,0,0,0,0,0,1,0,0,0,0,0,0,0,0,0,0,0,0,0,0,0,0,0,0,0,0
DC2,1,Door Creek 2,DC2_1,6/25/2019,2019,6,25,10:25:00,11:11:00,0:46,"ES,CL,EP",Rural,43.09626148,-89.24800062,317052.2758,4773957.298,COUNTY OF DANE,Lake Kegonsa-Yahara River,Door Creek,22.22,607,273,2010,Natural,0,0,0.678832117,0,0.321167883,0,0.036781609,0.097701149,0.227586207,0.037931034,0.57816092,0.01954023,0.00114646,0.408139868,0.041559186,0.006878762,0.084551447,0.056176555,0.081398682,0.086271138,0,0.182000573,0.00171969,0.033533964,0.004872456,0,0.011751218,0.147606764,0.07509315,0.098022356,0.081398682,0.591860132,0.004872456,22,8,64,10,NA,2,19.5,537,600,53,4.69,0.29,54.77,340.8,NA,4.9,82.18,445,8.25,0.22,372.6,21.25,81.52,2.05,NA,NA,NA,NA,NA,NA,NA,NA,NA,NA,NA,NA,NA,NA,"No inflows/outflows visible, no snail density recorded, no pond area/perimeter calculated",47,16,23,3,8,31,0,47,0,5,4,1,1,1,0,0,0,0,0,0,0,NA,0,0,0,1,NA,NA,1,0,0,0,0,0,0,0,0,0,NA,0,0,0,1,0,1,0,1,0,1,0,1,1,0,1,1,1,1,0,0,0,1,0,0,0,0,0,1,1,0,0,0,0,0,1,0,1,1,1,1,0,0,0,0,0,0,1,1,0,0,1,0,1,1,1,0,0,0,1,0,1,0,0,0,"Big physids, Dragonfly larvae",3,NA,NA,NA,NA,NA,NA,NA,NA,NA,NA,NA,NA,NA,NA,NA,NA,NA,NA,NA,NA,NA,NA,NA,NA,NA,NA,NA,NA,NA,NA,NA,NA,NA,NA,NA,NA,NA,NA,NA,NA,NA,NA,NA,NA,NA,NA,NA,NA,NA,NA,NA,NA,NA,NA,NA,NA,NA,NA,NA,NA,NA,NA,NA,NA,NA,NA,NA,NA,NA,NA
DC2,2,Door Creek 2,DC2_2,8/8/2019,2019,8,8,10:23:00,10:44:00,0:21,"BC,CL,EC",Rural,43.09626148,-89.24800062,317052.2758,4773957.298,COUNTY OF DANE,Lake Kegonsa-Yahara River,Door Creek,22.22,607,294,2010,Natural,0,0,0.678832117,0,0.321167883,0,0.036781609,0.097701149,0.227586207,0.037931034,0.57816092,0.01954023,0.00114646,0.408139868,0.041559186,0.006878762,0.084551447,0.056176555,0.081398682,0.086271138,0,0.182000573,0.00171969,0.033533964,0.004872456,0,0.011751218,0.147606764,0.07509315,0.098022356,0.081398682,0.591860132,0.004872456,22,7,67,10,NA,2,22.1,409,433.2,127.2,2.29,0.21,50.59,289.5,NA,4.9,82.18,445,8.25,0.22,372.6,21.25,81.52,3.01,NA,NA,NA,NA,NA,NA,NA,NA,NA,NA,NA,NA,NA,NA,No max depth recorded,47,16,23,3,8,31,0,47,0,5,4,0,1,0,1,0,0,0,0,0,0,NA,0,0,0,1,NA,Sticklebacks,1,1,0,1,0,0,0,0,0,0,NA,0,0,0,NA,NA,NA,NA,NA,NA,NA,NA,NA,NA,NA,NA,NA,NA,NA,NA,NA,NA,NA,NA,NA,NA,NA,NA,NA,NA,NA,NA,NA,NA,NA,NA,NA,NA,NA,NA,NA,NA,NA,NA,NA,NA,NA,NA,NA,NA,NA,NA,NA,NA,NA,NA,NA,NA,NA,NA,NA,NA,NA,NA,NA,NA,12,Tadpole in sweep 8 may be a bullfrog - a picture was taken,NA,NA,NA,NA,NA,NA,NA,NA,NA,NA,NA,NA,NA,NA,NA,NA,NA,NA,NA,NA,NA,NA,NA,NA,NA,NA,NA,NA,NA,NA,NA,NA,NA,NA,NA,NA,NA,NA,NA,NA,NA,NA,NA,NA,NA,NA,NA,NA,NA,NA,NA,NA,NA,NA,NA,NA,NA,NA,NA,NA,NA,NA,NA,NA,NA,NA,NA,NA,NA
DC3,3,Door Creek 3,DC3_3,5/30/2020,2020,5,30,11:16:00,11:38:00,0:22,DCT,Rural,43.09600047,-89.24856346,317005.6913,4773929.54,COUNTY OF DANE,Lake Kegonsa-Yahara River,Door Creek,22.22,2786,NA,2010,Natural,0,0.006944444,0.680555556,0,0.305555556,0.006944444,0.042334096,0.112128146,0.219679634,0.042334096,0.561784897,0.019450801,0.001147447,0.401032702,0.041594951,0.007171543,0.085197935,0.062535858,0.080608147,0.088066552,0,0.18043603,0.00172117,0.033562823,0.004876649,0,0.012048193,0.154905336,0.075157774,0.100114745,0.080608147,0.583189902,0.004876649,18,10,47,50,0,0,19.8,342.9,380.9,79.2,7.05,0.18,122.85,290.4,7.84,4.85,56.1,464.68,7.82,0.23,276.03,21.58,74.09,NA,0,25,5,70,20,80,"Mud,Vegetation,",3,3,1,0,1.75,1.75,"Thick with submergent plants up to the surface, duckweed on edges",NA,49,15,26,3,8,34,0,49,0,5,3,1,0,0,0,0,0,0,0,0,NA,"Painted,Snapping,,,",1,1,0,2,NA,NA,0,0,0,0,0,0,0,0,0,0,0,0,0,0,NA,NA,NA,NA,NA,NA,NA,NA,NA,NA,NA,NA,NA,NA,NA,NA,NA,NA,NA,NA,NA,NA,NA,NA,NA,NA,NA,NA,NA,NA,NA,NA,NA,NA,NA,NA,NA,NA,NA,NA,NA,NA,NA,NA,NA,NA,NA,NA,NA,NA,NA,NA,NA,NA,NA,NA,NA,NA,NA,NA,NA,NA,NA,NA,0,1,1,1,0,0,1,0,1,0,0,1,0,1,0,0,1,0,0,0,0,0,0,0,0,0,1,0,0,0,0,0,0,0,0,0,0,1,0,0,0,0,0,0,0,0,0,0,0,0,0,0,0,0,0,0,0,0,0,0,0,0,0,0,0,0,0,0,0
DC3,4,Door Creek 3,DC3_4,7/12/2020,2020,7,12,9:51:00,10:32:00,0:41,DCT,Rural,43.09600047,-89.24856346,317005.6913,4773929.54,COUNTY OF DANE,Lake Kegonsa-Yahara River,Door Creek,22.22,2786,NA,2010,Natural,0,0.006944444,0.680555556,0,0.305555556,0.006944444,0.042334096,0.112128146,0.219679634,0.042334096,0.561784897,0.019450801,0.001147447,0.401032702,0.041594951,0.007171543,0.085197935,0.062535858,0.080608147,0.088066552,0,0.18043603,0.00172117,0.033562823,0.004876649,0,0.012048193,0.154905336,0.075157774,0.100114745,0.080608147,0.583189902,0.004876649,22,7,67,15,0,0,24.3,324.3,328.4,51.4,4.16,0.16,NA,398.1,7.8,4.85,56.1,464.68,7.82,0.23,276.03,21.58,74.09,NA,0,30,20,50,10,90,"Mud,,",3,2,1,1,1.75,1.75,Water clear beneath wolffia.,NA,49,15,26,3,8,34,0,49,0,5,3,1,0,0,0,0,0,0,0,0,NA,NA,0,0,0,2,NA,"Mudminnow, Stickleback,,,,",1,1,0,0,0,0,0,0,0,0,0,0,0,0,NA,NA,NA,NA,NA,NA,NA,NA,NA,NA,NA,NA,NA,NA,NA,NA,NA,NA,NA,NA,NA,NA,NA,NA,NA,NA,NA,NA,NA,NA,NA,NA,NA,NA,NA,NA,NA,NA,NA,NA,NA,NA,NA,NA,NA,NA,NA,NA,NA,NA,NA,NA,NA,NA,NA,NA,NA,NA,NA,NA,NA,NA,NA,NA,0,1,1,1,0,0,1,0,1,0,0,0,0,1,0,0,1,1,0,1,0,0,0,0,1,0,1,0,0,0,0,0,0,0,0,0,0,1,0,1,0,0,0,0,0,0,0,0,0,1,0,0,0,0,0,0,0,0,0,0,0,0,0,0,0,0,0,0,0
DC3,1,Door Creek 3,DC3_1,6/20/2019,2019,6,20,10:42:00,11:45:00,1:03,"ES,CL,BC,EP",Rural,43.09600047,-89.24856346,317005.6913,4773929.54,COUNTY OF DANE,Lake Kegonsa-Yahara River,Door Creek,22.22,2786,271,2010,Natural,0,0.006944444,0.680555556,0,0.305555556,0.006944444,0.042334096,0.112128146,0.219679634,0.042334096,0.561784897,0.019450801,0.001147447,0.401032702,0.041594951,0.007171543,0.085197935,0.062535858,0.080608147,0.088066552,0,0.18043603,0.00172117,0.033562823,0.004876649,0,0.012048193,0.154905336,0.075157774,0.100114745,0.080608147,0.583189902,0.004876649,16,NA,74,65,NA,2,19.1,563,634,66.9,5.95,0.31,46.81,186.6,NA,4.85,56.1,464.68,7.82,0.23,276.03,21.58,74.09,1.17,NA,NA,NA,NA,NA,NA,NA,NA,NA,NA,NA,NA,NA,NA,had to drag tows because of duckweed,49,15,26,3,8,34,0,49,0,5,3,1,0,1,0,0,0,0,0,0,0,NA,0,0,0,2,NA,"minnows,pumpkin seeds",1,0,0,0,0,0,1,0,0,0,NA,0,0,0,1,0,1,0,1,0,1,0,1,1,0,0,1,1,1,0,0,0,1,0,0,0,1,0,0,1,0,0,0,1,0,0,0,0,1,1,1,0,1,1,0,1,0,1,1,0,0,0,1,1,1,1,0,1,1,1,0,0,0,0,0,NA,0,NA,NA,NA,NA,NA,NA,NA,NA,NA,NA,NA,NA,NA,NA,NA,NA,NA,NA,NA,NA,NA,NA,NA,NA,NA,NA,NA,NA,NA,NA,NA,NA,NA,NA,NA,NA,NA,NA,NA,NA,NA,NA,NA,NA,NA,NA,NA,NA,NA,NA,NA,NA,NA,NA,NA,NA,NA,NA,NA,NA,NA,NA,NA,NA,NA,NA,NA,NA,NA,NA
DC3,2,Door Creek 3,DC3_2,8/8/2019,2019,8,8,9:55:00,NA,NA,"BC,CL,EC",Rural,43.09600047,-89.24856346,317005.6913,4773929.54,COUNTY OF DANE,Lake Kegonsa-Yahara River,Door Creek,22.22,2786,278,2010,Natural,0,0.006944444,0.680555556,0,0.305555556,0.006944444,0.042334096,0.112128146,0.219679634,0.042334096,0.561784897,0.019450801,0.001147447,0.401032702,0.041594951,0.007171543,0.085197935,0.062535858,0.080608147,0.088066552,0,0.18043603,0.00172117,0.033562823,0.004876649,0,0.012048193,0.154905336,0.075157774,0.100114745,0.080608147,0.583189902,0.004876649,22,9,70,10,NA,2,23.1,496.3,515.4,26.9,2.22,0.25,52.61,229,NA,4.85,56.1,464.68,7.82,0.23,276.03,21.58,74.09,2.93,NA,NA,NA,NA,NA,NA,NA,NA,NA,NA,NA,NA,NA,NA,NA,49,15,26,3,8,34,0,49,0,5,3,0,0,0,1,0,0,0,0,0,1,"Painted,Snapping",1,1,0,2,NA,"Mudminnow, stickleback",1,1,0,0,0,0,0,0,0,0,NA,0,0,0,NA,NA,NA,NA,NA,NA,NA,NA,NA,NA,NA,NA,NA,NA,NA,NA,NA,NA,NA,NA,NA,NA,NA,NA,NA,NA,NA,NA,NA,NA,NA,NA,NA,NA,NA,NA,NA,NA,NA,NA,NA,NA,NA,NA,NA,NA,NA,NA,NA,NA,NA,NA,NA,NA,NA,NA,NA,NA,NA,NA,NA,NA,10,NA,NA,NA,NA,NA,NA,NA,NA,NA,NA,NA,NA,NA,NA,NA,NA,NA,NA,NA,NA,NA,NA,NA,NA,NA,NA,NA,NA,NA,NA,NA,NA,NA,NA,NA,NA,NA,NA,NA,NA,NA,NA,NA,NA,NA,NA,NA,NA,NA,NA,NA,NA,NA,NA,NA,NA,NA,NA,NA,NA,NA,NA,NA,NA,NA,NA,NA,NA,NA,NA
DC4,3,Door Creek 4,DC4_3,5/30/2020,2020,5,30,11:49:00,12:38:00,0:49,DCT,Rural,43.09573478,-89.24788392,317060.2047,4773898.55,COUNTY OF DANE,Lake Kegonsa-Yahara River,Door Creek,14.56,1449,NA,2010,Natural,0,0.01459854,0.540145985,0,0.445255474,0,0.026436782,0.116091954,0.211494253,0.022988506,0.601149425,0.01954023,0.00086,0.418624642,0.041547278,0.005157593,0.082808023,0.053868195,0.078223496,0.088538682,0,0.17765043,0.001719198,0.033810888,0.00487106,0,0.012320917,0.141833811,0.075358166,0.100859599,0.078223496,0.597994269,0.00487106,18,11,47,35,0,0,19.9,485.7,538,129.6,11.52,0.26,88.02,159.7,8.04,12.4,145.45,599.18,7.95,0.29,138.1,21.33,68.26,NA,0,20,5,75,30,70,"Super Muddy,,NA",2,4,1,0,1.75,1.75,"Very clear water, loves of submergent with leaves on top. Spring bubbling out of ground. Dense veg and mud for substrate.",NA,43,16,19,2,8,27,0,43,0,6,4,1,0,1,0,0,0,0,0,0,NA,"Snapping,,,,NA",0,1,0,2,NA,NA,0,0,0,0,0,0,0,0,0,0,0,0,0,0,NA,NA,NA,NA,NA,NA,NA,NA,NA,NA,NA,NA,NA,NA,NA,NA,NA,NA,NA,NA,NA,NA,NA,NA,NA,NA,NA,NA,NA,NA,NA,NA,NA,NA,NA,NA,NA,NA,NA,NA,NA,NA,NA,NA,NA,NA,NA,NA,NA,NA,NA,NA,NA,NA,NA,NA,NA,NA,NA,NA,NA,NA,NA,NA,0,1,1,1,0,0,0,0,1,0,0,0,1,1,0,0,0,1,0,0,0,0,0,0,0,0,1,0,0,0,0,0,0,1,0,0,0,0,0,0,0,0,0,0,0,0,0,0,0,0,0,0,0,0,0,0,0,0,0,0,0,0,0,0,0,0,0,0,0
DC4,4,Door Creek 4,DC4_4,7/12/2020,2020,7,12,8:36:00,9:43:00,1:07,DCT,Rural,43.09573478,-89.24788392,317060.2047,4773898.55,COUNTY OF DANE,Lake Kegonsa-Yahara River,Door Creek,14.56,1449,NA,2010,Natural,0,0.01459854,0.540145985,0,0.445255474,0,0.026436782,0.116091954,0.211494253,0.022988506,0.601149425,0.01954023,0.00086,0.418624642,0.041547278,0.005157593,0.082808023,0.053868195,0.078223496,0.088538682,0,0.17765043,0.001719198,0.033810888,0.00487106,0,0.012320917,0.141833811,0.075358166,0.100859599,0.078223496,0.597994269,0.00487106,21,8,72,0,0,0,22.4,494.1,519.7,57.6,4.84,0.25,NA,216.6,7.86,12.4,145.45,599.18,7.95,0.29,138.1,21.33,68.26,NA,0,60,10,30,7,93,"Super Muddy,,",5,1,1,0,1.75,1.75,"Water very clear, algae floating at S. end. Springfed. Total mix of submergent/emergent types.",NA,43,16,19,2,8,27,0,43,0,6,4,1,0,0,0,0,0,0,0,0,NA,"Painted,,,,",1,0,0,2,NA,"Sticklebacks, sunfish,,,,",1,0,0,0,0,0,0,0,0,0,1,0,0,0,NA,NA,NA,NA,NA,NA,NA,NA,NA,NA,NA,NA,NA,NA,NA,NA,NA,NA,NA,NA,NA,NA,NA,NA,NA,NA,NA,NA,NA,NA,NA,NA,NA,NA,NA,NA,NA,NA,NA,NA,NA,NA,NA,NA,NA,NA,NA,NA,NA,NA,NA,NA,NA,NA,NA,NA,NA,NA,NA,NA,NA,NA,NA,NA,0,1,1,1,0,0,1,0,1,0,0,1,1,1,0,0,0,1,0,1,0,1,0,0,1,0,0,0,0,0,0,0,0,1,0,0,0,1,0,0,0,0,0,0,0,0,0,0,0,1,0,0,0,0,0,0,0,0,0,0,0,0,0,0,0,0,0,0,0
DC4,1,Door Creek 4,DC4_1,6/20/2019,2019,6,20,13:24:00,14:15:00,0:51,"ES,CL,BC,EP",Rural,43.09573478,-89.24788392,317060.2047,4773898.55,COUNTY OF DANE,Lake Kegonsa-Yahara River,Door Creek,14.56,1449,269,2010,Natural,0,0.01459854,0.540145985,0,0.445255474,0,0.026436782,0.116091954,0.211494253,0.022988506,0.601149425,0.01954023,0.00086,0.418624642,0.041547278,0.005157593,0.082808023,0.053868195,0.078223496,0.088538682,0,0.17765043,0.001719198,0.033810888,0.00487106,0,0.012320917,0.141833811,0.075358166,0.100859599,0.078223496,0.597994269,0.00487106,23,9,60,70,NA,2,22.3,572,603,329.2,27.54,0.29,46.66,48.09,NA,12.4,145.45,599.18,7.95,0.29,138.1,21.33,68.26,8.95,NA,NA,NA,NA,NA,NA,NA,NA,NA,NA,NA,NA,NA,NA,"Drag zoop tows,",43,16,19,2,8,27,0,43,0,6,4,1,0,1,0,0,0,0,0,0,1,Snapping,0,1,0,2,NA,Minnow sp.,1,0,0,0,0,0,0,0,0,0,NA,0,0,0,1,0,1,0,1,0,0,0,1,1,0,0,0,1,1,0,1,0,1,0,0,0,0,0,0,0,0,0,0,0,0,1,0,0,1,1,1,0,0,1,0,0,0,0,1,0,0,0,1,1,1,1,1,0,0,1,0,1,0,0,0,Snails,3,No distance for seine 3,NA,NA,NA,NA,NA,NA,NA,NA,NA,NA,NA,NA,NA,NA,NA,NA,NA,NA,NA,NA,NA,NA,NA,NA,NA,NA,NA,NA,NA,NA,NA,NA,NA,NA,NA,NA,NA,NA,NA,NA,NA,NA,NA,NA,NA,NA,NA,NA,NA,NA,NA,NA,NA,NA,NA,NA,NA,NA,NA,NA,NA,NA,NA,NA,NA,NA,NA,NA,NA
DC4,2,Door Creek 4,DC4_2,8/8/2019,2019,8,8,9:30:00,NA,NA,"BC,CL,EC",Rural,43.09573478,-89.24788392,317060.2047,4773898.55,COUNTY OF DANE,Lake Kegonsa-Yahara River,Door Creek,14.56,1449,268,2010,Natural,0,0.01459854,0.540145985,0,0.445255474,0,0.026436782,0.116091954,0.211494253,0.022988506,0.601149425,0.01954023,0.00086,0.418624642,0.041547278,0.005157593,0.082808023,0.053868195,0.078223496,0.088538682,0,0.17765043,0.001719198,0.033810888,0.00487106,0,0.012320917,0.141833811,0.075358166,0.100859599,0.078223496,0.597994269,0.00487106,21,9,73,75,NA,2,20.7,668,736,65.4,5.71,0.36,70.11,128,NA,12.4,145.45,599.18,7.95,0.29,138.1,21.33,68.26,14.92,NA,NA,NA,NA,NA,NA,NA,NA,NA,NA,NA,NA,NA,NA,No stop time recorded,43,16,19,2,8,27,0,43,0,6,4,0,1,0,1,0,0,0,0,0,0,NA,0,0,0,2,NA,NA,1,0,0,0,0,0,0,1,0,0,NA,0,0,0,NA,NA,NA,NA,NA,NA,NA,NA,NA,NA,NA,NA,NA,NA,NA,NA,NA,NA,NA,NA,NA,NA,NA,NA,NA,NA,NA,NA,NA,NA,NA,NA,NA,NA,NA,NA,NA,NA,NA,NA,NA,NA,NA,NA,NA,NA,NA,NA,NA,NA,NA,NA,NA,NA,NA,NA,NA,NA,NA,NA,NA,NA,15,NA,NA,NA,NA,NA,NA,NA,NA,NA,NA,NA,NA,NA,NA,NA,NA,NA,NA,NA,NA,NA,NA,NA,NA,NA,NA,NA,NA,NA,NA,NA,NA,NA,NA,NA,NA,NA,NA,NA,NA,NA,NA,NA,NA,NA,NA,NA,NA,NA,NA,NA,NA,NA,NA,NA,NA,NA,NA,NA,NA,NA,NA,NA,NA,NA,NA,NA,NA,NA,NA
DC5,3,Door Creek 5,DC5_3,5/30/2020,2020,5,30,12:45:00,13:15:00,0:30,DCT,Rural,43.09479969,-89.24850219,317007.1004,4773796.052,COUNTY OF DANE,Lake Kegonsa-Yahara River,Door Creek,24.79,2836,NA,1995,Natural,0,0.120567376,0.382978723,0,0.496453901,0,0.011441648,0.139588101,0.196796339,0.014874142,0.615560641,0.019450801,0.000858,0.421745351,0.04148784,0.00286123,0.084120172,0.058369099,0.073819742,0.091273247,0,0.167381974,0.001716738,0.034048641,0.005150215,0,0.017167382,0.145350501,0.075536481,0.108440629,0.073819742,0.590844063,0.005150215,18,9,44,50,0,1,23,225.9,234.8,145.3,12.13,0.11,90.77,161.3,9.62,6.76,80.5,331.3,8.49,0.16,206.43,22.65,49.32,NA,0,12,8,80,10,90,"Mud,,",2,2,1,0,1.25,1.5,"Very thick with veg., forked duckweed mixed with pota sp. And coontail and lemna and wofflia throughout",NA,42,14,19,2,9,28,0,42,0,7,5,1,0,1,0,0,0,0,0,0,NA,"Snapping,,,,",0,1,0,2,NA,NA,0,0,0,0,0,0,0,0,0,0,0,0,0,0,NA,NA,NA,NA,NA,NA,NA,NA,NA,NA,NA,NA,NA,NA,NA,NA,NA,NA,NA,NA,NA,NA,NA,NA,NA,NA,NA,NA,NA,NA,NA,NA,NA,NA,NA,NA,NA,NA,NA,NA,NA,NA,NA,NA,NA,NA,NA,NA,NA,NA,NA,NA,NA,NA,NA,NA,NA,NA,NA,NA,NA,NA,NA,NA,0,1,0,1,0,0,0,0,1,0,0,0,0,1,0,0,1,0,0,0,1,0,0,0,0,0,1,0,0,0,0,0,0,0,0,0,1,0,0,1,0,0,0,0,0,0,0,0,0,0,0,0,0,0,0,0,0,0,0,0,0,0,0,0,0,0,0,0,0
DC5,4,Door Creek 5,DC5_4,7/12/2020,2020,7,12,7:23:00,8:14:00,0:51,DCT,Rural,43.09479969,-89.24850219,317007.1004,4773796.052,COUNTY OF DANE,Lake Kegonsa-Yahara River,Door Creek,24.79,2836,NA,1995,Natural,0,0.120567376,0.382978723,0,0.496453901,0,0.011441648,0.139588101,0.196796339,0.014874142,0.615560641,0.019450801,0.000858,0.421745351,0.04148784,0.00286123,0.084120172,0.058369099,0.073819742,0.091273247,0,0.167381974,0.001716738,0.034048641,0.005150215,0,0.017167382,0.145350501,0.075536481,0.108440629,0.073819742,0.590844063,0.005150215,20,7,83,2,0,0,22.2,367.1,388.2,1.3,0.11,0.19,NA,275.7,7.36,6.76,80.5,331.3,8.49,0.16,206.43,22.65,49.32,NA,0,10,15,75,30,70,"Mud,Leaf Litter,Vegetation",1,4,2,0,1.75,1.5,"Wolffia and floating veg over entire surface, thinner toward middle, thick submergent in middle but less around edges. Lots of Y.O.Y green frogs and numerous snappers.",NA,42,14,19,2,9,28,0,42,0,7,5,1,0,0,0,0,0,0,0,0,NA,"Snapping,,,,",0,1,0,2,NA,"Brook Stickleback, Mudminnow,,,,",1,1,0,0,0,0,0,0,0,0,0,0,0,0,NA,NA,NA,NA,NA,NA,NA,NA,NA,NA,NA,NA,NA,NA,NA,NA,NA,NA,NA,NA,NA,NA,NA,NA,NA,NA,NA,NA,NA,NA,NA,NA,NA,NA,NA,NA,NA,NA,NA,NA,NA,NA,NA,NA,NA,NA,NA,NA,NA,NA,NA,NA,NA,NA,NA,NA,NA,NA,NA,NA,NA,NA,NA,NA,0,1,1,1,0,0,0,0,1,0,0,1,1,1,0,0,1,0,0,0,1,0,0,0,0,0,1,0,0,0,0,0,0,0,0,0,1,1,0,1,0,0,0,0,0,0,0,0,0,0,0,0,0,0,0,0,0,0,0,0,0,0,0,0,0,0,0,0,0
DC5,1,Door Creek 5,DC5_1,6/20/2019,2019,6,20,12:12:00,13:05:00,0:53,"ES,CL,BC,EP",Rural,43.09479969,-89.24850219,317007.1004,4773796.052,COUNTY OF DANE,Lake Kegonsa-Yahara River,Door Creek,24.79,2836,278,1995,Natural,0,0.120567376,0.382978723,0,0.496453901,0,0.011441648,0.139588101,0.196796339,0.014874142,0.615560641,0.019450801,0.000858,0.421745351,0.04148784,0.00286123,0.084120172,0.058369099,0.073819742,0.091273247,0,0.167381974,0.001716738,0.034048641,0.005150215,0,0.017167382,0.145350501,0.075536481,0.108440629,0.073819742,0.590844063,0.005150215,21,9,58,55,NA,2,21.6,247.9,265.1,147.4,12.51,0.13,17.03,143.5,NA,6.76,80.5,331.3,8.49,0.16,206.43,22.65,49.32,1.86,NA,NA,NA,NA,NA,NA,NA,NA,NA,NA,NA,NA,NA,NA,"Drag zoop tows, No inflows/outflows recorded, tons of green frogs",42,14,19,2,9,28,0,42,0,7,5,1,0,1,0,0,0,0,0,0,1,Painted,1,0,0,2,NA,Minnow Sp.,1,0,0,0,0,0,0,0,0,0,NA,0,0,0,1,0,1,0,0,0,0,0,0,1,0,0,0,1,1,0,0,0,1,0,0,0,0,0,0,1,0,0,0,0,0,0,0,0,1,1,1,0,1,1,0,1,0,1,1,0,0,0,0,0,0,1,1,1,1,0,0,0,0,0,1,NA,4,NA,NA,NA,NA,NA,NA,NA,NA,NA,NA,NA,NA,NA,NA,NA,NA,NA,NA,NA,NA,NA,NA,NA,NA,NA,NA,NA,NA,NA,NA,NA,NA,NA,NA,NA,NA,NA,NA,NA,NA,NA,NA,NA,NA,NA,NA,NA,NA,NA,NA,NA,NA,NA,NA,NA,NA,NA,NA,NA,NA,NA,NA,NA,NA,NA,NA,NA,NA,NA,NA
DC5,2,Door Creek 5,DC5_2,8/8/2019,2019,8,8,9:02:00,9:18:00,0:16,"BC,CL,EC",Rural,43.09479969,-89.24850219,317007.1004,4773796.052,COUNTY OF DANE,Lake Kegonsa-Yahara River,Door Creek,24.79,2836,278,1995,Natural,0,0.120567376,0.382978723,0,0.496453901,0,0.011441648,0.139588101,0.196796339,0.014874142,0.615560641,0.019450801,0.000858,0.421745351,0.04148784,0.00286123,0.084120172,0.058369099,0.073819742,0.091273247,0,0.167381974,0.001716738,0.034048641,0.005150215,0,0.017167382,0.145350501,0.075536481,0.108440629,0.073819742,0.590844063,0.005150215,20,9,76,5,NA,2,23.8,427.4,437.1,28,2.28,0.21,40.15,245.2,NA,6.76,80.5,331.3,8.49,0.16,206.43,22.65,49.32,3.79,NA,NA,NA,NA,NA,NA,NA,NA,NA,NA,NA,NA,NA,NA,"No max depth recorded, No snail density recorded, No garbage recorded; Flour - OVER",42,14,19,2,9,28,0,42,0,7,5,0,0,0,1,1,0,0,0,0,1,NA,0,0,0,2,NA,NA,0,0,0,0,0,0,0,0,0,0,NA,0,0,0,NA,NA,NA,NA,NA,NA,NA,NA,NA,NA,NA,NA,NA,NA,NA,NA,NA,NA,NA,NA,NA,NA,NA,NA,NA,NA,NA,NA,NA,NA,NA,NA,NA,NA,NA,NA,NA,NA,NA,NA,NA,NA,NA,NA,NA,NA,NA,NA,NA,NA,NA,NA,NA,NA,NA,NA,NA,NA,NA,NA,NA,NA,0,No seine distances recorded,NA,NA,NA,NA,NA,NA,NA,NA,NA,NA,NA,NA,NA,NA,NA,NA,NA,NA,NA,NA,NA,NA,NA,NA,NA,NA,NA,NA,NA,NA,NA,NA,NA,NA,NA,NA,NA,NA,NA,NA,NA,NA,NA,NA,NA,NA,NA,NA,NA,NA,NA,NA,NA,NA,NA,NA,NA,NA,NA,NA,NA,NA,NA,NA,NA,NA,NA,NA,NA
DCSW,3,Door Creek Stormwater,DCSW_3,5/30/2020,2020,5,30,13:27:00,14:11:00,0:44,DCT,Rural,43.09661685,-89.25138149,316778.1829,4774004.149,COUNTY OF DANE,Lake Kegonsa-Yahara River,Door Creek,15.96,4161,NA,2005,Stormwater,0.079136691,0,0.294964029,0.071942446,0.438848921,0.100719424,0.137457045,0.145475372,0.21534937,0.10882016,0.369988545,0.019473081,0.001147776,0.351506456,0.041606887,0.012625538,0.091535151,0.092969871,0.08866571,0.086370158,0,0.181922525,0.001721664,0.033572453,0.004878049,0,0.011477762,0.19713056,0.07517934,0.09784792,0.08866571,0.535150646,0.004878049,18,10,43,35,3,1,21,404.8,438.4,227.5,19.6,0.21,129.2,132.6,9.39,12.37,147.08,519.15,8.77,0.25,113.61,23.2,107.54,NA,6,65,2,33,50,50,"Rock ,Sand,NA",4,5,2,1,3,2.63,"Large basin surrounded by willows. Looks very deep in middle, lots of sub ergent veg floating to surface and algae around shallows. 6 species submergent",NA,45,14,21,5,10,31,0,45,0,5,3,1,0,0,0,0,0,0,0,0,NA,"Painted,,,,NA",1,0,0,2,NA,"Large mouth bass, other small fish,,,,NA",0,0,0,0,1,0,0,0,0,0,0,0,1,0,NA,NA,NA,NA,NA,NA,NA,NA,NA,NA,NA,NA,NA,NA,NA,NA,NA,NA,NA,NA,NA,NA,NA,NA,NA,NA,NA,NA,NA,NA,NA,NA,NA,NA,NA,NA,NA,NA,NA,NA,NA,NA,NA,NA,NA,NA,NA,NA,NA,NA,NA,NA,NA,NA,NA,NA,NA,NA,NA,NA,NA,NA,NA,NA,1,1,0,1,1,0,0,0,1,1,0,0,0,0,0,0,0,0,0,0,0,0,0,0,1,0,0,0,0,0,0,0,0,1,0,0,0,0,0,0,0,0,0,0,0,0,1,0,0,0,0,0,0,0,0,0,0,0,0,0,0,0,0,0,0,0,0,0,0
DCSW,4,Door Creek Stormwater,DCSW_4,7/12/2020,2020,7,12,12:41:00,13:34:00,0:53,DCT,Rural,43.09661685,-89.25138149,316778.1829,4774004.149,COUNTY OF DANE,Lake Kegonsa-Yahara River,Door Creek,15.96,4161,NA,2005,Stormwater,0.079136691,0,0.294964029,0.071942446,0.438848921,0.100719424,0.137457045,0.145475372,0.21534937,0.10882016,0.369988545,0.019473081,0.001147776,0.351506456,0.041606887,0.012625538,0.091535151,0.092969871,0.08866571,0.086370158,0,0.181922525,0.001721664,0.033572453,0.004878049,0,0.011477762,0.19713056,0.07517934,0.09784792,0.08866571,0.535150646,0.004878049,24,9,43,35,3,1,28,326,309.7,107.4,8.13,0.15,NA,131.4,8.14,12.37,147.08,519.15,8.77,0.25,113.61,23.2,107.54,NA,2,90,5,5,60,40,"Firm Soil,Super Muddy,NA",2,4,2,1,2.25,2.63,"Very turbid, hard to determine submergent. Some areas are deep mud, others firm sand and rock. Lots of trash, and schools of small sunfish, with big fish jumping.",NA,45,14,21,5,10,31,0,45,0,5,3,1,1,0,0,0,0,0,0,0,NA,"Painted,Snapping,,,NA",1,1,0,2,NA,"Green Sunfish, fathead minnow,,,,NA",0,0,1,0,0,0,0,0,0,0,0,1,0,0,NA,NA,NA,NA,NA,NA,NA,NA,NA,NA,NA,NA,NA,NA,NA,NA,NA,NA,NA,NA,NA,NA,NA,NA,NA,NA,NA,NA,NA,NA,NA,NA,NA,NA,NA,NA,NA,NA,NA,NA,NA,NA,NA,NA,NA,NA,NA,NA,NA,NA,NA,NA,NA,NA,NA,NA,NA,NA,NA,NA,NA,NA,NA,NA,0,1,0,1,1,0,0,0,1,0,0,1,1,1,0,0,0,1,0,0,0,0,0,0,1,0,0,0,0,0,0,0,0,1,0,0,1,0,0,0,0,0,0,0,0,0,1,0,0,0,0,0,0,0,0,0,0,0,0,0,0,0,0,0,0,0,0,0,0
DCSW,1,Door Creek Stormwater,DCSW_1,6/20/2019,2019,6,20,9:18:00,10:11:00,0:53,"ES,CL,BC,EP",Rural,43.09661685,-89.25138149,316778.1829,4774004.149,COUNTY OF DANE,Lake Kegonsa-Yahara River,Door Creek,15.96,4161,278,2005,Stormwater,0.079136691,0,0.294964029,0.071942446,0.438848921,0.100719424,0.137457045,0.145475372,0.21534937,0.10882016,0.369988545,0.019473081,0.001147776,0.351506456,0.041606887,0.012625538,0.091535151,0.092969871,0.08866571,0.086370158,0,0.181922525,0.001721664,0.033572453,0.004878049,0,0.011477762,0.19713056,0.07517934,0.09784792,0.08866571,0.535150646,0.004878049,16,11,74,35,NA,2,19.4,772,865,170.1,15.03,0.43,118.69,89.65,NA,12.37,147.08,519.15,8.77,0.25,113.61,23.2,107.54,3.09,NA,NA,NA,NA,NA,NA,NA,NA,NA,NA,NA,NA,NA,NA,Dead bluegill present,45,14,21,5,10,31,0,45,0,5,3,1,1,0,0,0,0,0,0,0,0,Painted,1,0,0,2,NA,Bluegill,0,1,0,0,0,0,0,1,0,0,NA,0,0,0,1,0,1,0,1,0,1,0,1,0,0,0,0,1,1,0,1,0,1,0,0,0,0,0,0,0,0,0,1,0,1,1,0,0,0,1,1,0,0,1,1,0,0,0,1,0,0,0,1,1,1,0,1,1,1,0,0,1,0,0,0,"Planorbids, physids, clams",6,NA,NA,NA,NA,NA,NA,NA,NA,NA,NA,NA,NA,NA,NA,NA,NA,NA,NA,NA,NA,NA,NA,NA,NA,NA,NA,NA,NA,NA,NA,NA,NA,NA,NA,NA,NA,NA,NA,NA,NA,NA,NA,NA,NA,NA,NA,NA,NA,NA,NA,NA,NA,NA,NA,NA,NA,NA,NA,NA,NA,NA,NA,NA,NA,NA,NA,NA,NA,NA,NA
DCSW,2,Door Creek Stormwater,DCSW_2,8/8/2019,2019,8,8,11:27:00,11:46:00,0:19,"BC,CL,EC",Rural,43.09661685,-89.25138149,316778.1829,4774004.149,COUNTY OF DANE,Lake Kegonsa-Yahara River,Door Creek,15.96,4161,278,2005,Stormwater,0.079136691,0,0.294964029,0.071942446,0.438848921,0.100719424,0.137457045,0.145475372,0.21534937,0.10882016,0.369988545,0.019473081,0.001147776,0.351506456,0.041606887,0.012625538,0.091535151,0.092969871,0.08866571,0.086370158,0,0.181922525,0.001721664,0.033572453,0.004878049,0,0.011477762,0.19713056,0.07517934,0.09784792,0.08866571,0.535150646,0.004878049,23,10,55,40,NA,5,24.4,457.9,463.5,83.3,6.73,0.22,74.72,100.8,NA,12.37,147.08,519.15,8.77,0.25,113.61,23.2,107.54,3.93,NA,NA,NA,NA,NA,NA,NA,NA,NA,NA,NA,NA,NA,NA,No max depth or open water recorded,45,14,21,5,10,31,0,45,0,5,3,0,0,0,1,0,0,0,0,0,0,NA,0,0,0,2,NA,NA,0,0,0,0,0,0,0,0,0,0,NA,0,0,0,NA,NA,NA,NA,NA,NA,NA,NA,NA,NA,NA,NA,NA,NA,NA,NA,NA,NA,NA,NA,NA,NA,NA,NA,NA,NA,NA,NA,NA,NA,NA,NA,NA,NA,NA,NA,NA,NA,NA,NA,NA,NA,NA,NA,NA,NA,NA,NA,NA,NA,NA,NA,NA,NA,NA,NA,NA,NA,NA,NA,NA,NA,14,NA,NA,NA,NA,NA,NA,NA,NA,NA,NA,NA,NA,NA,NA,NA,NA,NA,NA,NA,NA,NA,NA,NA,NA,NA,NA,NA,NA,NA,NA,NA,NA,NA,NA,NA,NA,NA,NA,NA,NA,NA,NA,NA,NA,NA,NA,NA,NA,NA,NA,NA,NA,NA,NA,NA,NA,NA,NA,NA,NA,NA,NA,NA,NA,NA,NA,NA,NA,NA,NA
DCW,3,Door Creek Wild,DCW_3,5/5/2021,2021,5,5,12:30:00,13:30:00,1:00,DCT,Rural,43.004123,-89.255398,316175.1338,4763741.008,WIDNR,Lake Kegonsa-Yahara River,Door Creek,43.5,311,256,2010,Natural,0.035460993,0,0.326241135,0.028368794,0.609929078,0,0.014925373,0,0.451205511,0.014925373,0.518943743,0,0,0.332092757,0.021757801,0,0.011451474,0.000286,0.032922989,0.389063842,0,0.173489837,0,0.007729745,0.003149155,0,0.028056112,0.011737761,0.029487547,0.417119954,0.032922989,0.505582594,0.003149155,13,7,43,35,0,0,NA,NA,NA,NA,NA,NA,NA,NA,NA,1.5,16.4,434.35,7.48,0.21,368.75,18.4,334.06,NA,0,30,20,50,90,10,"Super Muddy,Mud,Leaf Litter,Vegetation",1,1,4,0,1.5,1.25,"Deep flocculent layer under duckweed. Large snapping turtle. Typha is dead, much more open water than previous year. Predated juvenile painted turtle. Chorus frogs calling nearby but not in pond. Blanding's turtle seen in pond next to parling lot.",NA,33,16,11,2,6,17,0,33,0,4,2,1,0,1,0,0,0,0,0,0,NA,"Painted,Snapping",1,1,0,2,NA,"Crayfish,,,,NA",0,0,0,0,0,0,0,0,0,0,0,0,0,0,NA,NA,NA,NA,NA,NA,NA,NA,NA,NA,NA,NA,NA,NA,NA,NA,NA,NA,NA,NA,NA,NA,NA,NA,NA,NA,NA,NA,NA,NA,NA,NA,NA,NA,NA,NA,NA,NA,NA,NA,NA,NA,NA,NA,NA,NA,NA,NA,NA,NA,NA,NA,NA,NA,NA,NA,NA,NA,NA,NA,NA,NA,NA,NA,0,1,1,0,0,0,0,1,0,0,0,1,1,0,1,0,1,0,0,0,0,0,0,0,1,0,1,0,0,0,0,0,0,0,0,0,1,0,0,1,0,0,0,0,0,0,0,0,0,0,1,0,0,0,0,0,0,0,0,0,0,0,0,0,0,0,0,0,0
DCW,4,Door Creek Wild,DCW_4,5/12/2021,2021,5,12,11:46:00,12:18:00,0:32,"DCT, JT",Rural,43.004123,-89.255398,316175.1338,4763741.008,WIDNR,Lake Kegonsa-Yahara River,Door Creek,43.5,311,256,2010,Natural,0.035460993,0,0.326241135,0.028368794,0.609929078,0,0.014925373,0,0.451205511,0.014925373,0.518943743,0,0,0.332092757,0.021757801,0,0.011451474,0.000286,0.032922989,0.389063842,0,0.173489837,0,0.007729745,0.003149155,0,0.028056112,0.011737761,0.029487547,0.417119954,0.032922989,0.505582594,0.003149155,16,1,24,15,0,0,NA,NA,NA,NA,NA,NA,NA,NA,NA,1.5,16.4,434.35,7.48,0.21,368.75,18.4,334.06,NA,0,10,20,70,95,5,"Mud,Leaf Litter,",1,1,2,0,1,1.25,"Water high, more floating veg than previous",NA,33,16,11,2,6,17,0,33,0,4,2,1,0,0,0,0,0,0,0,0,NA,"Painted,Snapping",1,1,0,2,NA,Mudminnow,0,1,0,0,0,0,0,0,0,0,0,0,0,0,NA,NA,NA,NA,NA,NA,NA,NA,NA,NA,NA,NA,NA,NA,NA,NA,NA,NA,NA,NA,NA,NA,NA,NA,NA,NA,NA,NA,NA,NA,NA,NA,NA,NA,NA,NA,NA,NA,NA,NA,NA,NA,NA,NA,NA,NA,NA,NA,NA,NA,NA,NA,NA,NA,NA,NA,NA,NA,NA,NA,NA,NA,NA,NA,0,1,0,0,0,0,0,0,0,0,0,0,1,1,1,0,1,0,0,0,0,1,0,0,0,0,1,0,0,1,0,0,0,0,0,0,1,0,0,0,1,0,0,0,0,0,0,0,0,0,1,0,0,0,0,0,0,0,0,0,0,0,0,0,0,0,0,0,0
DCW,1,Door Creek Wild,DCW_1,6/19/2020,2020,6,19,9:15:00,10:09:00,0:54,"DCT, DP",Rural,43.004123,-89.255398,316175.1338,4763741.008,WIDNR,Lake Kegonsa-Yahara River,Door Creek,43.5,311,256,2010,Natural,0.035460993,0,0.326241135,0.028368794,0.609929078,0,0.014925373,0,0.451205511,0.014925373,0.518943743,0,0,0.332092757,0.021757801,0,0.011451474,0.000286,0.032922989,0.389063842,0,0.173489837,0,0.007729745,0.003149155,0,0.028056112,0.011737761,0.029487547,0.417119954,0.032922989,0.505582594,0.003149155,25,4,54,1,0,0,17.7,346.2,401.9,12.7,1.18,0.19,334.06,318.1,7.61,1.5,16.4,434.35,7.48,0.21,368.75,18.4,334.06,NA,0,0,10,90,NA,NA,NA,NA,NA,NA,NA,NA,NA,Only 5 sweeps due to dense mud layer and thick floating layer of Wolffia and forked dw. Only small section with submergent. Corixidae.,NA,33,16,11,2,6,17,0,33,0,4,2,1,0,0,0,0,0,0,0,0,NA,NA,0,0,0,2,NA,"Stickleback, Mudminnow,,,,NA",1,1,0,0,0,0,0,0,0,0,0,0,0,0,1,0,1,0,1,1,1,0,1,1,0,1,0,1,1,1,1,1,1,0,0,0,0,0,0,1,0,0,0,0,0,1,0,0,1,1,1,0,1,1,0,1,1,1,1,0,0,1,1,0,0,0,1,1,1,0,0,1,0,0,0,NA,3,NA,NA,NA,NA,NA,NA,NA,NA,NA,NA,NA,NA,NA,NA,NA,NA,NA,NA,NA,NA,NA,NA,NA,NA,NA,NA,NA,NA,NA,NA,NA,NA,NA,NA,NA,NA,NA,NA,NA,NA,NA,NA,NA,NA,NA,NA,NA,NA,NA,NA,NA,NA,NA,NA,NA,NA,NA,NA,NA,NA,NA,NA,NA,NA,NA,NA,NA,NA,NA,NA
DCW,2,Door Creek Wild,DCW_2,8/3/2020,2020,8,3,10:35:00,11:32:00,0:57,DCT,Rural,43.004123,-89.255398,316175.1338,4763741.008,WIDNR,Lake Kegonsa-Yahara River,Door Creek,43.5,311,256,2010,Natural,0.035460993,0,0.326241135,0.028368794,0.609929078,0,0.014925373,0,0.451205511,0.014925373,0.518943743,0,0,0.332092757,0.021757801,0,0.011451474,0.000286,0.032922989,0.389063842,0,0.173489837,0,0.007729745,0.003149155,0,0.028056112,0.011737761,0.029487547,0.417119954,0.032922989,0.505582594,0.003149155,15,11,76,100,0,0,19.1,414.7,466.8,20.1,1.81,0.23,5.49,419.4,7.35,1.5,16.4,434.35,7.48,0.21,368.75,18.4,334.06,NA,0,0,20,80,NA,NA,NA,NA,NA,NA,NA,NA,NA,"Totally covered with watermeal with forked beneath. Thick flocc in water column. Variety of emergent but steep bank, so little in water. Muskrat channels around entire pond.",NA,33,16,11,2,6,17,0,33,0,4,2,0,0,0,0,0,0,0,0,0,NA,"Painted,,,,NA",1,0,0,2,NA,"Mudminnow,,,,NA",0,1,0,0,0,0,0,0,0,0,0,0,0,0,NA,NA,NA,NA,NA,NA,NA,NA,NA,NA,NA,NA,NA,NA,NA,NA,NA,NA,NA,NA,NA,NA,NA,NA,NA,NA,NA,NA,NA,NA,NA,NA,NA,NA,NA,NA,NA,NA,NA,NA,NA,NA,NA,NA,NA,NA,NA,NA,NA,NA,NA,NA,NA,NA,NA,NA,NA,NA,NA,NA,NA,NA,NA,NA,NA,NA,NA,NA,NA,NA,NA,NA,NA,NA,NA,NA,NA,NA,NA,NA,NA,NA,NA,NA,NA,NA,NA,NA,NA,NA,NA,NA,NA,NA,NA,NA,NA,NA,NA,NA,NA,NA,NA,NA,NA,NA,NA,NA,NA,NA,NA,NA,NA,NA,NA,NA,NA,NA,NA,NA,NA,NA,NA,NA,NA,NA,NA,NA,NA,NA,NA,NA,NA
ET1,3,Edna Pond 1,ET1_3,6/1/2020,2020,6,1,8:42:00,9:21:00,0:39,DCT,Green Space,43.05608322,-89.3120198,311719.0125,4769636.993,CITY OF MADISON PARKS EDNA TAYLOR PARK,Lake Monona-Yahara River,Lake Monona-Yahara River,62.97,1832,NA,1957,Stormwater,0.134751773,0.482269504,0.262411348,0.028368794,0.092198582,0,0.610792193,0.135476464,0.136624569,0.066590126,0.041331803,0.009184845,0,0.001430206,0.050629291,0.148455378,0.368993135,0.231979405,0.090675057,0.042906178,0,0.024599542,0,0.01687643,0.003718535,0,0.019736842,0.749427918,0.067505721,0.062643021,0.090675057,0.026029748,0.003718535,16,9,57,100,1,0,19,114,128.8,25.8,2.34,0.06,183.61,297.4,6.88,5.97,71.65,161.25,7.07,0.08,196.43,22.18,86.08,NA,NA,75,23,2,50,50,"Super Muddy,Leaf Litter,NA",3,5,2,1,2.75,2.63,"Wide cattail perimeter that is not well defined, with portions of deep muskrat channels. Open water is deep with muddy flocc layer and difficult to navigate. Turbid and hard to tell submergent percentage, but little at surface. Very hard to gauge dominant plant type. `5 m from open water was considered site.",NA,41,10,25,3,6,31,0,41,0,3,3,0,0,0,0,0,0,0,0,0,NA,NA,0,0,0,0,NA,NA,0,0,0,0,0,0,0,0,0,0,0,0,0,0,NA,NA,NA,NA,NA,NA,NA,NA,NA,NA,NA,NA,NA,NA,NA,NA,NA,NA,NA,NA,NA,NA,NA,NA,NA,NA,NA,NA,NA,NA,NA,NA,NA,NA,NA,NA,NA,NA,NA,NA,NA,NA,NA,NA,NA,NA,NA,NA,NA,NA,NA,NA,NA,NA,NA,NA,NA,NA,NA,NA,NA,NA,NA,NA,0,1,0,1,0,0,0,0,1,1,0,0,0,0,0,0,0,0,0,0,0,0,0,0,0,0,0,0,0,0,0,0,0,1,0,0,0,0,0,0,0,0,0,0,0,0,0,0,0,0,0,0,0,0,0,0,0,0,0,0,0,0,0,0,0,0,0,0,0
ET1,4,Edna Pond 1,ET1_4,7/14/2020,2020,7,14,11:08:00,12:13:00,1:05,DCT,Green Space,43.05608322,-89.3120198,311719.0125,4769636.993,CITY OF MADISON PARKS EDNA TAYLOR PARK,Lake Monona-Yahara River,Lake Monona-Yahara River,62.97,1832,NA,1957,Stormwater,0.134751773,0.482269504,0.262411348,0.028368794,0.092198582,0,0.610792193,0.135476464,0.136624569,0.066590126,0.041331803,0.009184845,0,0.001430206,0.050629291,0.148455378,0.368993135,0.231979405,0.090675057,0.042906178,0,0.024599542,0,0.01687643,0.003718535,0,0.019736842,0.749427918,0.067505721,0.062643021,0.090675057,0.026029748,0.003718535,24,13,61,NA,1,0,24.7,96.2,96.8,98.6,7.96,0.04,419.75,215.8,7.25,5.97,71.65,161.25,7.07,0.08,196.43,22.18,86.08,NA,0,45,10,5,10,90,"Firm Soil,Super Muddy,Leaf Litter",4,2,3,1,2.5,2.63,"Emergent extremely thick around entire pond making access difficult. Percentage and dominant dependent on where you define site edge. Flooded into trees, but considered site to edge of typha as NHWL. Submergent up to surface. Water column filled with submergent and some between typha.",NA,41,10,25,3,6,31,0,41,0,3,3,1,1,0,0,0,0,0,0,0,NA,NA,0,0,0,0,NA,"Large schools of juv black bullhead catfish,,,,",0,0,0,0,0,0,0,0,1,0,0,0,0,0,NA,NA,NA,NA,NA,NA,NA,NA,NA,NA,NA,NA,NA,NA,NA,NA,NA,NA,NA,NA,NA,NA,NA,NA,NA,NA,NA,NA,NA,NA,NA,NA,NA,NA,NA,NA,NA,NA,NA,NA,NA,NA,NA,NA,NA,NA,NA,NA,NA,NA,NA,NA,NA,NA,NA,NA,NA,NA,NA,NA,NA,NA,NA,NA,0,1,0,1,0,0,0,0,1,1,0,0,0,0,0,1,1,0,0,1,0,0,0,0,0,0,0,0,0,0,0,0,0,1,0,0,0,0,0,0,0,1,0,0,0,0,0,0,0,0,0,0,0,0,0,1,0,0,0,0,0,0,0,0,0,0,0,0,0
ET1,1,Edna Pond 1,ET1_1,6/13/2019,2019,6,13,12:46:00,13:32:00,0:46,"DP,RH,EP,CL",Green Space,43.05608322,-89.3120198,311719.0125,4769636.993,CITY OF MADISON PARKS EDNA TAYLOR PARK,Lake Monona-Yahara River,Lake Monona-Yahara River,62.97,1832,270,1957,Stormwater,0.134751773,0.482269504,0.262411348,0.028368794,0.092198582,0,0.610792193,0.135476464,0.136624569,0.066590126,0.041331803,0.009184845,0,0.001430206,0.050629291,0.148455378,0.368993135,0.231979405,0.090675057,0.042906178,0,0.024599542,0,0.01687643,0.003718535,0,0.019736842,0.749427918,0.067505721,0.062643021,0.090675057,0.026029748,0.003718535,18,15,39,38,NA,2,21.8,318.6,339.1,84.2,7.17,0.16,69.02,170.6,NA,5.97,71.65,161.25,7.07,0.08,196.43,22.18,86.08,1.1,NA,NA,NA,NA,NA,NA,NA,NA,NA,NA,NA,NA,NA,NA,*other in veg=submerged *no VES,41,10,25,3,6,31,0,41,0,3,3,1,0,1,0,0,0,0,0,0,1,NA,0,0,0,0,NA,fathead minnows,0,0,0,0,0,1,1,0,0,0,NA,0,0,0,1,0,1,0,1,0,1,0,1,1,0,0,0,1,1,1,1,0,1,0,0,0,0,0,0,1,0,0,0,0,1,1,0,0,1,1,1,0,1,0,1,0,1,0,1,0,0,1,0,1,0,0,0,1,1,1,0,0,0,0,1,NA,0,NA,NA,NA,NA,NA,NA,NA,NA,NA,NA,NA,NA,NA,NA,NA,NA,NA,NA,NA,NA,NA,NA,NA,NA,NA,NA,NA,NA,NA,NA,NA,NA,NA,NA,NA,NA,NA,NA,NA,NA,NA,NA,NA,NA,NA,NA,NA,NA,NA,NA,NA,NA,NA,NA,NA,NA,NA,NA,NA,NA,NA,NA,NA,NA,NA,NA,NA,NA,NA,NA
ET1,2,Edna Pond 1,ET1_2,7/19/2019,2019,7,19,8:32:00,8:36:00,0:04,"BC,EC,CL",Green Space,43.05608322,-89.3120198,311719.0125,4769636.993,CITY OF MADISON PARKS EDNA TAYLOR PARK,Lake Monona-Yahara River,Lake Monona-Yahara River,62.97,1832,215,1957,Stormwater,0.134751773,0.482269504,0.262411348,0.028368794,0.092198582,0,0.610792193,0.135476464,0.136624569,0.066590126,0.041331803,0.009184845,0,0.001430206,0.050629291,0.148455378,0.368993135,0.231979405,0.090675057,0.042906178,0,0.024599542,0,0.01687643,0.003718535,0,0.019736842,0.749427918,0.067505721,0.062643021,0.090675057,0.026029748,0.003718535,NA,NA,NA,NA,NA,2,23.2,77.7,80.3,78,6.42,0.04,5.62,101.9,NA,5.97,71.65,161.25,7.07,0.08,196.43,22.18,86.08,0.76,NA,NA,NA,NA,NA,NA,NA,NA,NA,NA,NA,NA,NA,NA,"Large mosquito density, technicians could not reach main pond due to flooding and cattail density, modified survey protocol was implemented",41,10,25,3,6,31,0,41,0,3,3,0,0,0,0,0,0,0,0,0,0,NA,0,0,0,0,NA,Fatheads,0,0,1,0,0,0,0,0,0,0,NA,0,0,0,NA,NA,NA,NA,NA,NA,NA,NA,NA,NA,NA,NA,NA,NA,NA,NA,NA,NA,NA,NA,NA,NA,NA,NA,NA,NA,NA,NA,NA,NA,NA,NA,NA,NA,NA,NA,NA,NA,NA,NA,NA,NA,NA,NA,NA,NA,NA,NA,NA,NA,NA,NA,NA,NA,NA,NA,NA,NA,NA,NA,NA,NA,0,"Unable to reach main pond body due to flooding and cattail density, modified protocol employed",NA,NA,NA,NA,NA,NA,NA,NA,NA,NA,NA,NA,NA,NA,NA,NA,NA,NA,NA,NA,NA,NA,NA,NA,NA,NA,NA,NA,NA,NA,NA,NA,NA,NA,NA,NA,NA,NA,NA,NA,NA,NA,NA,NA,NA,NA,NA,NA,NA,NA,NA,NA,NA,NA,NA,NA,NA,NA,NA,NA,NA,NA,NA,NA,NA,NA,NA,NA,NA
ET2,3,Edna Pond 2,ET2_3,5/31/2020,2020,5,31,11:07:00,12:45:00,1:38,DCT,Green Space,43.05597012,-89.31349066,311598.881,4769627.735,CITY OF MADISON PARKS EDNA TAYLOR PARK,Lake Monona-Yahara River,Lake Monona-Yahara River,25.78,2111,NA,1968,Stormwater,0.129496403,0.323741007,0.395683453,0.057553957,0.09352518,0,0.547428571,0.158857143,0.156571429,0.073142857,0.054857143,0.009142857,0,0,0.053038991,0.143061927,0.385321101,0.219610092,0.095183486,0.040137615,0,0.023509174,0,0.018922018,0.002293578,0,0.018922018,0.747993119,0.071961009,0.059059633,0.095183486,0.023509174,0.002293578,16,6,44,0,2,5,20.8,145.1,157.9,67.9,5.98,0.07,172.05,225.6,7.21,5.42,62.93,198.13,6.96,0.09,187.55,22.25,91.1,NA,4,25,25,50,15,85,",,NA",3,2,3,5,3.25,3.38,"Great habitat with shallow emergent parts, deeper submergent parts, lots of woody debris, variety of plant species, firm soil areas, deep flocculent and Typha leaf litter areas. Although duckweed on top, deep submergent layer in water column.",NA,47,16,22,3,9,31,0,47,0,6,4,1,0,1,0,0,0,0,0,0,NA,"Painted,Snapping,,,NA",1,1,0,2,NA,"Fathead minnow, Mud Minnow,,,,NA",0,1,1,0,0,0,0,0,0,0,0,0,0,0,NA,NA,NA,NA,NA,NA,NA,NA,NA,NA,NA,NA,NA,NA,NA,NA,NA,NA,NA,NA,NA,NA,NA,NA,NA,NA,NA,NA,NA,NA,NA,NA,NA,NA,NA,NA,NA,NA,NA,NA,NA,NA,NA,NA,NA,NA,NA,NA,NA,NA,NA,NA,NA,NA,NA,NA,NA,NA,NA,NA,NA,NA,NA,NA,0,1,1,1,0,0,0,0,1,1,0,1,0,1,0,0,1,0,0,0,0,1,1,0,0,0,0,0,0,0,0,0,0,1,0,0,0,0,0,0,0,0,0,0,0,0,0,0,0,0,0,0,0,0,0,0,1,0,0,0,0,0,0,0,0,0,0,0,0
ET2,4,Edna Pond 2,ET2_4,7/14/2020,2020,7,14,12:34:00,13:34:00,1:00,DCT,Green Space,43.05597012,-89.31349066,311598.881,4769627.735,CITY OF MADISON PARKS EDNA TAYLOR PARK,Lake Monona-Yahara River,Lake Monona-Yahara River,25.78,2111,NA,1968,Stormwater,0.129496403,0.323741007,0.395683453,0.057553957,0.09352518,0,0.547428571,0.158857143,0.156571429,0.073142857,0.054857143,0.009142857,0,0,0.053038991,0.143061927,0.385321101,0.219610092,0.095183486,0.040137615,0,0.023509174,0,0.018922018,0.002293578,0,0.018922018,0.747993119,0.071961009,0.059059633,0.095183486,0.023509174,0.002293578,26,14,56,30,2,5,24.3,100.8,102.1,16.6,1.35,0.05,3.28,245.4,6.71,5.42,62.93,198.13,6.96,0.09,187.55,22.25,91.1,NA,1,10,20,70,50,50,"Firm Soil,Mud,Leaf Litter",1,5,3,5,3.5,3.38,"Parts with firm soil, others with mud and thicc flocculent, mostly around edges. Open water had thick submergent vegetation, edges muddy flocc. Hard to determine submergent. Lots of wood ducks (6) and CAGO (12), tons of frogs, few inverts most sweeps just mud.",NA,47,16,22,3,9,31,0,47,0,6,4,1,1,0,0,0,0,0,0,0,NA,"Painted,,,,",1,0,0,2,Garter,NA,0,0,0,0,0,0,0,0,0,0,0,0,0,0,NA,NA,NA,NA,NA,NA,NA,NA,NA,NA,NA,NA,NA,NA,NA,NA,NA,NA,NA,NA,NA,NA,NA,NA,NA,NA,NA,NA,NA,NA,NA,NA,NA,NA,NA,NA,NA,NA,NA,NA,NA,NA,NA,NA,NA,NA,NA,NA,NA,NA,NA,NA,NA,NA,NA,NA,NA,NA,NA,NA,NA,NA,NA,NA,0,1,1,1,0,0,0,0,1,1,1,0,1,1,0,1,1,0,0,0,0,1,0,0,0,0,0,0,0,1,0,0,0,1,0,0,0,0,0,0,0,0,0,0,0,0,0,0,0,0,0,0,0,0,0,0,0,0,0,0,0,0,0,0,0,0,0,0,0
ET2,1,Edna Pond 2,ET2_1,6/13/2019,2019,6,13,11:19:00,12:19:00,1:00,"DP,CL,RH,EP",Green Space,43.05597012,-89.31349066,311598.881,4769627.735,CITY OF MADISON PARKS EDNA TAYLOR PARK,Lake Monona-Yahara River,Lake Monona-Yahara River,25.78,2111,264,1968,Stormwater,0.129496403,0.323741007,0.395683453,0.057553957,0.09352518,0,0.547428571,0.158857143,0.156571429,0.073142857,0.054857143,0.009142857,0,0,0.053038991,0.143061927,0.385321101,0.219610092,0.095183486,0.040137615,0,0.023509174,0,0.018922018,0.002293578,0,0.018922018,0.747993119,0.071961009,0.059059633,0.095183486,0.023509174,0.002293578,18,15,47,14,NA,16,19.6,323.7,361.2,103.3,9.19,0.17,81.18,168.1,NA,5.42,62.93,198.13,6.96,0.09,187.55,22.25,91.1,1.3,NA,NA,NA,NA,NA,NA,NA,NA,NA,NA,NA,NA,NA,NA,*perimeter=227*other zoop tow lengths not listed,47,16,22,3,9,31,0,47,0,6,4,1,0,1,0,0,0,0,0,0,0,Painted,1,0,0,2,NA,fathead minnows,0,0,0,0,0,1,1,0,0,0,NA,0,0,0,1,0,1,0,1,0,1,0,1,1,0,0,0,1,1,1,1,0,1,0,0,0,0,0,0,1,0,0,0,0,0,0,0,0,1,1,1,0,1,1,1,0,0,1,1,0,0,0,1,1,0,0,0,0,1,1,0,0,0,0,0,NA,0,NA,NA,NA,NA,NA,NA,NA,NA,NA,NA,NA,NA,NA,NA,NA,NA,NA,NA,NA,NA,NA,NA,NA,NA,NA,NA,NA,NA,NA,NA,NA,NA,NA,NA,NA,NA,NA,NA,NA,NA,NA,NA,NA,NA,NA,NA,NA,NA,NA,NA,NA,NA,NA,NA,NA,NA,NA,NA,NA,NA,NA,NA,NA,NA,NA,NA,NA,NA,NA,NA
ET2,2,Edna Pond 2,ET2_2,7/19/2019,2019,7,19,8:07:00,8:22:00,0:15,"EC,BC,CL",Green Space,43.05597012,-89.31349066,311598.881,4769627.735,CITY OF MADISON PARKS EDNA TAYLOR PARK,Lake Monona-Yahara River,Lake Monona-Yahara River,25.78,2111,245,1968,Stormwater,0.129496403,0.323741007,0.395683453,0.057553957,0.09352518,0,0.547428571,0.158857143,0.156571429,0.073142857,0.054857143,0.009142857,0,0,0.053038991,0.143061927,0.385321101,0.219610092,0.095183486,0.040137615,0,0.023509174,0,0.018922018,0.002293578,0,0.018922018,0.747993119,0.071961009,0.059059633,0.095183486,0.023509174,0.002293578,24,0,NA,80,NA,16,24.3,169,171.3,63.9,5.16,0.08,20.08,111.1,NA,5.42,62.93,198.13,6.96,0.09,187.55,22.25,91.1,0.92,NA,NA,NA,NA,NA,NA,NA,NA,NA,NA,NA,NA,NA,NA,NA,47,16,22,3,9,31,0,47,0,6,4,1,1,0,1,0,0,0,0,0,0,NA,0,0,0,2,NA,NA,0,0,1,0,0,0,0,0,0,0,NA,0,0,0,NA,NA,NA,NA,NA,NA,NA,NA,NA,NA,NA,NA,NA,NA,NA,NA,NA,NA,NA,NA,NA,NA,NA,NA,NA,NA,NA,NA,NA,NA,NA,NA,NA,NA,NA,NA,NA,NA,NA,NA,NA,NA,NA,NA,NA,NA,NA,NA,NA,NA,NA,NA,NA,NA,NA,NA,NA,NA,NA,NA,NA,NA,10,NA,NA,NA,NA,NA,NA,NA,NA,NA,NA,NA,NA,NA,NA,NA,NA,NA,NA,NA,NA,NA,NA,NA,NA,NA,NA,NA,NA,NA,NA,NA,NA,NA,NA,NA,NA,NA,NA,NA,NA,NA,NA,NA,NA,NA,NA,NA,NA,NA,NA,NA,NA,NA,NA,NA,NA,NA,NA,NA,NA,NA,NA,NA,NA,NA,NA,NA,NA,NA,NA
ET3,3,Edna Pond 3,ET3_3,6/1/2020,2020,6,1,9:27:00,10:15:00,0:48,DCT,Green Space,43.05620248,-89.31418145,311543.3357,4769655.092,CITY OF MADISON PARKS EDNA TAYLOR PARK,Lake Monona-Yahara River,Lake Monona-Yahara River,25.78,2986,NA,2000,Stormwater,0.260869565,0.195652174,0.384057971,0.086956522,0.072463768,0,0.539170507,0.164746544,0.167050691,0.066820276,0.052995392,0.00921659,0,0,0.05291762,0.141304348,0.393306636,0.220823799,0.092677346,0.038615561,0,0.023455378,0,0.018878719,0.00228833,0,0.015732265,0.755434783,0.071796339,0.054347826,0.092677346,0.023455378,0.00228833,16,11,59,100,3,20,18.4,71.2,81.4,78.1,7.16,0.04,157.84,171.4,7.11,5.59,67.73,154.1,7.32,0.07,153.15,21.8,78.11,NA,4,90,12,8,95,5,"Super Muddy,leaf litter,NA",3,1,2,3,2.25,2.25,"Lots of emergent, but no cattails. Substrate deep mud with leaf litter and smells terrible. Very few submergent veg.",NA,32,14,15,0,3,18,0,32,0,3,2,1,0,0,0,0,0,0,0,0,NA,"Painted,,,,NA",1,0,0,1,NA,NA,0,0,0,0,0,0,0,0,0,0,0,0,0,0,NA,NA,NA,NA,NA,NA,NA,NA,NA,NA,NA,NA,NA,NA,NA,NA,NA,NA,NA,NA,NA,NA,NA,NA,NA,NA,NA,NA,NA,NA,NA,NA,NA,NA,NA,NA,NA,NA,NA,NA,NA,NA,NA,NA,NA,NA,NA,NA,NA,NA,NA,NA,NA,NA,NA,NA,NA,NA,NA,NA,NA,NA,NA,NA,0,1,0,1,0,0,0,1,1,0,0,0,1,1,0,1,0,0,0,0,0,0,0,0,0,0,0,0,0,0,0,0,0,0,0,0,0,0,0,0,0,0,0,0,1,0,0,0,0,0,0,0,0,0,1,0,0,1,0,0,0,0,0,0,0,0,0,0,0
ET3,4,Edna Pond 3,ET3_4,7/14/2020,2020,7,14,13:39:00,14:18:00,0:39,DCT,Green Space,43.05620248,-89.31418145,311543.3357,4769655.092,CITY OF MADISON PARKS EDNA TAYLOR PARK,Lake Monona-Yahara River,Lake Monona-Yahara River,25.78,2986,NA,2000,Stormwater,0.260869565,0.195652174,0.384057971,0.086956522,0.072463768,0,0.539170507,0.164746544,0.167050691,0.066820276,0.052995392,0.00921659,0,0,0.05291762,0.141304348,0.393306636,0.220823799,0.092677346,0.038615561,0,0.023455378,0,0.018878719,0.00228833,0,0.015732265,0.755434783,0.071796339,0.054347826,0.092677346,0.023455378,0.00228833,27,14,57,90,3,15,27.2,96,92,125.2,9.64,0.04,3.97,149.7,7.53,5.59,67.73,154.1,7.32,0.07,153.15,21.8,78.11,NA,7,75,15,10,95,5,"Super Muddy,Leaf Litter,NA",3,1,2,3,2.25,2.25,"Thick mud, with hair algae mats on top of leaf litter, but next to no submergent. Mosquitos bad, pond gross.",NA,32,14,15,0,3,18,0,32,0,3,2,1,1,0,0,0,0,0,0,0,NA,NA,0,0,0,1,NA,NA,0,0,0,0,0,0,0,0,0,0,0,0,0,0,NA,NA,NA,NA,NA,NA,NA,NA,NA,NA,NA,NA,NA,NA,NA,NA,NA,NA,NA,NA,NA,NA,NA,NA,NA,NA,NA,NA,NA,NA,NA,NA,NA,NA,NA,NA,NA,NA,NA,NA,NA,NA,NA,NA,NA,NA,NA,NA,NA,NA,NA,NA,NA,NA,NA,NA,NA,NA,NA,NA,NA,NA,NA,NA,0,1,0,1,0,0,0,1,1,0,0,1,0,1,1,1,1,0,0,0,0,1,0,0,0,0,0,0,0,0,0,0,0,0,0,0,0,0,0,0,0,0,0,0,1,0,0,0,0,0,0,0,0,0,1,0,0,1,0,0,0,0,0,0,0,0,0,0,0
ET3,1,Edna Pond 3,ET3_1,6/13/2019,2019,6,13,10:03:00,10:45:00,0:42,"DP,CL,RH,EP",Green Space,43.05620248,-89.31418145,311543.3357,4769655.092,CITY OF MADISON PARKS EDNA TAYLOR PARK,Lake Monona-Yahara River,Lake Monona-Yahara River,25.78,2986,270,2000,Stormwater,0.260869565,0.195652174,0.384057971,0.086956522,0.072463768,0,0.539170507,0.164746544,0.167050691,0.066820276,0.052995392,0.00921659,0,0,0.05291762,0.141304348,0.393306636,0.220823799,0.092677346,0.038615561,0,0.023455378,0,0.018878719,0.00228833,0,0.015732265,0.755434783,0.071796339,0.054347826,0.092677346,0.023455378,0.00228833,17,15,49,4,NA,17,17.9,318.5,368.8,2.8,0.26,0.18,71.25,202.6,NA,5.59,67.73,154.1,7.32,0.07,153.15,21.8,78.11,0.91,NA,NA,NA,NA,NA,NA,NA,NA,NA,NA,NA,NA,NA,NA,*other veg=lilypads *no VES (too big)  *completely covered in duckweed,32,14,15,0,3,18,0,32,0,3,2,0,0,0,0,0,0,0,0,0,0,Painted,1,0,0,1,NA,NA,0,0,0,0,0,0,0,0,0,0,NA,0,0,0,1,0,1,0,1,0,1,0,0,1,0,0,0,0,1,0,1,1,1,0,0,0,0,0,0,1,0,0,0,0,1,0,0,0,1,1,1,0,1,1,0,0,0,0,0,0,0,0,1,0,0,0,0,0,0,0,0,0,0,0,0,NA,0,NA,NA,NA,NA,NA,NA,NA,NA,NA,NA,NA,NA,NA,NA,NA,NA,NA,NA,NA,NA,NA,NA,NA,NA,NA,NA,NA,NA,NA,NA,NA,NA,NA,NA,NA,NA,NA,NA,NA,NA,NA,NA,NA,NA,NA,NA,NA,NA,NA,NA,NA,NA,NA,NA,NA,NA,NA,NA,NA,NA,NA,NA,NA,NA,NA,NA,NA,NA,NA,NA
ET3,2,Edna Pond 3,ET3_2,7/19/2019,2019,7,19,7:47:00,8:03:00,0:16,"BC,CL,EC",Green Space,43.05620248,-89.31418145,311543.3357,4769655.092,CITY OF MADISON PARKS EDNA TAYLOR PARK,Lake Monona-Yahara River,Lake Monona-Yahara River,25.78,2986,283,2000,Stormwater,0.260869565,0.195652174,0.384057971,0.086956522,0.072463768,0,0.539170507,0.164746544,0.167050691,0.066820276,0.052995392,0.00921659,0,0,0.05291762,0.141304348,0.393306636,0.220823799,0.092677346,0.038615561,0,0.023455378,0,0.018878719,0.00228833,0,0.015732265,0.755434783,0.071796339,0.054347826,0.092677346,0.023455378,0.00228833,74,6,84,NA,NA,17,23.7,72.3,74.2,64.8,5.28,0.03,5.24,88.9,NA,5.59,67.73,154.1,7.32,0.07,153.15,21.8,78.11,0.96,NA,NA,NA,NA,NA,NA,NA,NA,NA,NA,NA,NA,NA,NA,NA,32,14,15,0,3,18,0,32,0,3,2,1,0,0,0,0,0,0,0,0,0,NA,0,0,0,1,NA,NA,0,0,0,0,0,0,0,0,0,0,NA,0,0,0,NA,NA,NA,NA,NA,NA,NA,NA,NA,NA,NA,NA,NA,NA,NA,NA,NA,NA,NA,NA,NA,NA,NA,NA,NA,NA,NA,NA,NA,NA,NA,NA,NA,NA,NA,NA,NA,NA,NA,NA,NA,NA,NA,NA,NA,NA,NA,NA,NA,NA,NA,NA,NA,NA,NA,NA,NA,NA,NA,NA,NA,NA,9,"11 Sweeps, 3 Seines - Nothing",NA,NA,NA,NA,NA,NA,NA,NA,NA,NA,NA,NA,NA,NA,NA,NA,NA,NA,NA,NA,NA,NA,NA,NA,NA,NA,NA,NA,NA,NA,NA,NA,NA,NA,NA,NA,NA,NA,NA,NA,NA,NA,NA,NA,NA,NA,NA,NA,NA,NA,NA,NA,NA,NA,NA,NA,NA,NA,NA,NA,NA,NA,NA,NA,NA,NA,NA,NA,NA
ET4,3,Edna Pond 4,ET4_3,6/1/2020,2020,6,1,10:18:00,10:55:00,0:37,DCT,Green Space,43.05533418,-89.31571572,311415.7246,4769562.111,CITY OF MADISON PARKS EDNA TAYLOR PARK,Lake Monona-Yahara River,Lake Monona-Yahara River,30.47,906,NA,2000,Stormwater,0.251798561,0.201438849,0.446043165,0.079136691,0,0.021582734,0.462068966,0.191954023,0.195402299,0.070114943,0.071264368,0.009195402,0,0,0.052978236,0.123424971,0.395761741,0.217353952,0.103379152,0.04696449,0,0.023482245,0,0.018900344,0.002290951,0,0.015463918,0.736540664,0.07187858,0.062428408,0.103379152,0.023482245,0.002290951,17,10,63,98,2,8,16.7,112.8,134.2,27.2,2.58,0.06,146.38,189,7.02,3.38,38.93,137.43,6.97,0.07,184.12,19.98,57.3,NA,4,45,15,40,50,50,"Super Muddy,Rock ,NA",5,5,2,2,3.5,3.13,"Deep flocc and duckweed makes it hard to gauge submerged vegetation. Floating is a mix of wolffia, duckweed and algae.",NA,43,14,22,1,7,29,0,43,0,6,5,0,0,0,0,0,0,0,0,0,NA,"Painted,,,,NA",1,0,0,1,NA,NA,0,0,0,0,0,0,0,0,0,0,0,0,0,0,NA,NA,NA,NA,NA,NA,NA,NA,NA,NA,NA,NA,NA,NA,NA,NA,NA,NA,NA,NA,NA,NA,NA,NA,NA,NA,NA,NA,NA,NA,NA,NA,NA,NA,NA,NA,NA,NA,NA,NA,NA,NA,NA,NA,NA,NA,NA,NA,NA,NA,NA,NA,NA,NA,NA,NA,NA,NA,NA,NA,NA,NA,NA,NA,0,1,0,1,0,0,0,1,1,1,1,0,0,1,1,0,1,0,0,0,0,0,0,0,0,0,0,0,0,0,0,0,0,0,0,0,0,0,0,0,0,0,0,0,0,0,0,0,0,0,0,0,0,0,1,0,0,0,1,0,0,0,0,0,0,0,0,0,0
ET4,4,Edna Pond 4,ET4_4,7/14/2020,2020,7,14,14:26:00,14:59:00,0:33,DCT,Green Space,43.05533418,-89.31571572,311415.7246,4769562.111,CITY OF MADISON PARKS EDNA TAYLOR PARK,Lake Monona-Yahara River,Lake Monona-Yahara River,30.47,906,NA,2000,Stormwater,0.251798561,0.201438849,0.446043165,0.079136691,0,0.021582734,0.462068966,0.191954023,0.195402299,0.070114943,0.071264368,0.009195402,0,0,0.052978236,0.123424971,0.395761741,0.217353952,0.103379152,0.04696449,0,0.023482245,0,0.018900344,0.002290951,0,0.015463918,0.736540664,0.07187858,0.062428408,0.103379152,0.023482245,0.002290951,27,15,58,NA,2,8,22.9,96.9,101,49.5,4.13,0.05,41.37,241.37,6.92,3.38,38.93,137.43,6.97,0.07,184.12,19.98,57.3,NA,3,10,30,60,50,50,"Super Muddy,Leaf Litter,Rock ",1,5,3,2,2.75,3.13,"Drops off deep and muddy quickly. Submergent under wolffia, but also severla areas or bare mud. Hard to gauge submergent.",NA,43,14,22,1,7,29,0,43,0,6,5,1,0,0,0,0,0,0,0,0,NA,"Painted,,,,",1,0,0,1,NA,NA,0,0,0,0,0,0,0,0,0,0,0,0,0,0,NA,NA,NA,NA,NA,NA,NA,NA,NA,NA,NA,NA,NA,NA,NA,NA,NA,NA,NA,NA,NA,NA,NA,NA,NA,NA,NA,NA,NA,NA,NA,NA,NA,NA,NA,NA,NA,NA,NA,NA,NA,NA,NA,NA,NA,NA,NA,NA,NA,NA,NA,NA,NA,NA,NA,NA,NA,NA,NA,NA,NA,NA,NA,NA,0,1,0,1,0,0,0,1,1,1,1,0,1,1,1,0,1,0,0,1,0,0,0,0,0,0,0,1,0,0,0,0,0,0,0,0,0,0,0,0,0,0,0,0,0,0,0,0,0,0,0,0,0,0,1,0,0,0,1,0,0,0,0,0,0,0,0,0,0
ET4,1,Edna Pond 4,ET4_1,6/13/2019,2019,6,13,8:50:00,10:00:00,1:10,"DP,CL,RH,EP",Green Space,43.05533418,-89.31571572,311415.7246,4769562.111,CITY OF MADISON PARKS EDNA TAYLOR PARK,Lake Monona-Yahara River,Lake Monona-Yahara River,30.47,906,273,2000,Stormwater,0.251798561,0.201438849,0.446043165,0.079136691,0,0.021582734,0.462068966,0.191954023,0.195402299,0.070114943,0.071264368,0.009195402,0,0,0.052978236,0.123424971,0.395761741,0.217353952,0.103379152,0.04696449,0,0.023482245,0,0.018900344,0.002290951,0,0.015463918,0.736540664,0.07187858,0.062428408,0.103379152,0.023482245,0.002290951,14,15,56,0,NA,22,17.3,178.2,209.1,25.5,2.38,0.1,20.79,169.9,NA,3.38,38.93,137.43,6.97,0.07,184.12,19.98,57.3,0.51,NA,NA,NA,NA,NA,NA,NA,NA,NA,NA,NA,NA,NA,NA,*no substrate info *VES inaccurate,43,14,22,1,7,29,0,43,0,6,5,1,1,0,1,0,0,0,0,0,1,Painted,1,0,0,1,NA,fathead minnows,0,0,0,0,0,0,0,0,0,0,NA,0,0,0,1,1,1,0,1,1,1,0,1,1,0,0,0,1,1,1,1,0,1,0,0,0,0,0,1,0,0,0,0,0,0,0,0,0,1,1,1,0,1,1,0,0,0,0,1,0,0,0,1,1,0,0,1,0,1,0,0,0,0,0,0,NA,0,NA,NA,NA,NA,NA,NA,NA,NA,NA,NA,NA,NA,NA,NA,NA,NA,NA,NA,NA,NA,NA,NA,NA,NA,NA,NA,NA,NA,NA,NA,NA,NA,NA,NA,NA,NA,NA,NA,NA,NA,NA,NA,NA,NA,NA,NA,NA,NA,NA,NA,NA,NA,NA,NA,NA,NA,NA,NA,NA,NA,NA,NA,NA,NA,NA,NA,NA,NA,NA,NA
ET4,2,Edna Pond 4,ET4_2,7/19/2019,2019,7,19,7:21:00,7:44:00,0:23,"BC,CL,EC",Green Space,43.05533418,-89.31571572,311415.7246,4769562.111,CITY OF MADISON PARKS EDNA TAYLOR PARK,Lake Monona-Yahara River,Lake Monona-Yahara River,30.47,906,284,2000,Stormwater,0.251798561,0.201438849,0.446043165,0.079136691,0,0.021582734,0.462068966,0.191954023,0.195402299,0.070114943,0.071264368,0.009195402,0,0,0.052978236,0.123424971,0.395761741,0.217353952,0.103379152,0.04696449,0,0.023482245,0,0.018900344,0.002290951,0,0.015463918,0.736540664,0.07187858,0.062428408,0.103379152,0.023482245,0.002290951,22,12,84,70,NA,5,23,101.4,105.4,53.5,4.41,0.05,4.73,136.2,NA,3.38,38.93,137.43,6.97,0.07,184.12,19.98,57.3,1.05,NA,NA,NA,NA,NA,NA,NA,NA,NA,NA,NA,NA,NA,NA,NA,43,14,22,1,7,29,0,43,0,6,5,1,1,0,0,1,0,0,0,0,0,NA,0,0,0,1,NA,Fathead,0,0,1,0,0,0,0,0,0,0,NA,0,0,0,NA,NA,NA,NA,NA,NA,NA,NA,NA,NA,NA,NA,NA,NA,NA,NA,NA,NA,NA,NA,NA,NA,NA,NA,NA,NA,NA,NA,NA,NA,NA,NA,NA,NA,NA,NA,NA,NA,NA,NA,NA,NA,NA,NA,NA,NA,NA,NA,NA,NA,NA,NA,NA,NA,NA,NA,NA,NA,NA,NA,NA,Snails,6,NA,NA,NA,NA,NA,NA,NA,NA,NA,NA,NA,NA,NA,NA,NA,NA,NA,NA,NA,NA,NA,NA,NA,NA,NA,NA,NA,NA,NA,NA,NA,NA,NA,NA,NA,NA,NA,NA,NA,NA,NA,NA,NA,NA,NA,NA,NA,NA,NA,NA,NA,NA,NA,NA,NA,NA,NA,NA,NA,NA,NA,NA,NA,NA,NA,NA,NA,NA,NA,NA
ET5,3,Edna Pond 5,ET5_3,6/1/2020,2020,6,1,11:00:00,11:37:00,0:37,DCT,Green Space,43.05470366,-89.31633163,311363.6314,4769493.473,CITY OF MADISON PARKS EDNA TAYLOR PARK,Lake Monona-Yahara River,Lake Monona-Yahara River,11.59,2022,NA,2000,Stormwater,0.160583942,0.248175182,0.503649635,0.04379562,0,0.04379562,0.440229885,0.183908046,0.195402299,0.093103448,0.07816092,0.009195402,0,0,0.053008596,0.118051576,0.393123209,0.208022923,0.114613181,0.053581662,0,0.023495702,0,0.018911175,0.002292264,0,0.014899713,0.719197708,0.071919771,0.068481375,0.114613181,0.023495702,0.002292264,18,11,61,95,2,10,17.9,146.9,169.9,22,2.15,0.08,97.31,151.1,7.37,3.08,35.33,187.63,7.06,0.09,207.05,20.78,56.12,NA,2,25,2,73,20,80,"Mud,Vegetation,NA",3,2,1,3,2.25,1.88,"Very clear water and lots of submergent under duckweed. Although duckweed dominates surface, thick layer of pota. Spp. And coontail below.",NA,43,15,22,1,6,28,0,43,0,5,4,1,0,0,0,0,0,0,0,0,NA,"Painted,,,,NA",1,0,0,1,NA,"Possible small fish,,,,NA",0,0,0,0,1,0,0,0,0,0,0,0,0,0,NA,NA,NA,NA,NA,NA,NA,NA,NA,NA,NA,NA,NA,NA,NA,NA,NA,NA,NA,NA,NA,NA,NA,NA,NA,NA,NA,NA,NA,NA,NA,NA,NA,NA,NA,NA,NA,NA,NA,NA,NA,NA,NA,NA,NA,NA,NA,NA,NA,NA,NA,NA,NA,NA,NA,NA,NA,NA,NA,NA,NA,NA,NA,NA,0,1,0,1,0,0,0,1,0,0,1,0,1,1,0,0,1,0,0,0,0,0,0,1,0,0,0,0,0,0,0,0,0,0,0,0,0,0,0,0,0,0,0,0,1,0,0,0,0,0,0,0,0,0,0,0,0,0,0,0,0,0,0,0,0,0,0,0,0
ET5,4,Edna Pond 5,ET5_4,7/14/2020,2020,7,14,15:01:00,15:39:00,0:38,DCT,Green Space,43.05470366,-89.31633163,311363.6314,4769493.473,CITY OF MADISON PARKS EDNA TAYLOR PARK,Lake Monona-Yahara River,Lake Monona-Yahara River,11.59,2022,NA,2000,Stormwater,0.160583942,0.248175182,0.503649635,0.04379562,0,0.04379562,0.440229885,0.183908046,0.195402299,0.093103448,0.07816092,0.009195402,0,0,0.053008596,0.118051576,0.393123209,0.208022923,0.114613181,0.053581662,0,0.023495702,0,0.018911175,0.002292264,0,0.014899713,0.719197708,0.071919771,0.068481375,0.114613181,0.023495702,0.002292264,27,15,59,80,2,5,22.8,104,108.6,5,0.42,0.05,93.87,369.1,6.75,3.08,35.33,187.63,7.06,0.09,207.05,20.78,56.12,NA,0,5,10,85,5,95,"Mud,,NA",1,1,1,3,1.5,1.88,Thick submergent under wolffia layer. Steep bank with little actual emergent. Hard to gauge submergent.,NA,43,15,22,1,6,28,0,43,0,5,4,1,0,0,0,1,0,0,0,0,NA,"Painted,,,,NA",1,0,0,1,NA,NA,0,0,0,0,0,0,0,0,0,0,0,0,0,0,NA,NA,NA,NA,NA,NA,NA,NA,NA,NA,NA,NA,NA,NA,NA,NA,NA,NA,NA,NA,NA,NA,NA,NA,NA,NA,NA,NA,NA,NA,NA,NA,NA,NA,NA,NA,NA,NA,NA,NA,NA,NA,NA,NA,NA,NA,NA,NA,NA,NA,NA,NA,NA,NA,NA,NA,NA,NA,NA,NA,NA,NA,NA,NA,0,1,0,1,0,1,0,0,1,0,1,0,1,1,0,1,1,0,0,0,0,1,0,0,1,0,0,0,0,0,0,0,0,0,0,0,0,0,0,0,0,0,0,0,1,0,0,0,0,0,0,0,0,0,0,0,0,0,0,0,0,0,0,0,0,0,0,0,0
ET5,1,Edna Pond 5,ET5_1,6/13/2019,2019,6,13,13:50:00,14:40:00,0:50,"DP,CL,RH,EP",Green Space,43.05470366,-89.31633163,311363.6314,4769493.473,CITY OF MADISON PARKS EDNA TAYLOR PARK,Lake Monona-Yahara River,Lake Monona-Yahara River,11.59,2022,269,2000,Stormwater,0.160583942,0.248175182,0.503649635,0.04379562,0,0.04379562,0.440229885,0.183908046,0.195402299,0.093103448,0.07816092,0.009195402,0,0,0.053008596,0.118051576,0.393123209,0.208022923,0.114613181,0.053581662,0,0.023495702,0,0.018911175,0.002292264,0,0.014899713,0.719197708,0.071919771,0.068481375,0.114613181,0.023495702,0.002292264,19,13,36,14,NA,12,19.1,264.9,298.5,49.3,4.4,0.14,48.66,120.1,NA,3.08,35.33,187.63,7.06,0.09,207.05,20.78,56.12,0.71,NA,NA,NA,NA,NA,NA,NA,NA,NA,NA,NA,NA,NA,NA,*lots of dead snails *no VES *covered in duckweed *zoop tows were drags b/c of duckweed,43,15,22,1,6,28,0,43,0,5,4,1,1,1,0,0,0,0,0,0,1,NA,0,0,0,1,NA,NA,0,0,0,0,0,0,0,0,0,0,NA,0,0,0,1,0,1,0,1,0,1,0,1,1,0,0,0,0,1,1,1,0,1,0,0,0,0,0,0,0,0,0,0,0,0,0,0,0,1,1,1,0,1,1,0,1,0,1,1,0,0,0,1,1,0,0,1,1,1,0,1,0,0,0,0,NA,85,NA,NA,NA,NA,NA,NA,NA,NA,NA,NA,NA,NA,NA,NA,NA,NA,NA,NA,NA,NA,NA,NA,NA,NA,NA,NA,NA,NA,NA,NA,NA,NA,NA,NA,NA,NA,NA,NA,NA,NA,NA,NA,NA,NA,NA,NA,NA,NA,NA,NA,NA,NA,NA,NA,NA,NA,NA,NA,NA,NA,NA,NA,NA,NA,NA,NA,NA,NA,NA,NA
ET5,2,Edna Pond 5,ET5_2,7/19/2019,2019,7,19,8:47:00,9:02:00,0:15,"BC,EC,CL",Green Space,43.05470366,-89.31633163,311363.6314,4769493.473,CITY OF MADISON PARKS EDNA TAYLOR PARK,Lake Monona-Yahara River,Lake Monona-Yahara River,11.59,2022,271,2000,Stormwater,0.160583942,0.248175182,0.503649635,0.04379562,0,0.04379562,0.440229885,0.183908046,0.195402299,0.093103448,0.07816092,0.009195402,0,0,0.053008596,0.118051576,0.393123209,0.208022923,0.114613181,0.053581662,0,0.023495702,0,0.018911175,0.002292264,0,0.014899713,0.719197708,0.071919771,0.068481375,0.114613181,0.023495702,0.002292264,26,6,77,100,NA,13,23.3,167.8,173.5,65,5.35,0.08,22.4,187.9,NA,3.08,35.33,187.63,7.06,0.09,207.05,20.78,56.12,0.72,NA,NA,NA,NA,NA,NA,NA,NA,NA,NA,NA,NA,NA,NA,NA,43,15,22,1,6,28,0,43,0,5,4,1,0,0,0,0,0,0,0,0,0,Painted,1,0,0,1,NA,NA,0,0,0,0,0,0,0,0,0,0,NA,0,0,0,NA,NA,NA,NA,NA,NA,NA,NA,NA,NA,NA,NA,NA,NA,NA,NA,NA,NA,NA,NA,NA,NA,NA,NA,NA,NA,NA,NA,NA,NA,NA,NA,NA,NA,NA,NA,NA,NA,NA,NA,NA,NA,NA,NA,NA,NA,NA,NA,NA,NA,NA,NA,NA,NA,NA,NA,NA,NA,NA,NA,NA,NA,10,12 sweeps and 3 seines - nothing found,NA,NA,NA,NA,NA,NA,NA,NA,NA,NA,NA,NA,NA,NA,NA,NA,NA,NA,NA,NA,NA,NA,NA,NA,NA,NA,NA,NA,NA,NA,NA,NA,NA,NA,NA,NA,NA,NA,NA,NA,NA,NA,NA,NA,NA,NA,NA,NA,NA,NA,NA,NA,NA,NA,NA,NA,NA,NA,NA,NA,NA,NA,NA,NA,NA,NA,NA,NA,NA
ET6,3,Edna Pond 6,ET6_3,5/31/2020,2020,5,31,8:40:00,10:18:00,1:38,DCT,Green Space,43.05305414,-89.31525709,311446.0863,4769307.868,CITY OF MADISON PARKS EDNA TAYLOR PARK,Lake Monona-Yahara River,Lake Monona-Yahara River,23.03,5821,NA,1968,Stormwater,0.158273381,0.086330935,0.438848921,0,0.258992806,0.057553957,0.475372279,0.154639175,0.192439863,0.111111111,0.057273769,0.009163803,0,0,0.053008596,0.120057307,0.359312321,0.217191977,0.117191977,0.069340974,0,0.023495702,0,0.018911175,0.003724928,0,0.017765043,0.696561605,0.071919771,0.087106017,0.117191977,0.023495702,0.003724928,11,7,56,0,2,0,19.4,132.7,148.6,71.5,6.5,0.07,133.66,302.3,7.13,6.99,81.08,194.08,7.2,0.09,189.3,22.2,75.25,NA,6,75,13,12,50,50,"Mud,Leaf Litter,NA",3,5,2,1,2.75,2.5,"Shallow wetlands surround site, bordered by typha, typha leaves and mud is the substrate, then open water with pota spp. As the dominant submergent. Water fairly turbid and some light film and duckweed. Trees on edge of wetland but not directly over site. Fairly bust trail next to site.",NA,42,13,20,4,9,29,0,42,0,5,3,1,1,0,0,0,0,0,0,0,NA,"Painted,,,,NA",1,0,0,2,NA,"Fathead minnow, black bullhead catfish,,,,NA",0,0,1,0,0,0,0,0,1,0,0,0,0,0,NA,NA,NA,NA,NA,NA,NA,NA,NA,NA,NA,NA,NA,NA,NA,NA,NA,NA,NA,NA,NA,NA,NA,NA,NA,NA,NA,NA,NA,NA,NA,NA,NA,NA,NA,NA,NA,NA,NA,NA,NA,NA,NA,NA,NA,NA,NA,NA,NA,NA,NA,NA,NA,NA,NA,NA,NA,NA,NA,NA,NA,NA,NA,NA,0,1,0,1,0,0,0,0,0,1,0,0,0,1,0,1,1,0,0,0,0,0,1,0,0,0,0,0,0,0,0,0,0,0,0,0,0,0,0,0,0,1,0,0,0,0,0,0,0,0,0,0,0,0,0,0,0,0,1,0,0,0,0,0,0,0,0,0,0
ET6,4,Edna Pond 6,ET6_4,8/11/2020,2020,8,11,8:50:00,9:58:00,1:08,DCT,Green Space,43.05305414,-89.31525709,311446.0863,4769307.868,CITY OF MADISON PARKS EDNA TAYLOR PARK,Lake Monona-Yahara River,Lake Monona-Yahara River,23.03,5821,NA,1968,Stormwater,0.158273381,0.086330935,0.438848921,0,0.258992806,0.057553957,0.475372279,0.154639175,0.192439863,0.111111111,0.057273769,0.009163803,0,0,0.053008596,0.120057307,0.359312321,0.217191977,0.117191977,0.069340974,0,0.023495702,0,0.018911175,0.003724928,0,0.017765043,0.696561605,0.071919771,0.087106017,0.117191977,0.023495702,0.003724928,18,2,81,0,2,1,21.8,126.3,134.6,41.4,3.7,0.06,5.9,267.9,7.26,6.99,81.08,194.08,7.2,0.09,189.3,22.2,75.25,NA,0,30,20,50,60,40,"Mud,Super Muddy,NA",3,4,2,0,2.25,2.5,"Variety of submergent that is evenly distributed throughout pond, very little emergent aside from typha. Water significantly lower, with far less typha in water than previous. 1000s of shiners and tads and bullfrogs.",NA,42,13,20,4,9,29,0,42,0,5,3,0,1,0,0,0,0,0,0,0,NA,"Painted,Snapping,,,NA",1,1,0,2,NA,"Shiner,,,,NA",0,0,0,1,0,0,0,0,0,0,0,0,0,0,NA,NA,NA,NA,NA,NA,NA,NA,NA,NA,NA,NA,NA,NA,NA,NA,NA,NA,NA,NA,NA,NA,NA,NA,NA,NA,NA,NA,NA,NA,NA,NA,NA,NA,NA,NA,NA,NA,NA,NA,NA,NA,NA,NA,NA,NA,NA,NA,NA,NA,NA,NA,NA,NA,NA,NA,NA,NA,NA,NA,NA,NA,NA,NA,0,1,1,1,0,0,0,0,1,1,0,0,0,1,0,1,1,0,0,0,0,0,0,0,0,0,0,0,0,0,0,0,0,1,0,0,0,0,0,0,0,1,0,0,0,0,0,0,0,0,0,0,1,0,0,0,0,0,0,0,0,0,0,0,0,0,0,0,0
ET6,1,Edna Pond 6,ET6_1,6/13/2019,2019,6,13,14:52:00,15:30:00,0:38,"DP,CL,RH,EP",Green Space,43.05305414,-89.31525709,311446.0863,4769307.868,CITY OF MADISON PARKS EDNA TAYLOR PARK,Lake Monona-Yahara River,Lake Monona-Yahara River,23.03,5821,265,1968,Stormwater,0.158273381,0.086330935,0.438848921,0,0.258992806,0.057553957,0.475372279,0.154639175,0.192439863,0.111111111,0.057273769,0.009163803,0,0,0.053008596,0.120057307,0.359312321,0.217191977,0.117191977,0.069340974,0,0.023495702,0,0.018911175,0.003724928,0,0.017765043,0.696561605,0.071919771,0.087106017,0.117191977,0.023495702,0.003724928,21,13,34,17,NA,2,20.7,265.4,289.4,145.9,12.71,0.14,60.96,137.7,NA,6.99,81.08,194.08,7.2,0.09,189.3,22.2,75.25,0.88,NA,NA,NA,NA,NA,NA,NA,NA,NA,NA,NA,NA,NA,NA,*no VES *unknown adult frog,42,13,20,4,9,29,0,42,0,5,3,1,0,1,0,0,0,0,0,0,0,NA,0,0,0,2,NA,"large fish, minnows-probably fatheads",0,0,0,0,0,0,1,0,0,0,NA,0,0,0,1,0,1,0,1,0,0,0,1,0,0,0,0,1,1,1,1,0,1,0,0,0,0,0,0,0,0,0,0,0,0,1,0,0,1,1,1,0,1,1,0,0,0,1,1,0,0,0,1,1,0,1,0,0,1,0,0,0,0,0,1,NA,0,NA,NA,NA,NA,NA,NA,NA,NA,NA,NA,NA,NA,NA,NA,NA,NA,NA,NA,NA,NA,NA,NA,NA,NA,NA,NA,NA,NA,NA,NA,NA,NA,NA,NA,NA,NA,NA,NA,NA,NA,NA,NA,NA,NA,NA,NA,NA,NA,NA,NA,NA,NA,NA,NA,NA,NA,NA,NA,NA,NA,NA,NA,NA,NA,NA,NA,NA,NA,NA,NA
ET6,2,Edna Pond 6,ET6_2,7/9/2019,2019,7,9,9:12:00,9:25:00,0:13,"BC,EC,CL",Green Space,43.05305414,-89.31525709,311446.0863,4769307.868,CITY OF MADISON PARKS EDNA TAYLOR PARK,Lake Monona-Yahara River,Lake Monona-Yahara River,23.03,5821,266,1968,Stormwater,0.158273381,0.086330935,0.438848921,0,0.258992806,0.057553957,0.475372279,0.154639175,0.192439863,0.111111111,0.057273769,0.009163803,0,0,0.053008596,0.120057307,0.359312321,0.217191977,0.117191977,0.069340974,0,0.023495702,0,0.018911175,0.003724928,0,0.017765043,0.696561605,0.071919771,0.087106017,0.117191977,0.023495702,0.003724928,26,NA,77,NA,NA,2,26.9,211.1,203.7,65.5,5.05,0.1,31.12,49.3,NA,6.99,81.08,194.08,7.2,0.09,189.3,22.2,75.25,1.2,NA,NA,NA,NA,NA,NA,NA,NA,NA,NA,NA,NA,NA,NA,No pond type/garbage/shoreline vegetated,42,13,20,4,9,29,0,42,0,5,3,1,1,0,0,0,0,0,0,0,1,Painted,1,0,0,2,NA,NA,0,0,0,1,0,0,0,0,1,0,NA,0,0,0,NA,NA,NA,NA,NA,NA,NA,NA,NA,NA,NA,NA,NA,NA,NA,NA,NA,NA,NA,NA,NA,NA,NA,NA,NA,NA,NA,NA,NA,NA,NA,NA,NA,NA,NA,NA,NA,NA,NA,NA,NA,NA,NA,NA,NA,NA,NA,NA,NA,NA,NA,NA,NA,NA,NA,NA,NA,NA,NA,NA,NA,NA,16,NA,NA,NA,NA,NA,NA,NA,NA,NA,NA,NA,NA,NA,NA,NA,NA,NA,NA,NA,NA,NA,NA,NA,NA,NA,NA,NA,NA,NA,NA,NA,NA,NA,NA,NA,NA,NA,NA,NA,NA,NA,NA,NA,NA,NA,NA,NA,NA,NA,NA,NA,NA,NA,NA,NA,NA,NA,NA,NA,NA,NA,NA,NA,NA,NA,NA,NA,NA,NA,NA
ELV,4,Elver Pond,ELV_4,7/21/2020,2020,7,21,9:06:00,10:19:00,1:13,DCT,Green Space,43.03801484,-89.50464724,295971.6796,4768080.825,CITY OF MADISON PARKS ELVER PARK,Headwaters Sugar River,Badger Mill Creek,41.17,8349,NA,1987,Stormwater,0.34057971,0.166666667,0,0.108695652,0.347826087,0.036231884,0.291618829,0.272101033,0,0.049368542,0.381171068,0.005740528,0.000573,0.051590714,0.081398682,0.006018917,0.296073373,0.1501863,0.102894812,0.000573,0.014044139,0.192032101,0.00114646,0.085697908,0.010891373,0.006878762,0,0.45227859,0.181140728,0.000573,0.102894812,0.251648037,0.010891373,21,9,75,95,2,2,25.3,95.6,95,117.3,9.34,0.04,7.79,143.4,9.53,7.84,95.4,206.13,9.04,0.1,135.96,23.83,97.83,NA,2,85,5,10,80,20,"Firm Soil,Rock ,Sand",2,2,3,2,2.25,2,"Lots of CMS, but some native snails and lots of damsels. Buffer 1-4 m until mowed. Steep bank with little emergent in water. Coontail somewhat sparse but hard to gauge because water green and turbid.",NA,30,12,14,3,5,19,1,31,1,2,1,0,1,0,0,0,0,0,0,0,NA,NA,0,0,0,1,NA,"Sunfish,,,,",0,0,0,0,0,0,0,0,0,0,1,0,0,0,NA,NA,NA,NA,NA,NA,NA,NA,NA,NA,NA,NA,NA,NA,NA,NA,NA,NA,NA,NA,NA,NA,NA,NA,NA,NA,NA,NA,NA,NA,NA,NA,NA,NA,NA,NA,NA,NA,NA,NA,NA,NA,NA,NA,NA,NA,NA,NA,NA,NA,NA,NA,NA,NA,NA,NA,NA,NA,NA,NA,NA,NA,NA,NA,1,1,1,1,0,1,0,0,0,0,0,1,0,0,1,0,0,0,0,0,0,0,0,0,0,0,0,0,0,0,0,0,0,0,0,0,0,0,0,1,0,1,0,0,0,0,0,0,0,0,0,0,0,0,0,0,0,0,0,0,0,0,0,0,0,0,0,0,0
ELV,3,Elver Pond,ELV_3,5/29/2020,2020,5,29,16:05:00,17:07:00,1:02,DCT,Green Space,43.03801484,-89.50464724,295971.6796,4768080.825,CITY OF MADISON PARKS ELVER PARK,Headwaters Sugar River,Badger Mill Creek,41.17,8349,NA,1987,Stormwater,0.34057971,0.166666667,0,0.108695652,0.347826087,0.036231884,0.291618829,0.272101033,0,0.049368542,0.381171068,0.005740528,0.000573,0.051590714,0.081398682,0.006018917,0.296073373,0.1501863,0.102894812,0.000573,0.014044139,0.192032101,0.00114646,0.085697908,0.010891373,0.006878762,0,0.45227859,0.181140728,0.000573,0.102894812,0.251648037,0.010891373,16,12,55,25,2,2,21.5,188.7,202.1,105.7,9.03,0.1,161.37,169.3,8.55,7.84,95.4,206.13,9.04,0.1,135.96,23.83,97.83,NA,0,97,1,2,80,20,"Mud,Rock ,NA",1,2,2,2,1.75,2,"Tons of CMS, baby painted turtle, variety of submergent and emergent but all sparse. Long leaf Pota. Dominant in shallows but hard to tell whats in deeper water.",NA,30,12,14,3,5,19,1,31,1,2,1,0,1,0,0,0,0,0,0,0,NA,"Painted,,,,NA",1,0,0,1,NA,"Goldfish, Sunfish,,,,NA",0,0,0,0,0,0,0,0,0,1,1,0,0,0,NA,NA,NA,NA,NA,NA,NA,NA,NA,NA,NA,NA,NA,NA,NA,NA,NA,NA,NA,NA,NA,NA,NA,NA,NA,NA,NA,NA,NA,NA,NA,NA,NA,NA,NA,NA,NA,NA,NA,NA,NA,NA,NA,NA,NA,NA,NA,NA,NA,NA,NA,NA,NA,NA,NA,NA,NA,NA,NA,NA,NA,NA,NA,NA,1,1,1,1,0,0,0,0,0,0,0,1,0,1,1,1,0,0,1,0,0,0,0,0,0,0,0,0,0,0,0,0,0,0,0,0,0,0,0,0,0,0,0,0,0,0,0,0,0,0,0,0,0,0,0,0,0,0,0,0,0,0,0,0,0,0,0,0,0
ELV,1,Elver Pond,ELV_1,6/19/2019,2019,6,19,11:23:00,12:19:00,0:56,"CL,DP,EC",Green Space,43.03801484,-89.50464724,295971.6796,4768080.825,CITY OF MADISON PARKS ELVER PARK,Headwaters Sugar River,Badger Mill Creek,41.17,8349,323,1987,Stormwater,0.34057971,0.166666667,0,0.108695652,0.347826087,0.036231884,0.291618829,0.272101033,0,0.049368542,0.381171068,0.005740528,0.000573,0.051590714,0.081398682,0.006018917,0.296073373,0.1501863,0.102894812,0.000573,0.014044139,0.192032101,0.00114646,0.085697908,0.010891373,0.006878762,0,0.45227859,0.181140728,0.000573,0.102894812,0.251648037,0.010891373,19,5,83,100,NA,16,22.1,233.3,247.1,98,8.22,0.12,46.27,141.2,NA,7.84,95.4,206.13,9.04,0.1,135.96,23.83,97.83,1,NA,NA,NA,NA,NA,NA,NA,NA,NA,NA,NA,NA,NA,NA,other veg=phragmites,30,12,14,3,5,19,1,31,1,2,1,0,1,0,0,0,0,0,0,0,1,Painted,1,0,0,1,NA,goldfish,0,0,0,0,0,0,1,1,0,1,NA,0,0,0,0,0,0,0,1,0,0,0,0,0,0,0,0,1,1,0,0,0,1,0,0,0,0,0,0,0,0,0,0,1,0,0,0,0,0,1,1,1,1,1,0,1,0,0,0,0,0,0,1,1,0,0,1,1,0,1,0,1,0,0,0,"planorbids,CMS",25,NA,NA,NA,NA,NA,NA,NA,NA,NA,NA,NA,NA,NA,NA,NA,NA,NA,NA,NA,NA,NA,NA,NA,NA,NA,NA,NA,NA,NA,NA,NA,NA,NA,NA,NA,NA,NA,NA,NA,NA,NA,NA,NA,NA,NA,NA,NA,NA,NA,NA,NA,NA,NA,NA,NA,NA,NA,NA,NA,NA,NA,NA,NA,NA,NA,NA,NA,NA,NA,NA
ELV,2,Elver Pond,ELV_2,8/1/2019,2019,8,1,12:45:00,13:09:00,0:24,"CL,BC,EP",Green Space,43.03801484,-89.50464724,295971.6796,4768080.825,CITY OF MADISON PARKS ELVER PARK,Headwaters Sugar River,Badger Mill Creek,41.17,8349,NA,1987,Stormwater,0.34057971,0.166666667,0,0.108695652,0.347826087,0.036231884,0.291618829,0.272101033,0,0.049368542,0.381171068,0.005740528,0.000573,0.051590714,0.081398682,0.006018917,0.296073373,0.1501863,0.102894812,0.000573,0.014044139,0.192032101,0.00114646,0.085697908,0.010891373,0.006878762,0,0.45227859,0.181140728,0.000573,0.102894812,0.251648037,0.010891373,26,3,41,43,NA,16,26.4,287.6,280.3,60.6,4.76,0.13,85.85,89.95,NA,7.84,95.4,206.13,9.04,0.1,135.96,23.83,97.83,1.85,NA,NA,NA,NA,NA,NA,NA,NA,NA,NA,NA,NA,NA,NA,NA,30,12,14,3,5,19,1,31,1,2,1,0,1,0,0,0,0,0,0,0,0,Painted,1,0,0,1,NA,"goldfish,bluegill,green sunfish",0,0,0,0,0,0,0,0,0,0,NA,0,0,0,NA,NA,NA,NA,NA,NA,NA,NA,NA,NA,NA,NA,NA,NA,NA,NA,NA,NA,NA,NA,NA,NA,NA,NA,NA,NA,NA,NA,NA,NA,NA,NA,NA,NA,NA,NA,NA,NA,NA,NA,NA,NA,NA,NA,NA,NA,NA,NA,NA,NA,NA,NA,NA,NA,NA,NA,NA,NA,NA,NA,NA,NA,20,NA,NA,NA,NA,NA,NA,NA,NA,NA,NA,NA,NA,NA,NA,NA,NA,NA,NA,NA,NA,NA,NA,NA,NA,NA,NA,NA,NA,NA,NA,NA,NA,NA,NA,NA,NA,NA,NA,NA,NA,NA,NA,NA,NA,NA,NA,NA,NA,NA,NA,NA,NA,NA,NA,NA,NA,NA,NA,NA,NA,NA,NA,NA,NA,NA,NA,NA,NA,NA,NA
GPP,3,Garner Park Pond,GPP_3,6/3/2020,2020,6,3,8:35:00,9:05:00,0:30,DCT,Green Space,43.06354804,-89.4727964,298649.9544,4770839.485,CITY OF MADISON PARKS GARNER  PARK,Lake Mendota-Yahara River,Lake Mendota-Yahara River,569.68,3705,NA,1995,Stormwater,0.5,0.242857143,0,0.078571429,0.164285714,0.014285714,0.62456946,0.080367394,0,0.158438576,0.134328358,0.002296211,0.002288984,0.008297568,0.031759657,0.014020029,0.547639485,0.130472103,0.194563662,0,0,0.050357654,0,0.020028612,0.000572,0,0,0.692131617,0.051788269,0,0.194563662,0.058655222,0.000572,20,9,92,70,2,15,22.4,787,828,41.2,3.44,0.41,126.07,163.7,7.56,5.32,64.2,658.45,7.64,NA,152.53,23.43,193.8,NA,0,65,0,35,65,35,"Super Muddy,Leaf Litter,NA",4,4,2,4,3.5,3,"Heavily wooded around edges withou emergent. Thick band of pota. Spp. That floats to surface, lots of algae mixed in, in some areas.",NA,24,5,15,2,4,19,0,24,0,2,2,0,0,0,0,0,0,0,0,0,NA,NA,0,0,0,0,NA,NA,0,0,0,0,0,0,0,0,0,0,0,0,0,0,NA,NA,NA,NA,NA,NA,NA,NA,NA,NA,NA,NA,NA,NA,NA,NA,NA,NA,NA,NA,NA,NA,NA,NA,NA,NA,NA,NA,NA,NA,NA,NA,NA,NA,NA,NA,NA,NA,NA,NA,NA,NA,NA,NA,NA,NA,NA,NA,NA,NA,NA,NA,NA,NA,NA,NA,NA,NA,NA,NA,NA,NA,NA,NA,0,0,0,0,0,0,0,0,1,0,0,0,0,0,0,0,0,0,0,0,0,0,0,0,0,0,0,0,0,0,0,0,0,0,0,0,0,0,0,0,0,0,0,0,0,0,0,0,0,0,0,0,0,0,0,0,0,0,0,0,0,0,0,0,0,0,0,0,0
GPP,4,Garner Park Pond,GPP_4,7/24/2020,2020,7,24,8:38:00,9:35:00,0:57,DCT,Green Space,43.06354804,-89.4727964,298649.9544,4770839.485,CITY OF MADISON PARKS GARNER  PARK,Lake Mendota-Yahara River,Lake Mendota-Yahara River,569.68,3705,NA,1995,Stormwater,0.5,0.242857143,0,0.078571429,0.164285714,0.014285714,0.62456946,0.080367394,0,0.158438576,0.134328358,0.002296211,0.002288984,0.008297568,0.031759657,0.014020029,0.547639485,0.130472103,0.194563662,0,0,0.050357654,0,0.020028612,0.000572,0,0,0.692131617,0.051788269,0,0.194563662,0.058655222,0.000572,21,1,77,5,2,15,25,143.8,143.8,69.7,5.61,0.07,5.76,135.8,7.72,5.32,64.2,658.45,7.64,NA,152.53,23.43,193.8,NA,0,97,1,2,77,23,"Super Muddy,Leaf Litter,NA",1,3,2,4,2.5,3,"Turbid water, 1000's of water striders, Almost no emergent except on island. Steep bank surrounded by trees. Lots of sticks in the water. Mud gets very deep and boot sucking approx. 4 m out. Hard to gauge submergent, but only saw leafy PW and hair algae along edges.",NA,24,5,15,2,4,19,0,24,0,2,2,0,0,1,0,0,0,0,0,0,NA,NA,0,0,0,0,NA,"Fathead Minnow,,,,NA",0,0,1,0,0,0,0,0,0,0,0,0,0,0,NA,NA,NA,NA,NA,NA,NA,NA,NA,NA,NA,NA,NA,NA,NA,NA,NA,NA,NA,NA,NA,NA,NA,NA,NA,NA,NA,NA,NA,NA,NA,NA,NA,NA,NA,NA,NA,NA,NA,NA,NA,NA,NA,NA,NA,NA,NA,NA,NA,NA,NA,NA,NA,NA,NA,NA,NA,NA,NA,NA,NA,NA,NA,NA,1,1,0,0,0,0,0,0,1,1,0,0,1,0,0,0,0,0,0,0,0,0,0,0,0,0,0,0,0,0,0,0,0,0,0,0,0,0,0,0,0,0,0,0,0,0,0,0,0,0,0,0,0,0,0,0,0,0,0,0,0,0,0,0,0,0,0,0,0
GPP,1,Garner Park Pond,GPP_1,6/14/2019,2019,6,14,13:40:00,14:25:00,0:45,"ES,EC,ECL,BC,EP",Green Space,43.06354804,-89.4727964,298649.9544,4770839.485,CITY OF MADISON PARKS GARNER  PARK,Lake Mendota-Yahara River,Lake Mendota-Yahara River,569.68,3705,NA,1995,Stormwater,0.5,0.242857143,0,0.078571429,0.164285714,0.014285714,0.62456946,0.080367394,0,0.158438576,0.134328358,0.002296211,0.002288984,0.008297568,0.031759657,0.014020029,0.547639485,0.130472103,0.194563662,0,0,0.050357654,0,0.020028612,0.000572,0,0,0.692131617,0.051788269,0,0.194563662,0.058655222,0.000572,24,20,39,50,NA,5,20.8,NA,1330,103.2,8.85,NA,374.53,158.1,NA,5.32,64.2,658.45,7.64,NA,152.53,23.43,193.8,2.3,NA,NA,NA,NA,NA,NA,NA,NA,NA,NA,NA,NA,NA,NA,"No perimeter, no area (unable to walk the perimeter), no conductivity recorded,",24,5,15,2,4,19,0,24,0,2,2,0,0,1,0,0,0,0,0,0,0,NA,0,0,0,0,NA,Fatheads,0,0,1,0,0,0,0,0,0,0,NA,0,0,0,1,1,1,0,0,0,1,0,1,1,0,0,0,0,1,0,0,0,1,0,0,0,0,0,0,0,0,0,0,0,0,0,0,0,0,1,1,0,1,1,0,0,0,0,0,0,0,0,1,0,0,0,1,1,0,1,0,0,0,0,0,Planorbids,12,No stages recorded,NA,NA,NA,NA,NA,NA,NA,NA,NA,NA,NA,NA,NA,NA,NA,NA,NA,NA,NA,NA,NA,NA,NA,NA,NA,NA,NA,NA,NA,NA,NA,NA,NA,NA,NA,NA,NA,NA,NA,NA,NA,NA,NA,NA,NA,NA,NA,NA,NA,NA,NA,NA,NA,NA,NA,NA,NA,NA,NA,NA,NA,NA,NA,NA,NA,NA,NA,NA,NA
GPP,2,Garner Park Pond,GPP_2,7/16/2019,2019,7,16,7:45:00,8:04:00,0:19,"ES,EP,CL",Green Space,43.06354804,-89.4727964,298649.9544,4770839.485,CITY OF MADISON PARKS GARNER  PARK,Lake Mendota-Yahara River,Lake Mendota-Yahara River,569.68,3705,289,1995,Stormwater,0.5,0.242857143,0,0.078571429,0.164285714,0.014285714,0.62456946,0.080367394,0,0.158438576,0.134328358,0.002296211,0.002288984,0.008297568,0.031759657,0.014020029,0.547639485,0.130472103,0.194563662,0,0,0.050357654,0,0.020028612,0.000572,0,0,0.692131617,0.051788269,0,0.194563662,0.058655222,0.000572,22,7,87,80,NA,5,25.5,328.8,332,42.7,3.37,0.16,80.79,NA,NA,5.32,64.2,658.45,7.64,NA,152.53,23.43,193.8,1.96,NA,NA,NA,NA,NA,NA,NA,NA,NA,NA,NA,NA,NA,NA,toad metamorphs; turb not recorded,24,5,15,2,4,19,0,24,0,2,2,0,0,1,0,0,0,0,0,0,0,NA,0,0,0,0,NA,"fathead,bullhead catfish",0,0,1,0,0,0,0,0,1,0,NA,0,0,0,NA,NA,NA,NA,NA,NA,NA,NA,NA,NA,NA,NA,NA,NA,NA,NA,NA,NA,NA,NA,NA,NA,NA,NA,NA,NA,NA,NA,NA,NA,NA,NA,NA,NA,NA,NA,NA,NA,NA,NA,NA,NA,NA,NA,NA,NA,NA,NA,NA,NA,NA,NA,NA,NA,NA,NA,NA,NA,NA,NA,NA,"damselfly,planorbid",15,NA,NA,NA,NA,NA,NA,NA,NA,NA,NA,NA,NA,NA,NA,NA,NA,NA,NA,NA,NA,NA,NA,NA,NA,NA,NA,NA,NA,NA,NA,NA,NA,NA,NA,NA,NA,NA,NA,NA,NA,NA,NA,NA,NA,NA,NA,NA,NA,NA,NA,NA,NA,NA,NA,NA,NA,NA,NA,NA,NA,NA,NA,NA,NA,NA,NA,NA,NA,NA,NA
GCH,3,Greentree Pond,GCH_3,5/26/2020,2020,5,26,16:55:00,17:37:00,0:42,DCT,Green Space,43.04184272,-89.49836001,296496.519,4768490.665,CITY OF MADISON ENGINEER GREENTREE LANDFILL 537,Headwaters Sugar River,Badger Mill Creek,218.59,9185,NA,1968,Stormwater,0.375,0.111111111,0,0.166666667,0.298611111,0.048611111,0.667808219,0.023972603,0,0.184931507,0.115296804,0.007990868,0,0,0.028415614,0.045924225,0.435706085,0.157577497,0.159586682,0,0.008036739,0.122847302,0.000287,0.035304248,0.003444317,0.002870264,0,0.639207807,0.071756602,0,0.159586682,0.126004592,0.003444317,29,18,49,25,4,15,27,248.7,239.6,129.6,9.94,0.11,156.11,114.3,9.1,9.32,118.8,232,9.66,0.11,113.49,26.1,95.03,NA,2,99,1,0,98,2,",,NA",1,1,3,1,1.5,2.13,"Very trurbid, hard to determine submergent. Giant clams/mussells ~4in long at least a dozen around pond. Water looks like it fluctuates significantly. Steep bank then muddy beach ~4m wide. Tons of CMS",NA,34,10,14,5,10,24,0,34,0,5,3,0,1,1,0,0,0,0,0,0,NA,"Snapping,,,,NA",0,1,0,2,NA,NA,0,0,0,0,0,0,0,0,0,0,0,0,0,0,NA,NA,NA,NA,NA,NA,NA,NA,NA,NA,NA,NA,NA,NA,NA,NA,NA,NA,NA,NA,NA,NA,NA,NA,NA,NA,NA,NA,NA,NA,NA,NA,NA,NA,NA,NA,NA,NA,NA,NA,NA,NA,NA,NA,NA,NA,NA,NA,NA,NA,NA,NA,NA,NA,NA,NA,NA,NA,NA,NA,NA,NA,NA,NA,1,0,0,1,0,1,0,0,0,0,0,0,0,0,0,0,0,0,0,0,0,0,0,0,0,0,0,0,0,0,0,0,0,0,0,0,0,0,0,0,0,0,0,0,0,0,0,0,0,0,0,0,0,0,0,0,0,0,0,0,0,0,0,0,0,0,0,0,0
GCH,4,Greentree Pond,GCH_4,7/21/2020,2020,7,21,11:36:00,12:40:00,1:04,DCT,Green Space,43.04184272,-89.49836001,296496.519,4768490.665,CITY OF MADISON ENGINEER GREENTREE LANDFILL 537,Headwaters Sugar River,Badger Mill Creek,218.59,9185,NA,1968,Stormwater,0.375,0.111111111,0,0.166666667,0.298611111,0.048611111,0.667808219,0.023972603,0,0.184931507,0.115296804,0.007990868,0,0,0.028415614,0.045924225,0.435706085,0.157577497,0.159586682,0,0.008036739,0.122847302,0.000287,0.035304248,0.003444317,0.002870264,0,0.639207807,0.071756602,0,0.159586682,0.126004592,0.003444317,24,10,68,80,4,6,27.3,122.1,116.9,160.9,12.33,0.05,5.76,108.6,10.21,9.32,118.8,232,9.66,0.11,113.49,26.1,95.03,NA,9,85,5,10,75,25,"Mud,Rock ,Sand",2,3,3,3,2.75,2.13,"Rocky portions with breeding sunfish, but mostly muddy banks filled with Pinkweed. Water looks to fluctuate a lot. Submergent varies throughout, but coontail looks dominant in deep water. Lots of CMS also Sphaeridae, rams and giant mussels.",NA,34,10,14,5,10,24,0,34,0,5,3,0,1,0,0,0,0,0,0,0,NA,"Painted,,,,",0,1,0,2,NA,"Pumkinseed,,,,",0,0,0,0,0,0,1,0,0,0,0,0,0,0,NA,NA,NA,NA,NA,NA,NA,NA,NA,NA,NA,NA,NA,NA,NA,NA,NA,NA,NA,NA,NA,NA,NA,NA,NA,NA,NA,NA,NA,NA,NA,NA,NA,NA,NA,NA,NA,NA,NA,NA,NA,NA,NA,NA,NA,NA,NA,NA,NA,NA,NA,NA,NA,NA,NA,NA,NA,NA,NA,NA,NA,NA,NA,NA,1,0,0,1,0,1,0,0,1,0,0,1,0,0,1,1,0,0,0,0,0,0,0,0,0,0,0,0,0,0,0,0,0,1,0,0,0,0,0,0,0,1,0,0,0,0,0,0,1,0,0,0,0,0,0,0,0,0,0,0,0,0,0,0,0,0,0,0,0
GCH,1,Greentree Pond,GCH_1,6/19/2019,2019,6,19,12:45:00,13:58:00,1:13,"DP,CL,EC",Green Space,43.04184272,-89.49836001,296496.519,4768490.665,CITY OF MADISON ENGINEER GREENTREE LANDFILL 537,Headwaters Sugar River,Badger Mill Creek,218.59,9185,313,1968,Stormwater,0.375,0.111111111,0,0.166666667,0.298611111,0.048611111,0.667808219,0.023972603,0,0.184931507,0.115296804,0.007990868,0,0,0.028415614,0.045924225,0.435706085,0.157577497,0.159586682,0,0.008036739,0.122847302,0.000287,0.035304248,0.003444317,0.002870264,0,0.639207807,0.071756602,0,0.159586682,0.126004592,0.003444317,22,6,78,100,NA,16,22.5,245.7,258.3,131.9,10.97,0.12,51.21,136.2,NA,9.32,118.8,232,9.66,0.11,113.49,26.1,95.03,1.04,NA,NA,NA,NA,NA,NA,NA,NA,NA,NA,NA,NA,NA,NA,black spots on the sunfish-possible trematodes,34,10,14,5,10,24,0,34,0,5,3,0,1,0,0,0,0,0,0,0,1,snapping,0,1,0,2,NA,"sunfish,goldfish",0,0,1,0,0,0,1,1,1,0,NA,0,0,0,0,0,1,0,1,0,0,0,1,1,0,0,0,0,1,0,0,0,1,0,0,0,0,0,0,1,0,0,1,0,0,0,0,0,0,1,1,1,0,1,1,0,0,0,0,0,0,0,0,1,0,0,1,1,0,0,0,1,0,0,0,"planorbid,CMS",18,bluegill and pumpkin seeds have black spots all over possible trematodes,NA,NA,NA,NA,NA,NA,NA,NA,NA,NA,NA,NA,NA,NA,NA,NA,NA,NA,NA,NA,NA,NA,NA,NA,NA,NA,NA,NA,NA,NA,NA,NA,NA,NA,NA,NA,NA,NA,NA,NA,NA,NA,NA,NA,NA,NA,NA,NA,NA,NA,NA,NA,NA,NA,NA,NA,NA,NA,NA,NA,NA,NA,NA,NA,NA,NA,NA,NA,NA
GCH,2,Greentree Pond,GCH_2,8/1/2019,2019,8,1,13:25:00,14:40:00,1:15,"BC,CL,EP",Green Space,43.04184272,-89.49836001,296496.519,4768490.665,CITY OF MADISON ENGINEER GREENTREE LANDFILL 537,Headwaters Sugar River,Badger Mill Creek,218.59,9185,314,1968,Stormwater,0.375,0.111111111,0,0.166666667,0.298611111,0.048611111,0.667808219,0.023972603,0,0.184931507,0.115296804,0.007990868,0,0,0.028415614,0.045924225,0.435706085,0.157577497,0.159586682,0,0.008036739,0.122847302,0.000287,0.035304248,0.003444317,0.002870264,0,0.639207807,0.071756602,0,0.159586682,0.126004592,0.003444317,25,4,41,10,NA,13,27.6,328.8,313.2,52.8,4.05,0.15,77.78,94.87,NA,9.32,118.8,232,9.66,0.11,113.49,26.1,95.03,1.61,NA,NA,NA,NA,NA,NA,NA,NA,NA,NA,NA,NA,NA,NA,giant snapping turtle-40ish lbs,34,10,14,5,10,24,0,34,0,5,3,1,1,0,0,0,0,0,0,0,1,"Painted,Snapping",1,1,0,2,NA,NA,0,0,0,1,0,0,0,1,1,0,NA,0,0,0,NA,NA,NA,NA,NA,NA,NA,NA,NA,NA,NA,NA,NA,NA,NA,NA,NA,NA,NA,NA,NA,NA,NA,NA,NA,NA,NA,NA,NA,NA,NA,NA,NA,NA,NA,NA,NA,NA,NA,NA,NA,NA,NA,NA,NA,NA,NA,NA,NA,NA,NA,NA,NA,NA,NA,NA,NA,NA,NA,NA,NA,CMS,9,CMS in every sweep,NA,NA,NA,NA,NA,NA,NA,NA,NA,NA,NA,NA,NA,NA,NA,NA,NA,NA,NA,NA,NA,NA,NA,NA,NA,NA,NA,NA,NA,NA,NA,NA,NA,NA,NA,NA,NA,NA,NA,NA,NA,NA,NA,NA,NA,NA,NA,NA,NA,NA,NA,NA,NA,NA,NA,NA,NA,NA,NA,NA,NA,NA,NA,NA,NA,NA,NA,NA,NA
HPC,4,High Point Church Pond,HPC_4,7/16/2020,2020,7,16,7:15:00,8:40:00,1:25,DCT,Urban,43.07749016,-89.51566752,295205.4311,4772491.689,CITY OF MADISON ENGINEER STORMWATER UTILITY 533,Lake Mendota-Yahara River,Pheasant Branch,23.24,2792,NA,2005,Stormwater,0.459854015,0,0,0.540145985,0,0,0.770114943,0,0,0.229885057,0,0,0,0,0.001433075,0.046145027,0.477214101,0.24505589,0.216680997,0,0,0.006305532,0,0.006592147,0.000287,0,0.000287,0.768415019,0.008025222,0.000287,0.216680997,0.006305532,0.000287,19,2,96,95,5,0,21.5,50.2,53.9,6.6,0.56,0.02,15.96,135.4,6.98,4.66,57.13,118.53,8.05,0.06,136.71,22.65,74.44,NA,0,85,15,0,60,40,"Mud,Rock ,NA",2,4,2,2,2.5,2.5,"Water much higher than previous visit, rain the last 2 days. Active mowing during survey ~ 10m buffer from current water line. Submergent pushed up onto bank covering emergent and making percentages difficult. 100s of pounds of submergent out of water, pushed ~6ft high onto bank in some areas- must have been like a giant toilet bowl.",NA,38,16,14,3,8,22,0,38,0,5,3,1,0,0,0,0,0,0,0,0,NA,"Painted,Snapping,,,NA",1,1,0,2,NA,"Sunfish,,,,NA",0,0,0,0,0,0,0,0,0,0,1,0,0,0,NA,NA,NA,NA,NA,NA,NA,NA,NA,NA,NA,NA,NA,NA,NA,NA,NA,NA,NA,NA,NA,NA,NA,NA,NA,NA,NA,NA,NA,NA,NA,NA,NA,NA,NA,NA,NA,NA,NA,NA,NA,NA,NA,NA,NA,NA,NA,NA,NA,NA,NA,NA,NA,NA,NA,NA,NA,NA,NA,NA,NA,NA,NA,NA,0,1,1,1,0,1,0,0,0,0,1,1,1,0,0,1,0,0,0,0,0,1,0,0,1,0,0,0,0,0,0,0,0,0,0,0,0,0,0,1,0,0,0,0,1,0,0,0,0,0,0,0,0,0,0,0,0,0,0,0,0,0,0,0,0,0,0,0,0
HPC,3,High Point Church Pond,HPC_3,6/4/2020,2020,6,4,8:00:00,9:08:00,1:08,DCT,Urban,43.07749016,-89.51566752,295205.4311,4772491.689,CITY OF MADISON ENGINEER STORMWATER UTILITY 533,Lake Mendota-Yahara River,Pheasant Branch,23.24,2792,NA,2005,Stormwater,0.459854015,0,0,0.540145985,0,0,0.770114943,0,0,0.229885057,0,0,0,0,0.001433075,0.046145027,0.477214101,0.24505589,0.216680997,0,0,0.006305532,0,0.006592147,0.000287,0,0.000287,0.768415019,0.008025222,0.000287,0.216680997,0.006305532,0.000287,21,4,84,35,5,0,24.4,123.8,124.8,89.9,7.22,0.06,186.39,181.6,9.12,4.66,57.13,118.53,8.05,0.06,136.71,22.65,74.44,NA,0,90,1,9,15,85,"Super Muddy,Rock ,Sand",2,2,3,3,2.5,2.5,"Dense submergent veg. throughout, but mush is covered in algae, Some open sandy rocky areas near inflows with fish breeding , almost no emergent veg. enevn though it is shallow and gradual bank. Deep flocc in some parts.",NA,38,16,14,3,8,22,0,38,0,5,3,0,1,1,0,0,0,0,0,0,NA,"Painted,Snapping,,,",1,1,0,2,NA,"Bullhead Catfish, Fathead Minnow, Sunfish,,,,",0,0,1,0,0,0,0,0,1,0,1,0,0,0,NA,NA,NA,NA,NA,NA,NA,NA,NA,NA,NA,NA,NA,NA,NA,NA,NA,NA,NA,NA,NA,NA,NA,NA,NA,NA,NA,NA,NA,NA,NA,NA,NA,NA,NA,NA,NA,NA,NA,NA,NA,NA,NA,NA,NA,NA,NA,NA,NA,NA,NA,NA,NA,NA,NA,NA,NA,NA,NA,NA,NA,NA,NA,NA,0,1,0,1,0,0,0,0,1,0,0,1,0,1,0,0,0,0,0,0,0,0,0,0,1,0,0,0,0,0,0,0,0,0,0,0,0,0,0,0,0,0,0,0,1,0,1,0,0,0,0,0,0,0,0,0,1,0,0,0,0,0,0,0,0,0,0,0,0
HPC,1,High Point Church Pond,HPC_1,6/14/2019,2019,6,14,8:57:00,9:40:00,0:43,"ES,EC,CL,BC,EP",Urban,43.07749016,-89.51566752,295205.4311,4772491.689,CITY OF MADISON ENGINEER STORMWATER UTILITY 533,Lake Mendota-Yahara River,Pheasant Branch,23.24,2792,305,2005,Stormwater,0.459854015,0,0,0.540145985,0,0,0.770114943,0,0,0.229885057,0,0,0,0,0.001433075,0.046145027,0.477214101,0.24505589,0.216680997,0,0,0.006305532,0,0.006592147,0.000287,0,0.000287,0.768415019,0.008025222,0.000287,0.216680997,0.006305532,0.000287,17,12,61,73,NA,2,17.4,118.4,138.4,47.9,4.42,0.07,20.47,149.5,NA,4.66,57.13,118.53,8.05,0.06,136.71,22.65,74.44,1.48,NA,NA,NA,NA,NA,NA,NA,NA,NA,NA,NA,NA,NA,NA,"95% macrophytes just beneath surface,",38,16,14,3,8,22,0,38,0,5,3,0,0,1,0,0,0,0,0,0,0,Painted,1,0,0,2,NA,Sunfish sp.,0,0,0,0,0,0,0,0,1,0,NA,0,0,0,0,1,1,0,1,0,0,0,1,0,0,0,0,1,1,0,1,0,1,0,0,0,0,0,0,1,0,0,0,0,0,1,0,0,0,1,1,0,0,0,0,0,0,0,0,0,0,0,1,1,0,0,0,1,1,0,0,0,0,0,0,NA,6,NA,NA,NA,NA,NA,NA,NA,NA,NA,NA,NA,NA,NA,NA,NA,NA,NA,NA,NA,NA,NA,NA,NA,NA,NA,NA,NA,NA,NA,NA,NA,NA,NA,NA,NA,NA,NA,NA,NA,NA,NA,NA,NA,NA,NA,NA,NA,NA,NA,NA,NA,NA,NA,NA,NA,NA,NA,NA,NA,NA,NA,NA,NA,NA,NA,NA,NA,NA,NA,NA
HPC,2,High Point Church Pond,HPC_2,7/16/2019,2019,7,16,11:16:00,11:30:00,0:14,"ES,EP,CL",Urban,43.07749016,-89.51566752,295205.4311,4772491.689,CITY OF MADISON ENGINEER STORMWATER UTILITY 533,Lake Mendota-Yahara River,Pheasant Branch,23.24,2792,228,2005,Stormwater,0.459854015,0,0,0.540145985,0,0,0.770114943,0,0,0.229885057,0,0,0,0,0.001433075,0.046145027,0.477214101,0.24505589,0.216680997,0,0,0.006305532,0,0.006592147,0.000287,0,0.000287,0.768415019,0.008025222,0.000287,0.216680997,0.006305532,0.000287,28,4,58,30,NA,2,27.3,163.9,157,84.1,6.43,0.07,16.46,80.35,NA,4.66,57.13,118.53,8.05,0.06,136.71,22.65,74.44,1.12,NA,NA,NA,NA,NA,NA,NA,NA,NA,NA,NA,NA,NA,NA,NA,38,16,14,3,8,22,0,38,0,5,3,0,0,0,0,0,0,0,0,0,0,NA,0,0,0,2,NA,NA,0,0,0,0,0,0,1,0,0,0,NA,0,0,0,NA,NA,NA,NA,NA,NA,NA,NA,NA,NA,NA,NA,NA,NA,NA,NA,NA,NA,NA,NA,NA,NA,NA,NA,NA,NA,NA,NA,NA,NA,NA,NA,NA,NA,NA,NA,NA,NA,NA,NA,NA,NA,NA,NA,NA,NA,NA,NA,NA,NA,NA,NA,NA,NA,NA,NA,NA,NA,NA,NA,NA,NA,10,did 15 sweeps,NA,NA,NA,NA,NA,NA,NA,NA,NA,NA,NA,NA,NA,NA,NA,NA,NA,NA,NA,NA,NA,NA,NA,NA,NA,NA,NA,NA,NA,NA,NA,NA,NA,NA,NA,NA,NA,NA,NA,NA,NA,NA,NA,NA,NA,NA,NA,NA,NA,NA,NA,NA,NA,NA,NA,NA,NA,NA,NA,NA,NA,NA,NA,NA,NA,NA,NA,NA,NA
HP-UW,3,Hospital Pond,HP-UW_3,5/20/2020,2020,5,20,15:30:00,16:37:00,1:07,"DCT, DP",Urban,43.07849119,-89.42924194,302244.649,4772395.362,UNIV OF WIS REGENTS,Lake Mendota-Yahara River,Lake Mendota-Yahara River,189.97,4240,NA,1995,Stormwater,1,0,0,0,0,0,0.684210526,0.012585812,0.060640732,0.060640732,0.115560641,0.065217391,0.000287,0.004878049,0.01348637,0.096700143,0.237302726,0.230989957,0.099856528,0.024964132,0,0.064849354,0.000287,0.070014347,0.152080344,0.001721664,0.002582496,0.564992826,0.083500717,0.027546628,0.099856528,0.071736011,0.152080344,21,14,49,0,4,1,19.9,864,960,230.7,20.5,0.47,135.55,65.54,8.69,10.18,118.7,1077,8.38,0.53,63.54,22.23,189.45,NA,3,95,4,1,65,35,"Firm Soil,Super Muddy,",1,4,2,0,1.75,1.88,"Very turbid, can barely see bottom, steep bank, difficult to gauge submergent/substrate.",NA,28,13,10,4,6,16,1,29,1,2,1,0,0,0,0,0,0,0,0,0,NA,"Painted,,,,",1,0,0,1,NA,"Large fish,,,,",0,0,0,0,0,1,0,0,0,0,0,0,0,0,NA,NA,NA,NA,NA,NA,NA,NA,NA,NA,NA,NA,NA,NA,NA,NA,NA,NA,NA,NA,NA,NA,NA,NA,NA,NA,NA,NA,NA,NA,NA,NA,NA,NA,NA,NA,NA,NA,NA,NA,NA,NA,NA,NA,NA,NA,NA,NA,NA,NA,NA,NA,NA,NA,NA,NA,NA,NA,NA,NA,NA,NA,NA,NA,0,0,1,0,0,0,0,0,0,1,0,0,0,0,0,0,0,0,0,0,0,0,0,0,0,0,0,0,0,0,0,0,0,0,0,0,0,0,0,0,0,0,0,0,0,0,0,0,0,0,0,0,0,0,0,0,0,0,0,0,0,0,0,0,0,0,0,0,0
HP-UW,4,Hospital Pond,HP-UW_4,7/30/2020,2020,7,30,7:55:00,8:48:00,0:53,DCT,Urban,43.07849119,-89.42924194,302244.649,4772395.362,UNIV OF WIS REGENTS,Lake Mendota-Yahara River,Lake Mendota-Yahara River,189.97,4240,NA,1995,Stormwater,1,0,0,0,0,0,0.684210526,0.012585812,0.060640732,0.060640732,0.115560641,0.065217391,0.000287,0.004878049,0.01348637,0.096700143,0.237302726,0.230989957,0.099856528,0.024964132,0,0.064849354,0.000287,0.070014347,0.152080344,0.001721664,0.002582496,0.564992826,0.083500717,0.027546628,0.099856528,0.071736011,0.152080344,20,5,90,35,4,1,24.3,1015,1029,87.2,7.03,0.51,8.98,65.61,8.07,10.18,118.7,1077,8.38,0.53,63.54,22.23,189.45,NA,0,75,10,15,80,20,"Firm Soil,Rock ,Sand",3,2,3,0,2,1.88,"Deep water with floating veg. made difficult to gauge submergent, but seems like more milfoil. No amphibs, or insects detected. Large fish. Steep bank drops to .75m immediately.",NA,28,13,10,4,6,16,1,29,1,2,1,0,0,0,0,0,0,0,0,0,NA,NA,0,0,0,1,NA,"Sunfish, Carp,,,,",0,0,0,0,0,0,0,0,0,0,1,0,0,1,NA,NA,NA,NA,NA,NA,NA,NA,NA,NA,NA,NA,NA,NA,NA,NA,NA,NA,NA,NA,NA,NA,NA,NA,NA,NA,NA,NA,NA,NA,NA,NA,NA,NA,NA,NA,NA,NA,NA,NA,NA,NA,NA,NA,NA,NA,NA,NA,NA,NA,NA,NA,NA,NA,NA,NA,NA,NA,NA,NA,NA,NA,NA,NA,0,0,1,1,1,1,0,0,0,1,0,1,1,1,1,0,0,0,0,0,0,0,0,0,1,0,0,0,0,0,0,0,0,1,0,0,0,0,0,0,0,1,0,0,0,0,0,0,0,0,0,0,0,0,0,0,0,1,0,0,0,0,0,0,0,0,0,0,0
HP-UW,1,Hospital Pond,HP-UW_1,6/5/2019,2019,6,5,10:23:00,11:27:00,1:04,"ES,EC,EP,CL",Urban,43.07849119,-89.42924194,302244.649,4772395.362,UNIV OF WIS REGENTS,Lake Mendota-Yahara River,Lake Mendota-Yahara River,189.97,4240,NA,1995,Stormwater,1,0,0,0,0,0,0.684210526,0.012585812,0.060640732,0.060640732,0.115560641,0.065217391,0.000287,0.004878049,0.01348637,0.096700143,0.237302726,0.230989957,0.099856528,0.024964132,0,0.064849354,0.000287,0.070014347,0.152080344,0.001721664,0.002582496,0.564992826,0.083500717,0.027546628,0.099856528,0.071736011,0.152080344,23,6,72,35,NA,2,19.7,1033,1150,84.6,7.43,0.57,217.91,79.1,NA,10.18,118.7,1077,8.38,0.53,63.54,22.23,189.45,2.4,NA,NA,NA,NA,NA,NA,NA,NA,NA,NA,NA,NA,NA,NA,"other veg=phragmites,other turtle=unknown",28,13,10,4,6,16,1,29,1,2,1,0,0,0,1,0,0,0,0,0,0,"Painted,Other",1,0,0,1,NA,"sunfish,possible bass,large fish",0,0,0,1,0,0,1,1,0,0,NA,0,0,0,0,0,1,0,1,0,0,0,0,0,0,0,0,0,1,0,1,0,1,0,0,0,0,1,0,0,0,0,0,0,0,1,0,1,0,1,1,0,0,0,0,0,0,0,0,0,0,0,1,0,0,0,0,1,0,0,0,1,0,0,0,"physid snails,bloodworms,chironomids",13,NA,NA,NA,NA,NA,NA,NA,NA,NA,NA,NA,NA,NA,NA,NA,NA,NA,NA,NA,NA,NA,NA,NA,NA,NA,NA,NA,NA,NA,NA,NA,NA,NA,NA,NA,NA,NA,NA,NA,NA,NA,NA,NA,NA,NA,NA,NA,NA,NA,NA,NA,NA,NA,NA,NA,NA,NA,NA,NA,NA,NA,NA,NA,NA,NA,NA,NA,NA,NA,NA
HP-UW,2,Hospital Pond,HP-UW_2,7/10/2019,2019,7,10,13:20:00,13:45:00,0:25,"ES, EC, EP",Urban,43.07849119,-89.42924194,302244.649,4772395.362,UNIV OF WIS REGENTS,Lake Mendota-Yahara River,Lake Mendota-Yahara River,189.97,4240,252,1995,Stormwater,1,0,0,0,0,0,0.684210526,0.012585812,0.060640732,0.060640732,0.115560641,0.065217391,0.000287,0.004878049,0.01348637,0.096700143,0.237302726,0.230989957,0.099856528,0.024964132,0,0.064849354,0.000287,0.070014347,0.152080344,0.001721664,0.002582496,0.564992826,0.083500717,0.027546628,0.099856528,0.071736011,0.152080344,30,9,50,10,NA,2,25,1169,1169,72.3,5.76,0.58,214.9,43.91,NA,10.18,118.7,1077,8.38,0.53,63.54,22.23,189.45,3.93,NA,NA,NA,NA,NA,NA,NA,NA,NA,NA,NA,NA,NA,NA,NA,28,13,10,4,6,16,1,29,1,2,1,0,0,0,0,0,0,0,0,0,0,"Painted,Other",1,0,0,1,NA,"Perch, Bass, Sunfish",0,0,0,0,0,1,0,1,0,0,NA,0,0,0,NA,NA,NA,NA,NA,NA,NA,NA,NA,NA,NA,NA,NA,NA,NA,NA,NA,NA,NA,NA,NA,NA,NA,NA,NA,NA,NA,NA,NA,NA,NA,NA,NA,NA,NA,NA,NA,NA,NA,NA,NA,NA,NA,NA,NA,NA,NA,NA,NA,NA,NA,NA,NA,NA,NA,NA,NA,NA,NA,NA,NA,NA,0,No distance recorded for seines,NA,NA,NA,NA,NA,NA,NA,NA,NA,NA,NA,NA,NA,NA,NA,NA,NA,NA,NA,NA,NA,NA,NA,NA,NA,NA,NA,NA,NA,NA,NA,NA,NA,NA,NA,NA,NA,NA,NA,NA,NA,NA,NA,NA,NA,NA,NA,NA,NA,NA,NA,NA,NA,NA,NA,NA,NA,NA,NA,NA,NA,NA,NA,NA,NA,NA,NA,NA,NA
JKN,3,JK North Pond,JKN_3,5/26/2020,2020,5,26,11:40:00,12:15:00,0:35,DCT,Green Space,43.02563297,-89.40301025,304211.9866,4766463.591,DANE COUNTY Park Commission,Lake Monona-Yahara River,Lake Monona-Yahara River,47.96,1344,NA,2010,Natural,0.262411348,0.021276596,0.581560284,0.04964539,0.085106383,0,0.396096441,0.035591274,0.44087256,0.026406429,0.101033295,0,0,0.035519908,0.017187052,0.185047264,0.093382985,0.199369808,0.039530221,0.330564308,0,0.085648811,0,0.004869665,0,0.002291607,0.00658837,0.477800057,0.022056717,0.337152678,0.039530221,0.123460327,0,27,10,61,NA,0,1,24.5,717,725,44.8,3.62,0.35,156.22,334.9,7.26,4.81,57.73,923.75,7.4,0.46,318.28,21.8,145.31,NA,1,60,10,30,100,0,"Firm Soil,Mud,",5,1,2,1,2.25,2.25,"Water extremely turbid blackwater- lots of organic matter. Did not have waders on, depth is estimated. Floating mats along edge with water underneath.",NA,42,12,24,2,6,30,0,42,0,4,3,1,1,0,0,0,0,0,0,0,NA,NA,0,0,0,1,NA,NA,0,0,0,0,0,0,0,0,0,0,0,0,0,0,NA,NA,NA,NA,NA,NA,NA,NA,NA,NA,NA,NA,NA,NA,NA,NA,NA,NA,NA,NA,NA,NA,NA,NA,NA,NA,NA,NA,NA,NA,NA,NA,NA,NA,NA,NA,NA,NA,NA,NA,NA,NA,NA,NA,NA,NA,NA,NA,NA,NA,NA,NA,NA,NA,NA,NA,NA,NA,NA,NA,NA,NA,NA,NA,0,1,1,0,0,0,0,0,0,0,0,0,0,1,0,0,1,0,0,0,0,0,0,0,0,0,0,0,0,0,0,0,0,0,0,0,1,0,0,0,1,0,0,0,0,0,0,0,0,0,0,0,0,0,0,0,0,0,0,0,0,0,0,0,0,0,0,0,0
JKN,4,JK North Pond,JKN_4,8/12/2020,2020,8,12,9:22:00,10:29:00,1:07,DCT,Green Space,43.02563297,-89.40301025,304211.9866,4766463.591,DANE COUNTY Park Commission,Lake Monona-Yahara River,Lake Monona-Yahara River,47.96,1344,NA,2010,Natural,0.262411348,0.021276596,0.581560284,0.04964539,0.085106383,0,0.396096441,0.035591274,0.44087256,0.026406429,0.101033295,0,0,0.035519908,0.017187052,0.185047264,0.093382985,0.199369808,0.039530221,0.330564308,0,0.085648811,0,0.004869665,0,0.002291607,0.00658837,0.477800057,0.022056717,0.337152678,0.039530221,0.123460327,0,22,1,67,0,0,1,18.1,987,1137,5.8,0.53,0.57,4.47,504.2,7.54,4.81,57.73,923.75,7.4,0.46,318.28,21.8,145.31,NA,0,30,15,55,65,35,"Firm Soil,Mud,NA",3,4,2,0,2.25,2.25,"About half algae mat, half duckweed on top with dense forked DW belwo and covering submergent sago. Water very clear with flocculent layer ~20 cm below surface. Very different than JK-S. Saw large fish but did not catch in sweep.",NA,42,12,24,2,6,30,0,42,0,4,3,1,1,0,0,0,0,0,0,0,NA,"Painted,,,,NA",1,0,0,1,NA,"Possible sunfish, saw large fish dart,,,,NA",0,0,0,0,0,1,0,0,0,0,0,0,0,0,NA,NA,NA,NA,NA,NA,NA,NA,NA,NA,NA,NA,NA,NA,NA,NA,NA,NA,NA,NA,NA,NA,NA,NA,NA,NA,NA,NA,NA,NA,NA,NA,NA,NA,NA,NA,NA,NA,NA,NA,NA,NA,NA,NA,NA,NA,NA,NA,NA,NA,NA,NA,NA,NA,NA,NA,NA,NA,NA,NA,NA,NA,NA,NA,0,0,1,0,0,0,0,0,1,0,0,0,0,1,1,1,1,1,0,0,0,0,0,0,0,0,1,0,0,0,0,0,0,0,0,0,1,1,0,0,1,0,0,0,0,0,0,0,0,0,0,0,0,0,0,0,0,0,0,0,0,0,0,0,0,0,0,0,0
JKN,1,JK North Pond,JKN_1,6/6/2019,2019,6,6,10:45:00,12:00:00,1:15,"CL,JC,EL,EC,ES",Green Space,43.02563297,-89.40301025,304211.9866,4766463.591,DANE COUNTY Park Commission,Lake Monona-Yahara River,Lake Monona-Yahara River,47.96,1344,839,2010,Natural,0.262411348,0.021276596,0.581560284,0.04964539,0.085106383,0,0.396096441,0.035591274,0.44087256,0.026406429,0.101033295,0,0,0.035519908,0.017187052,0.185047264,0.093382985,0.199369808,0.039530221,0.330564308,0,0.085648811,0,0.004869665,0,0.002291607,0.00658837,0.477800057,0.022056717,0.337152678,0.039530221,0.123460327,0,23,1,64,40,NA,3,23.3,868,897,128.7,10.61,0.44,98.35,224.1,NA,4.81,57.73,923.75,7.4,0.46,318.28,21.8,145.31,1.19,NA,NA,NA,NA,NA,NA,NA,NA,NA,NA,NA,NA,NA,NA,NA,42,12,24,2,6,30,0,42,0,4,3,1,1,0,1,0,0,0,0,0,1,Painted,1,0,0,1,NA,NA,0,0,0,0,0,0,0,0,0,0,NA,0,0,0,1,0,1,0,1,0,1,0,1,1,0,0,0,1,1,1,1,0,1,0,0,0,0,0,0,0,0,0,0,0,1,1,0,0,1,1,1,0,0,0,1,0,1,0,1,0,0,1,1,1,1,0,1,0,1,1,0,1,0,0,0,NA,9,NA,NA,NA,NA,NA,NA,NA,NA,NA,NA,NA,NA,NA,NA,NA,NA,NA,NA,NA,NA,NA,NA,NA,NA,NA,NA,NA,NA,NA,NA,NA,NA,NA,NA,NA,NA,NA,NA,NA,NA,NA,NA,NA,NA,NA,NA,NA,NA,NA,NA,NA,NA,NA,NA,NA,NA,NA,NA,NA,NA,NA,NA,NA,NA,NA,NA,NA,NA,NA,NA
JKN,2,JK North Pond,JKN_2,8/1/2019,2019,8,1,10:41:00,11:13:00,0:32,"BC,CL,EP",Green Space,43.02563297,-89.40301025,304211.9866,4766463.591,DANE COUNTY Park Commission,Lake Monona-Yahara River,Lake Monona-Yahara River,47.96,1344,266,2010,Natural,0.262411348,0.021276596,0.581560284,0.04964539,0.085106383,0,0.396096441,0.035591274,0.44087256,0.026406429,0.101033295,0,0,0.035519908,0.017187052,0.185047264,0.093382985,0.199369808,0.039530221,0.330564308,0,0.085648811,0,0.004869665,0,0.002291607,0.00658837,0.477800057,0.022056717,0.337152678,0.039530221,0.123460327,0,23,2,51,5,NA,2,21.3,870,936,51.6,4.47,0.46,181.35,209.9,NA,4.81,57.73,923.75,7.4,0.46,318.28,21.8,145.31,2.77,NA,NA,NA,NA,NA,NA,NA,NA,NA,NA,NA,NA,NA,NA,other snail=clams,42,12,24,2,6,30,0,42,0,4,3,1,1,0,1,0,0,0,0,0,0,NA,0,0,0,1,NA,stickleback,1,0,0,0,0,0,0,0,0,0,NA,0,0,0,NA,NA,NA,NA,NA,NA,NA,NA,NA,NA,NA,NA,NA,NA,NA,NA,NA,NA,NA,NA,NA,NA,NA,NA,NA,NA,NA,NA,NA,NA,NA,NA,NA,NA,NA,NA,NA,NA,NA,NA,NA,NA,NA,NA,NA,NA,NA,NA,NA,NA,NA,NA,NA,NA,NA,NA,NA,NA,NA,NA,NA,crayfish,15,NA,NA,NA,NA,NA,NA,NA,NA,NA,NA,NA,NA,NA,NA,NA,NA,NA,NA,NA,NA,NA,NA,NA,NA,NA,NA,NA,NA,NA,NA,NA,NA,NA,NA,NA,NA,NA,NA,NA,NA,NA,NA,NA,NA,NA,NA,NA,NA,NA,NA,NA,NA,NA,NA,NA,NA,NA,NA,NA,NA,NA,NA,NA,NA,NA,NA,NA,NA,NA,NA
JKP-S,3,JK South Pond,JKP-S_3,8/12/2020,2020,8,12,8:00:00,9:05:00,1:05,DCT,Green Space,43.02468202,-89.40343032,304174.735,4766358.963,DANE COUNTY Park Commission,Lake Monona-Yahara River,Lake Monona-Yahara River,47.96,2694,NA,2010,Natural,0.036231884,0,0.797101449,0.028985507,0.137681159,0,0.278032037,0.049199085,0.530892449,0.033180778,0.108695652,0,0,0.041272571,0.014617369,0.161077673,0.092290054,0.181140728,0.040699341,0.348810547,0,0.099742046,0,0.008311837,0,0.002292921,0.009744913,0.434508455,0.022929206,0.35855546,0.040699341,0.143307538,0,19,2,77,0,0,1,19.3,635,713,25.8,2.32,0.35,8.07,438.3,7.76,7.33,91.17,677.33,7.62,0.33,374.4,23.83,97.75,NA,0,2,10,88,40,60,"Mud,Super Muddy,NA",4,5,2,0,2.75,2.5,"Water ~2m lower than previous with exposed mud bank. Thick layer of floating veg dominated by forked DW. Made gauging submergent difficult. Based on sweep, Elodia dominant. Tons of bullfrogs, possible green frogs but couldn't confirm. Lots of barn swallows using pond. No mow.",NA,46,15,23,2,8,31,0,46,0,6,4,0,1,0,0,0,0,0,0,0,NA,"Painted,Snapping,,,NA",1,1,0,2,NA,"Mudminnow,,,,NA",0,1,0,0,0,0,0,0,0,0,0,0,0,0,NA,NA,NA,NA,NA,NA,NA,NA,NA,NA,NA,NA,NA,NA,NA,NA,NA,NA,NA,NA,NA,NA,NA,NA,NA,NA,NA,NA,NA,NA,NA,NA,NA,NA,NA,NA,NA,NA,NA,NA,NA,NA,NA,NA,NA,NA,NA,NA,NA,NA,NA,NA,NA,NA,NA,NA,NA,NA,NA,NA,NA,NA,NA,NA,0,1,1,1,0,0,0,0,1,0,0,1,1,1,0,1,1,0,0,0,0,0,0,0,0,0,0,0,0,0,0,0,0,0,0,0,1,0,0,0,0,0,0,0,0,0,0,0,0,0,0,0,0,0,0,0,0,0,0,0,0,0,0,0,0,0,0,0,0
JKP-S,4,JK South Pond,JKP-S_4,5/14/2021,2021,5,14,11:10:00,12:00:00,0:50,DCT,Green Space,43.02468202,-89.40343032,304174.735,4766358.963,DANE COUNTY Park Commission,Lake Monona-Yahara River,Lake Monona-Yahara River,47.96,2694,843,2010,Natural,0.036231884,0,0.797101449,0.028985507,0.137681159,0,0.278032037,0.049199085,0.530892449,0.033180778,0.108695652,0,0,0.041272571,0.014617369,0.161077673,0.092290054,0.181140728,0.040699341,0.348810547,0,0.099742046,0,0.008311837,0,0.002292921,0.009744913,0.434508455,0.022929206,0.35855546,0.040699341,0.143307538,0,19,7,21,20,0,0,NA,NA,NA,NA,NA,NA,NA,NA,NA,7.33,91.17,677.33,7.62,0.33,374.4,23.83,97.75,NA,0,70,10,20,35,65,"Super Muddy,Leaf Litter,",1,4,3,1,2.25,2.5,"Something large jumped in the middle, possible large fish. Saw a Floater Clam. Lots of Pickerel frogs(4). Deep flocculent and lots of hair algae above and below surface.",NA,46,15,23,2,8,31,0,46,0,6,4,1,0,0,0,0,1,0,0,0,NA,"Painted,Snapping",1,1,0,2,NA,NA,0,0,0,0,0,0,0,0,0,0,0,0,0,0,NA,NA,NA,NA,NA,NA,NA,NA,NA,NA,NA,NA,NA,NA,NA,NA,NA,NA,NA,NA,NA,NA,NA,NA,NA,NA,NA,NA,NA,NA,NA,NA,NA,NA,NA,NA,NA,NA,NA,NA,NA,NA,NA,NA,NA,NA,NA,NA,NA,NA,NA,NA,NA,NA,NA,NA,NA,NA,NA,NA,NA,NA,NA,NA,0,1,1,1,0,1,1,0,0,0,0,0,0,1,0,1,1,0,0,0,0,0,0,0,0,0,1,0,0,0,0,0,0,0,0,0,1,1,0,0,1,0,0,0,0,0,0,0,0,0,0,0,0,0,0,0,0,0,0,0,0,0,0,0,0,0,0,0,0
JKP-S,1,JK South Pond,JKP-S_1,6/6/2019,2019,6,6,12:13:00,13:20:00,1:07,"CL,JC,EL,EC,ES",Green Space,43.02468202,-89.40343032,304174.735,4766358.963,DANE COUNTY Park Commission,Lake Monona-Yahara River,Lake Monona-Yahara River,47.96,2694,843,2010,Natural,0.036231884,0,0.797101449,0.028985507,0.137681159,0,0.278032037,0.049199085,0.530892449,0.033180778,0.108695652,0,0,0.041272571,0.014617369,0.161077673,0.092290054,0.181140728,0.040699341,0.348810547,0,0.099742046,0,0.008311837,0,0.002292921,0.009744913,0.434508455,0.022929206,0.35855546,0.040699341,0.143307538,0,25,2,63,21,0,2,24.7,602,605,187.6,15.09,0.29,72.78,263.7,NA,7.33,91.17,677.33,7.62,0.33,374.4,23.83,97.75,1.37,NA,NA,NA,NA,NA,NA,NA,NA,NA,NA,NA,NA,NA,NA,have two turbidity readings because AquaFlor shut down for awhile in the field,46,15,23,2,8,31,0,46,0,6,4,1,1,1,0,0,1,0,0,0,1,"Painted,Snapping",1,1,0,2,NA,"sunfish, unknown small sp.",0,0,0,0,0,0,0,0,0,0,1,0,0,0,1,0,1,1,1,0,1,0,1,1,0,1,0,1,1,0,1,0,1,0,0,0,1,0,0,1,0,0,0,1,0,1,0,0,1,1,1,0,1,0,0,1,0,0,1,0,0,0,1,1,1,0,0,0,0,0,0,0,0,0,0,NA,9,other minnow=unknown small sp.,NA,NA,NA,NA,NA,NA,NA,NA,NA,NA,NA,NA,NA,NA,NA,NA,NA,NA,NA,NA,NA,NA,NA,NA,NA,NA,NA,NA,NA,NA,NA,NA,NA,NA,NA,NA,NA,NA,NA,NA,NA,NA,NA,NA,NA,NA,NA,NA,NA,NA,NA,NA,NA,NA,NA,NA,NA,NA,NA,NA,NA,NA,NA,NA,NA,NA,NA,NA,NA
JKP-S,2,JK South Pond,JKP-S_2,5/26/2020,2020,5,26,12:24:00,12:55:00,0:31,DCT,Green Space,43.02468202,-89.40343032,304174.735,4766358.963,DANE COUNTY Park Commission,Lake Monona-Yahara River,Lake Monona-Yahara River,47.96,2694,NA,2010,Natural,0.036231884,0,0.797101449,0.028985507,0.137681159,0,0.278032037,0.049199085,0.530892449,0.033180778,0.108695652,0,0,0.041272571,0.014617369,0.161077673,0.092290054,0.181140728,0.040699341,0.348810547,0,0.099742046,0,0.008311837,0,0.002292921,0.009744913,0.434508455,0.022929206,0.35855546,0.040699341,0.143307538,0,28,10,56,40,0,0,27.5,748,714,60.1,4.59,0.35,122.72,421.2,7.47,7.33,91.17,677.33,7.62,0.33,374.4,23.83,97.75,NA,NA,40,5,55,NA,NA,NA,NA,NA,NA,NA,NA,NA,"Deep Flocc, Hard to estimate submergent percentage because of duckweed. Depth estimated, no waders.",NA,46,15,23,2,8,31,0,46,0,6,4,1,1,0,0,0,0,0,0,0,NA,"Painted,Snapping,,,NA",1,1,0,2,NA,NA,0,0,0,0,0,0,0,0,0,0,0,0,0,0,NA,NA,NA,NA,NA,NA,NA,NA,NA,NA,NA,NA,NA,NA,NA,NA,NA,NA,NA,NA,NA,NA,NA,NA,NA,NA,NA,NA,NA,NA,NA,NA,NA,NA,NA,NA,NA,NA,NA,NA,NA,NA,NA,NA,NA,NA,NA,NA,NA,NA,NA,NA,NA,NA,NA,NA,NA,NA,NA,NA,NA,NA,NA,NA,NA,NA,NA,NA,NA,NA,NA,NA,NA,NA,NA,NA,NA,NA,NA,NA,NA,NA,NA,NA,NA,NA,NA,NA,NA,NA,NA,NA,NA,NA,NA,NA,NA,NA,NA,NA,NA,NA,NA,NA,NA,NA,NA,NA,NA,NA,NA,NA,NA,NA,NA,NA,NA,NA,NA,NA,NA,NA,NA,NA,NA,NA,NA,NA,NA,NA,NA,NA,NA
KP,3,Kettle Pond,KP_3,5/25/2020,2020,5,25,7:38:00,9:56:00,2:18,DCT,Green Space,43.08040326,-89.47911001,298191.1869,4772726.552,CITY OF MADISON PARKS KETTLE POND,Lake Mendota-Yahara River,Lake Mendota-Yahara River,726.9,3725,NA,1937,Stormwater,0.402877698,0.035971223,0,0.561151079,0,0,0.507428571,0.202285714,0,0.286857143,0.003428571,0,0,0,0.065385718,0.011471179,0.363062805,0.05391454,0.213077144,0.001147118,0.022655578,0.029825065,0.000287,0.186980212,0.048752509,0,0.003441354,0.428448523,0.275021508,0.004588471,0.213077144,0.030111844,0.048752509,20,6,91,80,1,8,19.6,102.5,114.2,27.5,2.43,0.05,219.05,129.1,6.83,2.09,23.55,177.13,6.71,0.08,88.84,20.15,104.49,NA,10,20,20,60,100,0,"Firm Soil,Leaf Litter,NA",2,1,2,4,2.25,2.13,"Clear water, locals say it dries occassionaly, lots of tads, 2 frogs calling",NA,39,15,19,0,5,24,0,39,0,5,4,0,0,0,0,1,0,0,0,0,NA,"Painted,,,,NA",1,0,0,1,NA,NA,0,0,0,0,0,0,0,0,0,0,0,0,0,0,NA,NA,NA,NA,NA,NA,NA,NA,NA,NA,NA,NA,NA,NA,NA,NA,NA,NA,NA,NA,NA,NA,NA,NA,NA,NA,NA,NA,NA,NA,NA,NA,NA,NA,NA,NA,NA,NA,NA,NA,NA,NA,NA,NA,NA,NA,NA,NA,NA,NA,NA,NA,NA,NA,NA,NA,NA,NA,NA,NA,NA,NA,NA,NA,0,1,0,0,0,0,0,0,0,1,1,0,0,1,1,0,0,0,0,0,0,0,0,0,0,0,0,0,0,0,0,0,0,0,0,0,0,0,0,0,0,0,0,0,0,0,0,0,0,0,0,0,0,0,0,0,0,1,0,0,0,0,0,0,0,0,0,0,0
KP,4,Kettle Pond,KP_4,8/2/2020,2020,8,2,7:10:00,8:54:00,1:44,"DCT, Lucas",Green Space,43.08040326,-89.47911001,298191.1869,4772726.552,CITY OF MADISON PARKS KETTLE POND,Lake Mendota-Yahara River,Lake Mendota-Yahara River,726.9,3725,NA,1937,Stormwater,0.402877698,0.035971223,0,0.561151079,0,0,0.507428571,0.202285714,0,0.286857143,0.003428571,0,0,0,0.065385718,0.011471179,0.363062805,0.05391454,0.213077144,0.001147118,0.022655578,0.029825065,0.000287,0.186980212,0.048752509,0,0.003441354,0.428448523,0.275021508,0.004588471,0.213077144,0.030111844,0.048752509,19,4,86,15,1,10,19.6,76.5,85.5,3.8,0.34,0.04,3.05,14.6,6.58,2.09,23.55,177.13,6.71,0.08,88.84,20.15,104.49,NA,0,10,30,60,93,7,"Mud,,NA",1,1,1,5,2,2.13,"Variety of floating, almost no submergent. Water level ~2m lower than NHWL. Very few insects in sweeps compared to first visit.",NA,39,15,19,0,5,24,0,39,0,5,4,1,0,0,0,0,0,0,0,0,NA,NA,0,0,0,1,NA,NA,0,0,0,0,0,0,0,0,0,0,0,0,0,0,NA,NA,NA,NA,NA,NA,NA,NA,NA,NA,NA,NA,NA,NA,NA,NA,NA,NA,NA,NA,NA,NA,NA,NA,NA,NA,NA,NA,NA,NA,NA,NA,NA,NA,NA,NA,NA,NA,NA,NA,NA,NA,NA,NA,NA,NA,NA,NA,NA,NA,NA,NA,NA,NA,NA,NA,NA,NA,NA,NA,NA,NA,NA,NA,0,1,0,0,0,1,0,0,1,1,0,0,0,1,1,0,1,0,0,1,0,1,1,0,0,0,1,0,0,0,0,0,0,0,0,0,0,0,0,1,0,1,0,0,0,0,0,0,0,0,0,0,0,0,0,0,0,1,0,0,0,0,0,0,0,0,0,0,0
KP,1,Kettle Pond,KP_1,6/14/2019,2019,6,14,12:30:00,13:20:00,0:50,"ES,EC,EP,CL,BC",Green Space,43.08040326,-89.47911001,298191.1869,4772726.552,CITY OF MADISON PARKS KETTLE POND,Lake Mendota-Yahara River,Lake Mendota-Yahara River,726.9,3725,277,1937,Stormwater,0.402877698,0.035971223,0,0.561151079,0,0,0.507428571,0.202285714,0,0.286857143,0.003428571,0,0,0,0.065385718,0.011471179,0.363062805,0.05391454,0.213077144,0.001147118,0.022655578,0.029825065,0.000287,0.186980212,0.048752509,0,0.003441354,0.428448523,0.275021508,0.004588471,0.213077144,0.030111844,0.048752509,24,16,43,90,NA,5,16.9,238.1,281.1,40.1,3.75,0.13,57,114.3,NA,2.09,23.55,177.13,6.71,0.08,88.84,20.15,104.49,0.47,NA,NA,NA,NA,NA,NA,NA,NA,NA,NA,NA,NA,NA,NA,other=pseudecris sp,39,15,19,0,5,24,0,39,0,5,4,0,0,1,0,1,0,0,0,0,0,NA,0,0,0,1,NA,NA,0,0,0,0,0,0,0,0,0,0,NA,0,0,0,1,0,1,0,1,0,1,0,1,1,0,1,0,0,1,0,0,1,1,0,0,0,0,0,0,0,0,0,1,0,0,0,0,0,0,1,1,0,0,1,0,1,0,1,1,0,0,1,1,1,0,1,0,0,0,0,0,1,0,0,0,"planorbid,belestoma,mayfly,backswimmers,damselfly",9,other amphib=psuedacris sp.,NA,NA,NA,NA,NA,NA,NA,NA,NA,NA,NA,NA,NA,NA,NA,NA,NA,NA,NA,NA,NA,NA,NA,NA,NA,NA,NA,NA,NA,NA,NA,NA,NA,NA,NA,NA,NA,NA,NA,NA,NA,NA,NA,NA,NA,NA,NA,NA,NA,NA,NA,NA,NA,NA,NA,NA,NA,NA,NA,NA,NA,NA,NA,NA,NA,NA,NA,NA,NA
KP,2,Kettle Pond,KP_2,7/16/2019,2019,7,16,11:50:00,12:15:00,0:25,"ES,EP,CL",Green Space,43.08040326,-89.47911001,298191.1869,4772726.552,CITY OF MADISON PARKS KETTLE POND,Lake Mendota-Yahara River,Lake Mendota-Yahara River,726.9,3725,283,1937,Stormwater,0.402877698,0.035971223,0,0.561151079,0,0,0.507428571,0.202285714,0,0.286857143,0.003428571,0,0,0,0.065385718,0.011471179,0.363062805,0.05391454,0.213077144,0.001147118,0.022655578,0.029825065,0.000287,0.186980212,0.048752509,0,0.003441354,0.428448523,0.275021508,0.004588471,0.213077144,0.030111844,0.048752509,28,4,58,5,NA,5,24.5,25.4,227.7,22.8,1.84,0.11,37.43,97.37,NA,2.09,23.55,177.13,6.71,0.08,88.84,20.15,104.49,0.85,NA,NA,NA,NA,NA,NA,NA,NA,NA,NA,NA,NA,NA,NA,NA,39,15,19,0,5,24,0,39,0,5,4,0,0,0,0,1,0,0,0,0,0,NA,0,0,0,1,NA,NA,0,0,0,0,0,0,0,0,0,0,NA,0,0,0,NA,NA,NA,NA,NA,NA,NA,NA,NA,NA,NA,NA,NA,NA,NA,NA,NA,NA,NA,NA,NA,NA,NA,NA,NA,NA,NA,NA,NA,NA,NA,NA,NA,NA,NA,NA,NA,NA,NA,NA,NA,NA,NA,NA,NA,NA,NA,NA,NA,NA,NA,NA,NA,NA,NA,NA,NA,NA,NA,NA,NA,NA,0,other amphibian=pseudacris,NA,NA,NA,NA,NA,NA,NA,NA,NA,NA,NA,NA,NA,NA,NA,NA,NA,NA,NA,NA,NA,NA,NA,NA,NA,NA,NA,NA,NA,NA,NA,NA,NA,NA,NA,NA,NA,NA,NA,NA,NA,NA,NA,NA,NA,NA,NA,NA,NA,NA,NA,NA,NA,NA,NA,NA,NA,NA,NA,NA,NA,NA,NA,NA,NA,NA,NA,NA,NA
L60-UW,3,Lot 60 Pond,L60-UW_3,5/20/2020,2020,5,20,12:51:00,NA,NA,DCT,Urban,43.08113195,-89.42700781,302435.0186,4772683.368,UNIV OF WIS REGENTS,Lake Mendota-Yahara River,Lake Mendota-Yahara River,25.68,6903,NA,2014,Stormwater,0.503597122,0,0.172661871,0.028776978,0.071942446,0.223021583,0.386285714,0.036571429,0.091428571,0.089142857,0.062857143,0.333714286,0.000287,0.00544881,0.018640665,0.082018927,0.137654144,0.179237167,0.084026384,0.028677947,0.000287,0.092342988,0.000287,0.079437912,0.2793232,0.001720677,0.01061084,0.398910238,0.098365357,0.039288787,0.084026384,0.099799254,0.2793232,20,16,52,10,2,5,22.5,756,910,57.9,5.6,0.45,262.73,166.8,7.22,3.83,43.83,722.2,7.22,0.29,131.55,22.28,157.13,NA,More than 50 on pathway,55,35,5,20,80,"Super Muddy,,NA",5,3,1,0,2.25,2.63,Submergent with borwn algae and floating algae mats with duckweed. Somewhat turbid,NA,50,20,24,0,6,30,0,50,0,6,5,0,0,1,0,0,0,0,0,0,NA,"Painted,,,,NA",1,0,0,1,NA,NA,0,0,0,0,0,0,0,0,0,0,0,0,0,0,NA,NA,NA,NA,NA,NA,NA,NA,NA,NA,NA,NA,NA,NA,NA,NA,NA,NA,NA,NA,NA,NA,NA,NA,NA,NA,NA,NA,NA,NA,NA,NA,NA,NA,NA,NA,NA,NA,NA,NA,NA,NA,NA,NA,NA,NA,NA,NA,NA,NA,NA,NA,NA,NA,NA,NA,NA,NA,NA,NA,NA,NA,NA,NA,0,1,0,1,0,0,0,0,0,1,0,0,1,1,0,0,0,0,0,0,0,0,0,0,0,0,0,0,0,0,0,0,0,0,0,0,0,0,0,0,0,0,0,0,0,0,0,0,0,0,0,0,0,0,0,0,0,0,1,0,0,0,0,0,0,0,0,0,0
L60-UW,4,Lot 60 Pond,L60-UW_4,7/23/2020,2020,7,23,7:30:00,8:39:00,1:09,DCT,Urban,43.08113195,-89.42700781,302435.0186,4772683.368,UNIV OF WIS REGENTS,Lake Mendota-Yahara River,Lake Mendota-Yahara River,25.68,6903,NA,2014,Stormwater,0.503597122,0,0.172661871,0.028776978,0.071942446,0.223021583,0.386285714,0.036571429,0.091428571,0.089142857,0.062857143,0.333714286,0.000287,0.00544881,0.018640665,0.082018927,0.137654144,0.179237167,0.084026384,0.028677947,0.000287,0.092342988,0.000287,0.079437912,0.2793232,0.001720677,0.01061084,0.398910238,0.098365357,0.039288787,0.084026384,0.099799254,0.2793232,17,1,88,60,2,2,19.6,359.1,400.7,2.4,0.21,0.19,6.51,178.9,7.21,3.83,43.83,722.2,7.22,0.29,131.55,22.28,157.13,NA,0,45,25,30,30,70,"Firm Soil,Super Muddy,Leaf Litter",5,3,3,1,3,2.63,"Shallow bench with wide variety of emergent, but dominated by cattail. Drops off to deep water filled with submergent and muddy substrate. Thick typha makes navigating and estimating % difficult. Sphaeridae present",NA,50,20,24,0,6,30,0,50,0,6,5,0,0,0,1,1,0,0,0,0,NA,NA,0,0,0,1,NA,NA,0,0,0,0,0,0,0,0,0,0,0,0,0,0,NA,NA,NA,NA,NA,NA,NA,NA,NA,NA,NA,NA,NA,NA,NA,NA,NA,NA,NA,NA,NA,NA,NA,NA,NA,NA,NA,NA,NA,NA,NA,NA,NA,NA,NA,NA,NA,NA,NA,NA,NA,NA,NA,NA,NA,NA,NA,NA,NA,NA,NA,NA,NA,NA,NA,NA,NA,NA,NA,NA,NA,NA,NA,NA,0,1,0,1,1,0,0,0,0,1,1,1,0,1,1,1,1,0,0,1,0,1,1,0,0,1,0,0,0,0,0,0,0,0,0,0,0,0,0,1,0,1,0,0,0,0,0,0,0,0,0,0,0,0,1,0,0,0,1,1,0,0,0,0,0,0,0,0,0
L60-UW,1,Lot 60 Pond,L60-UW_1,6/5/2019,2019,6,5,11:42:00,12:39:00,0:57,"ES,EC,EP,CL",Urban,43.08113195,-89.42700781,302435.0186,4772683.368,UNIV OF WIS REGENTS,Lake Mendota-Yahara River,Lake Mendota-Yahara River,25.68,6903,NA,2014,Stormwater,0.503597122,0,0.172661871,0.028776978,0.071942446,0.223021583,0.386285714,0.036571429,0.091428571,0.089142857,0.062857143,0.333714286,0.000287,0.00544881,0.018640665,0.082018927,0.137654144,0.179237167,0.084026384,0.028677947,0.000287,0.092342988,0.000287,0.079437912,0.2793232,0.001720677,0.01061084,0.398910238,0.098365357,0.039288787,0.084026384,0.099799254,0.2793232,24,7,66,10,NA,16,21.1,701,757,68.1,5.82,0.37,157.36,98.96,NA,3.83,43.83,722.2,7.22,0.29,131.55,22.28,157.13,1.05,NA,NA,NA,NA,NA,NA,NA,NA,NA,NA,NA,NA,NA,NA,"other veg=phragmites,lots of frogs and snails",50,20,24,0,6,30,0,50,0,6,5,1,0,1,1,0,0,0,0,0,1,NA,0,0,0,1,NA,NA,0,0,0,0,0,0,0,0,0,0,NA,0,0,0,1,0,1,0,1,0,1,0,1,1,0,1,1,0,1,0,1,0,1,0,0,0,1,0,0,1,0,0,0,1,0,1,0,0,1,1,1,0,0,1,0,0,0,1,1,0,0,0,1,1,0,0,0,1,1,1,0,0,0,0,0,"Snails,Odonata,Coleoptera,Clams,Damselfly",5,NA,NA,NA,NA,NA,NA,NA,NA,NA,NA,NA,NA,NA,NA,NA,NA,NA,NA,NA,NA,NA,NA,NA,NA,NA,NA,NA,NA,NA,NA,NA,NA,NA,NA,NA,NA,NA,NA,NA,NA,NA,NA,NA,NA,NA,NA,NA,NA,NA,NA,NA,NA,NA,NA,NA,NA,NA,NA,NA,NA,NA,NA,NA,NA,NA,NA,NA,NA,NA,NA
L60-UW,2,Lot 60 Pond,L60-UW_2,7/10/2019,2019,7,10,12:45:00,13:10:00,0:25,"ES,EC,EP",Urban,43.08113195,-89.42700781,302435.0186,4772683.368,UNIV OF WIS REGENTS,Lake Mendota-Yahara River,Lake Mendota-Yahara River,25.68,6903,77,2014,Stormwater,0.503597122,0,0.172661871,0.028776978,0.071942446,0.223021583,0.386285714,0.036571429,0.091428571,0.089142857,0.062857143,0.333714286,0.000287,0.00544881,0.018640665,0.082018927,0.137654144,0.179237167,0.084026384,0.028677947,0.000287,0.092342988,0.000287,0.079437912,0.2793232,0.001720677,0.01061084,0.398910238,0.098365357,0.039288787,0.084026384,0.099799254,0.2793232,30,9,49,15,NA,2,25.9,326.5,821.1,46.9,3.69,0.15,51.31,81.53,NA,3.83,43.83,722.2,7.22,0.29,131.55,22.28,157.13,0.95,NA,NA,NA,NA,NA,NA,NA,NA,NA,NA,NA,NA,NA,NA,"Super thick parrot's feather, nearly impossible to seine/sweep",50,20,24,0,6,30,0,50,0,6,5,1,0,0,1,1,0,0,0,0,0,NA,0,0,0,1,NA,NA,0,0,0,0,0,0,0,0,0,0,NA,0,0,0,NA,NA,NA,NA,NA,NA,NA,NA,NA,NA,NA,NA,NA,NA,NA,NA,NA,NA,NA,NA,NA,NA,NA,NA,NA,NA,NA,NA,NA,NA,NA,NA,NA,NA,NA,NA,NA,NA,NA,NA,NA,NA,NA,NA,NA,NA,NA,NA,NA,NA,NA,NA,NA,NA,NA,NA,NA,NA,NA,NA,NA,NA,5,"No stages recorded, Nearly impossible to survey due to parrot's feather and depth",NA,NA,NA,NA,NA,NA,NA,NA,NA,NA,NA,NA,NA,NA,NA,NA,NA,NA,NA,NA,NA,NA,NA,NA,NA,NA,NA,NA,NA,NA,NA,NA,NA,NA,NA,NA,NA,NA,NA,NA,NA,NA,NA,NA,NA,NA,NA,NA,NA,NA,NA,NA,NA,NA,NA,NA,NA,NA,NA,NA,NA,NA,NA,NA,NA,NA,NA,NA,NA
MC-ARB,3,Mad City Pond,MC-ARB_3,5/15/2020,2020,5,15,16:48:00,17:26:00,0:38,DCT,Green Space,43.0388574,-89.42464823,302491.3713,4767982.953,UNIV OF WIS REGENTS,Lake Monona-Yahara River,Lake Monona-Yahara River,7.73,2807,NA,1987,Stormwater,0.108695652,0,0.855072464,0,0.028985507,0.007246377,0.249142857,0.138285714,0.462857143,0.013714286,0.133714286,0.001142857,0.000571,0.039965744,0.187268056,0.090493862,0.128461319,0.114187839,0.12789038,0.04967171,0.00713674,0.054810163,0,0.0356837,0.000856,0,0.16300314,0.33314302,0.230088496,0.21267485,0.12789038,0.094775906,0.000856,22,5,34,2,3,1,21.3,612,659,62.4,5.3,0.32,478.89,187.2,7.44,3.52,42.55,542.03,7.33,0.26,175.08,23.28,254.04,NA,NA,92,4,4,97,3,"Mud,Rock ,NA",1,1,2,1,1.25,1.63,"Toads amplexing, lots of barn swallows, 1 dead toad, 1 large fish jumping, millions of worms in soil.",NA,26,11,11,0,4,15,0,26,0,4,2,1,0,1,0,0,0,0,0,0,NA,"Painted,,,,NA",1,0,0,2,NA,NA,0,0,0,0,0,0,0,0,0,0,0,0,0,0,NA,NA,NA,NA,NA,NA,NA,NA,NA,NA,NA,NA,NA,NA,NA,NA,NA,NA,NA,NA,NA,NA,NA,NA,NA,NA,NA,NA,NA,NA,NA,NA,NA,NA,NA,NA,NA,NA,NA,NA,NA,NA,NA,NA,NA,NA,NA,NA,NA,NA,NA,NA,NA,NA,NA,NA,NA,NA,NA,NA,NA,NA,NA,NA,0,1,1,0,0,0,0,0,0,0,0,0,1,1,0,0,1,0,0,0,0,0,0,0,0,0,0,0,0,0,0,1,0,0,0,0,0,0,0,0,0,0,0,0,0,0,0,0,0,0,0,0,0,0,0,0,0,0,0,0,0,0,0,0,0,0,0,0,0
MC-ARB,4,Mad City Pond,MC-ARB_4,7/9/2020,2020,7,9,7:15:00,7:59:00,0:44,DCT,Green Space,43.0388574,-89.42464823,302491.3713,4767982.953,UNIV OF WIS REGENTS,Lake Monona-Yahara River,Lake Monona-Yahara River,7.73,2807,NA,1987,Stormwater,0.108695652,0,0.855072464,0,0.028985507,0.007246377,0.249142857,0.138285714,0.462857143,0.013714286,0.133714286,0.001142857,0.000571,0.039965744,0.187268056,0.090493862,0.128461319,0.114187839,0.12789038,0.04967171,0.00713674,0.054810163,0,0.0356837,0.000856,0,0.16300314,0.33314302,0.230088496,0.21267485,0.12789038,0.094775906,0.000856,23,1,88,15,3,1,26.5,282.1,274.1,11.1,0.86,0.13,180.87,245.7,7.22,3.52,42.55,542.03,7.33,0.26,175.08,23.28,254.04,NA,0,65,5,30,100,0,"Firm Soil,Rock ,NA",4,1,2,1,2,1.63,"Water coumn thick with cladocerans, soil millions of worms. No submergent, lots of black algae and wolffia. Substrate smells rancid. Several turtle nests raided.",NA,26,11,11,0,4,15,0,26,0,4,2,1,0,0,0,0,0,0,0,0,NA,"Painted,,,,NA",1,0,0,2,NA,NA,0,0,0,0,0,0,0,0,0,0,0,0,0,0,NA,NA,NA,NA,NA,NA,NA,NA,NA,NA,NA,NA,NA,NA,NA,NA,NA,NA,NA,NA,NA,NA,NA,NA,NA,NA,NA,NA,NA,NA,NA,NA,NA,NA,NA,NA,NA,NA,NA,NA,NA,NA,NA,NA,NA,NA,NA,NA,NA,NA,NA,NA,NA,NA,NA,NA,NA,NA,NA,NA,NA,NA,NA,NA,0,1,0,0,0,1,1,1,0,0,0,1,1,1,0,0,1,0,0,0,0,1,0,0,0,0,0,0,0,0,0,1,0,0,0,0,0,0,0,0,0,0,0,0,0,0,0,0,0,0,0,0,0,0,0,0,0,0,0,0,0,0,0,0,0,0,0,0,0
MC-ARB,1,Mad City Pond,MC-ARB_1,5/29/2019,2019,5,29,11:50:00,NA,NA,"DP,ES,EC,EP",Green Space,43.0388574,-89.42464823,302491.3713,4767982.953,UNIV OF WIS REGENTS,Lake Monona-Yahara River,Lake Monona-Yahara River,7.73,2807,NA,1987,Stormwater,0.108695652,0,0.855072464,0,0.028985507,0.007246377,0.249142857,0.138285714,0.462857143,0.013714286,0.133714286,0.001142857,0.000571,0.039965744,0.187268056,0.090493862,0.128461319,0.114187839,0.12789038,0.04967171,0.00713674,0.054810163,0,0.0356837,0.000856,0,0.16300314,0.33314302,0.230088496,0.21267485,0.12789038,0.094775906,0.000856,18,2,82,75,NA,2,18.7,625,711,27.5,2.47,0.35,166.7,111.5,NA,3.52,42.55,542.03,7.33,0.26,175.08,23.28,254.04,1.06,NA,NA,NA,NA,NA,NA,NA,NA,NA,NA,NA,NA,NA,NA,"No substrate recorded, No time stop recorded, No perimeter recorded, Incorrect elevation, Dead ranid tadpoles (one kept)",26,11,11,0,4,15,0,26,0,4,2,1,0,0,0,0,0,0,0,0,1,"Painted,Snapping",1,1,0,2,NA,NA,0,0,0,0,0,0,0,0,0,0,NA,0,0,0,0,0,1,0,1,0,1,0,0,0,0,0,0,1,1,0,1,0,1,0,0,0,0,0,0,0,0,0,0,0,1,0,0,0,0,1,0,0,1,1,0,0,0,1,0,0,0,0,1,0,0,0,0,0,0,0,0,0,0,0,0,Physids,20,NA,NA,NA,NA,NA,NA,NA,NA,NA,NA,NA,NA,NA,NA,NA,NA,NA,NA,NA,NA,NA,NA,NA,NA,NA,NA,NA,NA,NA,NA,NA,NA,NA,NA,NA,NA,NA,NA,NA,NA,NA,NA,NA,NA,NA,NA,NA,NA,NA,NA,NA,NA,NA,NA,NA,NA,NA,NA,NA,NA,NA,NA,NA,NA,NA,NA,NA,NA,NA,NA
MC-ARB,2,Mad City Pond,MC-ARB_2,7/31/2019,2019,7,31,12:35:00,12:41:00,0:06,"EC,CL,EP",Green Space,43.0388574,-89.42464823,302491.3713,4767982.953,UNIV OF WIS REGENTS,Lake Monona-Yahara River,Lake Monona-Yahara River,7.73,2807,266,1987,Stormwater,0.108695652,0,0.855072464,0,0.028985507,0.007246377,0.249142857,0.138285714,0.462857143,0.013714286,0.133714286,0.001142857,0.000571,0.039965744,0.187268056,0.090493862,0.128461319,0.114187839,0.12789038,0.04967171,0.00713674,0.054810163,0,0.0356837,0.000856,0,0.16300314,0.33314302,0.230088496,0.21267485,0.12789038,0.094775906,0.000856,23,3,46,60,NA,2,26.6,540,524,69.2,5.43,0.25,116.53,155.9,NA,3.52,42.55,542.03,7.33,0.26,175.08,23.28,254.04,2.18,NA,NA,NA,NA,NA,NA,NA,NA,NA,NA,NA,NA,NA,NA,Flour - OVER,26,11,11,0,4,15,0,26,0,4,2,1,0,0,0,0,0,0,0,0,0,Painted,1,0,0,2,NA,NA,0,0,0,0,0,0,0,0,0,0,NA,0,0,0,NA,NA,NA,NA,NA,NA,NA,NA,NA,NA,NA,NA,NA,NA,NA,NA,NA,NA,NA,NA,NA,NA,NA,NA,NA,NA,NA,NA,NA,NA,NA,NA,NA,NA,NA,NA,NA,NA,NA,NA,NA,NA,NA,NA,NA,NA,NA,NA,NA,NA,NA,NA,NA,NA,NA,NA,NA,NA,NA,NA,NA,No seine data recorded,0,NA,NA,NA,NA,NA,NA,NA,NA,NA,NA,NA,NA,NA,NA,NA,NA,NA,NA,NA,NA,NA,NA,NA,NA,NA,NA,NA,NA,NA,NA,NA,NA,NA,NA,NA,NA,NA,NA,NA,NA,NA,NA,NA,NA,NA,NA,NA,NA,NA,NA,NA,NA,NA,NA,NA,NA,NA,NA,NA,NA,NA,NA,NA,NA,NA,NA,NA,NA,NA,NA
LM-ARB,3,Manitou Lower Pond,LM-ARB_3,5/16/2020,2020,5,16,15:31:00,16:13:00,0:42,DCT,Green Space,43.04713585,-89.43541403,301641.0561,4768927.727,UNIV OF WIS REGENTS,Lake Monona-Yahara River,Lake Monona-Yahara River,0,3341,NA,1995,Stormwater,0,0,0.863309353,0.122302158,0,0.014388489,0.130884041,0.03673938,0.50401837,0.31228473,0,0.016073479,0,0.008018328,0.079896907,0.001145475,0.243413517,0.021477663,0.296678121,0.06443299,0,0.044959908,0.001431844,0.018613975,0.082760596,0,0.137170676,0.266036655,0.098510882,0.201603666,0.296678121,0.05441008,0.082760596,21,12,46,95,1,8,2.5,653,685,140.6,11.83,0.33,191.35,145.4,8.7,5.81,69.48,479.98,8.18,0.23,142.43,19.2,120.09,NA,0,99,1,0,99,1,"Firm Soil,Rock ,NA",1,1,2,3,1.75,1.75,"Almost no vegetation, visibility poor.",NA,27,12,8,4,8,16,1,28,1,4,2,0,1,0,0,0,0,0,0,0,NA,"Painted,,,,NA",1,0,0,2,NA,"Large fish jumping, sunfish,,,,NA",0,0,0,0,0,0,0,0,0,0,1,0,0,0,NA,NA,NA,NA,NA,NA,NA,NA,NA,NA,NA,NA,NA,NA,NA,NA,NA,NA,NA,NA,NA,NA,NA,NA,NA,NA,NA,NA,NA,NA,NA,NA,NA,NA,NA,NA,NA,NA,NA,NA,NA,NA,NA,NA,NA,NA,NA,NA,NA,NA,NA,NA,NA,NA,NA,NA,NA,NA,NA,NA,NA,NA,NA,NA,0,1,0,0,0,0,0,1,1,1,0,0,0,0,0,0,0,0,0,0,0,0,0,0,0,0,0,0,0,0,0,0,0,0,0,0,0,0,0,0,0,0,0,0,0,0,0,0,0,0,0,0,0,0,0,0,0,0,0,0,0,0,0,0,0,0,0,0,0
LM-ARB,4,Manitou Lower Pond,LM-ARB_4,7/6/2020,2020,7,6,9:48:00,10:44:00,0:56,DCT,Green Space,43.04713585,-89.43541403,301641.0561,4768927.727,UNIV OF WIS REGENTS,Lake Monona-Yahara River,Lake Monona-Yahara River,0,3341,NA,1995,Stormwater,0,0,0.863309353,0.122302158,0,0.014388489,0.130884041,0.03673938,0.50401837,0.31228473,0,0.016073479,0,0.008018328,0.079896907,0.001145475,0.243413517,0.021477663,0.296678121,0.06443299,0,0.044959908,0.001431844,0.018613975,0.082760596,0,0.137170676,0.266036655,0.098510882,0.201603666,0.296678121,0.05441008,0.082760596,29,5,57,2,1,10,28.4,343.1,322.2,33.1,2.51,0.15,357.7,195,7.65,5.81,69.48,479.98,8.18,0.23,142.43,19.2,120.09,NA,0,98,1,1,90,10,"Firm Soil,Rock ,NA",1,1,2,3,1.75,1.75,"Tons of water striders, large schools of minnows, water level dropped, no emergent in water. Some in mud, mostly on dry bank.",NA,27,12,8,4,8,16,1,28,1,4,2,0,1,1,0,0,0,0,0,0,NA,"Painted,Snapping,,,NA",1,1,0,2,NA,"Large Carp, Large schools of shiners, pumpkinseed,,,,NA",0,0,0,1,0,0,1,0,0,0,0,0,0,1,NA,NA,NA,NA,NA,NA,NA,NA,NA,NA,NA,NA,NA,NA,NA,NA,NA,NA,NA,NA,NA,NA,NA,NA,NA,NA,NA,NA,NA,NA,NA,NA,NA,NA,NA,NA,NA,NA,NA,NA,NA,NA,NA,NA,NA,NA,NA,NA,NA,NA,NA,NA,NA,NA,NA,NA,NA,NA,NA,NA,NA,NA,NA,NA,1,1,0,1,0,0,0,1,1,1,0,0,0,1,1,1,0,0,0,0,1,0,0,0,0,0,0,0,0,0,0,0,0,1,0,0,0,0,0,0,0,0,0,0,0,0,0,0,0,0,0,0,0,0,1,0,0,0,0,0,0,0,0,0,0,0,0,0,0
LM-ARB,1,Manitou Lower Pond,LM-ARB_1,5/30/2019,2019,5,30,11:16:00,12:15:00,0:59,"DP,EC,ES,EP",Green Space,43.04713585,-89.43541403,301641.0561,4768927.727,UNIV OF WIS REGENTS,Lake Monona-Yahara River,Lake Monona-Yahara River,0,3341,NA,1995,Stormwater,0,0,0.863309353,0.122302158,0,0.014388489,0.130884041,0.03673938,0.50401837,0.31228473,0,0.016073479,0,0.008018328,0.079896907,0.001145475,0.243413517,0.021477663,0.296678121,0.06443299,0,0.044959908,0.001431844,0.018613975,0.082760596,0,0.137170676,0.266036655,0.098510882,0.201603666,0.296678121,0.05441008,0.082760596,22,5,60,77,NA,12,19.3,490.4,549.8,70.7,6.28,0.27,110.5,109.2,NA,5.81,69.48,479.98,8.18,0.23,142.43,19.2,120.09,0.84,NA,NA,NA,NA,NA,NA,NA,NA,NA,NA,NA,NA,NA,NA,*mesh on bottom,27,12,8,4,8,16,1,28,1,4,2,0,0,0,0,0,0,0,0,0,0,NA,0,0,0,2,NA,unknown but present,0,0,0,0,0,0,1,1,0,0,NA,0,0,0,0,0,1,0,1,0,0,0,0,0,0,0,0,0,1,0,0,0,1,0,0,0,0,0,0,0,0,0,0,0,0,0,0,0,1,1,1,0,0,0,0,0,0,0,0,0,0,0,1,0,0,0,0,1,0,1,0,0,0,0,0,NA,4,NA,NA,NA,NA,NA,NA,NA,NA,NA,NA,NA,NA,NA,NA,NA,NA,NA,NA,NA,NA,NA,NA,NA,NA,NA,NA,NA,NA,NA,NA,NA,NA,NA,NA,NA,NA,NA,NA,NA,NA,NA,NA,NA,NA,NA,NA,NA,NA,NA,NA,NA,NA,NA,NA,NA,NA,NA,NA,NA,NA,NA,NA,NA,NA,NA,NA,NA,NA,NA,NA
LM-ARB,2,Manitou Lower Pond,LM-ARB_2,7/10/2019,2019,7,10,10:32:00,10:53:00,0:21,"ES, EC, EP",Green Space,43.04713585,-89.43541403,301641.0561,4768927.727,UNIV OF WIS REGENTS,Lake Monona-Yahara River,Lake Monona-Yahara River,0,3341,269,1995,Stormwater,0,0,0.863309353,0.122302158,0,0.014388489,0.130884041,0.03673938,0.50401837,0.31228473,0,0.016073479,0,0.008018328,0.079896907,0.001145475,0.243413517,0.021477663,0.296678121,0.06443299,0,0.044959908,0.001431844,0.018613975,0.082760596,0,0.137170676,0.266036655,0.098510882,0.201603666,0.296678121,0.05441008,0.082760596,26,8,80,0,NA,18,26.6,373.7,362.9,33.5,2.6,0.17,58.42,120.1,NA,5.81,69.48,479.98,8.18,0.23,142.43,19.2,120.09,1.4,NA,NA,NA,NA,NA,NA,NA,NA,NA,NA,NA,NA,NA,NA,"Rocky, difficult to move through",27,12,8,4,8,16,1,28,1,4,2,0,0,0,0,0,0,0,0,0,0,NA,0,0,0,2,NA,NA,0,0,0,1,0,0,0,0,0,0,NA,0,0,0,NA,NA,NA,NA,NA,NA,NA,NA,NA,NA,NA,NA,NA,NA,NA,NA,NA,NA,NA,NA,NA,NA,NA,NA,NA,NA,NA,NA,NA,NA,NA,NA,NA,NA,NA,NA,NA,NA,NA,NA,NA,NA,NA,NA,NA,NA,NA,NA,NA,NA,NA,NA,NA,NA,NA,NA,NA,NA,NA,NA,NA,NA,19,NA,NA,NA,NA,NA,NA,NA,NA,NA,NA,NA,NA,NA,NA,NA,NA,NA,NA,NA,NA,NA,NA,NA,NA,NA,NA,NA,NA,NA,NA,NA,NA,NA,NA,NA,NA,NA,NA,NA,NA,NA,NA,NA,NA,NA,NA,NA,NA,NA,NA,NA,NA,NA,NA,NA,NA,NA,NA,NA,NA,NA,NA,NA,NA,NA,NA,NA,NA,NA,NA
UM-ARB,3,Manitou Upper Pond,UM-ARB_3,5/16/2020,2020,5,16,14:14:00,15:21:00,1:07,DCT,Green Space,43.0476228,-89.43781415,301447.1351,4768987.484,UNIV OF WIS REGENTS,Lake Monona-Yahara River,Lake Monona-Yahara River,0,6875,NA,2014,Stormwater,0.268115942,0,0.492753623,0.210144928,0,0.028985507,0.324137931,0,0.33908046,0.332183908,0,0.004597701,0,0.000858,0.035765379,0.001144492,0.312160229,0.02546495,0.335908441,0.057224607,0,0.038912732,0.001430615,0.010586552,0.058941345,0,0.121602289,0.338769671,0.046351931,0.178826896,0.335908441,0.041201717,0.058941345,20,14,49,70,3,0,22,641,679,129.8,10.91,0.33,126.88,126.7,8.63,7.59,91.6,468.38,8.14,0.23,135.98,23.53,102.47,NA,3,99,1,0,100,0,"Firm Soil,Rock ,Leaf Litter",1,1,3,1,1.5,1.5,"No submergent or floating observed, poor visibility though. Emergent veg extremely sparse. Very turbid.",NA,29,14,5,5,10,15,0,29,0,5,3,0,0,1,0,0,0,0,0,0,NA,"Painted,Snapping,,,",1,1,0,2,NA,"Large jumping,,,,",0,0,0,0,0,1,0,0,0,0,0,0,0,0,NA,NA,NA,NA,NA,NA,NA,NA,NA,NA,NA,NA,NA,NA,NA,NA,NA,NA,NA,NA,NA,NA,NA,NA,NA,NA,NA,NA,NA,NA,NA,NA,NA,NA,NA,NA,NA,NA,NA,NA,NA,NA,NA,NA,NA,NA,NA,NA,NA,NA,NA,NA,NA,NA,NA,NA,NA,NA,NA,NA,NA,NA,NA,NA,0,0,1,0,0,0,0,0,0,0,0,0,0,0,0,0,0,0,0,0,0,0,0,0,0,0,0,0,0,0,0,0,0,0,0,0,0,0,0,0,1,0,0,0,1,0,0,0,0,0,0,0,0,0,1,0,0,0,0,0,0,0,0,0,0,0,0,0,0
UM-ARB,4,Manitou Upper Pond,UM-ARB_4,7/6/2020,2020,7,6,8:06:00,9:33:00,1:27,DCT,Green Space,43.0476228,-89.43781415,301447.1351,4768987.484,UNIV OF WIS REGENTS,Lake Monona-Yahara River,Lake Monona-Yahara River,0,6875,NA,2014,Stormwater,0.268115942,0,0.492753623,0.210144928,0,0.028985507,0.324137931,0,0.33908046,0.332183908,0,0.004597701,0,0.000858,0.035765379,0.001144492,0.312160229,0.02546495,0.335908441,0.057224607,0,0.038912732,0.001430615,0.010586552,0.058941345,0,0.121602289,0.338769671,0.046351931,0.178826896,0.335908441,0.041201717,0.058941345,26,2,72,80,3,1,27,310.5,299.2,113.4,8.79,0.14,363.68,172.4,7.64,7.59,91.6,468.38,8.14,0.23,135.98,23.53,102.47,NA,0,90,2,8,90,10,"Firm Soil,Rock ,NA",2,1,2,1,1.5,1.5,"Water pea green with algae, Orange dragonflies (small), Light blue blackwing dragonfly (lg), Thick floating mat of algae on N. end, difficult to tell submergent b/c of visibility (0cm-5cm) sub based on sweeps.",NA,29,14,5,5,10,15,0,29,0,5,3,0,1,0,0,0,0,0,0,0,NA,"Painted,Snapping,,,NA",1,1,0,2,NA,"Large jumping fish, Common shiner, fathead minnow, catfish, pumpkinseed,,,,NA",0,0,1,1,0,1,1,0,1,0,0,0,0,0,NA,NA,NA,NA,NA,NA,NA,NA,NA,NA,NA,NA,NA,NA,NA,NA,NA,NA,NA,NA,NA,NA,NA,NA,NA,NA,NA,NA,NA,NA,NA,NA,NA,NA,NA,NA,NA,NA,NA,NA,NA,NA,NA,NA,NA,NA,NA,NA,NA,NA,NA,NA,NA,NA,NA,NA,NA,NA,NA,NA,NA,NA,NA,NA,0,1,0,1,0,1,0,0,0,1,1,1,1,1,1,1,0,0,0,0,0,0,0,0,0,0,0,0,0,0,0,0,0,0,0,0,0,0,0,0,1,0,0,0,1,0,0,0,0,0,0,0,0,0,1,0,0,0,0,0,0,0,0,0,0,0,0,0,0
UM-ARB,1,Manitou Upper Pond,UM-ARB_1,5/30/2019,2019,5,30,9:40:00,11:08:00,1:28,"DP,ES,EC,EP",Green Space,43.0476228,-89.43781415,301447.1351,4768987.484,UNIV OF WIS REGENTS,Lake Monona-Yahara River,Lake Monona-Yahara River,0,6875,NA,2014,Stormwater,0.268115942,0,0.492753623,0.210144928,0,0.028985507,0.324137931,0,0.33908046,0.332183908,0,0.004597701,0,0.000858,0.035765379,0.001144492,0.312160229,0.02546495,0.335908441,0.057224607,0,0.038912732,0.001430615,0.010586552,0.058941345,0,0.121602289,0.338769671,0.046351931,0.178826896,0.335908441,0.041201717,0.058941345,19,3,74,33,NA,2,18.6,487.3,555.4,88.6,7.98,0.27,120.29,116.1,NA,7.59,91.6,468.38,8.14,0.23,135.98,23.53,102.47,0.9,NA,NA,NA,NA,NA,NA,NA,NA,NA,NA,NA,NA,NA,NA,"No perimeter, no substrate, no snail records",29,14,5,5,10,15,0,29,0,5,3,0,0,0,0,0,0,0,0,0,0,NA,0,0,0,2,NA,Pumpkinseed,0,0,1,0,0,1,1,1,1,0,NA,0,0,0,0,0,0,0,1,0,0,0,0,0,0,0,0,0,1,0,1,0,1,0,0,0,0,0,0,0,0,0,0,0,0,0,0,0,0,1,0,0,0,1,0,0,0,0,0,0,0,0,1,0,0,0,0,0,0,0,0,0,0,0,0,NA,NA,No seine distances recorded,NA,NA,NA,NA,NA,NA,NA,NA,NA,NA,NA,NA,NA,NA,NA,NA,NA,NA,NA,NA,NA,NA,NA,NA,NA,NA,NA,NA,NA,NA,NA,NA,NA,NA,NA,NA,NA,NA,NA,NA,NA,NA,NA,NA,NA,NA,NA,NA,NA,NA,NA,NA,NA,NA,NA,NA,NA,NA,NA,NA,NA,NA,NA,NA,NA,NA,NA,NA,NA
UM-ARB,2,Manitou Upper Pond,UM-ARB_2,7/10/2019,2019,7,10,9:52:00,10:22:00,0:30,"ES,EC,EP",Green Space,43.0476228,-89.43781415,301447.1351,4768987.484,UNIV OF WIS REGENTS,Lake Monona-Yahara River,Lake Monona-Yahara River,0,6875,268,2014,Stormwater,0.268115942,0,0.492753623,0.210144928,0,0.028985507,0.324137931,0,0.33908046,0.332183908,0,0.004597701,0,0.000858,0.035765379,0.001144492,0.312160229,0.02546495,0.335908441,0.057224607,0,0.038912732,0.001430615,0.010586552,0.058941345,0,0.121602289,0.338769671,0.046351931,0.178826896,0.335908441,0.041201717,0.058941345,26,8,80,0,NA,2,26.5,349.7,339.9,34.6,2.69,0.16,60.25,128.7,NA,7.59,91.6,468.38,8.14,0.23,135.98,23.53,102.47,1.94,NA,NA,NA,NA,NA,NA,NA,NA,NA,NA,NA,NA,NA,NA,NA,29,14,5,5,10,15,0,29,0,5,3,1,0,0,0,0,0,0,0,0,0,"Snapping,Other",0,1,0,2,NA,"Bluegill, Shiners, Pumpkinseed, Fathead, Sunfish, Very large fish breaching",0,0,1,1,0,0,1,1,0,0,NA,0,0,0,NA,NA,NA,NA,NA,NA,NA,NA,NA,NA,NA,NA,NA,NA,NA,NA,NA,NA,NA,NA,NA,NA,NA,NA,NA,NA,NA,NA,NA,NA,NA,NA,NA,NA,NA,NA,NA,NA,NA,NA,NA,NA,NA,NA,NA,NA,NA,NA,NA,NA,NA,NA,NA,NA,NA,NA,NA,NA,NA,NA,NA,NA,25,"Extra line added to seine portion of datasheet without a title, unknown fish/invert species.",NA,NA,NA,NA,NA,NA,NA,NA,NA,NA,NA,NA,NA,NA,NA,NA,NA,NA,NA,NA,NA,NA,NA,NA,NA,NA,NA,NA,NA,NA,NA,NA,NA,NA,NA,NA,NA,NA,NA,NA,NA,NA,NA,NA,NA,NA,NA,NA,NA,NA,NA,NA,NA,NA,NA,NA,NA,NA,NA,NA,NA,NA,NA,NA,NA,NA,NA,NA,NA
MCS,3,McCarthy South,MCS_3,6/5/2020,2020,6,5,9:15:00,10:32:00,1:17,DCT,Rural,43.11861507,-89.19289394,321602.102,4776320.986,COUNTY OF DANE,Koshkonong Creek,Headwaters Koshkonong Creek,51.5,4218,NA,2010,Natural,0,0,0.210144928,0,0.782608696,0.007246377,0.005733945,0.02293578,0.106651376,0.006880734,0.853211009,0.004587156,0.000286,0.518613975,0.073024055,0.010595647,0.041523482,0.018041237,0.02233677,0.035509737,0,0.223940435,0,0.035223368,0.001145475,0,0.01975945,0.070160367,0.108247423,0.055269187,0.02233677,0.74255441,0.001145475,22,3,76,90,0,0,22,403.4,427.7,58.7,4.95,0.21,202.43,594.3,7.58,3.48,41.55,413.88,7.68,0.2,451.08,22.65,87.94,NA,0,40,30,30,10,90,"Firm Soil,Mud,Leaf Litter",4,2,3,4,3.25,3,"Shallow bench of water surrounds pond with cattails and lots of logs cut down into water. All DW species present in cattails. In open water dominated by submergent (flat leaf), pond only .8m deep most of the way, muddy leaf litter at edges but fiem soil in the middle.",NA,42,19,19,0,4,23,0,42,0,4,4,1,0,0,0,0,0,0,0,0,NA,NA,0,0,0,0,NA,NA,0,0,0,0,0,0,0,0,0,0,0,0,0,0,NA,NA,NA,NA,NA,NA,NA,NA,NA,NA,NA,NA,NA,NA,NA,NA,NA,NA,NA,NA,NA,NA,NA,NA,NA,NA,NA,NA,NA,NA,NA,NA,NA,NA,NA,NA,NA,NA,NA,NA,NA,NA,NA,NA,NA,NA,NA,NA,NA,NA,NA,NA,NA,NA,NA,NA,NA,NA,NA,NA,NA,NA,NA,NA,0,1,0,1,0,0,0,0,0,0,0,0,1,1,0,0,1,0,0,1,0,0,1,0,1,0,1,0,0,0,0,0,0,0,0,0,1,0,0,0,0,0,0,0,0,0,0,1,0,0,0,0,0,0,0,0,0,0,1,0,1,0,0,0,0,0,0,0,0
MCS,4,McCarthy South,MCS_4,7/22/2020,2020,7,22,7:40:00,8:57:00,1:17,DCT,Rural,43.11861507,-89.19289394,321602.102,4776320.986,COUNTY OF DANE,Koshkonong Creek,Headwaters Koshkonong Creek,51.5,4218,NA,2010,Natural,0,0,0.210144928,0,0.782608696,0.007246377,0.005733945,0.02293578,0.106651376,0.006880734,0.853211009,0.004587156,0.000286,0.518613975,0.073024055,0.010595647,0.041523482,0.018041237,0.02233677,0.035509737,0,0.223940435,0,0.035223368,0.001145475,0,0.01975945,0.070160367,0.108247423,0.055269187,0.02233677,0.74255441,0.001145475,22,7,90,95,0,0,22.2,359.9,380.6,14.8,1.24,0.18,6.15,587.2,7.77,3.48,41.55,413.88,7.68,0.2,451.08,22.65,87.94,NA,0,45,25,30,5,95,"Mud,Vegetation,NA",5,1,1,4,2.75,3,"Thick layer ~40 ft of cattail wuth DW wolffia, forked on top elodia and coontail beneath. In open water sago and leafy with some coontail. Possiblesmall fish, lots of leeches, Belo, Damsel, Nepidae, tons of cladocera.",NA,42,19,19,0,4,23,0,42,0,4,4,1,0,0,0,0,0,0,0,0,NA,NA,0,0,0,0,NA,"None detected but looks like small fish jumping,,,,NA",0,0,0,0,0,0,0,0,0,0,0,0,0,0,NA,NA,NA,NA,NA,NA,NA,NA,NA,NA,NA,NA,NA,NA,NA,NA,NA,NA,NA,NA,NA,NA,NA,NA,NA,NA,NA,NA,NA,NA,NA,NA,NA,NA,NA,NA,NA,NA,NA,NA,NA,NA,NA,NA,NA,NA,NA,NA,NA,NA,NA,NA,NA,NA,NA,NA,NA,NA,NA,NA,NA,NA,NA,NA,0,1,1,1,0,0,0,0,1,0,0,0,1,1,0,1,1,1,0,1,0,0,0,0,1,0,1,0,1,0,0,0,0,0,0,0,1,0,0,0,0,0,0,0,0,0,0,1,1,0,0,0,0,0,0,0,0,0,0,0,0,0,0,0,0,0,0,0,0
MCS,1,McCarthy South,MCS_1,7/11/2019,2019,7,11,12:00:00,12:45:00,0:45,"EC,EP,BC",Rural,43.11861507,-89.19289394,321602.102,4776320.986,COUNTY OF DANE,Koshkonong Creek,Headwaters Koshkonong Creek,51.5,4218,277,2010,Natural,0,0,0.210144928,0,0.782608696,0.007246377,0.005733945,0.02293578,0.106651376,0.006880734,0.853211009,0.004587156,0.000286,0.518613975,0.073024055,0.010595647,0.041523482,0.018041237,0.02233677,0.035509737,0,0.223940435,0,0.035223368,0.001145475,0,0.01975945,0.070160367,0.108247423,0.055269187,0.02233677,0.74255441,0.001145475,26,9,54,5,NA,2,28.3,453.6,464.1,80.4,6.58,0.22,27.22,281.2,NA,3.48,41.55,413.88,7.68,0.2,451.08,22.65,87.94,2.2,NA,NA,NA,NA,NA,NA,NA,NA,NA,NA,NA,NA,NA,NA,zoop tows were dragged,42,19,19,0,4,23,0,42,0,4,4,1,0,1,0,1,0,0,0,0,0,NA,0,0,0,0,NA,NA,0,0,0,0,0,0,0,0,0,0,NA,0,0,0,1,0,1,0,1,0,1,0,0,0,0,0,0,0,1,0,1,1,1,0,0,0,0,0,0,1,0,0,0,0,0,0,0,0,0,1,1,0,1,1,0,0,1,1,1,0,0,0,1,1,1,1,0,1,0,0,0,0,0,0,0,backswimmers,1.5,seines couldnt get under veg so very little collected,NA,NA,NA,NA,NA,NA,NA,NA,NA,NA,NA,NA,NA,NA,NA,NA,NA,NA,NA,NA,NA,NA,NA,NA,NA,NA,NA,NA,NA,NA,NA,NA,NA,NA,NA,NA,NA,NA,NA,NA,NA,NA,NA,NA,NA,NA,NA,NA,NA,NA,NA,NA,NA,NA,NA,NA,NA,NA,NA,NA,NA,NA,NA,NA,NA,NA,NA,NA,NA
MCS,2,McCarthy South,MCS_2,8/15/2019,2019,8,15,10:38:00,10:52:00,0:14,"EC,EP,CL",Rural,43.11861507,-89.19289394,321602.102,4776320.986,COUNTY OF DANE,Koshkonong Creek,Headwaters Koshkonong Creek,51.5,4218,272,2010,Natural,0,0,0.210144928,0,0.782608696,0.007246377,0.005733945,0.02293578,0.106651376,0.006880734,0.853211009,0.004587156,0.000286,0.518613975,0.073024055,0.010595647,0.041523482,0.018041237,0.02233677,0.035509737,0,0.223940435,0,0.035223368,0.001145475,0,0.01975945,0.070160367,0.108247423,0.055269187,0.02233677,0.74255441,0.001145475,23,5,55,2,NA,2,18.1,332.2,383.1,12.3,1.13,0.18,34.18,341.6,NA,3.48,41.55,413.88,7.68,0.2,451.08,22.65,87.94,2.85,NA,NA,NA,NA,NA,NA,NA,NA,NA,NA,NA,NA,NA,NA,no snail density recorded,42,19,19,0,4,23,0,42,0,4,4,0,0,0,0,0,0,0,0,0,1,NA,0,0,0,0,NA,NA,0,0,0,0,0,0,0,0,0,0,NA,0,0,0,NA,NA,NA,NA,NA,NA,NA,NA,NA,NA,NA,NA,NA,NA,NA,NA,NA,NA,NA,NA,NA,NA,NA,NA,NA,NA,NA,NA,NA,NA,NA,NA,NA,NA,NA,NA,NA,NA,NA,NA,NA,NA,NA,NA,NA,NA,NA,NA,NA,NA,NA,NA,NA,NA,NA,NA,NA,NA,NA,NA,NA,NA,12,Shallow sweeps/seines due to duckweed and parrot's feather,NA,NA,NA,NA,NA,NA,NA,NA,NA,NA,NA,NA,NA,NA,NA,NA,NA,NA,NA,NA,NA,NA,NA,NA,NA,NA,NA,NA,NA,NA,NA,NA,NA,NA,NA,NA,NA,NA,NA,NA,NA,NA,NA,NA,NA,NA,NA,NA,NA,NA,NA,NA,NA,NA,NA,NA,NA,NA,NA,NA,NA,NA,NA,NA,NA,NA,NA,NA,NA
MCF,3,McFarland,MCF_3,6/6/2020,2020,6,6,9:53:00,11:05:00,1:12,DCT,Rural,43.00350222,-89.27397982,314658.7102,4763712.92,MCFARLAND VILLAGE OF,Lake Kegonsa-Yahara River,Lake Kegonsa-Yahara River,291.83,1339,NA,1974,Natural,0,0.182481752,0.510948905,0,0.306569343,0,0.163030999,0.096440873,0.190585534,0.065442021,0.484500574,0,0,0.272050401,0.038659794,0.001718213,0.098224513,0.052119129,0.071305842,0.240836197,0,0.128293242,0,0.015463918,0,0,0.081328751,0.152061856,0.054123711,0.322164948,0.071305842,0.400343643,0,22,7,55,30,0,15,23.8,257.5,263.7,65.9,5.43,0.12,320.88,198.9,7.66,6.23,74.33,283.28,7.67,0.13,146.83,23.25,110.49,NA,0,60,10,30,90,10,"Firm Soil,Mud,NA",5,1,2,5,3.25,3.5,Edges dominated by willow and phalaras. Soil is firm and drops quickly past 1m. Shallow areas with mud in willows. Not much submergent past edges.,NA,56,17,27,6,12,39,0,56,0,6,5,1,1,1,0,0,0,0,0,0,NA,"Painted,,,,NA",1,0,0,1,NA,"Mud Minnow, Fathead Minnow, Black Bullhead Catfish, Northern Clearwater Crayfish,,,,NA",0,1,1,0,0,0,0,0,1,0,0,0,0,0,NA,NA,NA,NA,NA,NA,NA,NA,NA,NA,NA,NA,NA,NA,NA,NA,NA,NA,NA,NA,NA,NA,NA,NA,NA,NA,NA,NA,NA,NA,NA,NA,NA,NA,NA,NA,NA,NA,NA,NA,NA,NA,NA,NA,NA,NA,NA,NA,NA,NA,NA,NA,NA,NA,NA,NA,NA,NA,NA,NA,NA,NA,NA,NA,0,1,1,0,0,0,0,1,0,0,0,0,1,1,0,0,1,0,0,1,0,0,1,0,1,0,1,0,0,0,0,0,0,0,0,0,0,0,0,1,0,0,1,0,0,0,0,0,0,0,0,0,0,0,0,0,0,0,1,0,0,0,0,0,0,0,0,0,0
MCF,4,McFarland,MCF_4,8/3/2020,2020,8,3,8:16:00,9:56:00,1:40,DCT,Rural,43.00350222,-89.27397982,314658.7102,4763712.92,MCFARLAND VILLAGE OF,Lake Kegonsa-Yahara River,Lake Kegonsa-Yahara River,291.83,1339,NA,1974,Natural,0,0.182481752,0.510948905,0,0.306569343,0,0.163030999,0.096440873,0.190585534,0.065442021,0.484500574,0,0,0.272050401,0.038659794,0.001718213,0.098224513,0.052119129,0.071305842,0.240836197,0,0.128293242,0,0.015463918,0,0,0.081328751,0.152061856,0.054123711,0.322164948,0.071305842,0.400343643,0,14,10,79,100,0,20,22.6,221.2,232,30.8,2.59,0.11,7.23,166.2,7.68,6.23,74.33,283.28,7.67,0.13,146.83,23.25,110.49,NA,0,60,5,35,67,33,"Mud,,NA",5,4,1,5,3.75,3.5,"Drops off to deeper water quickly, very little submergent detected along shoreline, almost entirely mosses along edge. Lots of forked DW. 2nd pond behind main almost entirely dry with lots of stranded ranid tads. Water line ~1m lower than NHWL with most shallow benches just mud now.",NA,56,17,27,6,12,39,0,56,0,6,5,0,1,0,1,0,0,0,0,0,NA,NA,0,0,0,1,NA,"Mudminnow, sunfish, large fish jumping,,,,NA",0,1,0,0,0,0,0,0,0,0,1,0,0,0,NA,NA,NA,NA,NA,NA,NA,NA,NA,NA,NA,NA,NA,NA,NA,NA,NA,NA,NA,NA,NA,NA,NA,NA,NA,NA,NA,NA,NA,NA,NA,NA,NA,NA,NA,NA,NA,NA,NA,NA,NA,NA,NA,NA,NA,NA,NA,NA,NA,NA,NA,NA,NA,NA,NA,NA,NA,NA,NA,NA,NA,NA,NA,NA,0,1,1,0,0,0,0,1,1,0,0,0,1,1,0,0,1,0,0,0,0,0,0,0,1,0,1,1,0,0,0,0,0,0,0,0,0,1,0,0,0,1,1,0,0,0,0,0,0,0,0,0,0,0,0,0,0,0,0,0,0,0,0,0,0,0,0,0,0
MCF,1,McFarland,MCF_1,6/18/2019,2019,6,18,12:30:00,13:18:00,0:48,"DP,EC,CL,EP",Rural,43.00350222,-89.27397982,314658.7102,4763712.92,MCFARLAND VILLAGE OF,Lake Kegonsa-Yahara River,Lake Kegonsa-Yahara River,291.83,1339,272,1974,Natural,0,0.182481752,0.510948905,0,0.306569343,0,0.163030999,0.096440873,0.190585534,0.065442021,0.484500574,0,0,0.272050401,0.038659794,0.001718213,0.098224513,0.052119129,0.071305842,0.240836197,0,0.128293242,0,0.015463918,0,0,0.081328751,0.152061856,0.054123711,0.322164948,0.071305842,0.400343643,0,24,6,57,92,NA,10,20.6,292.9,319.8,130.7,11.39,0.15,3.94,105.4,NA,6.23,74.33,283.28,7.67,0.13,146.83,23.25,110.49,0.68,NA,NA,NA,NA,NA,NA,NA,NA,NA,NA,NA,NA,NA,NA,"No area/perimeter calculation, No photo number, No inflows/outflows recorded",56,17,27,6,12,39,0,56,0,6,5,1,0,1,0,0,0,0,0,0,1,NA,0,0,0,1,NA,"Fatheads, Mudminnows",0,1,1,0,0,0,0,0,0,0,NA,0,0,0,1,0,0,0,1,0,1,1,1,1,0,0,0,1,1,1,1,0,1,0,0,0,1,0,0,0,0,0,0,1,0,1,0,0,0,1,1,0,1,1,1,0,1,1,1,0,0,1,1,1,0,1,1,0,1,1,0,1,0,0,1,NA,6,No distance on 3rd seine,NA,NA,NA,NA,NA,NA,NA,NA,NA,NA,NA,NA,NA,NA,NA,NA,NA,NA,NA,NA,NA,NA,NA,NA,NA,NA,NA,NA,NA,NA,NA,NA,NA,NA,NA,NA,NA,NA,NA,NA,NA,NA,NA,NA,NA,NA,NA,NA,NA,NA,NA,NA,NA,NA,NA,NA,NA,NA,NA,NA,NA,NA,NA,NA,NA,NA,NA,NA,NA
MCF,2,McFarland,MCF_2,7/30/2019,2019,7,30,12:55:00,13:13:00,0:18,"ES,CL,EP",Rural,43.00350222,-89.27397982,314658.7102,4763712.92,MCFARLAND VILLAGE OF,Lake Kegonsa-Yahara River,Lake Kegonsa-Yahara River,291.83,1339,238,1974,Natural,0,0.182481752,0.510948905,0,0.306569343,0,0.163030999,0.096440873,0.190585534,0.065442021,0.484500574,0,0,0.272050401,0.038659794,0.001718213,0.098224513,0.052119129,0.071305842,0.240836197,0,0.128293242,0,0.015463918,0,0,0.081328751,0.152061856,0.054123711,0.322164948,0.071305842,0.400343643,0,23,8,49,70,NA,8,26,323.9,317.6,69.9,5.52,0.15,6.66,116.8,NA,6.23,74.33,283.28,7.67,0.13,146.83,23.25,110.49,1.69,NA,NA,NA,NA,NA,NA,NA,NA,NA,NA,NA,NA,NA,NA,NA,56,17,27,6,12,39,0,56,0,6,5,0,1,0,1,0,0,1,0,0,1,Painted,1,0,0,1,NA,"Shiner, stickleback",1,0,0,1,0,0,0,0,0,0,NA,0,0,0,NA,NA,NA,NA,NA,NA,NA,NA,NA,NA,NA,NA,NA,NA,NA,NA,NA,NA,NA,NA,NA,NA,NA,NA,NA,NA,NA,NA,NA,NA,NA,NA,NA,NA,NA,NA,NA,NA,NA,NA,NA,NA,NA,NA,NA,NA,NA,NA,NA,NA,NA,NA,NA,NA,NA,NA,NA,NA,NA,NA,NA,NA,16,NA,NA,NA,NA,NA,NA,NA,NA,NA,NA,NA,NA,NA,NA,NA,NA,NA,NA,NA,NA,NA,NA,NA,NA,NA,NA,NA,NA,NA,NA,NA,NA,NA,NA,NA,NA,NA,NA,NA,NA,NA,NA,NA,NA,NA,NA,NA,NA,NA,NA,NA,NA,NA,NA,NA,NA,NA,NA,NA,NA,NA,NA,NA,NA,NA,NA,NA,NA,NA,NA
MP,3,Meadow Pond,MP_3,6/4/2020,2020,6,4,10:01:00,10:58:00,0:57,DCT,Rural,43.04132307,-89.56619813,290968.7573,4768599.759,City of Madison Storm Water,Headwaters Sugar River,Badger Mill Creek,434.2,9849,NA,1995,Natural,0.035714286,0,0.071428571,0.064285714,0.814285714,0.014285714,0.099542334,0.04576659,0.011441648,0.043478261,0.797482838,0.00228833,0,0.329708071,0.025758443,0.007155123,0.085289067,0.043216943,0.093875215,0.007155123,0.010589582,0.360045793,0,0.031196337,0.003720664,0.002289639,0,0.135661133,0.067544362,0.007155123,0.093875215,0.692043503,0.003720664,26,6,57,NA,2,3,24.5,269.2,271.7,45.3,3.7,0.13,224.42,173.5,7.28,6.81,87.43,325.3,7.28,0.15,147.03,25.25,134.63,NA,NA,98,1,1,90,10,"Firm Soil,Rock ,",1,1,2,2,1.5,1.88,"Water level seems higher than normal, rain 2 days ago, Phalaras is flooded and only emergent veg. observed besides willows and trees. Only submergent is Pota. Spp. Though covered in algae. Very sparse duckweed, far more floating algae. Vast majority of pond only 0.8m deep with a couple of spots at 1m.",NA,28,6,13,6,10,23,1,29,1,4,4,1,1,0,0,0,0,0,0,0,NA,NA,0,0,0,0,NA,"Pumpkinseed, several dead or dying,,,,",0,0,0,0,0,0,1,0,0,0,0,0,0,0,NA,NA,NA,NA,NA,NA,NA,NA,NA,NA,NA,NA,NA,NA,NA,NA,NA,NA,NA,NA,NA,NA,NA,NA,NA,NA,NA,NA,NA,NA,NA,NA,NA,NA,NA,NA,NA,NA,NA,NA,NA,NA,NA,NA,NA,NA,NA,NA,NA,NA,NA,NA,NA,NA,NA,NA,NA,NA,NA,NA,NA,NA,NA,NA,0,1,0,0,0,0,0,0,1,0,0,0,0,1,0,0,0,0,0,0,0,0,0,0,1,0,0,0,0,0,0,0,0,0,0,0,0,0,0,0,0,0,0,0,0,0,0,0,0,0,0,0,0,0,0,0,0,0,0,0,0,0,0,0,0,0,0,0,0
MP,4,Meadow Pond,MP_4,7/28/2020,2020,7,28,8:05:00,9:17:00,1:12,DCT,Rural,43.04132307,-89.56619813,290968.7573,4768599.759,City of Madison Storm Water,Headwaters Sugar River,Badger Mill Creek,434.2,9849,NA,1995,Natural,0.035714286,0,0.071428571,0.064285714,0.814285714,0.014285714,0.099542334,0.04576659,0.011441648,0.043478261,0.797482838,0.00228833,0,0.329708071,0.025758443,0.007155123,0.085289067,0.043216943,0.093875215,0.007155123,0.010589582,0.360045793,0,0.031196337,0.003720664,0.002289639,0,0.135661133,0.067544362,0.007155123,0.093875215,0.692043503,0.003720664,21,2,74,90,2,2,22.9,152.3,158.8,18.7,1.55,0.07,5.42,159.9,7.28,6.81,87.43,325.3,7.28,0.15,147.03,25.25,134.63,NA,0,80,10,10,90,10,"Firm Soil,Rock ,Leaf Litter",3,1,3,2,2.25,1.88,"Raining as soon as I started, light rain ~5 mins. 100s of small fish jumping after rain. Tons of hair algae both floating and submerged. Deep water does not have veg. 1000s of water striders. Wide areas of flooded Phalaras. Inflows from neighborhood seen but fairly distant from actual pond.",NA,28,6,13,6,10,23,1,29,1,4,4,1,1,0,0,0,0,0,0,0,NA,NA,0,0,0,0,NA,"Bullhead Catfish, Sunfish likely Pumpkinseed,,,,",0,0,0,0,0,0,0,0,1,0,1,0,0,0,NA,NA,NA,NA,NA,NA,NA,NA,NA,NA,NA,NA,NA,NA,NA,NA,NA,NA,NA,NA,NA,NA,NA,NA,NA,NA,NA,NA,NA,NA,NA,NA,NA,NA,NA,NA,NA,NA,NA,NA,NA,NA,NA,NA,NA,NA,NA,NA,NA,NA,NA,NA,NA,NA,NA,NA,NA,NA,NA,NA,NA,NA,NA,NA,0,1,0,0,0,0,0,0,1,0,0,0,0,1,0,0,0,0,0,0,0,0,0,0,0,0,0,0,0,1,0,0,0,0,0,0,0,0,0,0,0,1,0,0,0,0,0,0,0,0,0,0,0,0,0,0,0,0,0,0,0,0,0,0,0,0,0,0,0
MP,1,Meadow Pond,MP_1,6/26/2019,2019,6,26,14:45:00,15:20:00,0:35,"ES,EC,CL,EP",Rural,43.04132307,-89.56619813,290968.7573,4768599.759,City of Madison Storm Water,Headwaters Sugar River,Badger Mill Creek,434.2,9849,320,1995,Natural,0.035714286,0,0.071428571,0.064285714,0.814285714,0.014285714,0.099542334,0.04576659,0.011441648,0.043478261,0.797482838,0.00228833,0,0.329708071,0.025758443,0.007155123,0.085289067,0.043216943,0.093875215,0.007155123,0.010589582,0.360045793,0,0.031196337,0.003720664,0.002289639,0,0.135661133,0.067544362,0.007155123,0.093875215,0.692043503,0.003720664,29,4,38,50,NA,16,28.4,558,524,180.2,13.54,0.25,107.81,101.7,NA,6.81,87.43,325.3,7.28,0.15,147.03,25.25,134.63,1.22,NA,NA,NA,NA,NA,NA,NA,NA,NA,NA,NA,NA,NA,NA,"No area/perimeter calculated due to size of pond, 3rd zoop tow distance not recorded, no inflows/outflows recorded",28,6,13,6,10,23,1,29,1,4,4,1,1,0,0,1,0,0,0,0,1,NA,0,0,0,0,NA,Catfish,0,0,1,1,0,0,1,1,0,0,NA,0,0,0,0,0,0,0,1,0,0,1,1,1,0,0,1,1,1,0,0,0,1,1,0,1,0,0,0,0,0,0,0,0,0,1,0,0,0,1,1,0,0,0,0,0,0,0,0,0,0,0,0,1,0,0,0,0,0,0,0,0,0,0,1,Physids,5.5,"No distances on seines 1, 3, or 4",NA,NA,NA,NA,NA,NA,NA,NA,NA,NA,NA,NA,NA,NA,NA,NA,NA,NA,NA,NA,NA,NA,NA,NA,NA,NA,NA,NA,NA,NA,NA,NA,NA,NA,NA,NA,NA,NA,NA,NA,NA,NA,NA,NA,NA,NA,NA,NA,NA,NA,NA,NA,NA,NA,NA,NA,NA,NA,NA,NA,NA,NA,NA,NA,NA,NA,NA,NA,NA
MP,2,Meadow Pond,MP_2,8/2/2019,2019,8,2,9:45:00,9:56:00,0:11,"CL,EP,BC",Rural,43.04132307,-89.56619813,290968.7573,4768599.759,City of Madison Storm Water,Headwaters Sugar River,Badger Mill Creek,434.2,9849,NA,1995,Natural,0.035714286,0,0.071428571,0.064285714,0.814285714,0.014285714,0.099542334,0.04576659,0.011441648,0.043478261,0.797482838,0.00228833,0,0.329708071,0.025758443,0.007155123,0.085289067,0.043216943,0.093875215,0.007155123,0.010589582,0.360045793,0,0.031196337,0.003720664,0.002289639,0,0.135661133,0.067544362,0.007155123,0.093875215,0.692043503,0.003720664,24,0,89.5661,5,NA,19,25.2,347.8,346.7,105.5,8.45,0.16,71.66,153,NA,6.81,87.43,325.3,7.28,0.15,147.03,25.25,134.63,2.69,NA,NA,NA,NA,NA,NA,NA,NA,NA,NA,NA,NA,NA,NA,NA,28,6,13,6,10,23,1,29,1,4,4,0,1,0,0,0,0,0,0,0,0,NA,0,0,0,0,NA,bluegill,0,0,0,1,0,0,0,1,1,0,NA,0,0,1,NA,NA,NA,NA,NA,NA,NA,NA,NA,NA,NA,NA,NA,NA,NA,NA,NA,NA,NA,NA,NA,NA,NA,NA,NA,NA,NA,NA,NA,NA,NA,NA,NA,NA,NA,NA,NA,NA,NA,NA,NA,NA,NA,NA,NA,NA,NA,NA,NA,NA,NA,NA,NA,NA,NA,NA,NA,NA,NA,NA,NA,NA,3,bluegill fry might be pumpkinseed fry in sweeps,NA,NA,NA,NA,NA,NA,NA,NA,NA,NA,NA,NA,NA,NA,NA,NA,NA,NA,NA,NA,NA,NA,NA,NA,NA,NA,NA,NA,NA,NA,NA,NA,NA,NA,NA,NA,NA,NA,NA,NA,NA,NA,NA,NA,NA,NA,NA,NA,NA,NA,NA,NA,NA,NA,NA,NA,NA,NA,NA,NA,NA,NA,NA,NA,NA,NA,NA,NA,NA
MDT,3,Midtown Pond,MDT_3,5/29/2020,2020,5,29,8:35:00,9:25:00,0:50,DCT,Rural,43.03737383,-89.5272514,294128.1195,4768064.858,CITY OF MADISON PARKS MIDTOWN COMMONS PARK,Headwaters Sugar River,Badger Mill Creek,248.69,4484,NA,2005,Stormwater,0.3,0.028571429,0,0.064285714,0.585714286,0.007142857,0.324942792,0.026315789,0,0.036613272,0.607551487,0.001144165,0.000859,0.440881764,0.043229316,0.005725737,0.164328657,0.16318351,0.096478672,0,0.000286,0.048668766,0.000286,0.034354423,0.000286,0.001431434,0,0.333237904,0.077870026,0,0.096478672,0.491268251,0.000286,16,10,66,0,5,0,20.7,81.2,88.4,86.4,7.49,0.04,344.09,150.3,8.33,6.35,75.4,110.15,7.84,0.05,139.2,22.43,131.69,NA,0,85,2,13,65,35,"Mud,Rock ,Sand",2,4,3,1,2.5,2.13,"Film over surface, lots of alage, it looks like it gets mowed.",NA,29,12,11,3,6,17,0,29,0,3,3,0,1,0,0,0,0,0,0,0,NA,NA,0,0,0,0,NA,"Unknown Medium fish,,,,",0,0,0,0,0,1,0,0,0,0,0,0,0,0,NA,NA,NA,NA,NA,NA,NA,NA,NA,NA,NA,NA,NA,NA,NA,NA,NA,NA,NA,NA,NA,NA,NA,NA,NA,NA,NA,NA,NA,NA,NA,NA,NA,NA,NA,NA,NA,NA,NA,NA,NA,NA,NA,NA,NA,NA,NA,NA,NA,NA,NA,NA,NA,NA,NA,NA,NA,NA,NA,NA,NA,NA,NA,NA,1,1,0,1,0,0,0,0,1,0,0,0,0,0,0,0,0,0,0,0,0,0,0,0,1,0,0,0,0,0,0,1,0,0,0,0,0,0,0,0,1,0,0,0,0,0,0,0,0,0,0,0,0,0,0,0,0,0,0,0,0,0,0,0,0,0,0,0,0
MDT,4,Midtown Pond,MDT_4,7/11/2020,2020,7,11,6:52:00,7:54:00,1:02,DCT,Rural,43.03737383,-89.5272514,294128.1195,4768064.858,CITY OF MADISON PARKS MIDTOWN COMMONS PARK,Headwaters Sugar River,Badger Mill Creek,248.69,4484,NA,2005,Stormwater,0.3,0.028571429,0,0.064285714,0.585714286,0.007142857,0.324942792,0.026315789,0,0.036613272,0.607551487,0.001144165,0.000859,0.440881764,0.043229316,0.005725737,0.164328657,0.16318351,0.096478672,0,0.000286,0.048668766,0.000286,0.034354423,0.000286,0.001431434,0,0.333237904,0.077870026,0,0.096478672,0.491268251,0.000286,19,2,87,50,5,0,24.2,60.3,61.1,58.6,4.73,0.03,278.3,147.3,7.35,6.35,75.4,110.15,7.84,0.05,139.2,22.43,131.69,NA,0,85,5,10,35,65,"Firm Soil,,NA",2,4,1,0,1.75,2.13,"Water turbid, hard to gauge submergent. Lots of floating Pota. With coontail beneath, some floating algae.",NA,29,12,11,3,6,17,0,29,0,3,3,0,1,0,0,0,0,0,0,0,NA,NA,0,0,0,0,NA,NA,0,0,0,0,0,0,0,0,0,0,0,0,0,0,NA,NA,NA,NA,NA,NA,NA,NA,NA,NA,NA,NA,NA,NA,NA,NA,NA,NA,NA,NA,NA,NA,NA,NA,NA,NA,NA,NA,NA,NA,NA,NA,NA,NA,NA,NA,NA,NA,NA,NA,NA,NA,NA,NA,NA,NA,NA,NA,NA,NA,NA,NA,NA,NA,NA,NA,NA,NA,NA,NA,NA,NA,NA,NA,1,1,0,1,0,0,0,0,0,0,0,0,1,1,0,0,0,0,0,0,0,0,0,0,1,0,0,0,0,0,0,1,0,0,0,0,1,0,0,1,1,0,0,0,0,0,0,0,1,0,0,0,0,0,0,0,0,0,0,0,0,0,0,0,0,0,0,0,0
MDT,1,Midtown Pond,MDT_1,6/19/2019,2019,6,19,9:05:00,NA,NA,"CL,EC,DP",Rural,43.03737383,-89.5272514,294128.1195,4768064.858,CITY OF MADISON PARKS MIDTOWN COMMONS PARK,Headwaters Sugar River,Badger Mill Creek,248.69,4484,329,2005,Stormwater,0.3,0.028571429,0,0.064285714,0.585714286,0.007142857,0.324942792,0.026315789,0,0.036613272,0.607551487,0.001144165,0.000859,0.440881764,0.043229316,0.005725737,0.164328657,0.16318351,0.096478672,0,0.000286,0.048668766,0.000286,0.034354423,0.000286,0.001431434,0,0.333237904,0.077870026,0,0.096478672,0.491268251,0.000286,17,4,93,100,NA,2,21.7,171.4,183,113.9,9.62,0.09,35.98,102.2,NA,6.35,75.4,110.15,7.84,0.05,139.2,22.43,131.69,1.16,NA,NA,NA,NA,NA,NA,NA,NA,NA,NA,NA,NA,NA,NA,"no pond area survey done, people say there is a muskrat, huge planorbids,no toad larvae found only adult",29,12,11,3,6,17,0,29,0,3,3,1,1,1,0,0,0,0,0,0,0,NA,0,0,0,0,NA,sunfish,0,0,1,0,0,0,1,1,0,0,NA,0,0,0,0,0,1,0,1,0,0,0,1,1,0,0,0,1,1,0,1,0,1,0,0,0,0,0,0,0,0,0,0,0,0,1,0,0,0,1,1,0,0,0,0,0,0,0,0,0,0,0,0,0,0,1,0,1,0,0,0,1,0,0,0,planorbid,19,NA,NA,NA,NA,NA,NA,NA,NA,NA,NA,NA,NA,NA,NA,NA,NA,NA,NA,NA,NA,NA,NA,NA,NA,NA,NA,NA,NA,NA,NA,NA,NA,NA,NA,NA,NA,NA,NA,NA,NA,NA,NA,NA,NA,NA,NA,NA,NA,NA,NA,NA,NA,NA,NA,NA,NA,NA,NA,NA,NA,NA,NA,NA,NA,NA,NA,NA,NA,NA,NA
MDT,2,Midtown Pond,MDT_2,8/2/2019,2019,8,2,7:45:00,7:59:00,0:14,"BC,CL,EP",Rural,43.03737383,-89.5272514,294128.1195,4768064.858,CITY OF MADISON PARKS MIDTOWN COMMONS PARK,Headwaters Sugar River,Badger Mill Creek,248.69,4484,326,2005,Stormwater,0.3,0.028571429,0,0.064285714,0.585714286,0.007142857,0.324942792,0.026315789,0,0.036613272,0.607551487,0.001144165,0.000859,0.440881764,0.043229316,0.005725737,0.164328657,0.16318351,0.096478672,0,0.000286,0.048668766,0.000286,0.034354423,0.000286,0.001431434,0,0.333237904,0.077870026,0,0.096478672,0.491268251,0.000286,19,0,71,5,NA,2,23.1,104.1,108.1,42.7,3.55,0.05,15.01,157,NA,6.35,75.4,110.15,7.84,0.05,139.2,22.43,131.69,1.45,NA,NA,NA,NA,NA,NA,NA,NA,NA,NA,NA,NA,NA,NA,"no infow, outflow, sl, or dept recorded; Flour - OVER",29,12,11,3,6,17,0,29,0,3,3,1,1,0,0,0,0,0,0,0,0,NA,0,0,0,0,NA,NA,0,0,0,0,0,0,0,0,0,0,NA,0,0,0,NA,NA,NA,NA,NA,NA,NA,NA,NA,NA,NA,NA,NA,NA,NA,NA,NA,NA,NA,NA,NA,NA,NA,NA,NA,NA,NA,NA,NA,NA,NA,NA,NA,NA,NA,NA,NA,NA,NA,NA,NA,NA,NA,NA,NA,NA,NA,NA,NA,NA,NA,NA,NA,NA,NA,NA,NA,NA,NA,NA,NA,NA,13,nothing in 20 sweeps,NA,NA,NA,NA,NA,NA,NA,NA,NA,NA,NA,NA,NA,NA,NA,NA,NA,NA,NA,NA,NA,NA,NA,NA,NA,NA,NA,NA,NA,NA,NA,NA,NA,NA,NA,NA,NA,NA,NA,NA,NA,NA,NA,NA,NA,NA,NA,NA,NA,NA,NA,NA,NA,NA,NA,NA,NA,NA,NA,NA,NA,NA,NA,NA,NA,NA,NA,NA,NA
OVP,3,Oakwood Village Pond,OVP_3,6/15/2020,2020,6,15,8:35:00,10:05:00,1:30,DCT,Green Space,43.05927462,-89.48943524,297280.9726,4770404.98,HOME OAKWOOD LUTHERAN,Lake Mendota-Yahara River,Lake Mendota-Yahara River,760.15,2242,NA,1937,Stormwater,0.546099291,0.425531915,0,0.021276596,0,0.007092199,0.759450172,0.109965636,0,0.045819015,0.083619702,0.001145475,0,0.000858,0.008011445,0.110729614,0.323891273,0.303004292,0.122460658,0,0,0.079828326,0.000858,0.043776824,0.00658083,0,0,0.737625179,0.051788269,0,0.122460658,0.081545064,0.00658083,16,8,55,0,2,20,15.8,186.6,226.6,37.5,3.65,0.11,366.27,197.9,7.17,5.14,59.88,317.48,7.06,0.15,145.03,21.48,209.58,NA,2,80,5,15,90,10,"Firm Soil,Leaf Litter,NA",3,1,2,5,2.75,3,"Very clear but stained with tannins, leaf litter and lots of wood. Little plant diversity. Sign says it occasionally dries. Newts are other",NA,28,4,20,0,4,24,0,28,0,4,4,0,0,1,0,0,0,0,0,1,NA,NA,0,0,0,0,NA,NA,0,0,0,0,0,0,0,0,0,0,0,0,0,0,NA,NA,NA,NA,NA,NA,NA,NA,NA,NA,NA,NA,NA,NA,NA,NA,NA,NA,NA,NA,NA,NA,NA,NA,NA,NA,NA,NA,NA,NA,NA,NA,NA,NA,NA,NA,NA,NA,NA,NA,NA,NA,NA,NA,NA,NA,NA,NA,NA,NA,NA,NA,NA,NA,NA,NA,NA,NA,NA,NA,NA,NA,NA,NA,1,0,0,0,0,0,0,0,0,0,0,0,0,1,0,0,0,0,0,1,0,0,0,0,0,0,0,0,0,0,0,0,0,0,0,0,0,0,0,0,0,0,0,0,0,0,0,0,0,0,0,0,0,0,0,0,0,0,0,0,0,0,0,0,0,0,0,0,0
OVP,4,Oakwood Village Pond,OVP_4,7/26/2020,2020,7,26,7:50:00,8:52:00,1:02,"DCT, Lucas",Green Space,43.05927462,-89.48943524,297280.9726,4770404.98,HOME OAKWOOD LUTHERAN,Lake Mendota-Yahara River,Lake Mendota-Yahara River,760.15,2242,NA,1937,Stormwater,0.546099291,0.425531915,0,0.021276596,0,0.007092199,0.759450172,0.109965636,0,0.045819015,0.083619702,0.001145475,0,0.000858,0.008011445,0.110729614,0.323891273,0.303004292,0.122460658,0,0,0.079828326,0.000858,0.043776824,0.00658083,0,0,0.737625179,0.051788269,0,0.122460658,0.081545064,0.00658083,26,8,87,40,2,15,25,100,100.1,32.8,2.58,0.05,5.99,123.7,6.94,5.14,59.88,317.48,7.06,0.15,145.03,21.48,209.58,NA,2,45,1,55,100,0,"Firm Soil,Leaf Litter,NA",5,1,2,5,3.25,3,"Water level ~2m lower than previous high water line. Lots of floating vegetation made submergent detection and estimation difficult. Talked to 2 residents, informed us that some of the amphibians may be planted by Bob Greenlar and water in pond rarely dries.",NA,28,4,20,0,4,24,0,28,0,4,4,0,0,1,0,1,0,0,0,0,NA,NA,0,0,0,0,NA,NA,0,0,0,0,0,0,0,0,0,0,0,0,0,0,NA,NA,NA,NA,NA,NA,NA,NA,NA,NA,NA,NA,NA,NA,NA,NA,NA,NA,NA,NA,NA,NA,NA,NA,NA,NA,NA,NA,NA,NA,NA,NA,NA,NA,NA,NA,NA,NA,NA,NA,NA,NA,NA,NA,NA,NA,NA,NA,NA,NA,NA,NA,NA,NA,NA,NA,NA,NA,NA,NA,NA,NA,NA,NA,1,0,0,0,0,0,0,0,0,1,0,0,0,1,0,0,0,0,0,1,0,0,0,0,0,0,0,0,0,0,0,0,0,0,0,0,0,0,0,0,0,0,0,0,0,0,0,0,0,0,0,0,0,0,0,0,0,0,0,0,0,0,0,0,0,0,0,0,0
OVP,1,Oakwood Village Pond,OVP_1,6/21/2019,2019,6,21,11:10:00,12:05:00,0:55,"ES,CL,BC",Green Space,43.05927462,-89.48943524,297280.9726,4770404.98,HOME OAKWOOD LUTHERAN,Lake Mendota-Yahara River,Lake Mendota-Yahara River,760.15,2242,231,1937,Stormwater,0.546099291,0.425531915,0,0.021276596,0,0.007092199,0.759450172,0.109965636,0,0.045819015,0.083619702,0.001145475,0,0.000858,0.008011445,0.110729614,0.323891273,0.303004292,0.122460658,0,0,0.079828326,0.000858,0.043776824,0.00658083,0,0,0.737625179,0.051788269,0,0.122460658,0.081545064,0.00658083,22,9,47,90,NA,20,20.5,553,605,110.9,9.65,0.29,183.51,150.5,NA,5.14,59.88,317.48,7.06,0.15,145.03,21.48,209.58,1.56,NA,NA,NA,NA,NA,NA,NA,NA,NA,NA,NA,NA,NA,NA,"No area/perimeter calculated, no inflow/outflow seen,",28,4,20,0,4,24,0,28,0,4,4,0,0,0,0,1,0,0,0,0,0,NA,0,0,0,0,NA,NA,0,0,0,0,0,0,0,0,0,0,NA,0,0,0,1,0,1,0,1,0,1,0,1,1,0,0,0,0,1,0,1,1,1,1,0,0,0,0,0,0,0,0,0,1,0,0,0,0,0,1,1,0,1,1,0,0,0,1,1,0,0,0,1,1,0,0,0,0,1,1,0,1,0,0,0,"Backswimmers, beetle larvae, physid snails",6.5,NA,NA,NA,NA,NA,NA,NA,NA,NA,NA,NA,NA,NA,NA,NA,NA,NA,NA,NA,NA,NA,NA,NA,NA,NA,NA,NA,NA,NA,NA,NA,NA,NA,NA,NA,NA,NA,NA,NA,NA,NA,NA,NA,NA,NA,NA,NA,NA,NA,NA,NA,NA,NA,NA,NA,NA,NA,NA,NA,NA,NA,NA,NA,NA,NA,NA,NA,NA,NA,NA
OVP,2,Oakwood Village Pond,OVP_2,7/16/2019,2019,7,16,9:22:00,9:53:00,0:31,"ES,EP,CL",Green Space,43.05927462,-89.48943524,297280.9726,4770404.98,HOME OAKWOOD LUTHERAN,Lake Mendota-Yahara River,Lake Mendota-Yahara River,760.15,2242,310,1937,Stormwater,0.546099291,0.425531915,0,0.021276596,0,0.007092199,0.759450172,0.109965636,0,0.045819015,0.083619702,0.001145475,0,0.000858,0.008011445,0.110729614,0.323891273,0.303004292,0.122460658,0,0,0.079828326,0.000858,0.043776824,0.00658083,0,0,0.737625179,0.051788269,0,0.122460658,0.081545064,0.00658083,24,6,74,10,NA,13,24.6,335.5,338.2,58.3,4.68,0.16,78.95,108,NA,5.14,59.88,317.48,7.06,0.15,145.03,21.48,209.58,1.54,NA,NA,NA,NA,NA,NA,NA,NA,NA,NA,NA,NA,NA,NA,other amphibian=Newts,28,4,20,0,4,24,0,28,0,4,4,0,0,1,0,1,0,0,0,1,0,NA,0,0,0,0,NA,NA,0,0,0,0,0,0,0,0,0,0,NA,0,0,0,NA,NA,NA,NA,NA,NA,NA,NA,NA,NA,NA,NA,NA,NA,NA,NA,NA,NA,NA,NA,NA,NA,NA,NA,NA,NA,NA,NA,NA,NA,NA,NA,NA,NA,NA,NA,NA,NA,NA,NA,NA,NA,NA,NA,NA,NA,NA,NA,NA,NA,NA,NA,NA,NA,NA,NA,NA,NA,NA,NA,NA,NA,0,NA,NA,NA,NA,NA,NA,NA,NA,NA,NA,NA,NA,NA,NA,NA,NA,NA,NA,NA,NA,NA,NA,NA,NA,NA,NA,NA,NA,NA,NA,NA,NA,NA,NA,NA,NA,NA,NA,NA,NA,NA,NA,NA,NA,NA,NA,NA,NA,NA,NA,NA,NA,NA,NA,NA,NA,NA,NA,NA,NA,NA,NA,NA,NA,NA,NA,NA,NA,NA,NA
ODP-UW,3,Observatory Dr. Pond,ODP-UW_3,5/20/2020,2020,5,20,11:23:00,12:30:00,1:07,DCT,Urban,43.07686611,-89.4230926,302740.0477,4772200.399,UNIV OF WIS REGENTS,Lake Mendota-Yahara River,Lake Mendota-Yahara River,18.19,756,NA,2010,Stormwater,0.611111111,0.006944444,0.027777778,0.284722222,0.0625,0.006944444,0.709049255,0.001145475,0.025200458,0.073310424,0.022909507,0.16838488,0.000287,0.005455067,0.000861,0.112546655,0.244903819,0.271317829,0.055412001,0.024404249,0,0.02670112,0.000574,0.0097617,0.245190927,0,0.002583979,0.628768303,0.010623026,0.026988229,0.055412001,0.032730405,0.245190927,18,13,62,15,4,1,15,167.1,206.8,130.2,12.83,0.1,311,72.86,7.7,7.11,78.7,274.83,7.66,0.13,70.67,20.25,116.61,NA,0,10,70,20,40,60,"Firm Soil,Rock ,NA",1,5,2,0,2,2,"Clearwater, emergent dominant, however, lots of duckweed and floating and submergent veg",NA,35,13,16,1,6,22,0,35,0,5,3,0,0,1,0,0,0,0,0,0,NA,"Painted,,,,NA",1,0,0,2,NA,"Large schools of small cyprinids,,,,NA",0,0,0,0,1,0,0,0,0,0,0,0,0,0,NA,NA,NA,NA,NA,NA,NA,NA,NA,NA,NA,NA,NA,NA,NA,NA,NA,NA,NA,NA,NA,NA,NA,NA,NA,NA,NA,NA,NA,NA,NA,NA,NA,NA,NA,NA,NA,NA,NA,NA,NA,NA,NA,NA,NA,NA,NA,NA,NA,NA,NA,NA,NA,NA,NA,NA,NA,NA,NA,NA,NA,NA,NA,NA,0,1,1,0,0,0,0,0,1,0,0,0,1,1,0,1,0,0,0,0,0,0,0,0,0,0,0,1,0,0,0,0,0,0,0,0,1,0,0,0,1,0,0,0,1,0,0,0,0,0,0,0,0,0,0,0,0,0,0,0,0,0,0,0,0,0,0,0,0
ODP-UW,4,Observatory Dr. Pond,ODP-UW_4,7/8/2020,2020,7,8,8:42:00,9:46:00,1:04,DCT,Urban,43.07686611,-89.4230926,302740.0477,4772200.399,UNIV OF WIS REGENTS,Lake Mendota-Yahara River,Lake Mendota-Yahara River,18.19,756,NA,2010,Stormwater,0.611111111,0.006944444,0.027777778,0.284722222,0.0625,0.006944444,0.709049255,0.001145475,0.025200458,0.073310424,0.022909507,0.16838488,0.000287,0.005455067,0.000861,0.112546655,0.244903819,0.271317829,0.055412001,0.024404249,0,0.02670112,0.000574,0.0097617,0.245190927,0,0.002583979,0.628768303,0.010623026,0.026988229,0.055412001,0.032730405,0.245190927,23,5,85,30,4,0,20.6,331.1,361.1,75.9,6.61,0.17,222.7,57.68,7.62,7.11,78.7,274.83,7.66,0.13,70.67,20.25,116.61,NA,0,10,70,20,40,60,"Firm Soil,Rock ,NA",1,5,2,0,2,2,"Heavy rain the night before. Thick elodia under DW. Lots of ranid metamorphs (leopard). Lots of raccoon scat. Schools of shiners, lots of amphipods and corixids.",NA,35,13,16,1,6,22,0,35,0,5,3,0,0,1,1,0,0,0,0,0,NA,"Painted,,,,NA",1,0,0,2,NA,"Shiner,,,,NA",0,0,0,1,0,0,0,0,0,0,0,0,0,0,NA,NA,NA,NA,NA,NA,NA,NA,NA,NA,NA,NA,NA,NA,NA,NA,NA,NA,NA,NA,NA,NA,NA,NA,NA,NA,NA,NA,NA,NA,NA,NA,NA,NA,NA,NA,NA,NA,NA,NA,NA,NA,NA,NA,NA,NA,NA,NA,NA,NA,NA,NA,NA,NA,NA,NA,NA,NA,NA,NA,NA,NA,NA,NA,0,0,0,0,0,0,0,0,1,0,0,0,1,1,1,1,0,0,0,0,0,1,0,0,0,0,0,0,0,0,0,0,0,0,0,0,1,0,0,1,1,0,0,0,1,0,0,0,0,0,0,0,0,0,0,0,0,0,0,0,0,0,0,0,0,0,0,0,0
ODP-UW,1,Observatory Dr. Pond,ODP-UW_1,6/5/2019,2019,6,5,9:00:00,9:51:00,0:51,"ES,EC,EP",Urban,43.07686611,-89.4230926,302740.0477,4772200.399,UNIV OF WIS REGENTS,Lake Mendota-Yahara River,Lake Mendota-Yahara River,18.19,756,9,2010,Stormwater,0.611111111,0.006944444,0.027777778,0.284722222,0.0625,0.006944444,0.709049255,0.001145475,0.025200458,0.073310424,0.022909507,0.16838488,0.000287,0.005455067,0.000861,0.112546655,0.244903819,0.271317829,0.055412001,0.024404249,0,0.02670112,0.000574,0.0097617,0.245190927,0,0.002583979,0.628768303,0.010623026,0.026988229,0.055412001,0.032730405,0.245190927,23,6,74,31,NA,2,19.2,258.3,290.8,44.4,3.95,0.14,24.61,93.36,NA,7.11,78.7,274.83,7.66,0.13,70.67,20.25,116.61,0.53,NA,NA,NA,NA,NA,NA,NA,NA,NA,NA,NA,NA,NA,NA,*all zoop tows were dragged,35,13,16,1,6,22,0,35,0,5,3,0,0,1,1,0,0,0,0,0,1,"Painted,Snapping",1,1,0,2,NA,"minnow sp,lots of small fish-maybe fatheads",0,0,0,0,0,0,0,0,0,0,NA,0,0,0,1,0,0,0,1,0,1,0,0,1,0,0,0,0,1,0,1,0,1,1,0,0,0,0,0,1,0,0,0,0,0,0,0,0,1,1,0,0,0,1,0,0,0,0,1,0,0,0,1,1,0,0,1,1,0,1,0,0,0,0,0,"backswimmers,damselfly,physid snails",3,*accidentally did two sweep 6s,NA,NA,NA,NA,NA,NA,NA,NA,NA,NA,NA,NA,NA,NA,NA,NA,NA,NA,NA,NA,NA,NA,NA,NA,NA,NA,NA,NA,NA,NA,NA,NA,NA,NA,NA,NA,NA,NA,NA,NA,NA,NA,NA,NA,NA,NA,NA,NA,NA,NA,NA,NA,NA,NA,NA,NA,NA,NA,NA,NA,NA,NA,NA,NA,NA,NA,NA,NA,NA
ODP-UW,2,Observatory Dr. Pond,ODP-UW_2,7/10/2019,2019,7,10,13:55:00,14:17:00,0:22,"ES,EC,EP",Urban,43.07686611,-89.4230926,302740.0477,4772200.399,UNIV OF WIS REGENTS,Lake Mendota-Yahara River,Lake Mendota-Yahara River,18.19,756,254,2010,Stormwater,0.611111111,0.006944444,0.027777778,0.284722222,0.0625,0.006944444,0.709049255,0.001145475,0.025200458,0.073310424,0.022909507,0.16838488,0.000287,0.005455067,0.000861,0.112546655,0.244903819,0.271317829,0.055412001,0.024404249,0,0.02670112,0.000574,0.0097617,0.245190927,0,0.002583979,0.628768303,0.010623026,0.026988229,0.055412001,0.032730405,0.245190927,NA,NA,50,20,NA,2,26.2,246.2,240.6,64.3,5.03,0.11,14.23,58.76,NA,7.11,78.7,274.83,7.66,0.13,70.67,20.25,116.61,0.6,NA,NA,NA,NA,NA,NA,NA,NA,NA,NA,NA,NA,NA,NA,NA,35,13,16,1,6,22,0,35,0,5,3,1,0,0,1,0,0,0,0,0,1,NA,0,0,0,2,NA,NA,0,0,0,1,0,0,0,0,0,0,NA,0,0,0,NA,NA,NA,NA,NA,NA,NA,NA,NA,NA,NA,NA,NA,NA,NA,NA,NA,NA,NA,NA,NA,NA,NA,NA,NA,NA,NA,NA,NA,NA,NA,NA,NA,NA,NA,NA,NA,NA,NA,NA,NA,NA,NA,NA,NA,NA,NA,NA,NA,NA,NA,NA,NA,NA,NA,NA,NA,NA,NA,NA,NA,NA,6.5,NA,NA,NA,NA,NA,NA,NA,NA,NA,NA,NA,NA,NA,NA,NA,NA,NA,NA,NA,NA,NA,NA,NA,NA,NA,NA,NA,NA,NA,NA,NA,NA,NA,NA,NA,NA,NA,NA,NA,NA,NA,NA,NA,NA,NA,NA,NA,NA,NA,NA,NA,NA,NA,NA,NA,NA,NA,NA,NA,NA,NA,NA,NA,NA,NA,NA,NA,NA,NA,NA
O-N,3,Orchid North,O-N_3,5/22/2020,2020,5,22,16:04:00,16:26:00,0:22,"DCT, KR, AMKT",Green Space,43.11858208,-89.47877933,298343.5212,4776965.792,MIDDLETON CITY OF,Lake Mendota-Yahara River,Pheasant Branch,31.35,7484,NA,2000,Stormwater,0.115107914,0,0.510791367,0.014388489,0.316546763,0.043165468,0.320689655,0.004597701,0.356321839,0.083908046,0.225287356,0.009195402,0,0.060961649,0.040927304,0.006010303,0.251287922,0.0930166,0.082427018,0.22323984,0,0.142243847,0.002003434,0.058099599,0.006868918,0.002575844,0.030337722,0.350314825,0.099026903,0.253577562,0.082427018,0.207784774,0.006868918,19,9,69,98,2,1,19,318.6,359.9,195,17.56,0.17,101.96,109.6,9.06,10.26,121.18,398.75,8.78,0.19,104.89,23.28,75.12,NA,4,98,1,1,95,5,"Mud,,NA",1,1,1,1,1,1.25,"Children fishing, dead carp",NA,35,12,17,3,7,24,1,36,1,4,3,0,0,0,0,0,0,0,0,0,NA,NA,0,0,0,1,NA,"Carp, Bluegill, large fish jumping,,,,NA",0,0,0,0,0,0,0,1,0,0,0,0,0,1,NA,NA,NA,NA,NA,NA,NA,NA,NA,NA,NA,NA,NA,NA,NA,NA,NA,NA,NA,NA,NA,NA,NA,NA,NA,NA,NA,NA,NA,NA,NA,NA,NA,NA,NA,NA,NA,NA,NA,NA,NA,NA,NA,NA,NA,NA,NA,NA,NA,NA,NA,NA,NA,NA,NA,NA,NA,NA,NA,NA,NA,NA,NA,NA,0,0,1,1,0,0,0,0,1,1,0,1,0,0,0,0,0,0,0,0,0,0,0,0,0,0,0,0,0,0,0,0,0,0,0,0,0,0,0,0,0,0,0,0,0,0,0,0,0,0,0,0,0,0,0,0,0,0,0,0,0,0,0,0,0,0,0,0,0
O-N,4,Orchid North,O-N_4,7/13/2020,2020,7,13,7:17:00,8:07:00,0:50,DCT,Green Space,43.11858208,-89.47877933,298343.5212,4776965.792,MIDDLETON CITY OF,Lake Mendota-Yahara River,Pheasant Branch,31.35,7484,NA,2000,Stormwater,0.115107914,0,0.510791367,0.014388489,0.316546763,0.043165468,0.320689655,0.004597701,0.356321839,0.083908046,0.225287356,0.009195402,0,0.060961649,0.040927304,0.006010303,0.251287922,0.0930166,0.082427018,0.22323984,0,0.142243847,0.002003434,0.058099599,0.006868918,0.002575844,0.030337722,0.350314825,0.099026903,0.253577562,0.082427018,0.207784774,0.006868918,19,1,87,0,2,1,24.5,245.1,247.5,110.1,8.93,0.12,NA,147.2,8.5,10.26,121.18,398.75,8.78,0.19,104.89,23.28,75.12,NA,0,92,5,3,80,20,"Firm Soil,Rock ,NA",1,2,2,1,1.5,1.25,"Very turbid and difficult to gauge submergent but seems sparse and mostly coontail. Steep bank with very little emergent. Almost nothing in 8 sweeps, but lots of small sunfish observed and large jumping. No amphibians observed.",NA,35,12,17,3,7,24,1,36,1,4,3,0,0,0,0,0,1,0,0,0,NA,"Snapping,,,,NA",0,1,0,1,NA,"Pumkinseed,,,,NA",0,0,0,0,0,0,1,0,0,0,0,0,0,0,NA,NA,NA,NA,NA,NA,NA,NA,NA,NA,NA,NA,NA,NA,NA,NA,NA,NA,NA,NA,NA,NA,NA,NA,NA,NA,NA,NA,NA,NA,NA,NA,NA,NA,NA,NA,NA,NA,NA,NA,NA,NA,NA,NA,NA,NA,NA,NA,NA,NA,NA,NA,NA,NA,NA,NA,NA,NA,NA,NA,NA,NA,NA,NA,1,1,1,1,0,1,0,0,1,1,0,1,1,1,0,0,0,0,0,0,0,1,0,0,1,0,0,0,0,0,0,0,0,0,0,0,0,0,0,0,0,0,0,0,0,0,0,0,0,0,0,0,0,0,0,0,0,0,0,0,0,0,0,0,0,0,0,0,0
O-N,1,Orchid North,O-N_1,6/27/2019,2019,6,27,10:53:00,11:27:00,0:34,"DP,CL,BC,EP",Green Space,43.11858208,-89.47877933,298343.5212,4776965.792,MIDDLETON CITY OF,Lake Mendota-Yahara River,Pheasant Branch,31.35,7484,267,2000,Stormwater,0.115107914,0,0.510791367,0.014388489,0.316546763,0.043165468,0.320689655,0.004597701,0.356321839,0.083908046,0.225287356,0.009195402,0,0.060961649,0.040927304,0.006010303,0.251287922,0.0930166,0.082427018,0.22323984,0,0.142243847,0.002003434,0.058099599,0.006868918,0.002575844,0.030337722,0.350314825,0.099026903,0.253577562,0.082427018,0.207784774,0.006868918,28,5,57,28,NA,16,24.3,552,560,111.5,9.1,0.27,60.4,87.05,NA,10.26,121.18,398.75,8.78,0.19,104.89,23.28,75.12,1,NA,NA,NA,NA,NA,NA,NA,NA,NA,NA,NA,NA,NA,NA,suspected snapping turtle,35,12,17,3,7,24,1,36,1,4,3,1,0,0,0,0,0,0,0,0,0,NA,0,0,0,1,NA,NA,0,0,0,0,0,0,1,1,0,0,NA,0,0,0,1,0,0,0,1,0,0,0,0,1,0,0,0,1,1,0,1,0,1,0,0,0,0,0,0,0,0,0,0,0,1,1,0,1,0,1,1,0,0,0,0,1,0,0,0,0,0,0,1,1,0,1,1,1,0,0,0,1,0,0,1,NA,9,NA,NA,NA,NA,NA,NA,NA,NA,NA,NA,NA,NA,NA,NA,NA,NA,NA,NA,NA,NA,NA,NA,NA,NA,NA,NA,NA,NA,NA,NA,NA,NA,NA,NA,NA,NA,NA,NA,NA,NA,NA,NA,NA,NA,NA,NA,NA,NA,NA,NA,NA,NA,NA,NA,NA,NA,NA,NA,NA,NA,NA,NA,NA,NA,NA,NA,NA,NA,NA,NA
O-N,2,Orchid North,O-N_2,8/9/2019,2019,8,9,10:14:00,10:27:00,0:13,"CL,EC,BC",Green Space,43.11858208,-89.47877933,298343.5212,4776965.792,MIDDLETON CITY OF,Lake Mendota-Yahara River,Pheasant Branch,31.35,7484,265,2000,Stormwater,0.115107914,0,0.510791367,0.014388489,0.316546763,0.043165468,0.320689655,0.004597701,0.356321839,0.083908046,0.225287356,0.009195402,0,0.060961649,0.040927304,0.006010303,0.251287922,0.0930166,0.082427018,0.22323984,0,0.142243847,0.002003434,0.058099599,0.006868918,0.002575844,0.030337722,0.350314825,0.099026903,0.253577562,0.082427018,0.207784774,0.006868918,20,4,54,10,NA,5,25.3,430.5,427.6,68.1,5.44,0.2,63.01,75.71,NA,10.26,121.18,398.75,8.78,0.19,104.89,23.28,75.12,2.13,NA,NA,NA,NA,NA,NA,NA,NA,NA,NA,NA,NA,NA,NA,No max depth,35,12,17,3,7,24,1,36,1,4,3,0,0,0,1,0,0,0,0,0,0,NA,0,0,0,1,NA,"Bluegill, Pumpkinseed, Green Sunfish",0,0,0,0,0,0,1,1,0,0,NA,0,0,0,NA,NA,NA,NA,NA,NA,NA,NA,NA,NA,NA,NA,NA,NA,NA,NA,NA,NA,NA,NA,NA,NA,NA,NA,NA,NA,NA,NA,NA,NA,NA,NA,NA,NA,NA,NA,NA,NA,NA,NA,NA,NA,NA,NA,NA,NA,NA,NA,NA,NA,NA,NA,NA,NA,NA,NA,NA,NA,NA,NA,NA,NA,17,NA,NA,NA,NA,NA,NA,NA,NA,NA,NA,NA,NA,NA,NA,NA,NA,NA,NA,NA,NA,NA,NA,NA,NA,NA,NA,NA,NA,NA,NA,NA,NA,NA,NA,NA,NA,NA,NA,NA,NA,NA,NA,NA,NA,NA,NA,NA,NA,NA,NA,NA,NA,NA,NA,NA,NA,NA,NA,NA,NA,NA,NA,NA,NA,NA,NA,NA,NA,NA,NA
O-S,3,Orchid South,O-S_3,5/22/2020,2020,5,22,15:20:00,15:56:00,0:36,DCT,Green Space,43.11685318,-89.47789012,298410.185,4776771.644,MIDDLETON CITY OF,Lake Mendota-Yahara River,Pheasant Branch,31.35,5903,NA,2000,Stormwater,0.143884892,0,0.388489209,0.014388489,0.417266187,0.035971223,0.336009174,0.068807339,0.324541284,0.065366972,0.194954128,0.010321101,0,0.036665712,0.028072186,0.005729017,0.303065024,0.117444858,0.084503008,0.221712976,0,0.103122315,0.002291607,0.055285019,0.006874821,0.000286,0.034947007,0.4262389,0.083357204,0.256659983,0.084503008,0.142366084,0.006874821,19,7,67,90,3,5,20.2,357,393.1,175.1,15.32,0.19,90,114.4,8.97,9.38,113.63,390.88,8.74,0.19,99.3,24.05,68.49,NA,0,93,5,2,83,17,"Mud,,NA",1,2,1,0,1,1.88,Some frogs have dark spots. Turbid and hard to determine sbmergent.,NA,30,11,12,2,7,19,0,30,0,5,4,1,0,0,1,0,0,0,0,0,NA,"Snapping,,,,NA",0,1,0,1,NA,"Bluegill,,,,NA",0,0,0,0,0,0,0,1,0,0,0,0,0,0,NA,NA,NA,NA,NA,NA,NA,NA,NA,NA,NA,NA,NA,NA,NA,NA,NA,NA,NA,NA,NA,NA,NA,NA,NA,NA,NA,NA,NA,NA,NA,NA,NA,NA,NA,NA,NA,NA,NA,NA,NA,NA,NA,NA,NA,NA,NA,NA,NA,NA,NA,NA,NA,NA,NA,NA,NA,NA,NA,NA,NA,NA,NA,NA,1,0,0,1,0,0,0,0,1,0,0,0,0,1,0,0,0,0,0,0,0,0,0,0,0,0,0,0,0,0,0,0,0,0,0,0,1,0,0,0,0,0,0,0,0,0,0,0,0,0,0,0,0,0,0,0,0,0,0,0,0,0,0,0,0,0,0,0,0
O-S,4,Orchid South,O-S_4,7/13/2020,2020,7,13,8:15:00,9:02:00,0:47,DCT,Green Space,43.11685318,-89.47789012,298410.185,4776771.644,MIDDLETON CITY OF,Lake Mendota-Yahara River,Pheasant Branch,31.35,5903,NA,2000,Stormwater,0.143884892,0,0.388489209,0.014388489,0.417266187,0.035971223,0.336009174,0.068807339,0.324541284,0.065366972,0.194954128,0.010321101,0,0.036665712,0.028072186,0.005729017,0.303065024,0.117444858,0.084503008,0.221712976,0,0.103122315,0.002291607,0.055285019,0.006874821,0.000286,0.034947007,0.4262389,0.083357204,0.256659983,0.084503008,0.142366084,0.006874821,22,3,80,70,3,1,24.9,250.7,251.1,86.5,6.96,0.12,NA,146.9,8.51,9.38,113.63,390.88,8.74,0.19,99.3,24.05,68.49,NA,1,65,5,30,63,37,"Firm Soil,Rock ,NA",4,4,2,1,2.75,1.88,"Much more submergent veg than O-N. Coontail to surface with algae on top, Longleaf Pondweed mixed in. Steep bank and depth drops off quickly, very turbid. Almost nothing in 8 sweeps.",NA,30,11,12,2,7,19,0,30,0,5,4,0,1,0,1,0,1,0,0,0,NA,NA,0,0,0,1,NA,"Sunfish in shallows, large fish jumping,,,,NA",0,0,0,0,0,0,0,0,0,0,1,0,0,0,NA,NA,NA,NA,NA,NA,NA,NA,NA,NA,NA,NA,NA,NA,NA,NA,NA,NA,NA,NA,NA,NA,NA,NA,NA,NA,NA,NA,NA,NA,NA,NA,NA,NA,NA,NA,NA,NA,NA,NA,NA,NA,NA,NA,NA,NA,NA,NA,NA,NA,NA,NA,NA,NA,NA,NA,NA,NA,NA,NA,NA,NA,NA,NA,1,1,1,1,0,0,0,0,1,0,0,1,1,1,0,0,0,0,0,0,0,0,0,0,1,0,0,0,0,1,0,0,0,0,0,0,1,0,0,0,0,0,0,0,0,0,0,0,0,0,0,0,0,0,0,0,0,0,0,0,0,0,0,0,0,0,0,0,0
O-S,1,Orchid South,O-S_1,6/27/2019,2019,6,27,11:33:00,12:01:00,0:28,"CL,BC,DP,EP",Green Space,43.11685318,-89.47789012,298410.185,4776771.644,MIDDLETON CITY OF,Lake Mendota-Yahara River,Pheasant Branch,31.35,5903,267,2000,Stormwater,0.143884892,0,0.388489209,0.014388489,0.417266187,0.035971223,0.336009174,0.068807339,0.324541284,0.065366972,0.194954128,0.010321101,0,0.036665712,0.028072186,0.005729017,0.303065024,0.117444858,0.084503008,0.221712976,0,0.103122315,0.002291607,0.055285019,0.006874821,0.000286,0.034947007,0.4262389,0.083357204,0.256659983,0.084503008,0.142366084,0.006874821,30,10,51,56,NA,9,25.8,563,554,122.1,9.59,0.27,63.51,64.75,NA,9.38,113.63,390.88,8.74,0.19,99.3,24.05,68.49,0.95,NA,NA,NA,NA,NA,NA,NA,NA,NA,NA,NA,NA,NA,NA,NA,30,11,12,2,7,19,0,30,0,5,4,1,0,0,0,0,0,0,0,0,0,NA,0,0,0,1,NA,Sunfish,0,0,0,0,0,0,1,1,0,0,NA,0,0,0,0,0,0,0,1,0,0,0,0,1,0,0,1,0,1,0,1,0,1,0,0,0,0,0,0,0,0,0,0,0,0,1,0,0,0,1,1,0,0,0,0,1,0,0,0,0,0,0,1,1,0,1,0,1,0,0,0,1,0,0,0,NA,11,bluegill looks intermediate between bluegill and pumpkinseed-hybridizing?,NA,NA,NA,NA,NA,NA,NA,NA,NA,NA,NA,NA,NA,NA,NA,NA,NA,NA,NA,NA,NA,NA,NA,NA,NA,NA,NA,NA,NA,NA,NA,NA,NA,NA,NA,NA,NA,NA,NA,NA,NA,NA,NA,NA,NA,NA,NA,NA,NA,NA,NA,NA,NA,NA,NA,NA,NA,NA,NA,NA,NA,NA,NA,NA,NA,NA,NA,NA,NA
O-S,2,Orchid South,O-S_2,8/9/2019,2019,8,9,10:33:00,10:49:00,0:16,"CL,EC,BC",Green Space,43.11685318,-89.47789012,298410.185,4776771.644,MIDDLETON CITY OF,Lake Mendota-Yahara River,Pheasant Branch,31.35,5903,273,2000,Stormwater,0.143884892,0,0.388489209,0.014388489,0.417266187,0.035971223,0.336009174,0.068807339,0.324541284,0.065366972,0.194954128,0.010321101,0,0.036665712,0.028072186,0.005729017,0.303065024,0.117444858,0.084503008,0.221712976,0,0.103122315,0.002291607,0.055285019,0.006874821,0.000286,0.034947007,0.4262389,0.083357204,0.256659983,0.084503008,0.142366084,0.006874821,21,5,52,13,NA,16,25.3,367.5,365.3,70.8,5.65,0.17,51.96,71.14,NA,9.38,113.63,390.88,8.74,0.19,99.3,24.05,68.49,1.9,NA,NA,NA,NA,NA,NA,NA,NA,NA,NA,NA,NA,NA,NA,No max depth recorded,30,11,12,2,7,19,0,30,0,5,4,0,0,0,0,0,0,0,0,0,0,NA,0,0,0,1,NA,Sunfish,0,0,0,0,0,0,0,0,0,0,NA,0,0,0,NA,NA,NA,NA,NA,NA,NA,NA,NA,NA,NA,NA,NA,NA,NA,NA,NA,NA,NA,NA,NA,NA,NA,NA,NA,NA,NA,NA,NA,NA,NA,NA,NA,NA,NA,NA,NA,NA,NA,NA,NA,NA,NA,NA,NA,NA,NA,NA,NA,NA,NA,NA,NA,NA,NA,NA,NA,NA,NA,NA,NA,NA,13,Nothing caught in 10 sweeps,NA,NA,NA,NA,NA,NA,NA,NA,NA,NA,NA,NA,NA,NA,NA,NA,NA,NA,NA,NA,NA,NA,NA,NA,NA,NA,NA,NA,NA,NA,NA,NA,NA,NA,NA,NA,NA,NA,NA,NA,NA,NA,NA,NA,NA,NA,NA,NA,NA,NA,NA,NA,NA,NA,NA,NA,NA,NA,NA,NA,NA,NA,NA,NA,NA,NA,NA,NA,NA
OPP-E,3,Owen Park Pond East,OPP-E_3,5/25/2020,2020,5,25,12:51:00,13:27:00,0:36,DCT,Green Space,43.06869243,-89.48714077,297498.8439,4771445.348,CITY OF MADISON PARKS OWEN PARK,Lake Mendota-Yahara River,Lake Mendota-Yahara River,35.96,1190,NA,2010,Stormwater,0.212765957,0.602836879,0,0.106382979,0.078014184,0,0.35706085,0.450057405,0,0.145809414,0.047072331,0,0,0,0.127970226,0.007157171,0.468079015,0.091039221,0.174634984,0,0.000859,0.034068136,0,0.093615803,0.000286,0.002290295,0,0.566275408,0.22244489,0,0.174634984,0.036358431,0.000286,27,10,62,15,2,1,23.6,145.6,150,105.7,8.68,0.07,161.03,105.3,7.75,6.61,80.28,128.13,7.48,0.06,53.79,24.1,64.74,NA,NA,88,10,2,10,90,"Mud,Vegetation,NA",2,2,1,1,1.5,2.38,"Lots of goldfish and coontail covered in algae. Turbid, difficult to determine submerged. Ephemeroptera",NA,26,16,4,2,7,11,1,27,1,5,4,0,0,1,0,0,0,0,0,0,NA,NA,0,0,0,1,NA,"Goldfish,,,,NA",0,0,0,0,0,0,0,0,0,1,0,0,0,0,NA,NA,NA,NA,NA,NA,NA,NA,NA,NA,NA,NA,NA,NA,NA,NA,NA,NA,NA,NA,NA,NA,NA,NA,NA,NA,NA,NA,NA,NA,NA,NA,NA,NA,NA,NA,NA,NA,NA,NA,NA,NA,NA,NA,NA,NA,NA,NA,NA,NA,NA,NA,NA,NA,NA,NA,NA,NA,NA,NA,NA,NA,NA,NA,0,0,1,1,0,0,0,0,1,1,1,0,1,0,0,1,0,0,0,0,0,0,0,0,0,0,0,0,0,0,0,0,0,0,0,0,0,0,0,0,0,0,0,0,0,0,0,0,0,0,0,0,0,0,0,0,0,1,0,0,0,0,0,0,0,0,0,0,0
OPP-E,4,Owen Park Pond East,OPP-E_4,7/3/2020,2020,7,3,8:15:00,9:35:00,1:20,DCT,Green Space,43.06869243,-89.48714077,297498.8439,4771445.348,CITY OF MADISON PARKS OWEN PARK,Lake Mendota-Yahara River,Lake Mendota-Yahara River,35.96,1190,NA,2010,Stormwater,0.212765957,0.602836879,0,0.106382979,0.078014184,0,0.35706085,0.450057405,0,0.145809414,0.047072331,0,0,0,0.127970226,0.007157171,0.468079015,0.091039221,0.174634984,0,0.000859,0.034068136,0,0.093615803,0.000286,0.002290295,0,0.566275408,0.22244489,0,0.174634984,0.036358431,0.000286,19,4,77,15,2,2,25,71.7,71.8,51.3,4.11,0.03,5,104.4,7.2,6.61,80.28,128.13,7.48,0.06,53.79,24.1,64.74,NA,5,60,20,20,20,80,"Firm Soil,Rock ,Mud",5,3,3,2,3.25,2.38,"Lucas actively weedwhacking, Great habitat. Shallow bench with wide variety of emergents, drops to deeper water filled with coontail with sparse leafy pota and elodia. Huge rafts of lillys, then deep open water. Did not see turtles. Tons of corixidx and striders. Water very clear.",NA,26,16,4,2,7,11,1,27,1,5,4,1,0,0,0,0,0,0,0,0,NA,NA,0,0,0,1,NA,"Goldfish, Shiner,,,,",0,0,0,1,0,0,0,0,0,1,0,0,0,0,NA,NA,NA,NA,NA,NA,NA,NA,NA,NA,NA,NA,NA,NA,NA,NA,NA,NA,NA,NA,NA,NA,NA,NA,NA,NA,NA,NA,NA,NA,NA,NA,NA,NA,NA,NA,NA,NA,NA,NA,NA,NA,NA,NA,NA,NA,NA,NA,NA,NA,NA,NA,NA,NA,NA,NA,NA,NA,NA,NA,NA,NA,NA,NA,0,1,1,1,0,1,0,0,1,1,1,0,1,0,0,1,0,0,0,1,0,1,0,0,0,0,0,0,0,1,0,0,0,0,0,0,0,0,1,1,1,0,0,0,0,0,0,0,0,0,0,0,0,0,0,0,0,1,0,0,0,0,0,0,0,0,0,0,0
OPP-E,1,Owen Park Pond East,OPP-E_1,6/14/2019,2019,6,14,10:54:00,11:33:00,0:39,"ES,EC,CL,BC,EP",Green Space,43.06869243,-89.48714077,297498.8439,4771445.348,CITY OF MADISON PARKS OWEN PARK,Lake Mendota-Yahara River,Lake Mendota-Yahara River,35.96,1190,NA,2010,Stormwater,0.212765957,0.602836879,0,0.106382979,0.078014184,0,0.35706085,0.450057405,0,0.145809414,0.047072331,0,0,0,0.127970226,0.007157171,0.468079015,0.091039221,0.174634984,0,0.000859,0.034068136,0,0.093615803,0.000286,0.002290295,0,0.566275408,0.22244489,0,0.174634984,0.036358431,0.000286,22,17,51,45,NA,2,20.7,177.2,193.1,107.3,9.28,0.09,27.05,-67.86,NA,6.61,80.28,128.13,7.48,0.06,53.79,24.1,64.74,0.05,NA,NA,NA,NA,NA,NA,NA,NA,NA,NA,NA,NA,NA,NA,turbidity and flourescence seem wrong,26,16,4,2,7,11,1,27,1,5,4,0,0,1,0,1,0,0,0,0,0,NA,0,0,0,1,NA,Goldfish,0,0,0,0,0,0,0,0,0,1,NA,0,0,0,0,0,0,0,1,0,0,0,0,1,0,0,0,0,0,0,0,0,1,0,0,0,0,0,0,0,0,0,0,0,0,0,0,0,0,0,0,0,0,0,0,0,0,0,0,0,0,0,0,0,0,0,0,0,1,1,0,0,0,0,0,NA,12,other minnow=unknown minnow sp.,NA,NA,NA,NA,NA,NA,NA,NA,NA,NA,NA,NA,NA,NA,NA,NA,NA,NA,NA,NA,NA,NA,NA,NA,NA,NA,NA,NA,NA,NA,NA,NA,NA,NA,NA,NA,NA,NA,NA,NA,NA,NA,NA,NA,NA,NA,NA,NA,NA,NA,NA,NA,NA,NA,NA,NA,NA,NA,NA,NA,NA,NA,NA,NA,NA,NA,NA,NA,NA
OPP-E,2,Owen Park Pond East,OPP-E_2,7/16/2019,2019,7,16,8:40:00,8:59:00,0:19,"ES,EP,CL",Green Space,43.06869243,-89.48714077,297498.8439,4771445.348,CITY OF MADISON PARKS OWEN PARK,Lake Mendota-Yahara River,Lake Mendota-Yahara River,35.96,1190,296,2010,Stormwater,0.212765957,0.602836879,0,0.106382979,0.078014184,0,0.35706085,0.450057405,0,0.145809414,0.047072331,0,0,0,0.127970226,0.007157171,0.468079015,0.091039221,0.174634984,0,0.000859,0.034068136,0,0.093615803,0.000286,0.002290295,0,0.566275408,0.22244489,0,0.174634984,0.036358431,0.000286,22,6,84,40,NA,2,27.1,101.6,97.6,56.8,4.37,0.04,6.14,73.32,NA,6.61,80.28,128.13,7.48,0.06,53.79,24.1,64.74,0.78,NA,NA,NA,NA,NA,NA,NA,NA,NA,NA,NA,NA,NA,NA,sl not recorded,26,16,4,2,7,11,1,27,1,5,4,0,1,0,0,0,0,0,0,0,0,Painted,1,0,0,1,NA,Goldfish,0,0,0,1,0,0,0,0,0,1,NA,0,0,0,NA,NA,NA,NA,NA,NA,NA,NA,NA,NA,NA,NA,NA,NA,NA,NA,NA,NA,NA,NA,NA,NA,NA,NA,NA,NA,NA,NA,NA,NA,NA,NA,NA,NA,NA,NA,NA,NA,NA,NA,NA,NA,NA,NA,NA,NA,NA,NA,NA,NA,NA,NA,NA,NA,NA,NA,NA,NA,NA,NA,NA,"Damselfly,Odonata",13,NA,NA,NA,NA,NA,NA,NA,NA,NA,NA,NA,NA,NA,NA,NA,NA,NA,NA,NA,NA,NA,NA,NA,NA,NA,NA,NA,NA,NA,NA,NA,NA,NA,NA,NA,NA,NA,NA,NA,NA,NA,NA,NA,NA,NA,NA,NA,NA,NA,NA,NA,NA,NA,NA,NA,NA,NA,NA,NA,NA,NA,NA,NA,NA,NA,NA,NA,NA,NA,NA
OPP-W,3,Owen Park Pond West,OPP-W_3,5/25/2020,2020,5,25,11:55:00,12:45:00,0:50,DCT,Green Space,43.06867106,-89.48837267,297398.4688,4771445.95,CITY OF MADISON PARKS OWEN PARK,Lake Mendota-Yahara River,Lake Mendota-Yahara River,35.96,1828,NA,2010,Stormwater,0.352517986,0.381294964,0,0.244604317,0.021582734,0,0.407110092,0.385321101,0,0.169724771,0.037844037,0,0,0,0.126683864,0.006878762,0.463456578,0.092863285,0.185439954,0,0.001433075,0.029234738,0,0.091430209,0.000287,0.002292921,0,0.563198624,0.219547148,0,0.185439954,0.031527658,0.000287,24,8,69,60,3,1,22.5,215.4,226.2,63.2,5.28,0.11,131.41,153.9,7.24,5.18,61.85,139.68,7.13,0.06,159.83,23.53,50.4,NA,0,75,20,5,80,20,"Firm Soil,,NA",3,2,1,1,1.75,2.13,"Millions of toad tads. Flooded, water higher than usual with terrestrial veg submerged. Turbid difficult to see submerged.",NA,28,14,6,2,9,15,1,29,1,7,5,1,0,1,0,0,0,0,0,0,NA,"Painted,,,,NA",1,0,0,2,NA,"Juv. Goldfish,,,,NA",0,0,0,0,0,0,0,0,0,1,0,0,0,0,NA,NA,NA,NA,NA,NA,NA,NA,NA,NA,NA,NA,NA,NA,NA,NA,NA,NA,NA,NA,NA,NA,NA,NA,NA,NA,NA,NA,NA,NA,NA,NA,NA,NA,NA,NA,NA,NA,NA,NA,NA,NA,NA,NA,NA,NA,NA,NA,NA,NA,NA,NA,NA,NA,NA,NA,NA,NA,NA,NA,NA,NA,NA,NA,0,0,1,1,0,0,0,0,1,1,1,0,0,0,0,0,0,0,0,0,0,0,0,0,0,0,0,0,0,0,0,0,0,0,0,0,0,0,0,0,0,0,0,0,0,0,0,0,0,0,0,0,0,0,0,0,0,1,0,0,0,0,0,0,0,0,0,0,0
OPP-W,4,Owen Park Pond West,OPP-W_4,7/31/2020,2020,7,31,9:45:00,10:38:00,0:53,DCT,Green Space,43.06867106,-89.48837267,297398.4688,4771445.95,CITY OF MADISON PARKS OWEN PARK,Lake Mendota-Yahara River,Lake Mendota-Yahara River,35.96,1828,NA,2010,Stormwater,0.352517986,0.381294964,0,0.244604317,0.021582734,0,0.407110092,0.385321101,0,0.169724771,0.037844037,0,0,0,0.126683864,0.006878762,0.463456578,0.092863285,0.185439954,0,0.001433075,0.029234738,0,0.091430209,0.000287,0.002292921,0,0.563198624,0.219547148,0,0.185439954,0.031527658,0.000287,22,8,67,8,3,2,25.3,76.8,76.3,50.6,4.03,0.03,4.05,167.1,7.01,5.18,61.85,139.68,7.13,0.06,159.83,23.53,50.4,NA,0,65,10,25,85,15,"Firm Soil,Rock ,NA",4,2,2,2,2.5,2.13,"Water more turbid than East, with steeper bank and drops off deep faster. Almost no submergent, very sparse and more leafy than coontail. Water line ~1.5m lower than NHWL. Picked up camera 2.",NA,28,14,6,2,9,15,1,29,1,7,5,1,0,0,0,0,0,0,0,0,NA,"Painted,Snapping,,,NA",1,1,0,2,NA,"Goldfish, shiner,,,,NA",0,0,0,1,0,0,0,0,0,1,0,0,0,0,NA,NA,NA,NA,NA,NA,NA,NA,NA,NA,NA,NA,NA,NA,NA,NA,NA,NA,NA,NA,NA,NA,NA,NA,NA,NA,NA,NA,NA,NA,NA,NA,NA,NA,NA,NA,NA,NA,NA,NA,NA,NA,NA,NA,NA,NA,NA,NA,NA,NA,NA,NA,NA,NA,NA,NA,NA,NA,NA,NA,NA,NA,NA,NA,0,1,0,1,0,1,0,0,1,1,1,1,0,0,0,0,0,0,0,0,1,1,0,0,0,0,0,0,0,0,0,0,0,0,0,0,0,0,1,0,1,0,0,0,1,0,0,0,0,0,0,0,0,0,0,0,0,1,0,0,0,0,0,0,0,0,0,0,0
OPP-W,1,Owen Park Pond West,OPP-W_1,6/14/2019,2019,6,14,10:05:00,10:45:00,0:40,"EC,ES,CL,BC,EP",Green Space,43.06867106,-89.48837267,297398.4688,4771445.95,CITY OF MADISON PARKS OWEN PARK,Lake Mendota-Yahara River,Lake Mendota-Yahara River,35.96,1828,297,2010,Stormwater,0.352517986,0.381294964,0,0.244604317,0.021582734,0,0.407110092,0.385321101,0,0.169724771,0.037844037,0,0,0,0.126683864,0.006878762,0.463456578,0.092863285,0.185439954,0,0.001433075,0.029234738,0,0.091430209,0.000287,0.002292921,0,0.563198624,0.219547148,0,0.185439954,0.031527658,0.000287,68,14,53,40,NA,2,19.4,142.4,159.3,95.3,8.45,0.07,14.69,135.4,NA,5.18,61.85,139.68,7.13,0.06,159.83,23.53,50.4,1.6,NA,NA,NA,NA,NA,NA,NA,NA,NA,NA,NA,NA,NA,NA,NA,28,14,6,2,9,15,1,29,1,7,5,1,0,1,0,1,0,0,0,0,0,Painted,1,0,0,2,NA,"Shiner, Goldfish",0,0,0,0,0,0,0,0,0,1,NA,0,0,0,0,0,0,0,1,0,1,0,0,0,0,0,0,0,1,0,0,0,1,0,0,0,0,0,0,0,0,0,0,0,0,0,0,0,0,1,0,0,0,0,0,0,0,1,0,0,0,0,1,0,0,0,1,0,0,0,0,0,0,0,0,NA,20,NA,NA,NA,NA,NA,NA,NA,NA,NA,NA,NA,NA,NA,NA,NA,NA,NA,NA,NA,NA,NA,NA,NA,NA,NA,NA,NA,NA,NA,NA,NA,NA,NA,NA,NA,NA,NA,NA,NA,NA,NA,NA,NA,NA,NA,NA,NA,NA,NA,NA,NA,NA,NA,NA,NA,NA,NA,NA,NA,NA,NA,NA,NA,NA,NA,NA,NA,NA,NA,NA
OPP-W,2,Owen Park Pond West,OPP-W_2,7/16/2019,2019,7,16,8:12:00,8:37:00,0:25,"ES,EP,CL",Green Space,43.06867106,-89.48837267,297398.4688,4771445.95,CITY OF MADISON PARKS OWEN PARK,Lake Mendota-Yahara River,Lake Mendota-Yahara River,35.96,1828,286,2010,Stormwater,0.352517986,0.381294964,0,0.244604317,0.021582734,0,0.407110092,0.385321101,0,0.169724771,0.037844037,0,0,0,0.126683864,0.006878762,0.463456578,0.092863285,0.185439954,0,0.001433075,0.029234738,0,0.091430209,0.000287,0.002292921,0,0.563198624,0.219547148,0,0.185439954,0.031527658,0.000287,22,6,84,40,NA,2,26.9,100.5,96.9,38.3,2.95,0.04,5.09,182.9,NA,5.18,61.85,139.68,7.13,0.06,159.83,23.53,50.4,0.74,NA,NA,NA,NA,NA,NA,NA,NA,NA,NA,NA,NA,NA,NA,Flour - OVER,28,14,6,2,9,15,1,29,1,7,5,0,1,1,0,0,0,0,0,0,0,NA,0,0,0,2,NA,"goldfish,shiners",0,0,0,1,0,0,0,0,0,1,NA,0,0,0,NA,NA,NA,NA,NA,NA,NA,NA,NA,NA,NA,NA,NA,NA,NA,NA,NA,NA,NA,NA,NA,NA,NA,NA,NA,NA,NA,NA,NA,NA,NA,NA,NA,NA,NA,NA,NA,NA,NA,NA,NA,NA,NA,NA,NA,NA,NA,NA,NA,NA,NA,NA,NA,NA,NA,NA,NA,NA,NA,NA,NA,NA,15,caught a painted turtle in seine 2,NA,NA,NA,NA,NA,NA,NA,NA,NA,NA,NA,NA,NA,NA,NA,NA,NA,NA,NA,NA,NA,NA,NA,NA,NA,NA,NA,NA,NA,NA,NA,NA,NA,NA,NA,NA,NA,NA,NA,NA,NA,NA,NA,NA,NA,NA,NA,NA,NA,NA,NA,NA,NA,NA,NA,NA,NA,NA,NA,NA,NA,NA,NA,NA,NA,NA,NA,NA,NA
PBC,3,Pheasant Branch Pond,PBC_3,5/23/2020,2020,5,23,14:29:00,14:55:00,0:26,"DCT, AMKT, KR",Rural,43.12290315,-89.48877328,297544.7052,4777469.787,COUNTY OF DANE,Lake Mendota-Yahara River,Pheasant Branch,503.08,1029,NA,2005,Natural,0,0.014492754,0.036231884,0,0.949275362,0,0.014942529,0.070114943,0.175862069,0.029885057,0.709195402,0,0,0.408309456,0.019197708,0.00286533,0.064756447,0.054441261,0.034383954,0.184240688,0,0.182234957,0.000573,0.020630372,0.001719198,0,0.026647564,0.122063037,0.03982808,0.210888252,0.034383954,0.591117479,0.001719198,19,6,68,100,2,0,21,159.7,173,98.7,8.54,0.08,101.76,232.6,7.54,5.44,65.5,329.05,7.54,0.16,379.45,23.68,60.25,NA,0,98,1,1,99,1,"Mud,,NA",1,1,1,0,0.75,0.88,Almost no vegetation,NA,28,2,20,1,6,26,0,28,0,5,4,0,0,1,0,0,0,1,0,0,NA,"Painted,,,,NA",1,0,0,1,NA,NA,0,0,0,0,0,0,0,0,0,0,0,0,0,0,NA,NA,NA,NA,NA,NA,NA,NA,NA,NA,NA,NA,NA,NA,NA,NA,NA,NA,NA,NA,NA,NA,NA,NA,NA,NA,NA,NA,NA,NA,NA,NA,NA,NA,NA,NA,NA,NA,NA,NA,NA,NA,NA,NA,NA,NA,NA,NA,NA,NA,NA,NA,NA,NA,NA,NA,NA,NA,NA,NA,NA,NA,NA,NA,0,1,0,0,0,0,0,0,0,0,0,0,0,0,0,0,0,0,0,0,0,0,0,0,0,0,0,0,0,0,0,0,0,0,0,0,0,0,0,0,0,0,0,0,0,0,0,0,0,0,0,0,0,0,0,0,0,0,0,0,0,0,0,0,0,0,0,0,0
PBC,4,Pheasant Branch Pond,PBC_4,7/13/2020,2020,7,13,9:26:00,10:18:00,0:52,DCT,Rural,43.12290315,-89.48877328,297544.7052,4777469.787,COUNTY OF DANE,Lake Mendota-Yahara River,Pheasant Branch,503.08,1029,NA,2005,Natural,0,0.014492754,0.036231884,0,0.949275362,0,0.014942529,0.070114943,0.175862069,0.029885057,0.709195402,0,0,0.408309456,0.019197708,0.00286533,0.064756447,0.054441261,0.034383954,0.184240688,0,0.182234957,0.000573,0.020630372,0.001719198,0,0.026647564,0.122063037,0.03982808,0.210888252,0.034383954,0.591117479,0.001719198,23,3,69,15,2,0,25.6,167.5,165.9,107,8.51,0.08,NA,294.2,NA,5.44,65.5,329.05,7.54,0.16,379.45,23.68,60.25,NA,0,97,2,1,100,0,"Firm Soil,,",1,1,2,0,1,0.88,"Very Turbid. Tons of plankton and insects along shoreline. Lots of insect diversity, nepidae, multiple diving beetles, noto, corixidae, dragonfly. Large schools of minnows eating plankton balls.",NA,28,2,20,1,6,26,0,28,0,5,4,1,0,0,0,1,0,0,0,0,NA,"Painted,,,,",1,0,0,1,NA,"Shiners,,,,",0,0,0,1,0,0,0,0,0,0,0,0,0,0,NA,NA,NA,NA,NA,NA,NA,NA,NA,NA,NA,NA,NA,NA,NA,NA,NA,NA,NA,NA,NA,NA,NA,NA,NA,NA,NA,NA,NA,NA,NA,NA,NA,NA,NA,NA,NA,NA,NA,NA,NA,NA,NA,NA,NA,NA,NA,NA,NA,NA,NA,NA,NA,NA,NA,NA,NA,NA,NA,NA,NA,NA,NA,NA,0,1,0,0,0,0,0,0,0,0,0,0,0,1,0,0,0,0,0,0,0,0,0,0,0,0,0,0,0,0,0,0,0,0,0,0,0,0,0,0,0,0,0,0,0,0,0,0,0,0,0,0,0,0,0,0,0,0,0,0,0,0,0,0,0,0,0,0,0
PBC,1,Pheasant Branch Pond,PBC_1,6/27/2019,2019,6,27,12:55:00,13:30:00,0:35,"CL,DP,EP,BC",Rural,43.12290315,-89.48877328,297544.7052,4777469.787,COUNTY OF DANE,Lake Mendota-Yahara River,Pheasant Branch,503.08,1029,270,2005,Natural,0,0.014492754,0.036231884,0,0.949275362,0,0.014942529,0.070114943,0.175862069,0.029885057,0.709195402,0,0,0.408309456,0.019197708,0.00286533,0.064756447,0.054441261,0.034383954,0.184240688,0,0.182234957,0.000573,0.020630372,0.001719198,0,0.026647564,0.122063037,0.03982808,0.210888252,0.034383954,0.591117479,0.001719198,NA,NA,NA,NA,NA,2,25.6,580,573,6.2,0.5,0.28,31.99,270.8,NA,5.44,65.5,329.05,7.54,0.16,379.45,23.68,60.25,1.65,NA,NA,NA,NA,NA,NA,NA,NA,NA,NA,NA,NA,NA,NA,NA,28,2,20,1,6,26,0,28,0,5,4,0,0,0,0,0,0,0,0,0,0,NA,0,0,0,1,NA,possible bullhead,0,0,0,0,0,0,0,0,0,0,NA,0,0,0,0,1,1,0,1,0,1,0,0,1,0,0,1,1,1,0,1,1,1,0,0,1,0,0,0,0,0,0,0,1,0,0,0,0,0,1,1,0,1,1,0,0,1,1,0,0,0,0,1,1,0,0,0,1,0,0,0,0,0,0,0,NA,16,"""just invertebrates"" found in seines",NA,NA,NA,NA,NA,NA,NA,NA,NA,NA,NA,NA,NA,NA,NA,NA,NA,NA,NA,NA,NA,NA,NA,NA,NA,NA,NA,NA,NA,NA,NA,NA,NA,NA,NA,NA,NA,NA,NA,NA,NA,NA,NA,NA,NA,NA,NA,NA,NA,NA,NA,NA,NA,NA,NA,NA,NA,NA,NA,NA,NA,NA,NA,NA,NA,NA,NA,NA,NA
PBC,2,Pheasant Branch Pond,PBC_2,8/9/2019,2019,8,9,8:55:00,9:06:00,0:11,"CL,EC,BC",Rural,43.12290315,-89.48877328,297544.7052,4777469.787,COUNTY OF DANE,Lake Mendota-Yahara River,Pheasant Branch,503.08,1029,269,2005,Natural,0,0.014492754,0.036231884,0,0.949275362,0,0.014942529,0.070114943,0.175862069,0.029885057,0.709195402,0,0,0.408309456,0.019197708,0.00286533,0.064756447,0.054441261,0.034383954,0.184240688,0,0.182234957,0.000573,0.020630372,0.001719198,0,0.026647564,0.122063037,0.03982808,0.210888252,0.034383954,0.591117479,0.001719198,19,2,60,10,NA,9,22.5,389.2,404.3,50.1,4.21,0.19,46.99,720.2,NA,5.44,65.5,329.05,7.54,0.16,379.45,23.68,60.25,6.1,NA,NA,NA,NA,NA,NA,NA,NA,NA,NA,NA,NA,NA,NA,Flour - OVER,28,2,20,1,6,26,0,28,0,5,4,1,0,0,0,0,0,0,0,0,0,NA,0,0,0,1,NA,NA,0,0,0,0,0,0,0,0,0,0,NA,0,0,0,NA,NA,NA,NA,NA,NA,NA,NA,NA,NA,NA,NA,NA,NA,NA,NA,NA,NA,NA,NA,NA,NA,NA,NA,NA,NA,NA,NA,NA,NA,NA,NA,NA,NA,NA,NA,NA,NA,NA,NA,NA,NA,NA,NA,NA,NA,NA,NA,NA,NA,NA,NA,NA,NA,NA,NA,NA,NA,NA,NA,NA,NA,10,NA,NA,NA,NA,NA,NA,NA,NA,NA,NA,NA,NA,NA,NA,NA,NA,NA,NA,NA,NA,NA,NA,NA,NA,NA,NA,NA,NA,NA,NA,NA,NA,NA,NA,NA,NA,NA,NA,NA,NA,NA,NA,NA,NA,NA,NA,NA,NA,NA,NA,NA,NA,NA,NA,NA,NA,NA,NA,NA,NA,NA,NA,NA,NA,NA,NA,NA,NA,NA,NA
PPM-UW,3,Picnic Point Marsh,PPM-UW_3,5/20/2020,2020,5,20,14:04:00,15:12:00,1:08,"DCT, DP",Green Space,43.086494,-89.423565,302732.5,4773270.752,UNIV OF WIS REGENTS,Lake Mendota-Yahara River,Lake Mendota-Yahara River,27.06,11104,NA,1937,Natural,0,0.333333333,0.217391304,0.086956522,0,0.362318841,0.004581901,0.184421535,0.075601375,0.053837342,0.024054983,0.657502864,0,0.004012611,0.016623674,0.016910289,0.056749785,0.032960734,0.051017484,0.029234738,0.00171969,0.056749785,0.000287,0.091430209,0.627687016,0.00171969,0.012897678,0.106620808,0.109773574,0.042132416,0.051017484,0.062768702,0.627687016,21,16,49,0,0,20,23,114.2,118.6,267.7,22.4,0.05,208.88,262.9,7.24,9.11,110.08,184.7,7.29,0.09,275.9,23.68,76.03,NA,NA,45,10,45,100,0,"Leaf Litter,,NA",5,1,1,5,3,2.5,Grackle eating tadpoles,NA,38,17,15,0,6,21,0,38,0,6,5,0,0,1,1,0,0,0,0,0,NA,"Painted,,,,NA",1,0,0,1,NA,NA,0,0,0,0,0,0,0,0,0,0,0,0,0,0,NA,NA,NA,NA,NA,NA,NA,NA,NA,NA,NA,NA,NA,NA,NA,NA,NA,NA,NA,NA,NA,NA,NA,NA,NA,NA,NA,NA,NA,NA,NA,NA,NA,NA,NA,NA,NA,NA,NA,NA,NA,NA,NA,NA,NA,NA,NA,NA,NA,NA,NA,NA,NA,NA,NA,NA,NA,NA,NA,NA,NA,NA,NA,NA,0,0,0,0,0,0,0,0,0,1,0,0,0,1,0,0,0,0,0,0,0,0,0,0,0,0,0,0,0,0,0,0,0,0,0,0,0,0,0,0,0,0,0,0,0,0,0,0,0,0,0,0,0,0,0,0,0,0,0,0,0,0,0,0,0,0,0,0,0
PPM-UW,4,Picnic Point Marsh,PPM-UW_4,8/10/2020,2020,8,10,8:16:00,10:03:00,1:47,DCT,Green Space,43.086494,-89.423565,302732.5,4773270.752,UNIV OF WIS REGENTS,Lake Mendota-Yahara River,Lake Mendota-Yahara River,27.06,11104,NA,1937,Natural,0,0.333333333,0.217391304,0.086956522,0,0.362318841,0.004581901,0.184421535,0.075601375,0.053837342,0.024054983,0.657502864,0,0.004012611,0.016623674,0.016910289,0.056749785,0.032960734,0.051017484,0.029234738,0.00171969,0.056749785,0.000287,0.091430209,0.627687016,0.00171969,0.012897678,0.106620808,0.109773574,0.042132416,0.051017484,0.062768702,0.627687016,24,1,94,100,0,20,22.6,247.8,259.6,9.2,0.77,0.12,5.64,429.6,7.34,9.11,110.08,184.7,7.29,0.09,275.9,23.68,76.03,NA,3,5,15,80,100,0,"Leaf Litter,,NA",1,1,1,5,2,2.5,"Wide variety of emergent, but none totally dominant. Tons of trees and woody debris. Substrate sticks and leaf litter. Water stained but fairly clear under Duckweed. Lots of leopard frogs and wood ducks, almost no insects. No submergent detected.",NA,38,17,15,0,6,21,0,38,0,6,5,1,0,1,1,0,0,0,0,0,NA,"Painted,,,,NA",1,0,0,1,NA,NA,0,0,0,0,0,0,0,0,0,0,0,0,0,0,NA,NA,NA,NA,NA,NA,NA,NA,NA,NA,NA,NA,NA,NA,NA,NA,NA,NA,NA,NA,NA,NA,NA,NA,NA,NA,NA,NA,NA,NA,NA,NA,NA,NA,NA,NA,NA,NA,NA,NA,NA,NA,NA,NA,NA,NA,NA,NA,NA,NA,NA,NA,NA,NA,NA,NA,NA,NA,NA,NA,NA,NA,NA,NA,0,1,0,0,0,1,1,1,0,1,1,1,1,1,1,0,1,0,0,0,0,0,1,0,1,0,0,0,0,1,0,0,0,0,0,0,0,0,0,0,0,1,0,0,0,0,0,0,1,0,0,0,0,0,0,0,0,0,0,0,0,1,0,0,0,0,0,0,0
PPM-UW,1,Picnic Point Marsh,PPM-UW_1,6/5/2019,2019,6,5,14:17:00,15:30:00,1:13,"ES,EP,EC,CL",Green Space,43.086494,-89.423565,302732.5,4773270.752,UNIV OF WIS REGENTS,Lake Mendota-Yahara River,Lake Mendota-Yahara River,27.06,11104,NA,1937,Natural,0,0.333333333,0.217391304,0.086956522,0,0.362318841,0.004581901,0.184421535,0.075601375,0.053837342,0.024054983,0.657502864,0,0.004012611,0.016623674,0.016910289,0.056749785,0.032960734,0.051017484,0.029234738,0.00171969,0.056749785,0.000287,0.091430209,0.627687016,0.00171969,0.012897678,0.106620808,0.109773574,0.042132416,0.051017484,0.062768702,0.627687016,27,10,58,20,NA,10,23.6,177.7,182.6,123.6,10.11,0.09,10.49,203.1,NA,9.11,110.08,184.7,7.29,0.09,275.9,23.68,76.03,0.74,NA,NA,NA,NA,NA,NA,NA,NA,NA,NA,NA,NA,NA,NA,*no VES b/c too big,38,17,15,0,6,21,0,38,0,6,5,0,0,1,1,0,0,0,0,0,1,NA,0,0,0,1,NA,NA,0,0,0,0,0,0,0,0,0,0,NA,0,0,0,1,0,1,0,1,0,1,0,0,1,0,1,0,0,1,0,1,0,1,0,0,0,0,0,0,0,0,0,0,1,0,0,0,0,0,0,1,0,0,1,0,0,0,0,1,0,0,1,1,0,1,0,0,0,1,0,0,0,0,0,0,"damselfly,fingernail clams,chironomids,dobsonfly",4,NA,NA,NA,NA,NA,NA,NA,NA,NA,NA,NA,NA,NA,NA,NA,NA,NA,NA,NA,NA,NA,NA,NA,NA,NA,NA,NA,NA,NA,NA,NA,NA,NA,NA,NA,NA,NA,NA,NA,NA,NA,NA,NA,NA,NA,NA,NA,NA,NA,NA,NA,NA,NA,NA,NA,NA,NA,NA,NA,NA,NA,NA,NA,NA,NA,NA,NA,NA,NA,NA
PPM-UW,2,Picnic Point Marsh,PPM-UW_2,7/10/2019,2019,7,10,12:00:00,12:32:00,0:32,"ES,EC,EP",Green Space,43.086494,-89.423565,302732.5,4773270.752,UNIV OF WIS REGENTS,Lake Mendota-Yahara River,Lake Mendota-Yahara River,27.06,11104,264,1937,Natural,0,0.333333333,0.217391304,0.086956522,0,0.362318841,0.004581901,0.184421535,0.075601375,0.053837342,0.024054983,0.657502864,0,0.004012611,0.016623674,0.016910289,0.056749785,0.032960734,0.051017484,0.029234738,0.00171969,0.056749785,0.000287,0.091430209,0.627687016,0.00171969,0.012897678,0.106620808,0.109773574,0.042132416,0.051017484,0.062768702,0.627687016,29,11,52,6,NA,13,25.5,179.5,178,39.8,3.16,0.08,8.73,208,NA,9.11,110.08,184.7,7.29,0.09,275.9,23.68,76.03,1.39,NA,NA,NA,NA,NA,NA,NA,NA,NA,NA,NA,NA,NA,NA,NA,38,17,15,0,6,21,0,38,0,6,5,1,0,1,1,1,0,0,0,0,0,NA,0,0,0,1,NA,NA,0,0,0,0,0,0,0,0,0,0,NA,0,0,0,NA,NA,NA,NA,NA,NA,NA,NA,NA,NA,NA,NA,NA,NA,NA,NA,NA,NA,NA,NA,NA,NA,NA,NA,NA,NA,NA,NA,NA,NA,NA,NA,NA,NA,NA,NA,NA,NA,NA,NA,NA,NA,NA,NA,NA,NA,NA,NA,NA,NA,NA,NA,NA,NA,NA,NA,NA,NA,NA,NA,NA,NA,6,NA,NA,NA,NA,NA,NA,NA,NA,NA,NA,NA,NA,NA,NA,NA,NA,NA,NA,NA,NA,NA,NA,NA,NA,NA,NA,NA,NA,NA,NA,NA,NA,NA,NA,NA,NA,NA,NA,NA,NA,NA,NA,NA,NA,NA,NA,NA,NA,NA,NA,NA,NA,NA,NA,NA,NA,NA,NA,NA,NA,NA,NA,NA,NA,NA,NA,NA,NA,NA,NA
SP-ARB,3,Stevens Pond,SP-ARB_3,5/16/2020,2020,5,16,12:46:00,14:03:00,1:17,DCT,Green Space,43.05001309,-89.43657639,301555.662,4769250.011,UNIV OF WIS REGENTS,Lake Monona-Yahara River,Lake Monona-Yahara River,183.77,920,NA,1937,Natural,0.276595745,0,0.617021277,0.106382979,0,0,0.339839265,0,0.455797933,0.172215844,0.001148106,0.030998852,0,0,0.042930738,0.002575844,0.330566686,0.028906697,0.270749857,0.058958214,0,0.022037779,0.001431025,0.009444762,0.094733829,0,0.137664568,0.362049227,0.052375501,0.196622782,0.270749857,0.023468804,0.094733829,18,12,55,NA,4,15,14.5,752,942,207,20.53,0.47,433.22,41.01,7.41,9.64,95.4,1050.75,7.4,0.53,24.61,13,251.78,NA,18,84,1,15,50,50,"Mud,Rock ,",2,5,2,3,3,3.38,"Lots of people, lots of birds, Gravel at spring slowly gets covered by muddy substrate.",NA,30,11,15,1,4,19,0,30,0,3,3,0,1,1,0,0,0,0,0,0,NA,NA,0,0,0,0,Water,"Sticklebacks,,,,",1,0,0,0,0,0,0,0,0,0,0,0,0,0,NA,NA,NA,NA,NA,NA,NA,NA,NA,NA,NA,NA,NA,NA,NA,NA,NA,NA,NA,NA,NA,NA,NA,NA,NA,NA,NA,NA,NA,NA,NA,NA,NA,NA,NA,NA,NA,NA,NA,NA,NA,NA,NA,NA,NA,NA,NA,NA,NA,NA,NA,NA,NA,NA,NA,NA,NA,NA,NA,NA,NA,NA,NA,NA,0,0,0,0,0,0,0,0,0,0,0,0,0,1,0,0,0,1,0,0,0,0,0,0,0,0,0,1,0,0,0,0,0,0,0,0,0,0,0,0,0,0,0,0,0,0,0,0,0,0,0,0,0,0,0,0,0,0,0,0,0,0,1,0,0,0,0,0,0
SP-ARB,4,Stevens Pond,SP-ARB_4,7/6/2020,2020,7,6,6:32:00,7:46:00,1:14,DCT,Green Space,43.05001309,-89.43657639,301555.662,4769250.011,UNIV OF WIS REGENTS,Lake Monona-Yahara River,Lake Monona-Yahara River,183.77,920,NA,1937,Natural,0.276595745,0,0.617021277,0.106382979,0,0,0.339839265,0,0.455797933,0.172215844,0.001148106,0.030998852,0,0,0.042930738,0.002575844,0.330566686,0.028906697,0.270749857,0.058958214,0,0.022037779,0.001431025,0.009444762,0.094733829,0,0.137664568,0.362049227,0.052375501,0.196622782,0.270749857,0.023468804,0.094733829,26,1,76,5,4,7,12,722,960,46,4.8,0.48,766.4,26.56,7.39,9.64,95.4,1050.75,7.4,0.53,24.61,13,251.78,NA,0,70,7,23,55,45,"Mud,Rock ,Sand",4,5,3,3,3.75,3.38,"Narrow leaf pota w/o midvein dominant, growing to surface w/ Algae on top. No toads, green frogs or tads observed. Lots of birds and mosquitoes. Ducklings in pond. Lots of algae on surface and mats below.",NA,30,11,15,1,4,19,0,30,0,3,3,1,0,0,0,0,0,0,0,0,NA,NA,0,0,0,0,NA,"Stickleback,,,,",1,0,0,0,0,0,0,0,0,0,0,0,0,0,NA,NA,NA,NA,NA,NA,NA,NA,NA,NA,NA,NA,NA,NA,NA,NA,NA,NA,NA,NA,NA,NA,NA,NA,NA,NA,NA,NA,NA,NA,NA,NA,NA,NA,NA,NA,NA,NA,NA,NA,NA,NA,NA,NA,NA,NA,NA,NA,NA,NA,NA,NA,NA,NA,NA,NA,NA,NA,NA,NA,NA,NA,NA,NA,0,1,1,0,0,0,1,0,1,0,0,1,0,1,0,0,0,1,0,0,0,0,0,0,0,0,0,1,0,0,0,0,0,0,0,0,0,0,0,0,0,0,0,0,0,0,0,0,0,0,0,0,0,0,0,0,0,0,0,0,1,0,1,1,0,0,0,0,0
SP-ARB,1,Stevens Pond,SP-ARB_1,5/30/2019,2019,5,30,8:31:00,NA,NA,"DP,ES,EC,EP",Green Space,43.05001309,-89.43657639,301555.662,4769250.011,UNIV OF WIS REGENTS,Lake Monona-Yahara River,Lake Monona-Yahara River,183.77,920,NA,1937,Natural,0.276595745,0,0.617021277,0.106382979,0,0,0.339839265,0,0.455797933,0.172215844,0.001148106,0.030998852,0,0,0.042930738,0.002575844,0.330566686,0.028906697,0.270749857,0.058958214,0,0.022037779,0.001431025,0.009444762,0.094733829,0,0.137664568,0.362049227,0.052375501,0.196622782,0.270749857,0.023468804,0.094733829,18,6,75,37,NA,16,11.9,858,1144,91,9.45,0.57,151.88,11.95,NA,9.64,95.4,1050.75,7.4,0.53,24.61,13,251.78,4.2,NA,NA,NA,NA,NA,NA,NA,NA,NA,NA,NA,NA,NA,NA,"No perimeter recorded, no time stop recorded, incorrect elevation",30,11,15,1,4,19,0,30,0,3,3,0,0,0,0,0,0,0,0,0,1,NA,0,0,0,0,NA,Sticklebacks,1,0,0,0,0,0,0,0,0,0,NA,0,0,0,1,0,1,0,1,0,1,0,1,0,0,0,0,1,1,0,1,0,1,0,0,0,1,0,0,1,0,0,0,0,0,0,0,0,0,1,1,0,0,1,0,0,0,0,0,0,0,0,1,1,1,0,0,0,0,0,0,0,0,0,0,"Noto's, Snails",0,NA,NA,NA,NA,NA,NA,NA,NA,NA,NA,NA,NA,NA,NA,NA,NA,NA,NA,NA,NA,NA,NA,NA,NA,NA,NA,NA,NA,NA,NA,NA,NA,NA,NA,NA,NA,NA,NA,NA,NA,NA,NA,NA,NA,NA,NA,NA,NA,NA,NA,NA,NA,NA,NA,NA,NA,NA,NA,NA,NA,NA,NA,NA,NA,NA,NA,NA,NA,NA,NA
SP-ARB,2,Stevens Pond,SP-ARB_2,7/10/2019,2019,7,10,9:16:00,9:38:00,0:22,"ES, EC, EP",Green Space,43.05001309,-89.43657639,301555.662,4769250.011,UNIV OF WIS REGENTS,Lake Monona-Yahara River,Lake Monona-Yahara River,183.77,920,253,1937,Natural,0.276595745,0,0.617021277,0.106382979,0,0,0.339839265,0,0.455797933,0.172215844,0.001148106,0.030998852,0,0,0.042930738,0.002575844,0.330566686,0.028906697,0.270749857,0.058958214,0,0.022037779,0.001431025,0.009444762,0.094733829,0,0.137664568,0.362049227,0.052375501,0.196622782,0.270749857,0.023468804,0.094733829,26,8,80,0,NA,13,13.6,906,1157,37.6,3.78,0.58,170.25,18.91,NA,9.64,95.4,1050.75,7.4,0.53,24.61,13,251.78,6.15,NA,NA,NA,NA,NA,NA,NA,NA,NA,NA,NA,NA,NA,NA,NA,30,11,15,1,4,19,0,30,0,3,3,1,0,0,0,0,0,0,0,0,0,NA,0,0,0,0,NA,Sticklebacks,1,0,0,0,0,0,0,0,0,0,NA,0,0,0,NA,NA,NA,NA,NA,NA,NA,NA,NA,NA,NA,NA,NA,NA,NA,NA,NA,NA,NA,NA,NA,NA,NA,NA,NA,NA,NA,NA,NA,NA,NA,NA,NA,NA,NA,NA,NA,NA,NA,NA,NA,NA,NA,NA,NA,NA,NA,NA,NA,NA,NA,NA,NA,NA,NA,NA,NA,NA,NA,NA,NA,Physid Snails,NA,No seine distances recorded,NA,NA,NA,NA,NA,NA,NA,NA,NA,NA,NA,NA,NA,NA,NA,NA,NA,NA,NA,NA,NA,NA,NA,NA,NA,NA,NA,NA,NA,NA,NA,NA,NA,NA,NA,NA,NA,NA,NA,NA,NA,NA,NA,NA,NA,NA,NA,NA,NA,NA,NA,NA,NA,NA,NA,NA,NA,NA,NA,NA,NA,NA,NA,NA,NA,NA,NA,NA,NA
TP-ARB,3,Teal Pond,TP-ARB_3,5/15/2020,2020,5,15,15:30:00,16:40:00,1:10,DCT,Green Space,43.0409306,-89.42430679,302525.8387,4768212.391,UNIV OF WIS REGENTS,Lake Monona-Yahara River,Lake Monona-Yahara River,141.29,1342,NA,1937,Stormwater,0,0.202898551,0.797101449,0,0,0,0.084862385,0.252293578,0.5,0.008027523,0.153669725,0.001146789,0.000573,0.040126111,0.196044712,0.083691602,0.066494698,0.091143594,0.122098022,0.07394669,0.001433075,0.053023789,0.00086,0.044711952,0.005159071,0,0.220693608,0.241329894,0.242189739,0.294640298,0.122098022,0.094009745,0.005159071,17,4,31,10,2,10,21.6,665,713,6.1,71,0.35,721.11,244.4,7.7,24.62,77.54,652.75,7.67,0.32,199.6,21.02,326.23,NA,11,75,20,5,30,70,"Super Muddy,,NA",3,3,1,3,2.5,2.25,"Lots of toads amplexing, Flocculent .3 m deep, water strider, water spider",NA,41,13,24,1,4,28,0,41,0,3,2,0,0,1,0,0,0,0,0,0,NA,"Painted,,,,NA",1,0,0,1,NA,"Unknown,,,,NA",0,0,0,0,0,0,0,0,0,0,0,0,0,0,NA,NA,NA,NA,NA,NA,NA,NA,NA,NA,NA,NA,NA,NA,NA,NA,NA,NA,NA,NA,NA,NA,NA,NA,NA,NA,NA,NA,NA,NA,NA,NA,NA,NA,NA,NA,NA,NA,NA,NA,NA,NA,NA,NA,NA,NA,NA,NA,NA,NA,NA,NA,NA,NA,NA,NA,NA,NA,NA,NA,NA,NA,NA,NA,0,1,0,0,0,0,0,0,0,0,0,1,0,1,0,0,0,0,0,1,0,0,0,1,0,0,0,0,0,0,0,0,0,0,0,0,1,0,0,0,0,0,1,0,0,0,0,1,0,0,0,0,0,0,0,0,0,0,0,0,0,0,0,0,0,0,0,0,0
TP-ARB,4,Teal Pond,TP-ARB_4,7/8/2020,2020,7,8,6:37:00,7:15:00,0:38,DCT,Green Space,43.0409306,-89.42430679,302525.8387,4768212.391,UNIV OF WIS REGENTS,Lake Monona-Yahara River,Lake Monona-Yahara River,141.29,1342,NA,1937,Stormwater,0,0.202898551,0.797101449,0,0,0,0.084862385,0.252293578,0.5,0.008027523,0.153669725,0.001146789,0.000573,0.040126111,0.196044712,0.083691602,0.066494698,0.091143594,0.122098022,0.07394669,0.001433075,0.053023789,0.00086,0.044711952,0.005159071,0,0.220693608,0.241329894,0.242189739,0.294640298,0.122098022,0.094009745,0.005159071,21,2,93,25,2,15,20.1,546,603,35.1,3.09,0.29,349.62,317,7.63,24.62,77.54,652.75,7.67,0.32,199.6,21.02,326.23,NA,4,65,30,5,5,95,"Super Muddy,Vegetation,NA",4,1,1,2,2,2.25,Heavy Rains the night before. Entire bottom of pond a mix of pota spp. Lots of Belostomatids. Lots of grass but not phalaras. Most of pond 10cm deep with deep flocculent a couple of pockets with deeper water.,NA,41,13,24,1,4,28,0,41,0,3,2,1,0,1,0,0,0,0,0,0,NA,NA,0,0,0,1,NA,"Stickleback,,,,NA",1,0,0,0,0,0,0,0,0,0,0,0,0,0,NA,NA,NA,NA,NA,NA,NA,NA,NA,NA,NA,NA,NA,NA,NA,NA,NA,NA,NA,NA,NA,NA,NA,NA,NA,NA,NA,NA,NA,NA,NA,NA,NA,NA,NA,NA,NA,NA,NA,NA,NA,NA,NA,NA,NA,NA,NA,NA,NA,NA,NA,NA,NA,NA,NA,NA,NA,NA,NA,NA,NA,NA,NA,NA,0,0,0,1,0,0,1,0,1,0,0,1,0,1,0,0,0,1,0,1,0,0,0,1,0,0,0,0,0,0,0,0,0,0,0,0,1,0,0,0,0,0,1,0,0,0,0,0,1,0,0,0,0,0,0,0,0,0,0,0,0,0,0,0,0,0,0,0,0
TP-ARB,1,Teal Pond,TP-ARB_1,5/29/2019,2019,5,29,10:30:00,11:39:00,1:09,"DP,ES,EC,EP",Green Space,43.0409306,-89.42430679,302525.8387,4768212.391,UNIV OF WIS REGENTS,Lake Monona-Yahara River,Lake Monona-Yahara River,141.29,1342,NA,1937,Stormwater,0,0.202898551,0.797101449,0,0,0,0.084862385,0.252293578,0.5,0.008027523,0.153669725,0.001146789,0.000573,0.040126111,0.196044712,0.083691602,0.066494698,0.091143594,0.122098022,0.07394669,0.001433075,0.053023789,0.00086,0.044711952,0.005159071,0,0.220693608,0.241329894,0.242189739,0.294640298,0.122098022,0.094009745,0.005159071,13,NA,NA,NA,NA,16,16.4,535,641,204.9,19.33,0.31,108.82,75.11,NA,24.62,77.54,652.75,7.67,0.32,199.6,21.02,326.23,0.79,NA,NA,NA,NA,NA,NA,NA,NA,NA,NA,NA,NA,NA,NA,"No substrate recorded, most weather data not recorded, no perimeter recorded, elevation incorrect",41,13,24,1,4,28,0,41,0,3,2,0,0,1,0,0,0,0,0,0,1,"Painted,Other",1,0,0,1,NA,NA,0,0,0,0,0,0,0,0,0,0,NA,0,0,0,1,0,1,0,1,0,1,0,1,1,0,0,0,1,1,0,1,0,1,0,0,0,0,0,0,1,0,0,0,1,0,0,0,0,1,1,1,0,1,0,0,1,0,0,1,0,0,0,1,1,1,1,1,1,1,1,0,0,0,0,0,Snails,8,NA,NA,NA,NA,NA,NA,NA,NA,NA,NA,NA,NA,NA,NA,NA,NA,NA,NA,NA,NA,NA,NA,NA,NA,NA,NA,NA,NA,NA,NA,NA,NA,NA,NA,NA,NA,NA,NA,NA,NA,NA,NA,NA,NA,NA,NA,NA,NA,NA,NA,NA,NA,NA,NA,NA,NA,NA,NA,NA,NA,NA,NA,NA,NA,NA,NA,NA,NA,NA,NA
TP-ARB,2,Teal Pond,TP-ARB_2,7/31/2019,2019,7,31,12:06:00,12:19:00,0:13,"EP,CL,EC",Green Space,43.0409306,-89.42430679,302525.8387,4768212.391,UNIV OF WIS REGENTS,Lake Monona-Yahara River,Lake Monona-Yahara River,141.29,1342,262,1937,Stormwater,0,0.202898551,0.797101449,0,0,0,0.084862385,0.252293578,0.5,0.008027523,0.153669725,0.001146789,0.000573,0.040126111,0.196044712,0.083691602,0.066494698,0.091143594,0.122098022,0.07394669,0.001433075,0.053023789,0.00086,0.044711952,0.005159071,0,0.220693608,0.241329894,0.242189739,0.294640298,0.122098022,0.094009745,0.005159071,23,3,46,50,NA,10,26,667,654,64.1,5.07,0.32,148.76,161.9,NA,24.62,77.54,652.75,7.67,0.32,199.6,21.02,326.23,2.39,NA,NA,NA,NA,NA,NA,NA,NA,NA,NA,NA,NA,NA,NA,NA,41,13,24,1,4,28,0,41,0,3,2,1,0,0,0,0,0,0,0,0,0,NA,0,0,0,1,NA,NA,1,0,0,0,0,0,0,0,0,0,NA,0,0,0,NA,NA,NA,NA,NA,NA,NA,NA,NA,NA,NA,NA,NA,NA,NA,NA,NA,NA,NA,NA,NA,NA,NA,NA,NA,NA,NA,NA,NA,NA,NA,NA,NA,NA,NA,NA,NA,NA,NA,NA,NA,NA,NA,NA,NA,NA,NA,NA,NA,NA,NA,NA,NA,NA,NA,NA,NA,NA,NA,NA,NA,NA,10,Nothing in >15 sweeps,NA,NA,NA,NA,NA,NA,NA,NA,NA,NA,NA,NA,NA,NA,NA,NA,NA,NA,NA,NA,NA,NA,NA,NA,NA,NA,NA,NA,NA,NA,NA,NA,NA,NA,NA,NA,NA,NA,NA,NA,NA,NA,NA,NA,NA,NA,NA,NA,NA,NA,NA,NA,NA,NA,NA,NA,NA,NA,NA,NA,NA,NA,NA,NA,NA,NA,NA,NA,NA
TCW,3,Token West,TCW_3,6/8/2020,2020,6,8,8:37:00,9:29:00,0:52,DCT,Rural,43.18237723,-89.31738994,311669.6399,4783674.86,COUNTY OF DANE,Headwaters Yahara River,Token Creek,208.22,110,NA,1937,Natural,0.086330935,0.007194245,0.496402878,0.071942446,0.338129496,0,0.108695652,0.086956522,0.509153318,0.078947368,0.210526316,0.005720824,0,0.090883028,0.061066514,0.051892202,0.09690367,0.099770642,0.07396789,0.214736239,0,0.206135321,0,0.038417431,0.002866972,0.001433486,0.061926606,0.248566514,0.099483945,0.276662844,0.07396789,0.298451835,0.002866972,22,7,60,0,0,0,19.6,263.7,293.7,2.4,0.21,0.14,411.03,542.3,7.03,2.44,27.18,446.45,7.16,0.22,653.78,18.7,145.35,NA,0,25,35,40,90,10,"Firm Soil,Leaf Litter,NA",3,1,2,0,1.5,1.75,"Wide flooded phalaras bench with channels filled with riccia. Small open water with phalaras emerging in many other spots, Submergent veg is mostly rotting phalaras but some patches with branched out yellow crow's foot. Only 2 water smartweeds observed and 1 cursed buttercup. Tons of chorus frog tadpoles and old eggmassess",NA,33,11,19,0,3,22,0,33,0,3,3,1,0,0,0,1,0,0,0,0,NA,NA,0,0,0,0,NA,NA,0,0,0,0,0,0,0,0,0,0,0,0,0,0,NA,NA,NA,NA,NA,NA,NA,NA,NA,NA,NA,NA,NA,NA,NA,NA,NA,NA,NA,NA,NA,NA,NA,NA,NA,NA,NA,NA,NA,NA,NA,NA,NA,NA,NA,NA,NA,NA,NA,NA,NA,NA,NA,NA,NA,NA,NA,NA,NA,NA,NA,NA,NA,NA,NA,NA,NA,NA,NA,NA,NA,NA,NA,NA,0,1,1,0,0,0,0,0,0,0,0,0,0,1,0,0,0,0,0,0,0,0,1,0,0,0,0,0,0,1,1,0,0,0,0,0,0,0,0,0,0,0,0,0,0,0,0,0,0,0,0,0,0,0,0,0,0,0,0,0,0,0,0,0,0,1,0,0,0
TCW,4,Token West,TCW_4,8/4/2020,2020,8,4,11:35:00,12:29:00,0:54,DCT,Rural,43.18237723,-89.31738994,311669.6399,4783674.86,COUNTY OF DANE,Headwaters Yahara River,Token Creek,208.22,110,NA,1937,Natural,0.086330935,0.007194245,0.496402878,0.071942446,0.338129496,0,0.108695652,0.086956522,0.509153318,0.078947368,0.210526316,0.005720824,0,0.090883028,0.061066514,0.051892202,0.09690367,0.099770642,0.07396789,0.214736239,0,0.206135321,0,0.038417431,0.002866972,0.001433486,0.061926606,0.248566514,0.099483945,0.276662844,0.07396789,0.298451835,0.002866972,18,9,54,5,0,0,18.2,271.8,312.7,59.9,5.51,0.15,1.53,572.3,7.28,2.44,27.18,446.45,7.16,0.22,653.78,18.7,145.35,NA,0,25,40,35,75,25,"Mud,Leaf Litter,NA",3,3,2,0,2,1.75,"Water stained dark. Lots of cladocera. Sites edge not well defined and continues on past pond. I cut off site at 4m surrounding open water. Lots of emergent, floating algae and riccia.",NA,33,11,19,0,3,22,0,33,0,3,3,1,0,0,0,0,0,0,0,0,NA,NA,0,0,0,0,NA,NA,0,0,0,0,0,0,0,0,0,0,0,0,0,0,NA,NA,NA,NA,NA,NA,NA,NA,NA,NA,NA,NA,NA,NA,NA,NA,NA,NA,NA,NA,NA,NA,NA,NA,NA,NA,NA,NA,NA,NA,NA,NA,NA,NA,NA,NA,NA,NA,NA,NA,NA,NA,NA,NA,NA,NA,NA,NA,NA,NA,NA,NA,NA,NA,NA,NA,NA,NA,NA,NA,NA,NA,NA,NA,0,1,1,0,0,0,1,0,1,0,0,0,1,1,0,0,0,0,0,1,0,0,1,0,0,0,0,0,0,1,0,0,0,0,0,0,0,0,0,0,0,0,0,0,0,0,0,0,0,0,0,0,0,0,0,0,0,0,0,0,0,0,0,0,0,1,0,0,0
TCW,1,Token West,TCW_1,7/11/2019,2019,7,11,9:30:00,10:15:00,0:45,"EC,EP,BC",Rural,43.18237723,-89.31738994,311669.6399,4783674.86,COUNTY OF DANE,Headwaters Yahara River,Token Creek,208.22,110,255,1937,Natural,0.086330935,0.007194245,0.496402878,0.071942446,0.338129496,0,0.108695652,0.086956522,0.509153318,0.078947368,0.210526316,0.005720824,0,0.090883028,0.061066514,0.051892202,0.09690367,0.099770642,0.07396789,0.214736239,0,0.206135321,0,0.038417431,0.002866972,0.001433486,0.061926606,0.248566514,0.099483945,0.276662844,0.07396789,0.298451835,0.002866972,25,7,67,17,NA,2,20.8,478,520.4,45.1,3.92,0.25,8.01,627.8,NA,2.44,27.18,446.45,7.16,0.22,653.78,18.7,145.35,4.03,NA,NA,NA,NA,NA,NA,NA,NA,NA,NA,NA,NA,NA,NA,likely a turtle; Flour - OVER,33,11,19,0,3,22,0,33,0,3,3,1,0,0,0,0,0,0,0,0,0,NA,0,0,0,0,NA,NA,0,0,0,0,0,0,0,0,0,0,NA,0,0,0,0,0,0,0,1,0,1,0,1,1,0,0,0,1,1,0,1,1,1,0,0,0,0,0,0,1,0,0,0,1,0,0,0,0,0,1,1,0,1,0,0,0,1,1,1,0,0,0,1,1,1,1,0,0,0,0,0,0,0,0,0,"backswimmers,Odonata",3,NA,NA,NA,NA,NA,NA,NA,NA,NA,NA,NA,NA,NA,NA,NA,NA,NA,NA,NA,NA,NA,NA,NA,NA,NA,NA,NA,NA,NA,NA,NA,NA,NA,NA,NA,NA,NA,NA,NA,NA,NA,NA,NA,NA,NA,NA,NA,NA,NA,NA,NA,NA,NA,NA,NA,NA,NA,NA,NA,NA,NA,NA,NA,NA,NA,NA,NA,NA,NA,NA
TCW,2,Token West,TCW_2,8/15/2019,2019,8,15,8:48:00,9:04:00,0:16,"EC,CL,EP",Rural,43.18237723,-89.31738994,311669.6399,4783674.86,COUNTY OF DANE,Headwaters Yahara River,Token Creek,208.22,110,260,1937,Natural,0.086330935,0.007194245,0.496402878,0.071942446,0.338129496,0,0.108695652,0.086956522,0.509153318,0.078947368,0.210526316,0.005720824,0,0.090883028,0.061066514,0.051892202,0.09690367,0.099770642,0.07396789,0.214736239,0,0.206135321,0,0.038417431,0.002866972,0.001433486,0.061926606,0.248566514,0.099483945,0.276662844,0.07396789,0.298451835,0.002866972,21,4,68,2,NA,2,16.2,548,659,1.3,0.13,0.32,17.01,872.7,NA,2.44,27.18,446.45,7.16,0.22,653.78,18.7,145.35,6.27,NA,NA,NA,NA,NA,NA,NA,NA,NA,NA,NA,NA,NA,NA,very shallow 1 foot max; Flour - OVER,33,11,19,0,3,22,0,33,0,3,3,1,1,0,0,0,0,0,0,0,1,Snapping,0,0,0,0,NA,NA,0,0,0,0,0,0,0,0,0,0,NA,0,0,0,NA,NA,NA,NA,NA,NA,NA,NA,NA,NA,NA,NA,NA,NA,NA,NA,NA,NA,NA,NA,NA,NA,NA,NA,NA,NA,NA,NA,NA,NA,NA,NA,NA,NA,NA,NA,NA,NA,NA,NA,NA,NA,NA,NA,NA,NA,NA,NA,NA,NA,NA,NA,NA,NA,NA,NA,NA,NA,NA,NA,NA,NA,0,"too shallow to seine, fairly confident they were bull tads but they were very small",NA,NA,NA,NA,NA,NA,NA,NA,NA,NA,NA,NA,NA,NA,NA,NA,NA,NA,NA,NA,NA,NA,NA,NA,NA,NA,NA,NA,NA,NA,NA,NA,NA,NA,NA,NA,NA,NA,NA,NA,NA,NA,NA,NA,NA,NA,NA,NA,NA,NA,NA,NA,NA,NA,NA,NA,NA,NA,NA,NA,NA,NA,NA,NA,NA,NA,NA,NA,NA
2FP,3,Two Fountains Pond,2FP_3,5/26/2020,2020,5,26,15:56:00,16:46:00,0:50,DCT,Urban,43.044528,-89.499567,296407.0851,4768791.811,CITY OF MADISON ENGINEER GREENTREE LANDFILL 537,Headwaters Sugar River,Badger Mill Creek,218.59,6204,NA,1974,Stormwater,0.702898551,0,0,0.297101449,0,0,0.746849943,0.017182131,0,0.172966781,0.054982818,0.008018328,0,0,0.016618911,0.083094556,0.428653295,0.210888252,0.148137536,0,0.000287,0.082234957,0.000287,0.023495702,0.003438395,0.00286533,0,0.722636103,0.040401146,0,0.148137536,0.085386819,0.003438395,29,11,52,NA,2,5,25.5,221.5,219.4,129.9,10.16,0.1,218.98,99.33,9.18,8.68,109.93,279.95,9.09,0.13,82.65,25.6,140.69,NA,5,98,1,1,90,10,"Rock ,Sand,",1,1,2,4,2,2.25,"Lots of woody debris under water covered in algae, water very turbid and difficult to see submergent veg. but it looks sparse.",NA,26,9,11,3,7,18,1,27,1,4,2,1,1,0,0,0,0,0,0,0,NA,"Painted,Snapping,,,",1,1,0,2,NA,"Goldfish,,,,",0,0,0,0,0,0,0,0,0,1,0,0,0,0,NA,NA,NA,NA,NA,NA,NA,NA,NA,NA,NA,NA,NA,NA,NA,NA,NA,NA,NA,NA,NA,NA,NA,NA,NA,NA,NA,NA,NA,NA,NA,NA,NA,NA,NA,NA,NA,NA,NA,NA,NA,NA,NA,NA,NA,NA,NA,NA,NA,NA,NA,NA,NA,NA,NA,NA,NA,NA,NA,NA,NA,NA,NA,NA,1,1,1,1,0,0,0,0,0,0,0,0,0,0,0,0,0,0,0,0,0,0,0,0,0,0,0,0,0,0,0,0,0,0,0,0,0,0,0,0,0,0,0,0,0,0,0,0,0,0,0,0,0,0,0,0,0,0,0,0,0,0,0,0,0,0,0,0,0
2FP,4,Two Fountains Pond,2FP_4,7/21/2020,2020,7,21,10:32:00,11:21:00,0:49,DCT,Urban,43.044528,-89.499567,296407.0851,4768791.811,CITY OF MADISON ENGINEER GREENTREE LANDFILL 537,Headwaters Sugar River,Badger Mill Creek,218.59,6204,NA,1974,Stormwater,0.702898551,0,0,0.297101449,0,0,0.746849943,0.017182131,0,0.172966781,0.054982818,0.008018328,0,0,0.016618911,0.083094556,0.428653295,0.210888252,0.148137536,0,0.000287,0.082234957,0.000287,0.023495702,0.003438395,0.00286533,0,0.722636103,0.040401146,0,0.148137536,0.085386819,0.003438395,22,10,73,30,2,10,26.6,137.3,133.2,81,6.29,0.06,5.57,110.6,9,8.68,109.93,279.95,9.09,0.13,82.65,25.6,140.69,NA,0,96,1,3,85,15,"Firm Soil,Rock ,Sand",1,2,3,4,2.5,2.25,"Steep bank with hair/chain algae floating and submerged along edges. Water turbid, hard to determinesubmergent, but seems sparse. Lots of woody debris in water. Mowed up edge. Tons of goldfish.",NA,26,9,11,3,7,18,1,27,1,4,2,0,1,0,0,0,0,0,0,0,NA,"Painted,Snapping,,,",1,1,0,2,NA,"Goldfish, Sunfish,,,,",0,0,0,0,0,0,0,0,0,1,1,0,0,0,NA,NA,NA,NA,NA,NA,NA,NA,NA,NA,NA,NA,NA,NA,NA,NA,NA,NA,NA,NA,NA,NA,NA,NA,NA,NA,NA,NA,NA,NA,NA,NA,NA,NA,NA,NA,NA,NA,NA,NA,NA,NA,NA,NA,NA,NA,NA,NA,NA,NA,NA,NA,NA,NA,NA,NA,NA,NA,NA,NA,NA,NA,NA,NA,1,1,1,1,1,1,1,1,1,0,0,0,0,0,0,0,0,0,0,0,0,0,0,0,0,0,0,0,0,0,0,0,0,0,0,0,0,0,0,0,0,0,0,0,0,0,0,0,0,0,0,0,0,0,0,0,0,0,0,0,0,0,0,0,0,0,0,0,0
2FP,1,Two Fountains Pond,2FP_1,6/19/2019,2019,6,19,14:11:00,14:55:00,0:44,"EC,CL,DP",Urban,43.044528,-89.499567,296407.0851,4768791.811,CITY OF MADISON ENGINEER GREENTREE LANDFILL 537,Headwaters Sugar River,Badger Mill Creek,218.59,6204,317,1974,Stormwater,0.702898551,0,0,0.297101449,0,0,0.746849943,0.017182131,0,0.172966781,0.054982818,0.008018328,0,0,0.016618911,0.083094556,0.428653295,0.210888252,0.148137536,0,0.000287,0.082234957,0.000287,0.023495702,0.003438395,0.00286533,0,0.722636103,0.040401146,0,0.148137536,0.085386819,0.003438395,20,6,79,100,NA,5,22.1,419.6,443.8,120.2,10.04,0.21,107.78,66.58,NA,8.68,109.93,279.95,9.09,0.13,82.65,25.6,140.69,1.23,NA,NA,NA,NA,NA,NA,NA,NA,NA,NA,NA,NA,NA,NA,"No outflows recorded, No property name/owner recorded",26,9,11,3,7,18,1,27,1,4,2,0,1,0,0,0,0,0,0,0,1,Snapping,0,1,0,2,NA,"Goldfish, Black spot disease on sunfish",0,0,0,0,0,0,1,0,0,0,NA,0,0,0,1,0,1,0,1,0,0,0,0,0,0,0,0,0,1,0,0,0,1,0,0,0,0,0,1,0,0,0,0,0,0,1,0,0,0,1,1,1,0,1,0,0,0,0,0,0,0,0,1,1,0,0,0,0,0,0,0,1,0,0,0,NA,15,Sunfish have black spots,NA,NA,NA,NA,NA,NA,NA,NA,NA,NA,NA,NA,NA,NA,NA,NA,NA,NA,NA,NA,NA,NA,NA,NA,NA,NA,NA,NA,NA,NA,NA,NA,NA,NA,NA,NA,NA,NA,NA,NA,NA,NA,NA,NA,NA,NA,NA,NA,NA,NA,NA,NA,NA,NA,NA,NA,NA,NA,NA,NA,NA,NA,NA,NA,NA,NA,NA,NA,NA
2FP,2,Two Fountains Pond,2FP_2,8/1/2019,2019,8,1,14:53:00,15:16:00,0:23,"BC,CL,EP",Urban,43.044528,-89.499567,296407.0851,4768791.811,CITY OF MADISON ENGINEER GREENTREE LANDFILL 537,Headwaters Sugar River,Badger Mill Creek,218.59,6204,312,1974,Stormwater,0.702898551,0,0,0.297101449,0,0,0.746849943,0.017182131,0,0.172966781,0.054982818,0.008018328,0,0,0.016618911,0.083094556,0.428653295,0.210888252,0.148137536,0,0.000287,0.082234957,0.000287,0.023495702,0.003438395,0.00286533,0,0.722636103,0.040401146,0,0.148137536,0.085386819,0.003438395,26,4,35,0,NA,5,28.2,343.4,323.4,108.6,8.23,0.15,95.3,54.07,NA,8.68,109.93,279.95,9.09,0.13,82.65,25.6,140.69,2.71,NA,NA,NA,NA,NA,NA,NA,NA,NA,NA,NA,NA,NA,NA,NA,26,9,11,3,7,18,1,27,1,4,2,0,1,0,0,0,0,0,0,0,0,NA,0,0,0,2,NA,"goldfish,bullheads,bluegill",0,0,0,0,0,0,0,1,0,0,NA,0,0,0,NA,NA,NA,NA,NA,NA,NA,NA,NA,NA,NA,NA,NA,NA,NA,NA,NA,NA,NA,NA,NA,NA,NA,NA,NA,NA,NA,NA,NA,NA,NA,NA,NA,NA,NA,NA,NA,NA,NA,NA,NA,NA,NA,NA,NA,NA,NA,NA,NA,NA,NA,NA,NA,NA,NA,NA,NA,NA,NA,NA,NA,NA,13,NA,NA,NA,NA,NA,NA,NA,NA,NA,NA,NA,NA,NA,NA,NA,NA,NA,NA,NA,NA,NA,NA,NA,NA,NA,NA,NA,NA,NA,NA,NA,NA,NA,NA,NA,NA,NA,NA,NA,NA,NA,NA,NA,NA,NA,NA,NA,NA,NA,NA,NA,NA,NA,NA,NA,NA,NA,NA,NA,NA,NA,NA,NA,NA,NA,NA,NA,NA,NA,NA
WM,3,Waunakee Marsh,WM_3,5/5/2021,2021,5,5,15:27:00,16:30:00,1:03,"DCT, JT",Rural,43.18935,-89.52977,294432.5904,4784949.179,WIDNR,Lake Mendota-Yahara River,Waunakee Marsh-Sixmile Creek,101.76,2217,286,1937,Natural,0,0.111111111,0.479166667,0,0.395833333,0.013888889,0.035388128,0.090182648,0.5456621,0.017123288,0.309360731,0.002283105,0,0.292850991,0.051966695,0,0.018949182,0,0.013207005,0.429227677,0,0.164513351,0,0.024691358,0.000861,0,0.003732415,0.018949182,0.076658053,0.432960092,0.013207005,0.457364341,0.000861,16,8,36,35,0,5,NA,NA,NA,NA,NA,NA,NA,NA,NA,11.95,109.2,753,7.58,0.37,33.46,9.9,576.55,NA,0,80,10,10,65,35,"Mud,Super Muddy,Rock,Sand",4,4,4,5,4.25,4.13,"Water level much lower and about 1m away from normal high water line. A lot less submergent vegetation. Deep mud ~1m in some spots, only 2cm in other spots.",NA,57,24,23,3,10,33,0,57,0,7,4,1,0,1,0,0,0,0,0,0,NA,Blanding's,0,0,1,3,NA,"Brook Stickleback, Mudminnow,,,,",1,1,0,0,0,0,0,0,0,0,0,0,0,0,NA,NA,NA,NA,NA,NA,NA,NA,NA,NA,NA,NA,NA,NA,NA,NA,NA,NA,NA,NA,NA,NA,NA,NA,NA,NA,NA,NA,NA,NA,NA,NA,NA,NA,NA,NA,NA,NA,NA,NA,NA,NA,NA,NA,NA,NA,NA,NA,NA,NA,NA,NA,NA,NA,NA,NA,NA,NA,NA,NA,NA,NA,NA,NA,0,1,0,1,0,0,0,0,1,0,0,0,1,1,1,0,0,0,0,0,0,0,1,0,0,0,1,0,0,0,0,1,0,1,0,1,0,1,0,0,0,1,0,0,0,0,0,0,0,1,0,0,0,0,0,0,0,0,0,0,0,0,1,0,0,0,1,1,0
WM,4,Waunakee Marsh,WM_4,5/10/2021,2021,5,10,10:20:00,11:25:00,1:05,DCT,Rural,43.18935,-89.52977,294432.5904,4784949.179,WIDNR,Lake Mendota-Yahara River,Waunakee Marsh-Sixmile Creek,101.76,2217,286,1937,Natural,0,0.111111111,0.479166667,0,0.395833333,0.013888889,0.035388128,0.090182648,0.5456621,0.017123288,0.309360731,0.002283105,0,0.292850991,0.051966695,0,0.018949182,0,0.013207005,0.429227677,0,0.164513351,0,0.024691358,0.000861,0,0.003732415,0.018949182,0.076658053,0.432960092,0.013207005,0.457364341,0.000861,8,8,52,30,0,10,NA,NA,NA,NA,NA,NA,NA,NA,NA,11.95,109.2,753,7.58,0.37,33.46,9.9,576.55,NA,0,85,10,5,75,25,"Mud,Super Muddy,Rock,Sand",4,3,4,5,4,4.13,Water level still much lower than 2020,NA,57,24,23,3,10,33,0,57,0,7,4,1,0,0,0,0,0,0,0,0,NA,Blanding's,0,0,1,3,NA,"Mudminnow, Brook stickleback and Shiner",1,1,0,1,0,0,0,0,0,0,0,0,0,0,NA,NA,NA,NA,NA,NA,NA,NA,NA,NA,NA,NA,NA,NA,NA,NA,NA,NA,NA,NA,NA,NA,NA,NA,NA,NA,NA,NA,NA,NA,NA,NA,NA,NA,NA,NA,NA,NA,NA,NA,NA,NA,NA,NA,NA,NA,NA,NA,NA,NA,NA,NA,NA,NA,NA,NA,NA,NA,NA,NA,NA,NA,NA,NA,0,1,1,0,0,0,1,0,1,0,1,0,1,1,1,0,0,0,0,0,0,1,1,0,0,0,1,0,0,0,0,1,0,1,0,1,0,1,0,0,0,1,0,0,0,0,0,0,0,0,0,0,0,0,0,0,0,0,0,0,0,0,1,1,0,0,0,1,1
WM,1,Waunakee Marsh,WM_1,6/24/2020,2020,6,24,8:26:00,13:30:00,5:04,DCT,Rural,43.18935,-89.52977,294432.5904,4784949.179,WIDNR,Lake Mendota-Yahara River,Waunakee Marsh-Sixmile Creek,101.76,2217,286,1937,Natural,0,0.111111111,0.479166667,0,0.395833333,0.013888889,0.035388128,0.090182648,0.5456621,0.017123288,0.309360731,0.002283105,0,0.292850991,0.051966695,0,0.018949182,0,0.013207005,0.429227677,0,0.164513351,0,0.024691358,0.000861,0,0.003732415,0.018949182,0.076658053,0.432960092,0.013207005,0.457364341,0.000861,16,4,84,95,0,3,9.8,531,748,96.9,10.59,0.37,576.55,33.46,7.55,11.95,109.2,753,7.58,0.37,33.46,9.9,576.55,NA,0,40,20,40,NA,NA,NA,NA,NA,NA,NA,NA,NA,"Some rain the night before. Clear water bubbling up from springs, mix of sandy/rocky substrate near springs, then gradually becomes very deep flocculent. Lots of floating brown algae andd a variety of submergent veg. Shallow pools amongst cattail. Surveyed the remained of site by boat on seperate date.",NA,57,24,23,3,10,33,0,57,0,7,4,1,0,0,1,0,0,0,0,0,NA,"Blanding's,Snapping,Painted,,",1,1,1,3,NA,"Brook Stickleback, Mudminnow,,,,",1,1,0,0,0,0,0,0,0,0,0,0,0,0,1,1,1,0,1,0,1,0,0,1,0,0,1,1,1,0,1,0,1,0,1,0,1,0,1,0,0,0,1,0,0,0,0,0,1,1,1,0,0,1,1,0,1,1,1,0,0,0,1,1,1,0,1,0,0,1,0,1,0,0,0,NA,3,NA,NA,NA,NA,NA,NA,NA,NA,NA,NA,NA,NA,NA,NA,NA,NA,NA,NA,NA,NA,NA,NA,NA,NA,NA,NA,NA,NA,NA,NA,NA,NA,NA,NA,NA,NA,NA,NA,NA,NA,NA,NA,NA,NA,NA,NA,NA,NA,NA,NA,NA,NA,NA,NA,NA,NA,NA,NA,NA,NA,NA,NA,NA,NA,NA,NA,NA,NA,NA,NA
WM,2,Waunakee Marsh,WM_2,8/14/2020,2020,8,14,8:25:00,11:18:00,2:53,DCT,Rural,43.18935,-89.52977,294432.5904,4784949.179,WIDNR,Lake Mendota-Yahara River,Waunakee Marsh-Sixmile Creek,101.76,2217,286,1937,Natural,0,0.111111111,0.479166667,0,0.395833333,0.013888889,0.035388128,0.090182648,0.5456621,0.017123288,0.309360731,0.002283105,0,0.292850991,0.051966695,0,0.018949182,0,0.013207005,0.429227677,0,0.164513351,0,0.024691358,0.000861,0,0.003732415,0.018949182,0.076658053,0.432960092,0.013207005,0.457364341,0.000861,21,1,79,0,0,5,10,541,758,121.5,13.31,0.37,6.46,33.46,7.6,11.95,109.2,753,7.58,0.37,33.46,9.9,576.55,NA,0,65,15,20,NA,NA,NA,NA,NA,NA,NA,NA,NA,"Water cold and clear, can see springs bubbling up from sand. Some areas rocky sand, others extremely deep mud. Variety of emergents on wetland side with channels carved out and game trails. Pondweed floats to surface and is mixed with algae and duckweed. Most submergent covered in algae. Lots of corixidae and isopods.",NA,57,24,23,3,10,33,0,57,0,7,4,1,0,1,0,0,1,0,0,0,NA,"Painted,,,,",1,0,0,3,NA,"Brook Stickleback,,,,",1,0,0,0,0,0,0,0,0,0,0,0,0,0,NA,NA,NA,NA,NA,NA,NA,NA,NA,NA,NA,NA,NA,NA,NA,NA,NA,NA,NA,NA,NA,NA,NA,NA,NA,NA,NA,NA,NA,NA,NA,NA,NA,NA,NA,NA,NA,NA,NA,NA,NA,NA,NA,NA,NA,NA,NA,NA,NA,NA,NA,NA,NA,NA,NA,NA,NA,NA,NA,NA,NA,NA,NA,NA,NA,NA,NA,NA,NA,NA,NA,NA,NA,NA,NA,NA,NA,NA,NA,NA,NA,NA,NA,NA,NA,NA,NA,NA,NA,NA,NA,NA,NA,NA,NA,NA,NA,NA,NA,NA,NA,NA,NA,NA,NA,NA,NA,NA,NA,NA,NA,NA,NA,NA,NA,NA,NA,NA,NA,NA,NA,NA,NA,NA,NA,NA,NA,NA,NA,NA,NA,NA,NA
WS-ARB,3,Wingra Springs,WS-ARB_3,5/22/2020,2020,5,22,10:40:00,11:22:00,0:42,DCT,Green Space,43.05201405,-89.43511254,301681.3399,4769468.768,UNIV OF WIS REGENTS,Lake Monona-Yahara River,Lake Monona-Yahara River,183.77,5214,NA,1987,Stormwater,0.328467153,0,0.598540146,0.065693431,0,0.00729927,0.363949483,0.002296211,0.390355913,0.142365098,0.003444317,0.097588978,0,0,0.053868195,0.006303725,0.319770774,0.031518625,0.241833811,0.059312321,0,0.002578797,0.001432665,0.016905444,0.123495702,0,0.142979943,0.357593123,0.070773639,0.202292264,0.241833811,0.004011461,0.123495702,15,3,87,100,3,4,18.2,311.8,358.5,5.7,0.52,0.17,244.51,125.6,7.28,1.87,22.88,319.95,7.43,0.15,104.47,23.13,116.49,NA,2,98,0,2,100,0,"Super Muddy,,NA",1,1,1,1,1,1.38,"Lots of different tracks around pond, water level ~2m lower than high water line. Too muddy to get max depth, likely over 1m. 100s of cladocerans in water column.",NA,27,7,14,0,6,20,0,27,0,6,4,0,0,0,0,0,0,0,0,0,NA,"Painted,,,,NA",1,0,0,2,NA,NA,0,0,0,0,0,0,0,0,0,0,0,0,0,0,NA,NA,NA,NA,NA,NA,NA,NA,NA,NA,NA,NA,NA,NA,NA,NA,NA,NA,NA,NA,NA,NA,NA,NA,NA,NA,NA,NA,NA,NA,NA,NA,NA,NA,NA,NA,NA,NA,NA,NA,NA,NA,NA,NA,NA,NA,NA,NA,NA,NA,NA,NA,NA,NA,NA,NA,NA,NA,NA,NA,NA,NA,NA,NA,0,0,0,0,0,0,0,0,0,0,0,0,0,1,0,0,0,0,0,0,0,0,0,0,0,0,0,0,0,0,0,0,0,0,0,0,0,0,0,0,0,0,0,0,0,0,0,0,0,0,0,0,0,0,0,0,0,0,0,0,0,0,0,0,0,0,0,0,0
WS-ARB,4,Wingra Springs,WS-ARB_4,7/7/2020,2020,7,7,8:31:00,9:33:00,1:02,DCT,Green Space,43.05201405,-89.43511254,301681.3399,4769468.768,UNIV OF WIS REGENTS,Lake Monona-Yahara River,Lake Monona-Yahara River,183.77,5214,NA,1987,Stormwater,0.328467153,0,0.598540146,0.065693431,0,0.00729927,0.363949483,0.002296211,0.390355913,0.142365098,0.003444317,0.097588978,0,0,0.053868195,0.006303725,0.319770774,0.031518625,0.241833811,0.059312321,0,0.002578797,0.001432665,0.016905444,0.123495702,0,0.142979943,0.357593123,0.070773639,0.202292264,0.241833811,0.004011461,0.123495702,27,5,68,1,3,1,28.4,235.5,221.2,30.3,2.29,0.1,218.6,98.69,7.57,1.87,22.88,319.95,7.43,0.15,104.47,23.13,116.49,NA,0,74,12,14,95,5,"Super Muddy,Rock ,NA",3,1,2,1,1.75,1.38,Water level ~2m lower than high water line. Almost no emergent even if at high water. Very little patches of pota and mostly algae on bare substrate. Lots of hylid tads. Wolffia strating to take over. Saw a big snapper.,NA,27,7,14,0,6,20,0,27,0,6,4,1,1,0,0,1,0,0,0,0,NA,"Painted,Snapping,,,NA",1,1,0,2,Garter,NA,0,0,0,0,0,0,0,0,0,0,0,0,0,0,NA,NA,NA,NA,NA,NA,NA,NA,NA,NA,NA,NA,NA,NA,NA,NA,NA,NA,NA,NA,NA,NA,NA,NA,NA,NA,NA,NA,NA,NA,NA,NA,NA,NA,NA,NA,NA,NA,NA,NA,NA,NA,NA,NA,NA,NA,NA,NA,NA,NA,NA,NA,NA,NA,NA,NA,NA,NA,NA,NA,NA,NA,NA,NA,0,0,0,0,0,1,0,0,1,1,1,1,0,1,0,0,1,0,0,0,0,0,0,0,0,0,0,0,0,0,0,0,0,0,0,0,0,0,0,0,0,0,0,0,0,0,0,0,0,0,0,0,0,0,0,0,0,0,0,0,0,0,0,0,0,0,0,0,0
WS-ARB,1,Wingra Springs,WS-ARB_1,5/30/2019,2019,5,30,12:49:00,14:10:00,1:21,"DP, ES, EC, EP",Green Space,43.05201405,-89.43511254,301681.3399,4769468.768,UNIV OF WIS REGENTS,Lake Monona-Yahara River,Lake Monona-Yahara River,183.77,5214,NA,1987,Stormwater,0.328467153,0,0.598540146,0.065693431,0,0.00729927,0.363949483,0.002296211,0.390355913,0.142365098,0.003444317,0.097588978,0,0,0.053868195,0.006303725,0.319770774,0.031518625,0.241833811,0.059312321,0,0.002578797,0.001432665,0.016905444,0.123495702,0,0.142979943,0.357593123,0.070773639,0.202292264,0.241833811,0.004011461,0.123495702,24,1,50,77,NA,3,21.7,463.5,494.7,36.5,3.1,0.24,76.51,76.47,NA,1.87,22.88,319.95,7.43,0.15,104.47,23.13,116.49,0.65,NA,NA,NA,NA,NA,NA,NA,NA,NA,NA,NA,NA,NA,NA,"Zoop tows 2 &3 distance not recorded, perimeter not recorded, elevation incorrect",27,7,14,0,6,20,0,27,0,6,4,1,0,0,0,0,0,0,0,0,1,Painted,1,0,0,2,NA,NA,0,0,0,0,0,0,0,0,0,0,NA,0,0,0,1,0,1,0,1,0,1,0,0,1,0,0,1,1,1,0,0,0,1,0,0,0,0,0,0,0,0,0,0,0,0,0,0,0,1,0,1,0,0,1,0,0,0,1,0,0,0,0,1,0,0,0,1,0,0,1,0,0,0,0,0,"Dragonfly, Planorbid snail",0,NA,NA,NA,NA,NA,NA,NA,NA,NA,NA,NA,NA,NA,NA,NA,NA,NA,NA,NA,NA,NA,NA,NA,NA,NA,NA,NA,NA,NA,NA,NA,NA,NA,NA,NA,NA,NA,NA,NA,NA,NA,NA,NA,NA,NA,NA,NA,NA,NA,NA,NA,NA,NA,NA,NA,NA,NA,NA,NA,NA,NA,NA,NA,NA,NA,NA,NA,NA,NA,NA
WS-ARB,2,Wingra Springs,WS-ARB_2,7/10/2019,2019,7,10,8:41:00,9:10:00,0:29,"ES,EC,EP",Green Space,43.05201405,-89.43511254,301681.3399,4769468.768,UNIV OF WIS REGENTS,Lake Monona-Yahara River,Lake Monona-Yahara River,183.77,5214,254,1987,Stormwater,0.328467153,0,0.598540146,0.065693431,0,0.00729927,0.363949483,0.002296211,0.390355913,0.142365098,0.003444317,0.097588978,0,0,0.053868195,0.006303725,0.319770774,0.031518625,0.241833811,0.059312321,0,0.002578797,0.001432665,0.016905444,0.123495702,0,0.142979943,0.357593123,0.070773639,0.202292264,0.241833811,0.004011461,0.123495702,26,8,82,0,NA,9,24.2,202,205.4,19,1.55,0.1,28.44,117.1,NA,1.87,22.88,319.95,7.43,0.15,104.47,23.13,116.49,1.15,NA,NA,NA,NA,NA,NA,NA,NA,NA,NA,NA,NA,NA,NA,Water level much higher than 1st round,27,7,14,0,6,20,0,27,0,6,4,1,0,0,0,1,0,0,0,0,1,Painted,1,0,0,2,NA,NA,0,0,0,0,0,0,0,0,0,0,NA,0,0,0,NA,NA,NA,NA,NA,NA,NA,NA,NA,NA,NA,NA,NA,NA,NA,NA,NA,NA,NA,NA,NA,NA,NA,NA,NA,NA,NA,NA,NA,NA,NA,NA,NA,NA,NA,NA,NA,NA,NA,NA,NA,NA,NA,NA,NA,NA,NA,NA,NA,NA,NA,NA,NA,NA,NA,NA,NA,NA,NA,NA,NA,NA,9,NA,NA,NA,NA,NA,NA,NA,NA,NA,NA,NA,NA,NA,NA,NA,NA,NA,NA,NA,NA,NA,NA,NA,NA,NA,NA,NA,NA,NA,NA,NA,NA,NA,NA,NA,NA,NA,NA,NA,NA,NA,NA,NA,NA,NA,NA,NA,NA,NA,NA,NA,NA,NA,NA,NA,NA,NA,NA,NA,NA,NA,NA,NA,NA,NA,NA,NA,NA,NA,NA
